Sheet: январь
A1: Число | C1: 9 | G1: 9 | K1: 13 | O1: 14 | S1: 15 | W1: 16 | AA1: 17 | AE1: 20 | AI1: 21 | AM1: 22 | AQ1: 23 | AU1: 24 | AY1: 27 | BC1: 28 | BG1: 29 | BK1: 30 | BO1: 31 | BS1: Итого
A2: Клиенты | C2: план | D2: факт | E2: откл-е | F2: * | G2: план | H2: факт | I2: откл-е | J2: * | K2: план | L2: факт | M2: откл-е | N2: * | O2: план | P2: факт | Q2: откл-е | R2: * | S2: план | T2: факт | U2: откл-е | V2: * | W2: план | X2: факт | Y2: откл-е | Z2: * | AA2: план | AB2: факт | AC2: откл-е | AD2: * | AE2: план | AF2: факт | AG2: откл-е | AH2: * | AI2: план | AJ2: факт | AK2: откл-е | AL2: * | AM2: план | AN2: факт | AO2: откл-е | AP2: * | AQ2: план | AR2: факт | AS2: откл-е | AT2: * | AU2: план | AV2: факт | AW2: откл-е | AX2: * | AY2: план | AZ2: факт | BA2: откл-е | BB2: * | BC2: план | BD2: факт | BE2: откл-е | BF2: * | BG2: план | BH2: факт | BI2: откл-е | BJ2: * | BK2: план | BL2: факт | BM2: откл-е | BN2: * | BO2: план | BP2: факт | BQ2: откл-е | BR2: * | BS2: план | BT2: факт | BU2: откл-е
A3: БЕ ООО "НАК" | B3: ЛЗ | E3: =RC[-1]-RC[-2] -> 0 | G3: 2 | H3: 2 | I3: =RC[-1]-RC[-2] -> 0 | M3: =RC[-1]-RC[-2] -> 0 | Q3: =RC[-1]-RC[-2] -> 0 | S3: 0 | T3: 1 | U3: =RC[-1]-RC[-2] -> 1 | V3: 2 | W3: 2 | X3: 0 | Y3: =RC[-1]-RC[-2] -> -2 | Z3: 2 | AC3: =RC[-1]-RC[-2] -> 0 | AG3: =RC[-1]-RC[-2] -> 0 | AK3: =RC[-1]-RC[-2] -> 0 | AM3: 0 | AN3: 2 | AO3: =RC[-1]-RC[-2] -> 2 | AP3: 2 | AQ3: 2 | AR3: 0 | AS3: =RC[-1]-RC[-2] -> -2 | AT3: 2 | AW3: =RC[-1]-RC[-2] -> 0 | BA3: =RC[-1]-RC[-2] -> 0 | BE3: =RC[-1]-RC[-2] -> 0 | BG3: 2 | BH3: 2 | BI3: =RC[-1]-RC[-2] -> 0 | BM3: =RC[-1]-RC[-2] -> 0 | BQ3: =RC[-1]-RC[-2] -> 0 | BS3: =RC[-4]+RC[-8]+RC[-12]+RC[-16]+RC[-20]+RC[-24]+RC[-28]+RC[-32]+RC[-36]+RC[-40]+RC[-44]+RC[-48]+RC[-52]+RC[-56]+RC[-60]+RC[-64]+RC[-68] -> 8 | BT3: =RC[-4]+RC[-8]+RC[-12]+RC[-16]+RC[-20]+RC[-24]+RC[-28]+RC[-32]+RC[-36]+RC[-40]+RC[-44]+RC[-48]+RC[-52]+RC[-56]+RC[-60]+RC[-64]+RC[-68] -> 7 | BU3: =RC[-1]-RC[-2] -> -1
B4: ПРЗ | E4: =RC[-1]-RC[-2] -> 0 | G4: 2 | H4: 2 | I4: =RC[-1]-RC[-2] -> 0 | M4: =RC[-1]-RC[-2] -> 0 | Q4: =RC[-1]-RC[-2] -> 0 | S4: 0 | T4: 0 | U4: =RC[-1]-RC[-2] -> 0 | V4: 2 | W4: 2 | X4: 0 | Y4: =RC[-1]-RC[-2] -> -2 | Z4: 2 | AC4: =RC[-1]-RC[-2] -> 0 | AG4: =RC[-1]-RC[-2] -> 0 | AK4: =RC[-1]-RC[-2] -> 0 | AM4: 0 | AN4: 2 | AO4: =RC[-1]-RC[-2] -> 2 | AP4: 2 | AQ4: 2 | AR4: 0 | AS4: =RC[-1]-RC[-2] -> -2 | AT4: 2 | AW4: =RC[-1]-RC[-2] -> 0 | BA4: =RC[-1]-RC[-2] -> 0 | BE4: =RC[-1]-RC[-2] -> 0 | BG4: 2 | BH4: 0 | BI4: =RC[-1]-RC[-2] -> -2 | BJ4: 2 | BM4: =RC[-1]-RC[-2] -> 0 | BQ4: =RC[-1]-RC[-2] -> 0 | BS4: =RC[-4]+RC[-8]+RC[-12]+RC[-16]+RC[-20]+RC[-24]+RC[-28]+RC[-32]+RC[-36]+RC[-40]+RC[-44]+RC[-48]+RC[-52]+RC[-56]+RC[-60]+RC[-64]+RC[-68] -> 8 | BT4: =RC[-4]+RC[-8]+RC[-12]+RC[-16]+RC[-20]+RC[-24]+RC[-28]+RC[-32]+RC[-36]+RC[-40]+RC[-44]+RC[-48]+RC[-52]+RC[-56]+RC[-60]+RC[-64]+RC[-68] -> 4 | BU4: =RC[-1]-RC[-2] -> -4
A5: ООО "НАК" | B5: ЗШП | E5: =RC[-1]-RC[-2] -> 0 | I5: =RC[-1]-RC[-2] -> 0 | M5: =RC[-1]-RC[-2] -> 0 | Q5: =RC[-1]-RC[-2] -> 0 | U5: =RC[-1]-RC[-2] -> 0 | Y5: =RC[-1]-RC[-2] -> 0 | AC5: =RC[-1]-RC[-2] -> 0 | AG5: =RC[-1]-RC[-2] -> 0 | AK5: =RC[-1]-RC[-2] -> 0 | AO5: =RC[-1]-RC[-2] -> 0 | AS5: =RC[-1]-RC[-2] -> 0 | AW5: =RC[-1]-RC[-2] -> 0 | BA5: =RC[-1]-RC[-2] -> 0 | BE5: =RC[-1]-RC[-2] -> 0 | BI5: =RC[-1]-RC[-2] -> 0 | BM5: =RC[-1]-RC[-2] -> 0 | BQ5: =RC[-1]-RC[-2] -> 0 | BS5: =RC[-4]+RC[-8]+RC[-12]+RC[-16]+RC[-20]+RC[-24]+RC[-28]+RC[-32]+RC[-36]+RC[-40]+RC[-44]+RC[-48]+RC[-52]+RC[-56]+RC[-60]+RC[-64]+RC[-68] -> 0 | BT5: =RC[-4]+RC[-8]+RC[-12]+RC[-16]+RC[-20]+RC[-24]+RC[-28]+RC[-32]+RC[-36]+RC[-40]+RC[-44]+RC[-48]+RC[-52]+RC[-56]+RC[-60]+RC[-64]+RC[-68] -> 0 | BU5: =RC[-1]-RC[-2] -> 0
B6: НАК | C6: 15 | D6: 12 | E6: =RC[-1]-RC[-2] -> -3 | F6: 2 | G6: 15 | H6: 10 | I6: =RC[-1]-RC[-2] -> -5 | J6: 2 | K6: 15 | L6: 7 | M6: =RC[-1]-RC[-2] -> -8 | N6: 2 | O6: 15 | P6: 5 | Q6: =RC[-1]-RC[-2] -> -10 | R6: 2 | S6: 15 | T6: 5 | U6: =RC[-1]-RC[-2] -> -10 | V6: 2 | W6: 15 | X6: 10 | Y6: =RC[-1]-RC[-2] -> -5 | Z6: 2 | AA6: 15 | AB6: 6 | AC6: =RC[-1]-RC[-2] -> -9 | AD6: 2 | AE6: 15 | AF6: 6 | AG6: =RC[-1]-RC[-2] -> -9 | AH6: 2 | AI6: 15 | AJ6: 5 | AK6: =RC[-1]-RC[-2] -> -10 | AL6: 2 | AM6: 15 | AN6: 7 | AO6: =RC[-1]-RC[-2] -> -8 | AP6: 2 | AQ6: 15 | AR6: 8 | AS6: =RC[-1]-RC[-2] -> -7 | AT6: 2 | AU6: 15 | AV6: 10 | AW6: =RC[-1]-RC[-2] -> -5 | AX6: 2 | AY6: 15 | AZ6: 10 | BA6: =RC[-1]-RC[-2] -> -5 | BB6: 2 | BC6: 15 | BD6: 12 | BE6: =RC[-1]-RC[-2] -> -3 | BF6: 2 | BG6: 15 | BH6: 15 | BI6: =RC[-1]-RC[-2] -> 0 | BJ6: 2 | BK6: 15 | BL6: 10 | BM6: =RC[-1]-RC[-2] -> -5 | BN6: 2 | BO6: 15 | BP6: 12 | BQ6: =RC[-1]-RC[-2] -> -3 | BR6: 2 | BS6: =RC[-4]+RC[-8]+RC[-12]+RC[-16]+RC[-20]+RC[-24]+RC[-28]+RC[-32]+RC[-36]+RC[-40]+RC[-44]+RC[-48]+RC[-52]+RC[-56]+RC[-60]+RC[-64]+RC[-68] -> 255 | BT6: =RC[-4]+RC[-8]+RC[-12]+RC[-16]+RC[-20]+RC[-24]+RC[-28]+RC[-32]+RC[-36]+RC[-40]+RC[-44]+RC[-48]+RC[-52]+RC[-56]+RC[-60]+RC[-64]+RC[-68] -> 150 | BU6: =RC[-1]-RC[-2] -> -105
B7: НЛЗ | E7: =RC[-1]-RC[-2] -> 0 | I7: =RC[-1]-RC[-2] -> 0 | M7: =RC[-1]-RC[-2] -> 0 | Q7: =RC[-1]-RC[-2] -> 0 | U7: =RC[-1]-RC[-2] -> 0 | Y7: =RC[-1]-RC[-2] -> 0 | AC7: =RC[-1]-RC[-2] -> 0 | AG7: =RC[-1]-RC[-2] -> 0 | AK7: =RC[-1]-RC[-2] -> 0 | AO7: =RC[-1]-RC[-2] -> 0 | AS7: =RC[-1]-RC[-2] -> 0 | AW7: =RC[-1]-RC[-2] -> 0 | BA7: =RC[-1]-RC[-2] -> 0 | BE7: =RC[-1]-RC[-2] -> 0 | BI7: =RC[-1]-RC[-2] -> 0 | BM7: =RC[-1]-RC[-2] -> 0 | BQ7: =RC[-1]-RC[-2] -> 0 | BS7: =RC[-4]+RC[-8]+RC[-12]+RC[-16]+RC[-20]+RC[-24]+RC[-28]+RC[-32]+RC[-36]+RC[-40]+RC[-44]+RC[-48]+RC[-52]+RC[-56]+RC[-60]+RC[-64]+RC[-68] -> 0 | BT7: =RC[-4]+RC[-8]+RC[-12]+RC[-16]+RC[-20]+RC[-24]+RC[-28]+RC[-32]+RC[-36]+RC[-40]+RC[-44]+RC[-48]+RC[-52]+RC[-56]+RC[-60]+RC[-64]+RC[-68] -> 0 | BU7: =RC[-1]-RC[-2] -> 0
A8: ООО "НАЗ", АО "НГА" | B8: АЗ "НАЗ" | E8: =RC[-1]-RC[-2] -> 0 | G8: 5 | H8: 3 | I8: =RC[-1]-RC[-2] -> -2 | J8: 2 | K8: 10 | L8: 12 | M8: =RC[-1]-RC[-2] -> 2 | N8: 2 | O8: 3 | P8: 10 | Q8: =RC[-1]-RC[-2] -> 7 | R8: 2 | S8: 5 | T8: 8 | U8: =RC[-1]-RC[-2] -> 3 | V8: 2 | W8: 2 | X8: 5 | Y8: =RC[-1]-RC[-2] -> 3 | Z8: 2 | AA8: 5 | AB8: 0 | AC8: =RC[-1]-RC[-2] -> -5 | AD8: 2 | AE8: 5 | AF8: 10 | AG8: =RC[-1]-RC[-2] -> 5 | AH8: 2 | AI8: 0 | AJ8: 5 | AK8: =RC[-1]-RC[-2] -> 5 | AL8: 2 | AM8: 5 | AN8: 0 | AO8: =RC[-1]-RC[-2] -> -5 | AR8: 0 | AS8: =RC[-1]-RC[-2] -> 0 | AU8: 5 | AV8: 0 | AW8: =RC[-1]-RC[-2] -> -5 | AX8: 2 | BA8: =RC[-1]-RC[-2] -> 0 | BC8: 0 | BD8: 10 | BE8: =RC[-1]-RC[-2] -> 10 | BF8: 2 | BG8: 5 | BH8: 10 | BI8: =RC[-1]-RC[-2] -> 5 | BJ8: 2 | BM8: =RC[-1]-RC[-2] -> 0 | BO8: 5 | BP8: 10 | BQ8: =RC[-1]-RC[-2] -> 5 | BR8: 2 | BS8: =RC[-4]+RC[-8]+RC[-12]+RC[-16]+RC[-20]+RC[-24]+RC[-28]+RC[-32]+RC[-36]+RC[-40]+RC[-44]+RC[-48]+RC[-52]+RC[-56]+RC[-60]+RC[-64]+RC[-68] -> 55 | BT8: =RC[-4]+RC[-8]+RC[-12]+RC[-16]+RC[-20]+RC[-24]+RC[-28]+RC[-32]+RC[-36]+RC[-40]+RC[-44]+RC[-48]+RC[-52]+RC[-56]+RC[-60]+RC[-64]+RC[-68] -> 83 | BU8: =RC[-1]-RC[-2] -> 28
B9: АО "НГА" | E9: =RC[-1]-RC[-2] -> 0 | I9: =RC[-1]-RC[-2] -> 0 | K9: 11 | L9: 0 | M9: =RC[-1]-RC[-2] -> -11 | N9: 2 | O9: 11 | P9: 0 | Q9: =RC[-1]-RC[-2] -> -11 | S9: 11 | T9: 11 | U9: =RC[-1]-RC[-2] -> 0 | W9: 0 | X9: 11 | Y9: =RC[-1]-RC[-2] -> 11 | Z9: 2 | AC9: =RC[-1]-RC[-2] -> 0 | AE9: 10 | AF9: 0 | AG9: =RC[-1]-RC[-2] -> -10 | AH9: 2 | AK9: =RC[-1]-RC[-2] -> 0 | AO9: =RC[-1]-RC[-2] -> 0 | AS9: =RC[-1]-RC[-2] -> 0 | AW9: =RC[-1]-RC[-2] -> 0 | BA9: =RC[-1]-RC[-2] -> 0 | BE9: =RC[-1]-RC[-2] -> 0 | BG9: 10 | BH9: 10 | BI9: =RC[-1]-RC[-2] -> 0 | BM9: =RC[-1]-RC[-2] -> 0 | BO9: 2 | BP9: 0 | BQ9: =RC[-1]-RC[-2] -> -2 | BR9: 2 | BS9: =RC[-4]+RC[-8]+RC[-12]+RC[-16]+RC[-20]+RC[-24]+RC[-28]+RC[-32]+RC[-36]+RC[-40]+RC[-44]+RC[-48]+RC[-52]+RC[-56]+RC[-60]+RC[-64]+RC[-68] -> 55 | BT9: =RC[-4]+RC[-8]+RC[-12]+RC[-16]+RC[-20]+RC[-24]+RC[-28]+RC[-32]+RC[-36]+RC[-40]+RC[-44]+RC[-48]+RC[-52]+RC[-56]+RC[-60]+RC[-64]+RC[-68] -> 32 | BU9: =RC[-1]-RC[-2] -> -23
A10: Сторонние внутренние | B10: КА-Группа ГАЗ( Вьетнам) | E10: =RC[-1]-RC[-2] -> 0 | I10: =RC[-1]-RC[-2] -> 0 | M10: =RC[-1]-RC[-2] -> 0 | Q10: =RC[-1]-RC[-2] -> 0 | U10: =RC[-1]-RC[-2] -> 0 | Y10: =RC[-1]-RC[-2] -> 0 | AC10: =RC[-1]-RC[-2] -> 0 | AG10: =RC[-1]-RC[-2] -> 0 | AK10: =RC[-1]-RC[-2] -> 0 | AO10: =RC[-1]-RC[-2] -> 0 | AS10: =RC[-1]-RC[-2] -> 0 | AW10: =RC[-1]-RC[-2] -> 0 | BA10: =RC[-1]-RC[-2] -> 0 | BE10: =RC[-1]-RC[-2] -> 0 | BI10: =RC[-1]-RC[-2] -> 0 | BM10: =RC[-1]-RC[-2] -> 0 | BQ10: =RC[-1]-RC[-2] -> 0 | BS10: =RC[-4]+RC[-8]+RC[-12]+RC[-16]+RC[-20]+RC[-24]+RC[-28]+RC[-32]+RC[-36]+RC[-40]+RC[-44]+RC[-48]+RC[-52]+RC[-56]+RC[-60]+RC[-64]+RC[-68] -> 0 | BT10: =RC[-4]+RC[-8]+RC[-12]+RC[-16]+RC[-20]+RC[-24]+RC[-28]+RC[-32]+RC[-36]+RC[-40]+RC[-44]+RC[-48]+RC[-52]+RC[-56]+RC[-60]+RC[-64]+RC[-68] -> 0 | BU10: =RC[-1]-RC[-2] -> 0
B11: Платформа А | E11: =RC[-1]-RC[-2] -> 0 | I11: =RC[-1]-RC[-2] -> 0 | M11: =RC[-1]-RC[-2] -> 0 | Q11: =RC[-1]-RC[-2] -> 0 | U11: =RC[-1]-RC[-2] -> 0 | Y11: =RC[-1]-RC[-2] -> 0 | AC11: =RC[-1]-RC[-2] -> 0 | AG11: =RC[-1]-RC[-2] -> 0 | AK11: =RC[-1]-RC[-2] -> 0 | AO11: =RC[-1]-RC[-2] -> 0 | AS11: =RC[-1]-RC[-2] -> 0 | AW11: =RC[-1]-RC[-2] -> 0 | BA11: =RC[-1]-RC[-2] -> 0 | BE11: =RC[-1]-RC[-2] -> 0 | BI11: =RC[-1]-RC[-2] -> 0 | BM11: =RC[-1]-RC[-2] -> 0 | BQ11: =RC[-1]-RC[-2] -> 0 | BS11: =RC[-4]+RC[-8]+RC[-12]+RC[-16]+RC[-20]+RC[-24]+RC[-28]+RC[-32]+RC[-36]+RC[-40]+RC[-44]+RC[-48]+RC[-52]+RC[-56]+RC[-60]+RC[-64]+RC[-68] -> 0 | BT11: =RC[-4]+RC[-8]+RC[-12]+RC[-16]+RC[-20]+RC[-24]+RC[-28]+RC[-32]+RC[-36]+RC[-40]+RC[-44]+RC[-48]+RC[-52]+RC[-56]+RC[-60]+RC[-64]+RC[-68] -> 0 | BU11: =RC[-1]-RC[-2] -> 0
A12: Сторонние внешние | B12: АО "ГОТХ" | C12: 5 | D12: 0 | E12: =RC[-1]-RC[-2] -> -5 | G12: 5 | H12: 0 | I12: =RC[-1]-RC[-2] -> -5 | K12: 5 | L12: 0 | M12: =RC[-1]-RC[-2] -> -5 | O12: 5 | P12: 0 | Q12: =RC[-1]-RC[-2] -> -5 | S12: 5 | T12: 0 | U12: =RC[-1]-RC[-2] -> -5 | W12: 5 | X12: 0 | Y12: =RC[-1]-RC[-2] -> -5 | AA12: 5 | AB12: 0 | AC12: =RC[-1]-RC[-2] -> -5 | AE12: 5 | AF12: 0 | AG12: =RC[-1]-RC[-2] -> -5 | AI12: 5 | AJ12: 0 | AK12: =RC[-1]-RC[-2] -> -5 | AM12: 5 | AN12: 0 | AO12: =RC[-1]-RC[-2] -> -5 | AQ12: 5 | AR12: 0 | AS12: =RC[-1]-RC[-2] -> -5 | AU12: 5 | AV12: 0 | AW12: =RC[-1]-RC[-2] -> -5 | AY12: 5 | AZ12: 0 | BA12: =RC[-1]-RC[-2] -> -5 | BC12: 5 | BD12: 0 | BE12: =RC[-1]-RC[-2] -> -5 | BG12: 5 | BH12: 0 | BI12: =RC[-1]-RC[-2] -> -5 | BK12: 5 | BL12: 0 | BM12: =RC[-1]-RC[-2] -> -5 | BO12: 5 | BP12: 0 | BQ12: =RC[-1]-RC[-2] -> -5 | BS12: =RC[-4]+RC[-8]+RC[-12]+RC[-16]+RC[-20]+RC[-24]+RC[-28]+RC[-32]+RC[-36]+RC[-40]+RC[-44]+RC[-48]+RC[-52]+RC[-56]+RC[-60]+RC[-64]+RC[-68] -> 85 | BT12: =RC[-4]+RC[-8]+RC[-12]+RC[-16]+RC[-20]+RC[-24]+RC[-28]+RC[-32]+RC[-36]+RC[-40]+RC[-44]+RC[-48]+RC[-52]+RC[-56]+RC[-60]+RC[-64]+RC[-68] -> 0 | BU12: =RC[-1]-RC[-2] -> -85
B13: ООО "Нерудные материалы-НН" | E13: =RC[-1]-RC[-2] -> 0 | I13: =RC[-1]-RC[-2] -> 0 | M13: =RC[-1]-RC[-2] -> 0 | Q13: =RC[-1]-RC[-2] -> 0 | U13: =RC[-1]-RC[-2] -> 0 | Y13: =RC[-1]-RC[-2] -> 0 | AC13: =RC[-1]-RC[-2] -> 0 | AG13: =RC[-1]-RC[-2] -> 0 | AK13: =RC[-1]-RC[-2] -> 0 | AO13: =RC[-1]-RC[-2] -> 0 | AS13: =RC[-1]-RC[-2] -> 0 | AW13: =RC[-1]-RC[-2] -> 0 | BA13: =RC[-1]-RC[-2] -> 0 | BE13: =RC[-1]-RC[-2] -> 0 | BI13: =RC[-1]-RC[-2] -> 0 | BM13: =RC[-1]-RC[-2] -> 0 | BQ13: =RC[-1]-RC[-2] -> 0 | BS13: =RC[-4]+RC[-8]+RC[-12]+RC[-16]+RC[-20]+RC[-24]+RC[-28]+RC[-32]+RC[-36]+RC[-40]+RC[-44]+RC[-48]+RC[-52]+RC[-56]+RC[-60]+RC[-64]+RC[-68] -> 0 | BT13: =RC[-4]+RC[-8]+RC[-12]+RC[-16]+RC[-20]+RC[-24]+RC[-28]+RC[-32]+RC[-36]+RC[-40]+RC[-44]+RC[-48]+RC[-52]+RC[-56]+RC[-60]+RC[-64]+RC[-68] -> 0 | BU13: =RC[-1]-RC[-2] -> 0
B14: ПК НВМ (ООО "Профит") | E14: =RC[-1]-RC[-2] -> 0 | I14: =RC[-1]-RC[-2] -> 0 | M14: =RC[-1]-RC[-2] -> 0 | Q14: =RC[-1]-RC[-2] -> 0 | U14: =RC[-1]-RC[-2] -> 0 | Y14: =RC[-1]-RC[-2] -> 0 | AC14: =RC[-1]-RC[-2] -> 0 | AG14: =RC[-1]-RC[-2] -> 0 | AK14: =RC[-1]-RC[-2] -> 0 | AO14: =RC[-1]-RC[-2] -> 0 | AS14: =RC[-1]-RC[-2] -> 0 | AW14: =RC[-1]-RC[-2] -> 0 | BA14: =RC[-1]-RC[-2] -> 0 | BE14: =RC[-1]-RC[-2] -> 0 | BI14: =RC[-1]-RC[-2] -> 0 | BM14: =RC[-1]-RC[-2] -> 0 | BQ14: =RC[-1]-RC[-2] -> 0 | BS14: =RC[-4]+RC[-8]+RC[-12]+RC[-16]+RC[-20]+RC[-24]+RC[-28]+RC[-32]+RC[-36]+RC[-40]+RC[-44]+RC[-48]+RC[-52]+RC[-56]+RC[-60]+RC[-64]+RC[-68] -> 0 | BT14: =RC[-4]+RC[-8]+RC[-12]+RC[-16]+RC[-20]+RC[-24]+RC[-28]+RC[-32]+RC[-36]+RC[-40]+RC[-44]+RC[-48]+RC[-52]+RC[-56]+RC[-60]+RC[-64]+RC[-68] -> 0 | BU14: =RC[-1]-RC[-2] -> 0
B15: ООО "ИнтерметГрупп" | C15: 2 | D15: 0 | E15: =RC[-1]-RC[-2] -> -2 | G15: 0 | H15: 0 | I15: =RC[-1]-RC[-2] -> 0 | K15: 0 | L15: 1 | M15: =RC[-1]-RC[-2] -> 1 | N15: 2 | O15: 2 | P15: 0 | Q15: =RC[-1]-RC[-2] -> -2 | R15: 2 | S15: 0 | T15: 0 | U15: =RC[-1]-RC[-2] -> 0 | W15: 0 | X15: 0 | Y15: =RC[-1]-RC[-2] -> 0 | AA15: 0 | AB15: 0 | AC15: =RC[-1]-RC[-2] -> 0 | AE15: 2 | AF15: 2 | AG15: =RC[-1]-RC[-2] -> 0 | AI15: 2 | AJ15: 3 | AK15: =RC[-1]-RC[-2] -> 1 | AL15: 2 | AM15: 1 | AN15: 2 | AO15: =RC[-1]-RC[-2] -> 1 | AP15: 2 | AQ15: 0 | AR15: 0 | AS15: =RC[-1]-RC[-2] -> 0 | AU15: 1 | AV15: 3 | AW15: =RC[-1]-RC[-2] -> 2 | AX15: 2 | AZ15: 0 | BA15: =RC[-1]-RC[-2] -> 0 | BC15: 0 | BD15: 0 | BE15: =RC[-1]-RC[-2] -> 0 | BG15: 0 | BH15: 2 | BI15: =RC[-1]-RC[-2] -> 2 | BJ15: 2 | BM15: =RC[-1]-RC[-2] -> 0 | BO15: 0 | BP15: 2 | BQ15: =RC[-1]-RC[-2] -> 2 | BS15: =RC[-4]+RC[-8]+RC[-12]+RC[-16]+RC[-20]+RC[-24]+RC[-28]+RC[-32]+RC[-36]+RC[-40]+RC[-44]+RC[-48]+RC[-52]+RC[-56]+RC[-60]+RC[-64]+RC[-68] -> 10 | BT15: =RC[-4]+RC[-8]+RC[-12]+RC[-16]+RC[-20]+RC[-24]+RC[-28]+RC[-32]+RC[-36]+RC[-40]+RC[-44]+RC[-48]+RC[-52]+RC[-56]+RC[-60]+RC[-64]+RC[-68] -> 15 | BU15: =RC[-1]-RC[-2] -> 5
B16: Прочие | C16: 2 | E16: =RC[-1]-RC[-2] -> -2 | I16: =RC[-1]-RC[-2] -> 0 | K16: 1 | L16: 3 | M16: =RC[-1]-RC[-2] -> 2 | N16: 2 | O16: 0 | P16: 2 | Q16: =RC[-1]-RC[-2] -> 2 | R16: 2 | U16: =RC[-1]-RC[-2] -> 0 | W16: 1 | Y16: =RC[-1]-RC[-2] -> -1 | AC16: =RC[-1]-RC[-2] -> 0 | AG16: =RC[-1]-RC[-2] -> 0 | AK16: =RC[-1]-RC[-2] -> 0 | AM16: 1 | AN16: 3 | AO16: =RC[-1]-RC[-2] -> 2 | AP16: 3 | AQ16: 1 | AR16: 0 | AS16: =RC[-1]-RC[-2] -> -1 | AT16: 2 | AW16: =RC[-1]-RC[-2] -> 0 | AY16: 1 | AZ16: 3 | BA16: =RC[-1]-RC[-2] -> 2 | BB16: 3 | BE16: =RC[-1]-RC[-2] -> 0 | BI16: =RC[-1]-RC[-2] -> 0 | BK16: 1 | BL16: 3 | BM16: =RC[-1]-RC[-2] -> 2 | BN16: 2 | BO16: 0 | BP16: 3 | BQ16: =RC[-1]-RC[-2] -> 3 | BR16: 3 | BS16: =RC[-4]+RC[-8]+RC[-12]+RC[-16]+RC[-20]+RC[-24]+RC[-28]+RC[-32]+RC[-36]+RC[-40]+RC[-44]+RC[-48]+RC[-52]+RC[-56]+RC[-60]+RC[-64]+RC[-68] -> 8 | BT16: =RC[-4]+RC[-8]+RC[-12]+RC[-16]+RC[-20]+RC[-24]+RC[-28]+RC[-32]+RC[-36]+RC[-40]+RC[-44]+RC[-48]+RC[-52]+RC[-56]+RC[-60]+RC[-64]+RC[-68] -> 17 | BU16: =RC[-1]-RC[-2] -> 9
A17: ИТОГО за день: | C17: =SUM(R[-14]C:R[-1]C) -> 24 | D17: =SUM(R[-14]C:R[-1]C) -> 12 | E17: =RC[-1]-RC[-2] -> -12 | G17: =SUM(R[-14]C:R[-1]C) -> 29 | H17: =SUM(R[-14]C:R[-1]C) -> 17 | I17: =RC[-1]-RC[-2] -> -12 | K17: =SUM(R[-14]C:R[-1]C) -> 42 | L17: =SUM(R[-14]C:R[-1]C) -> 23 | M17: =RC[-1]-RC[-2] -> -19 | O17: =SUM(R[-14]C:R[-1]C) -> 36 | P17: =SUM(R[-14]C:R[-1]C) -> 17 | Q17: =RC[-1]-RC[-2] -> -19 | S17: =SUM(R[-14]C:R[-1]C) -> 36 | T17: =SUM(R[-14]C:R[-1]C) -> 25 | U17: =RC[-1]-RC[-2] -> -11 | W17: =SUM(R[-14]C:R[-1]C) -> 27 | X17: =SUM(R[-14]C:R[-1]C) -> 26 | Y17: =RC[-1]-RC[-2] -> -1 | AA17: =SUM(R[-14]C:R[-1]C) -> 25 | AB17: =SUM(R[-14]C:R[-1]C) -> 6 | AC17: =RC[-1]-RC[-2] -> -19 | AE17: =SUM(R[-14]C:R[-1]C) -> 37 | AF17: =SUM(R[-14]C:R[-1]C) -> 18 | AG17: =RC[-1]-RC[-2] -> -19 | AI17: =SUM(R[-14]C:R[-1]C) -> 22 | AJ17: =SUM(R[-14]C:R[-1]C) -> 13 | AK17: =RC[-1]-RC[-2] -> -9 | AM17: =SUM(R[-14]C:R[-1]C) -> 27 | AN17: =SUM(R[-14]C:R[-1]C) -> 16 | AO17: =RC[-1]-RC[-2] -> -11 | AQ17: =SUM(R[-14]C:R[-1]C) -> 25 | AR17: =SUM(R[-14]C:R[-1]C) -> 8 | AS17: =RC[-1]-RC[-2] -> -17 | AU17: =SUM(R[-14]C:R[-1]C) -> 26 | AV17: =SUM(R[-14]C:R[-1]C) -> 13 | AW17: =RC[-1]-RC[-2] -> -13 | AY17: =SUM(R[-14]C:R[-1]C) -> 21 | AZ17: =SUM(R[-14]C:R[-1]C) -> 13 | BA17: =RC[-1]-RC[-2] -> -8 | BC17: =SUM(R[-14]C:R[-1]C) -> 20 | BD17: =SUM(R[-14]C:R[-1]C) -> 22 | BE17: =RC[-1]-RC[-2] -> 2 | BG17: =SUM(R[-14]C:R[-1]C) -> 39 | BH17: =SUM(R[-14]C:R[-1]C) -> 39 | BI17: =RC[-1]-RC[-2] -> 0 | BK17: =SUM(R[-14]C:R[-1]C) -> 21 | BL17: =SUM(R[-14]C:R[-1]C) -> 13 | BM17: =RC[-1]-RC[-2] -> -8 | BO17: =SUM(R[-14]C:R[-1]C) -> 27 | BP17: =SUM(R[-14]C:R[-1]C) -> 27 | BQ17: =RC[-1]-RC[-2] -> 0 | BS17: =RC[-4]+RC[-8]+RC[-12]+RC[-16]+RC[-20]+RC[-24]+RC[-28]+RC[-32]+RC[-36]+RC[-40]+RC[-44]+RC[-48]+RC[-52]+RC[-56]+RC[-60]+RC[-64]+RC[-68] -> 484 | BT17: =RC[-4]+RC[-8]+RC[-12]+RC[-16]+RC[-20]+RC[-24]+RC[-28]+RC[-32]+RC[-36]+RC[-40]+RC[-44]+RC[-48]+RC[-52]+RC[-56]+RC[-60]+RC[-64]+RC[-68] -> 308 | BU17: =RC[-1]-RC[-2] -> -176
A18: Эксплуатируемый парк локомотивов: | C18: 2 | D18: 2 | E18: =RC[-1]-RC[-2] -> 0 | G18: 2 | H18: 2 | I18: =RC[-1]-RC[-2] -> 0 | K18: 2 | L18: 2 | M18: =RC[-1]-RC[-2] -> 0 | O18: 2 | P18: 2 | Q18: =RC[-1]-RC[-2] -> 0 | S18: 2 | T18: 2 | U18: =RC[-1]-RC[-2] -> 0 | W18: 2 | X18: 2 | Y18: =RC[-1]-RC[-2] -> 0 | AA18: 2 | AB18: 2 | AC18: =RC[-1]-RC[-2] -> 0 | AE18: 2 | AF18: 2 | AG18: =RC[-1]-RC[-2] -> 0 | AI18: 2 | AJ18: 2 | AK18: =RC[-1]-RC[-2] -> 0 | AM18: 2 | AN18: 2 | AO18: =RC[-1]-RC[-2] -> 0 | AQ18: 2 | AR18: 2 | AS18: =RC[-1]-RC[-2] -> 0 | AU18: 2 | AV18: 2 | AW18: 2 | AY18: 2 | AZ18: 2 | BA18: =RC[-1]-RC[-2] -> 0 | BC18: 2 | BD18: 2 | BE18: =RC[-1]-RC[-2] -> 0 | BG18: 2 | BH18: 2 | BI18: =RC[-1]-RC[-2] -> 0 | BK18: 2 | BL18: 2 | BM18: =RC[-1]-RC[-2] -> 0 | BO18: 2 | BP18: 2 | BQ18: =RC[-1]-RC[-2] -> 0 | BS18: =AVERAGE(, RC[-4], RC[-8], RC[-12], RC[-16], RC[-20], RC[-24], RC[-28], RC[-32], RC[-36], RC[-40], RC[-44], RC[-48], RC[-52], RC[-56], RC[-60], RC[-64],RC[-68]) -> 1.8888888888888888 | BT18: =AVERAGE(, RC[-4], RC[-8], RC[-12], RC[-16], RC[-20], RC[-24], RC[-28], RC[-32], RC[-36], RC[-40], RC[-44], RC[-48], RC[-52], RC[-56], RC[-60], RC[-64],RC[-68]) -> 1.8888888888888888 | BU18: =RC[-1]-RC[-2] -> 0
A19: * - причины отклонения
A21: Причины отклонения по вагонам:
A22: 1. | B22: Погодные условия
A23: 2. | B23: Отсутствие четкого планирования со стороны клиента
A24: 3. | B24: Запрет на отправление со стороны ОАО "РЖД"
A25: 4. | B25: Снятие запрета на отправление со стороны ОАО "РЖД"
A26: 5. | B26: Отсутствие заготовки перевозочных документов в АС ЭТРАН
A27: 6. | B27: Появление заготовки перевозочных документов в АС ЭТРАН
A28: 7. | B28: Наличие заявки на обработку со стороны клиента на большее кол-во вагонов
A29: 8. | B29: Заключение договора на подачу/уборку вагонов с новым клиентом
A30: 9. | B30: Вагоны не готовы к уборке с грузового фронта по вине клиента
A32: Причины отклонения по локомотивам:
A33: 1. | B33: Переработано вагонов более заявленного кол-ва
A34: 2. | B34: Наличие аварийной заявки на обработку от клиента
A35: 3. | B35: Внутренняя работа (работа с путевой техникой, обработка депо и др.)
A36: 4. | B36: Испытание локомобиля
A37: 5. | B37: Отказ от заявки на обработку грузового фронта от клиента

Sheet: февраль
A1: Число | C1: 3 | G1: 4 | K1: 5 | O1: 6 | S1: 7 | W1: 10 | AA1: 11 | AE1: 12 | AI1: 13 | AM1: 14 | AQ1: 17 | AU1: 18 | AY1: 19 | BC1: 20 | BG1: 21 | BK1: 24 | BO1: 25 | BS1: 26 | BW1: 27 | CA1: 28 | CE1: 29 | CI1: 30 | CM1: Итого
A2: Клиенты | C2: план | D2: факт | E2: откл-е | F2: * | G2: план | H2: факт | I2: откл-е | J2: * | K2: план | L2: факт | M2: откл-е | N2: * | O2: план | P2: факт | Q2: откл-е | R2: * | S2: план | T2: факт | U2: откл-е | V2: * | W2: план | X2: факт | Y2: откл-е | Z2: * | AA2: план | AB2: факт | AC2: откл-е | AD2: * | AE2: план | AF2: факт | AG2: откл-е | AH2: * | AI2: план | AJ2: факт | AK2: откл-е | AL2: * | AM2: план | AN2: факт | AO2: откл-е | AP2: * | AQ2: план | AR2: факт | AS2: откл-е | AT2: * | AU2: план | AV2: факт | AW2: откл-е | AX2: * | AY2: план | AZ2: факт | BA2: откл-е | BB2: * | BC2: план | BD2: факт | BE2: откл-е | BF2: * | BG2: план | BH2: факт | BI2: откл-е | BJ2: * | BK2: план | BL2: факт | BM2: откл-е | BN2: * | BO2: план | BP2: факт | BQ2: откл-е | BR2: * | BS2: план | BT2: факт | BU2: откл-е | BV2: * | BW2: план | BX2: факт | BY2: откл-е | BZ2: * | CA2: план | CB2: факт | CC2: откл-е | CD2: * | CE2: план | CF2: факт | CG2: откл-е | CH2: * | CI2: план | CJ2: факт | CK2: откл-е | CL2: * | CM2: план | CN2: факт | CO2: откл-е
A3: БЕ ООО "НАК" | B3: ЛЗ | C3: 2 | D3: 1 | E3: =RC[-1]-RC[-2] -> -1 | I3: =RC[-1]-RC[-2] -> 0 | K3: 2 | L3: 1 | M3: =RC[-1]-RC[-2] -> -1 | O3: 2 | P3: 0 | Q3: =RC[-1]-RC[-2] -> -2 | U3: =RC[-1]-RC[-2] -> 0 | W3: 1 | X3: 1 | Y3: =RC[-1]-RC[-2] -> 0 | AC3: =RC[-1]-RC[-2] -> 0 | AE3: 1 | AG3: =RC[-1]-RC[-2] -> -1 | AI3: 0 | AJ3: 1 | AK3: =RC[-1]-RC[-2] -> 1 | AL3: 2 | AM3: 1 | AN3: 0 | AO3: =RC[-1]-RC[-2] -> -1 | AP3: 2 | AQ3: 1 | AR3: 0 | AS3: =RC[-1]-RC[-2] -> -1 | AT3: 0 | AU3: 2 | AV3: 1 | AW3: =RC[-1]-RC[-2] -> -1 | AX3: 2 | BA3: =RC[-1]-RC[-2] -> 0 | BC3: 0 | BD3: 1 | BE3: =RC[-1]-RC[-2] -> 1 | BF3: 2 | BI3: =RC[-1]-RC[-2] -> 0 | BK3: 0 | BL3: 1 | BM3: =RC[-1]-RC[-2] -> 1 | BQ3: =RC[-1]-RC[-2] -> 0 | BS3: 0 | BT3: 2 | BU3: =RC[-1]-RC[-2] -> 2 | BV3: 2 | BY3: =RC[-1]-RC[-2] -> 0 | CC3: =RC[-1]-RC[-2] -> 0 | CG3: =RC[-1]-RC[-2] -> 0 | CK3: =RC[-1]-RC[-2] -> 0 | CM3: =RC[-4]+RC[-8]+RC[-12]+RC[-16]+RC[-20]+RC[-24]+RC[-28]+RC[-32]+RC[-36]+RC[-40]+RC[-44]+RC[-48]+RC[-52]+RC[-56]+RC[-60]+RC[-64]+RC[-68]+RC[-72]+RC[-76]+RC[-80]+RC[-84]+RC[-88] -> 12 | CN3: =RC[-4]+RC[-8]+RC[-12]+RC[-16]+RC[-20]+RC[-24]+RC[-28]+RC[-32]+RC[-36]+RC[-40]+RC[-44]+RC[-48]+RC[-52]+RC[-56]+RC[-60]+RC[-64]+RC[-68]+RC[-72]+RC[-76]+RC[-80]+RC[-84]+RC[-88] -> 9 | CO3: =RC[-1]-RC[-2] -> -3
B4: ПРЗ | C4: 2 | D4: 0 | E4: =RC[-1]-RC[-2] -> -2 | I4: =RC[-1]-RC[-2] -> 0 | K4: 2 | L4: 2 | M4: =RC[-1]-RC[-2] -> 0 | Q4: =RC[-1]-RC[-2] -> 0 | S4: 2 | T4: 2 | U4: =RC[-1]-RC[-2] -> 0 | Y4: =RC[-1]-RC[-2] -> 0 | AA4: 2 | AB4: 2 | AC4: =RC[-1]-RC[-2] -> 0 | AG4: =RC[-1]-RC[-2] -> 0 | AI4: 1 | AJ4: 1 | AK4: =RC[-1]-RC[-2] -> 0 | AO4: =RC[-1]-RC[-2] -> 0 | AQ4: 0 | AR4: 2 | AS4: =RC[-1]-RC[-2] -> 2 | AT4: 2 | AW4: =RC[-1]-RC[-2] -> 0 | BA4: =RC[-1]-RC[-2] -> 0 | BC4: 0 | BD4: 1 | BE4: =RC[-1]-RC[-2] -> 1 | BI4: =RC[-1]-RC[-2] -> 0 | BM4: =RC[-1]-RC[-2] -> 0 | BO4: 1 | BP4: 1 | BQ4: =RC[-1]-RC[-2] -> 0 | BU4: =RC[-1]-RC[-2] -> 0 | BY4: =RC[-1]-RC[-2] -> 0 | CA4: 2 | CB4: 2 | CC4: =RC[-1]-RC[-2] -> 0 | CG4: =RC[-1]-RC[-2] -> 0 | CK4: =RC[-1]-RC[-2] -> 0 | CM4: =RC[-4]+RC[-8]+RC[-12]+RC[-16]+RC[-20]+RC[-24]+RC[-28]+RC[-32]+RC[-36]+RC[-40]+RC[-44]+RC[-48]+RC[-52]+RC[-56]+RC[-60]+RC[-64]+RC[-68]+RC[-72]+RC[-76]+RC[-80]+RC[-84]+RC[-88] -> 12 | CN4: =RC[-4]+RC[-8]+RC[-12]+RC[-16]+RC[-20]+RC[-24]+RC[-28]+RC[-32]+RC[-36]+RC[-40]+RC[-44]+RC[-48]+RC[-52]+RC[-56]+RC[-60]+RC[-64]+RC[-68]+RC[-72]+RC[-76]+RC[-80]+RC[-84]+RC[-88] -> 13 | CO4: =RC[-1]-RC[-2] -> 1
A5: ООО "НАК" | B5: ЗШП | E5: =RC[-1]-RC[-2] -> 0 | I5: =RC[-1]-RC[-2] -> 0 | M5: =RC[-1]-RC[-2] -> 0 | Q5: =RC[-1]-RC[-2] -> 0 | U5: =RC[-1]-RC[-2] -> 0 | Y5: =RC[-1]-RC[-2] -> 0 | AC5: =RC[-1]-RC[-2] -> 0 | AG5: =RC[-1]-RC[-2] -> 0 | AK5: =RC[-1]-RC[-2] -> 0 | AO5: =RC[-1]-RC[-2] -> 0 | AS5: =RC[-1]-RC[-2] -> 0 | AW5: =RC[-1]-RC[-2] -> 0 | BA5: =RC[-1]-RC[-2] -> 0 | BE5: =RC[-1]-RC[-2] -> 0 | BI5: =RC[-1]-RC[-2] -> 0 | BM5: =RC[-1]-RC[-2] -> 0 | BQ5: =RC[-1]-RC[-2] -> 0 | BU5: =RC[-1]-RC[-2] -> 0 | BY5: =RC[-1]-RC[-2] -> 0 | CC5: =RC[-1]-RC[-2] -> 0 | CG5: =RC[-1]-RC[-2] -> 0 | CK5: =RC[-1]-RC[-2] -> 0 | CM5: =RC[-4]+RC[-8]+RC[-12]+RC[-16]+RC[-20]+RC[-24]+RC[-28]+RC[-32]+RC[-36]+RC[-40]+RC[-44]+RC[-48]+RC[-52]+RC[-56]+RC[-60]+RC[-64]+RC[-68]+RC[-72]+RC[-76]+RC[-80]+RC[-84]+RC[-88] -> 0 | CN5: =RC[-4]+RC[-8]+RC[-12]+RC[-16]+RC[-20]+RC[-24]+RC[-28]+RC[-32]+RC[-36]+RC[-40]+RC[-44]+RC[-48]+RC[-52]+RC[-56]+RC[-60]+RC[-64]+RC[-68]+RC[-72]+RC[-76]+RC[-80]+RC[-84]+RC[-88] -> 0 | CO5: =RC[-1]-RC[-2] -> 0
B6: НАК | E6: =RC[-1]-RC[-2] -> 0 | I6: =RC[-1]-RC[-2] -> 0 | M6: =RC[-1]-RC[-2] -> 0 | Q6: =RC[-1]-RC[-2] -> 0 | U6: =RC[-1]-RC[-2] -> 0 | Y6: =RC[-1]-RC[-2] -> 0 | AC6: =RC[-1]-RC[-2] -> 0 | AG6: =RC[-1]-RC[-2] -> 0 | AK6: =RC[-1]-RC[-2] -> 0 | AO6: =RC[-1]-RC[-2] -> 0 | AS6: =RC[-1]-RC[-2] -> 0 | AW6: =RC[-1]-RC[-2] -> 0 | BA6: =RC[-1]-RC[-2] -> 0 | BE6: =RC[-1]-RC[-2] -> 0 | BI6: =RC[-1]-RC[-2] -> 0 | BM6: =RC[-1]-RC[-2] -> 0 | BQ6: =RC[-1]-RC[-2] -> 0 | BU6: =RC[-1]-RC[-2] -> 0 | BY6: =RC[-1]-RC[-2] -> 0 | CC6: =RC[-1]-RC[-2] -> 0 | CG6: =RC[-1]-RC[-2] -> 0 | CK6: =RC[-1]-RC[-2] -> 0 | CM6: =RC[-4]+RC[-8]+RC[-12]+RC[-16]+RC[-20]+RC[-24]+RC[-28]+RC[-32]+RC[-36]+RC[-40]+RC[-44]+RC[-48]+RC[-52]+RC[-56]+RC[-60]+RC[-64]+RC[-68]+RC[-72]+RC[-76]+RC[-80]+RC[-84]+RC[-88] -> 0 | CN6: =RC[-4]+RC[-8]+RC[-12]+RC[-16]+RC[-20]+RC[-24]+RC[-28]+RC[-32]+RC[-36]+RC[-40]+RC[-44]+RC[-48]+RC[-52]+RC[-56]+RC[-60]+RC[-64]+RC[-68]+RC[-72]+RC[-76]+RC[-80]+RC[-84]+RC[-88] -> 0 | CO6: =RC[-1]-RC[-2] -> 0
B7: НЛЗ | E7: =RC[-1]-RC[-2] -> 0 | I7: =RC[-1]-RC[-2] -> 0 | M7: =RC[-1]-RC[-2] -> 0 | Q7: =RC[-1]-RC[-2] -> 0 | U7: =RC[-1]-RC[-2] -> 0 | Y7: =RC[-1]-RC[-2] -> 0 | AC7: =RC[-1]-RC[-2] -> 0 | AG7: =RC[-1]-RC[-2] -> 0 | AK7: =RC[-1]-RC[-2] -> 0 | AO7: =RC[-1]-RC[-2] -> 0 | AS7: =RC[-1]-RC[-2] -> 0 | AW7: =RC[-1]-RC[-2] -> 0 | BA7: =RC[-1]-RC[-2] -> 0 | BE7: =RC[-1]-RC[-2] -> 0 | BI7: =RC[-1]-RC[-2] -> 0 | BM7: =RC[-1]-RC[-2] -> 0 | BQ7: =RC[-1]-RC[-2] -> 0 | BU7: =RC[-1]-RC[-2] -> 0 | BY7: =RC[-1]-RC[-2] -> 0 | CC7: =RC[-1]-RC[-2] -> 0 | CG7: =RC[-1]-RC[-2] -> 0 | CK7: =RC[-1]-RC[-2] -> 0 | CM7: =RC[-4]+RC[-8]+RC[-12]+RC[-16]+RC[-20]+RC[-24]+RC[-28]+RC[-32]+RC[-36]+RC[-40]+RC[-44]+RC[-48]+RC[-52]+RC[-56]+RC[-60]+RC[-64]+RC[-68]+RC[-72]+RC[-76]+RC[-80]+RC[-84]+RC[-88] -> 0 | CN7: =RC[-4]+RC[-8]+RC[-12]+RC[-16]+RC[-20]+RC[-24]+RC[-28]+RC[-32]+RC[-36]+RC[-40]+RC[-44]+RC[-48]+RC[-52]+RC[-56]+RC[-60]+RC[-64]+RC[-68]+RC[-72]+RC[-76]+RC[-80]+RC[-84]+RC[-88] -> 0 | CO7: =RC[-1]-RC[-2] -> 0
A8: ООО "НАЗ", АО "НГА" | B8: АЗ "НАЗ" | E8: =RC[-1]-RC[-2] -> 0 | I8: =RC[-1]-RC[-2] -> 0 | M8: =RC[-1]-RC[-2] -> 0 | O8: 0 | P8: 3 | Q8: =RC[-1]-RC[-2] -> 3 | U8: =RC[-1]-RC[-2] -> 0 | W8: 0 | X8: 5 | Y8: =RC[-1]-RC[-2] -> 5 | AC8: =RC[-1]-RC[-2] -> 0 | AE8: 0 | AF8: 7 | AG8: =RC[-1]-RC[-2] -> 7 | AK8: =RC[-1]-RC[-2] -> 0 | AO8: =RC[-1]-RC[-2] -> 0 | AS8: =RC[-1]-RC[-2] -> 0 | AW8: =RC[-1]-RC[-2] -> 0 | BA8: =RC[-1]-RC[-2] -> 0 | BE8: =RC[-1]-RC[-2] -> 0 | BG8: 0 | BH8: 2 | BI8: =RC[-1]-RC[-2] -> 2 | BM8: =RC[-1]-RC[-2] -> 0 | BQ8: =RC[-1]-RC[-2] -> 0 | BS8: 0 | BT8: 3 | BU8: =RC[-1]-RC[-2] -> 3 | BY8: =RC[-1]-RC[-2] -> 0 | CC8: =RC[-1]-RC[-2] -> 0 | CG8: =RC[-1]-RC[-2] -> 0 | CK8: =RC[-1]-RC[-2] -> 0 | CM8: =RC[-4]+RC[-8]+RC[-12]+RC[-16]+RC[-20]+RC[-24]+RC[-28]+RC[-32]+RC[-36]+RC[-40]+RC[-44]+RC[-48]+RC[-52]+RC[-56]+RC[-60]+RC[-64]+RC[-68]+RC[-72]+RC[-76]+RC[-80]+RC[-84]+RC[-88] -> 0 | CN8: =RC[-4]+RC[-8]+RC[-12]+RC[-16]+RC[-20]+RC[-24]+RC[-28]+RC[-32]+RC[-36]+RC[-40]+RC[-44]+RC[-48]+RC[-52]+RC[-56]+RC[-60]+RC[-64]+RC[-68]+RC[-72]+RC[-76]+RC[-80]+RC[-84]+RC[-88] -> 20 | CO8: =RC[-1]-RC[-2] -> 20
B9: АО "НГА" | E9: =RC[-1]-RC[-2] -> 0 | I9: =RC[-1]-RC[-2] -> 0 | M9: =RC[-1]-RC[-2] -> 0 | Q9: =RC[-1]-RC[-2] -> 0 | S9: 0 | T9: 11 | U9: =RC[-1]-RC[-2] -> 11 | W9: 0 | X9: 10 | Y9: =RC[-1]-RC[-2] -> 10 | AA9: 0 | AB9: 10 | AC9: =RC[-1]-RC[-2] -> 10 | AG9: =RC[-1]-RC[-2] -> 0 | AK9: =RC[-1]-RC[-2] -> 0 | AO9: =RC[-1]-RC[-2] -> 0 | AS9: =RC[-1]-RC[-2] -> 0 | AW9: =RC[-1]-RC[-2] -> 0 | BA9: =RC[-1]-RC[-2] -> 0 | BE9: =RC[-1]-RC[-2] -> 0 | BI9: =RC[-1]-RC[-2] -> 0 | BM9: =RC[-1]-RC[-2] -> 0 | BQ9: =RC[-1]-RC[-2] -> 0 | BU9: =RC[-1]-RC[-2] -> 0 | BY9: =RC[-1]-RC[-2] -> 0 | CC9: =RC[-1]-RC[-2] -> 0 | CG9: =RC[-1]-RC[-2] -> 0 | CK9: =RC[-1]-RC[-2] -> 0 | CM9: =RC[-4]+RC[-8]+RC[-12]+RC[-16]+RC[-20]+RC[-24]+RC[-28]+RC[-32]+RC[-36]+RC[-40]+RC[-44]+RC[-48]+RC[-52]+RC[-56]+RC[-60]+RC[-64]+RC[-68]+RC[-72]+RC[-76]+RC[-80]+RC[-84]+RC[-88] -> 0 | CN9: =RC[-4]+RC[-8]+RC[-12]+RC[-16]+RC[-20]+RC[-24]+RC[-28]+RC[-32]+RC[-36]+RC[-40]+RC[-44]+RC[-48]+RC[-52]+RC[-56]+RC[-60]+RC[-64]+RC[-68]+RC[-72]+RC[-76]+RC[-80]+RC[-84]+RC[-88] -> 31 | CO9: =RC[-1]-RC[-2] -> 31
A10: Сторонние внутренние | B10: КА-Группа ГАЗ( Вьетнам) | E10: =RC[-1]-RC[-2] -> 0 | I10: =RC[-1]-RC[-2] -> 0 | K10: 11 | L10: 0 | M10: =RC[-1]-RC[-2] -> -11 | N10: 2 | O10: 11 | P10: 0 | Q10: =RC[-1]-RC[-2] -> -11 | R10: 2 | S10: 11 | T10: 0 | U10: =RC[-1]-RC[-2] -> -11 | V10: 2 | W10: 5 | X10: 0 | Y10: =RC[-1]-RC[-2] -> -5 | Z10: 2 | AC10: =RC[-1]-RC[-2] -> 0 | AG10: =RC[-1]-RC[-2] -> 0 | AK10: =RC[-1]-RC[-2] -> 0 | AO10: =RC[-1]-RC[-2] -> 0 | AS10: =RC[-1]-RC[-2] -> 0 | AW10: =RC[-1]-RC[-2] -> 0 | BA10: =RC[-1]-RC[-2] -> 0 | BE10: =RC[-1]-RC[-2] -> 0 | BI10: =RC[-1]-RC[-2] -> 0 | BM10: =RC[-1]-RC[-2] -> 0 | BQ10: =RC[-1]-RC[-2] -> 0 | BU10: =RC[-1]-RC[-2] -> 0 | BY10: =RC[-1]-RC[-2] -> 0 | CC10: =RC[-1]-RC[-2] -> 0 | CG10: =RC[-1]-RC[-2] -> 0 | CK10: =RC[-1]-RC[-2] -> 0 | CM10: =RC[-4]+RC[-8]+RC[-12]+RC[-16]+RC[-20]+RC[-24]+RC[-28]+RC[-32]+RC[-36]+RC[-40]+RC[-44]+RC[-48]+RC[-52]+RC[-56]+RC[-60]+RC[-64]+RC[-68]+RC[-72]+RC[-76]+RC[-80]+RC[-84]+RC[-88] -> 38 | CN10: =RC[-4]+RC[-8]+RC[-12]+RC[-16]+RC[-20]+RC[-24]+RC[-28]+RC[-32]+RC[-36]+RC[-40]+RC[-44]+RC[-48]+RC[-52]+RC[-56]+RC[-60]+RC[-64]+RC[-68]+RC[-72]+RC[-76]+RC[-80]+RC[-84]+RC[-88] -> 0 | CO10: =RC[-1]-RC[-2] -> -38
B11: Платформа А | E11: =RC[-1]-RC[-2] -> 0 | I11: =RC[-1]-RC[-2] -> 0 | M11: =RC[-1]-RC[-2] -> 0 | Q11: =RC[-1]-RC[-2] -> 0 | U11: =RC[-1]-RC[-2] -> 0 | Y11: =RC[-1]-RC[-2] -> 0 | AC11: =RC[-1]-RC[-2] -> 0 | AG11: =RC[-1]-RC[-2] -> 0 | AK11: =RC[-1]-RC[-2] -> 0 | AO11: =RC[-1]-RC[-2] -> 0 | AS11: =RC[-1]-RC[-2] -> 0 | AW11: =RC[-1]-RC[-2] -> 0 | BA11: =RC[-1]-RC[-2] -> 0 | BE11: =RC[-1]-RC[-2] -> 0 | BI11: =RC[-1]-RC[-2] -> 0 | BM11: =RC[-1]-RC[-2] -> 0 | BQ11: =RC[-1]-RC[-2] -> 0 | BU11: =RC[-1]-RC[-2] -> 0 | BY11: =RC[-1]-RC[-2] -> 0 | CC11: =RC[-1]-RC[-2] -> 0 | CG11: =RC[-1]-RC[-2] -> 0 | CK11: =RC[-1]-RC[-2] -> 0 | CM11: =RC[-4]+RC[-8]+RC[-12]+RC[-16]+RC[-20]+RC[-24]+RC[-28]+RC[-32]+RC[-36]+RC[-40]+RC[-44]+RC[-48]+RC[-52]+RC[-56]+RC[-60]+RC[-64]+RC[-68]+RC[-72]+RC[-76]+RC[-80]+RC[-84]+RC[-88] -> 0 | CN11: =RC[-4]+RC[-8]+RC[-12]+RC[-16]+RC[-20]+RC[-24]+RC[-28]+RC[-32]+RC[-36]+RC[-40]+RC[-44]+RC[-48]+RC[-52]+RC[-56]+RC[-60]+RC[-64]+RC[-68]+RC[-72]+RC[-76]+RC[-80]+RC[-84]+RC[-88] -> 0 | CO11: =RC[-1]-RC[-2] -> 0
A12: Сторонние внешние | B12: АО "ГОТХ" | C12: 0 | D12: 5 | E12: =RC[-1]-RC[-2] -> 5 | F12: 2 | I12: =RC[-1]-RC[-2] -> 0 | K12: 2 | L12: 5 | M12: =RC[-1]-RC[-2] -> 3 | N12: 2 | Q12: =RC[-1]-RC[-2] -> 0 | S12: 1 | T12: 8 | U12: =RC[-1]-RC[-2] -> 7 | W12: 0 | X12: 2 | Y12: =RC[-1]-RC[-2] -> 2 | Z12: 2 | AA12: 1 | AC12: =RC[-1]-RC[-2] -> -1 | AG12: =RC[-1]-RC[-2] -> 0 | AI12: 1 | AJ12: 5 | AK12: =RC[-1]-RC[-2] -> 4 | AL12: 2 | AO12: =RC[-1]-RC[-2] -> 0 | AS12: =RC[-1]-RC[-2] -> 0 | AW12: =RC[-1]-RC[-2] -> 0 | AY12: 0 | AZ12: 6 | BA12: =RC[-1]-RC[-2] -> 6 | BE12: =RC[-1]-RC[-2] -> 0 | BI12: =RC[-1]-RC[-2] -> 0 | BK12: 0 | BL12: 2 | BM12: =RC[-1]-RC[-2] -> 2 | BN12: 2 | BQ12: =RC[-1]-RC[-2] -> 0 | BS12: 0 | BT12: 3 | BU12: =RC[-1]-RC[-2] -> 3 | BV12: 3 | BY12: =RC[-1]-RC[-2] -> 0 | CC12: =RC[-1]-RC[-2] -> 0 | CG12: =RC[-1]-RC[-2] -> 0 | CK12: =RC[-1]-RC[-2] -> 0 | CM12: =RC[-4]+RC[-8]+RC[-12]+RC[-16]+RC[-20]+RC[-24]+RC[-28]+RC[-32]+RC[-36]+RC[-40]+RC[-44]+RC[-48]+RC[-52]+RC[-56]+RC[-60]+RC[-64]+RC[-68]+RC[-72]+RC[-76]+RC[-80]+RC[-84]+RC[-88] -> 5 | CN12: =RC[-4]+RC[-8]+RC[-12]+RC[-16]+RC[-20]+RC[-24]+RC[-28]+RC[-32]+RC[-36]+RC[-40]+RC[-44]+RC[-48]+RC[-52]+RC[-56]+RC[-60]+RC[-64]+RC[-68]+RC[-72]+RC[-76]+RC[-80]+RC[-84]+RC[-88] -> 36 | CO12: =RC[-1]-RC[-2] -> 31
B13: ООО "Нерудные материалы-НН" | E13: =RC[-1]-RC[-2] -> 0 | I13: =RC[-1]-RC[-2] -> 0 | M13: =RC[-1]-RC[-2] -> 0 | Q13: =RC[-1]-RC[-2] -> 0 | U13: =RC[-1]-RC[-2] -> 0 | Y13: =RC[-1]-RC[-2] -> 0 | AC13: =RC[-1]-RC[-2] -> 0 | AG13: =RC[-1]-RC[-2] -> 0 | AK13: =RC[-1]-RC[-2] -> 0 | AO13: =RC[-1]-RC[-2] -> 0 | AS13: =RC[-1]-RC[-2] -> 0 | AW13: =RC[-1]-RC[-2] -> 0 | BA13: =RC[-1]-RC[-2] -> 0 | BE13: =RC[-1]-RC[-2] -> 0 | BI13: =RC[-1]-RC[-2] -> 0 | BM13: =RC[-1]-RC[-2] -> 0 | BQ13: =RC[-1]-RC[-2] -> 0 | BU13: =RC[-1]-RC[-2] -> 0 | BY13: =RC[-1]-RC[-2] -> 0 | CC13: =RC[-1]-RC[-2] -> 0 | CG13: =RC[-1]-RC[-2] -> 0 | CK13: =RC[-1]-RC[-2] -> 0 | CM13: =RC[-4]+RC[-8]+RC[-12]+RC[-16]+RC[-20]+RC[-24]+RC[-28]+RC[-32]+RC[-36]+RC[-40]+RC[-44]+RC[-48]+RC[-52]+RC[-56]+RC[-60]+RC[-64]+RC[-68]+RC[-72]+RC[-76]+RC[-80]+RC[-84]+RC[-88] -> 0 | CN13: =RC[-4]+RC[-8]+RC[-12]+RC[-16]+RC[-20]+RC[-24]+RC[-28]+RC[-32]+RC[-36]+RC[-40]+RC[-44]+RC[-48]+RC[-52]+RC[-56]+RC[-60]+RC[-64]+RC[-68]+RC[-72]+RC[-76]+RC[-80]+RC[-84]+RC[-88] -> 0 | CO13: =RC[-1]-RC[-2] -> 0
B14: ПК НВМ (ООО "Профит") | E14: =RC[-1]-RC[-2] -> 0 | I14: =RC[-1]-RC[-2] -> 0 | M14: =RC[-1]-RC[-2] -> 0 | Q14: =RC[-1]-RC[-2] -> 0 | U14: =RC[-1]-RC[-2] -> 0 | Y14: =RC[-1]-RC[-2] -> 0 | AC14: =RC[-1]-RC[-2] -> 0 | AG14: =RC[-1]-RC[-2] -> 0 | AK14: =RC[-1]-RC[-2] -> 0 | AO14: =RC[-1]-RC[-2] -> 0 | AS14: =RC[-1]-RC[-2] -> 0 | AW14: =RC[-1]-RC[-2] -> 0 | BA14: =RC[-1]-RC[-2] -> 0 | BE14: =RC[-1]-RC[-2] -> 0 | BI14: =RC[-1]-RC[-2] -> 0 | BM14: =RC[-1]-RC[-2] -> 0 | BQ14: =RC[-1]-RC[-2] -> 0 | BU14: =RC[-1]-RC[-2] -> 0 | BY14: =RC[-1]-RC[-2] -> 0 | CC14: =RC[-1]-RC[-2] -> 0 | CG14: =RC[-1]-RC[-2] -> 0 | CK14: =RC[-1]-RC[-2] -> 0 | CM14: =RC[-4]+RC[-8]+RC[-12]+RC[-16]+RC[-20]+RC[-24]+RC[-28]+RC[-32]+RC[-36]+RC[-40]+RC[-44]+RC[-48]+RC[-52]+RC[-56]+RC[-60]+RC[-64]+RC[-68]+RC[-72]+RC[-76]+RC[-80]+RC[-84]+RC[-88] -> 0 | CN14: =RC[-4]+RC[-8]+RC[-12]+RC[-16]+RC[-20]+RC[-24]+RC[-28]+RC[-32]+RC[-36]+RC[-40]+RC[-44]+RC[-48]+RC[-52]+RC[-56]+RC[-60]+RC[-64]+RC[-68]+RC[-72]+RC[-76]+RC[-80]+RC[-84]+RC[-88] -> 0 | CO14: =RC[-1]-RC[-2] -> 0
B15: ООО "ИнтерметГрупп" | C15: 1 | D15: 2 | E15: =RC[-1]-RC[-2] -> 1 | F15: 2 | I15: =RC[-1]-RC[-2] -> 0 | M15: =RC[-1]-RC[-2] -> 0 | O15: 2 | Q15: =RC[-1]-RC[-2] -> -2 | U15: =RC[-1]-RC[-2] -> 0 | W15: 2 | X15: 3 | Y15: =RC[-1]-RC[-2] -> 1 | AC15: =RC[-1]-RC[-2] -> 0 | AE15: 0 | AF15: 2 | AG15: =RC[-1]-RC[-2] -> 2 | AK15: =RC[-1]-RC[-2] -> 0 | AM15: 2 | AN15: 3 | AO15: =RC[-1]-RC[-2] -> 1 | AS15: =RC[-1]-RC[-2] -> 0 | AW15: =RC[-1]-RC[-2] -> 0 | AY15: 3 | AZ15: 0 | BA15: =RC[-1]-RC[-2] -> -3 | BB15: 2 | BE15: =RC[-1]-RC[-2] -> 0 | BI15: =RC[-1]-RC[-2] -> 0 | BK15: 1 | BL15: 1 | BM15: =RC[-1]-RC[-2] -> 0 | BQ15: =RC[-1]-RC[-2] -> 0 | BU15: =RC[-1]-RC[-2] -> 0 | BW15: 2 | BX15: 0 | BY15: =RC[-1]-RC[-2] -> -2 | BZ15: 2 | CA15: 2 | CB15: 0 | CC15: =RC[-1]-RC[-2] -> -2 | CD15: 2 | CG15: =RC[-1]-RC[-2] -> 0 | CK15: =RC[-1]-RC[-2] -> 0 | CM15: =RC[-4]+RC[-8]+RC[-12]+RC[-16]+RC[-20]+RC[-24]+RC[-28]+RC[-32]+RC[-36]+RC[-40]+RC[-44]+RC[-48]+RC[-52]+RC[-56]+RC[-60]+RC[-64]+RC[-68]+RC[-72]+RC[-76]+RC[-80]+RC[-84]+RC[-88] -> 15 | CN15: =RC[-4]+RC[-8]+RC[-12]+RC[-16]+RC[-20]+RC[-24]+RC[-28]+RC[-32]+RC[-36]+RC[-40]+RC[-44]+RC[-48]+RC[-52]+RC[-56]+RC[-60]+RC[-64]+RC[-68]+RC[-72]+RC[-76]+RC[-80]+RC[-84]+RC[-88] -> 11 | CO15: =RC[-1]-RC[-2] -> -4
B16: Прочие | C16: 1 | D16: 0 | E16: =RC[-1]-RC[-2] -> -1 | F16: 2 | I16: =RC[-1]-RC[-2] -> 0 | K16: 1 | L16: 0 | M16: =RC[-1]-RC[-2] -> -1 | N16: 2 | Q16: =RC[-1]-RC[-2] -> 0 | S16: 0 | T16: 4 | U16: =RC[-1]-RC[-2] -> 4 | W16: 2 | X16: 3 | Y16: =RC[-1]-RC[-2] -> 1 | Z16: 2 | AC16: =RC[-1]-RC[-2] -> 0 | AG16: =RC[-1]-RC[-2] -> 0 | AI16: 1 | AJ16: 3 | AK16: =RC[-1]-RC[-2] -> 2 | AL16: 2 | AO16: =RC[-1]-RC[-2] -> 0 | AS16: =RC[-1]-RC[-2] -> 0 | AU16: 2 | AV16: 5 | AW16: =RC[-1]-RC[-2] -> 3 | AX16: 2 | BA16: =RC[-1]-RC[-2] -> 0 | BE16: =RC[-1]-RC[-2] -> 0 | BI16: =RC[-1]-RC[-2] -> 0 | BK16: 0 | BL16: 6 | BM16: =RC[-1]-RC[-2] -> 6 | BN16: 2 | BQ16: =RC[-1]-RC[-2] -> 0 | BS16: 1 | BT16: 2 | BU16: =RC[-1]-RC[-2] -> 1 | BV16: 2 | BW16: 0 | BX16: 3 | BY16: =RC[-1]-RC[-2] -> 3 | BZ16: 2 | CC16: =RC[-1]-RC[-2] -> 0 | CG16: =RC[-1]-RC[-2] -> 0 | CK16: =RC[-1]-RC[-2] -> 0 | CM16: =RC[-4]+RC[-8]+RC[-12]+RC[-16]+RC[-20]+RC[-24]+RC[-28]+RC[-32]+RC[-36]+RC[-40]+RC[-44]+RC[-48]+RC[-52]+RC[-56]+RC[-60]+RC[-64]+RC[-68]+RC[-72]+RC[-76]+RC[-80]+RC[-84]+RC[-88] -> 8 | CN16: =RC[-4]+RC[-8]+RC[-12]+RC[-16]+RC[-20]+RC[-24]+RC[-28]+RC[-32]+RC[-36]+RC[-40]+RC[-44]+RC[-48]+RC[-52]+RC[-56]+RC[-60]+RC[-64]+RC[-68]+RC[-72]+RC[-76]+RC[-80]+RC[-84]+RC[-88] -> 26 | CO16: =RC[-1]-RC[-2] -> 18
A17: ИТОГО за день: | C17: =SUM(R[-14]C:R[-1]C) -> 6 | D17: =SUM(R[-14]C:R[-1]C) -> 8 | E17: =RC[-1]-RC[-2] -> 2 | G17: =SUM(R[-14]C:R[-1]C) -> 0 | H17: =SUM(R[-14]C:R[-1]C) -> 0 | I17: =RC[-1]-RC[-2] -> 0 | K17: =SUM(R[-14]C:R[-1]C) -> 18 | L17: =SUM(R[-14]C:R[-1]C) -> 8 | M17: =RC[-1]-RC[-2] -> -10 | O17: =SUM(R[-14]C:R[-1]C) -> 15 | P17: =SUM(R[-14]C:R[-1]C) -> 3 | Q17: =RC[-1]-RC[-2] -> -12 | S17: =SUM(R[-14]C:R[-1]C) -> 14 | T17: =SUM(R[-14]C:R[-1]C) -> 25 | U17: =RC[-1]-RC[-2] -> 11 | W17: =SUM(R[-14]C:R[-1]C) -> 10 | X17: =SUM(R[-14]C:R[-1]C) -> 24 | Y17: =RC[-1]-RC[-2] -> 14 | AA17: =SUM(R[-14]C:R[-1]C) -> 3 | AB17: =SUM(R[-14]C:R[-1]C) -> 12 | AC17: =RC[-1]-RC[-2] -> 9 | AE17: =SUM(R[-14]C:R[-1]C) -> 1 | AF17: =SUM(R[-14]C:R[-1]C) -> 9 | AG17: =RC[-1]-RC[-2] -> 8 | AI17: =SUM(R[-14]C:R[-1]C) -> 3 | AJ17: =SUM(R[-14]C:R[-1]C) -> 10 | AK17: =RC[-1]-RC[-2] -> 7 | AM17: =SUM(R[-14]C:R[-1]C) -> 3 | AN17: =SUM(R[-14]C:R[-1]C) -> 3 | AO17: =RC[-1]-RC[-2] -> 0 | AQ17: =SUM(R[-14]C:R[-1]C) -> 1 | AR17: =SUM(R[-14]C:R[-1]C) -> 2 | AS17: =RC[-1]-RC[-2] -> 1 | AU17: =SUM(R[-14]C:R[-1]C) -> 4 | AV17: =SUM(R[-14]C:R[-1]C) -> 6 | AW17: =RC[-1]-RC[-2] -> 2 | AY17: =SUM(R[-14]C:R[-1]C) -> 3 | AZ17: =SUM(R[-14]C:R[-1]C) -> 6 | BA17: =RC[-1]-RC[-2] -> 3 | BC17: =SUM(R[-14]C:R[-1]C) -> 0 | BD17: =SUM(R[-14]C:R[-1]C) -> 2 | BE17: =RC[-1]-RC[-2] -> 2 | BG17: =SUM(R[-14]C:R[-1]C) -> 0 | BH17: =SUM(R[-14]C:R[-1]C) -> 2 | BI17: =RC[-1]-RC[-2] -> 2 | BK17: =SUM(R[-14]C:R[-1]C) -> 1 | BL17: =SUM(R[-14]C:R[-1]C) -> 10 | BM17: =RC[-1]-RC[-2] -> 9 | BO17: =SUM(R[-14]C:R[-1]C) -> 1 | BP17: =SUM(R[-14]C:R[-1]C) -> 1 | BQ17: =RC[-1]-RC[-2] -> 0 | BS17: =SUM(R[-14]C:R[-1]C) -> 1 | BT17: =SUM(R[-14]C:R[-1]C) -> 10 | BU17: =RC[-1]-RC[-2] -> 9 | BW17: =SUM(R[-14]C:R[-1]C) -> 2 | BX17: =SUM(R[-14]C:R[-1]C) -> 3 | BY17: =RC[-1]-RC[-2] -> 1 | CA17: =SUM(R[-14]C:R[-1]C) -> 4 | CB17: =SUM(R[-14]C:R[-1]C) -> 2 | CC17: =RC[-1]-RC[-2] -> -2 | CE17: =SUM(R[-14]C:R[-1]C) -> 0 | CF17: =SUM(R[-14]C:R[-1]C) -> 0 | CG17: =RC[-1]-RC[-2] -> 0 | CI17: =SUM(R[-14]C:R[-1]C) -> 0 | CJ17: =SUM(R[-14]C:R[-1]C) -> 0 | CK17: =RC[-1]-RC[-2] -> 0 | CM17: =RC[-4]+RC[-8]+RC[-12]+RC[-16]+RC[-20]+RC[-24]+RC[-28]+RC[-32]+RC[-36]+RC[-40]+RC[-44]+RC[-48]+RC[-52]+RC[-56]+RC[-60]+RC[-64]+RC[-68]+RC[-72]+RC[-76]+RC[-80]+RC[-84]+RC[-88] -> 90 | CN17: =RC[-4]+RC[-8]+RC[-12]+RC[-16]+RC[-20]+RC[-24]+RC[-28]+RC[-32]+RC[-36]+RC[-40]+RC[-44]+RC[-48]+RC[-52]+RC[-56]+RC[-60]+RC[-64]+RC[-68]+RC[-72]+RC[-76]+RC[-80]+RC[-84]+RC[-88] -> 146 | CO17: =RC[-1]-RC[-2] -> 56
A18: Эксплуатируемый парк локомотивов: | C18: 2 | D18: 2 | E18: =RC[-1]-RC[-2] -> 0 | G18: 2 | H18: 2 | I18: =RC[-1]-RC[-2] -> 0 | K18: 2 | L18: 2 | M18: =RC[-1]-RC[-2] -> 0 | O18: 2 | P18: 2 | Q18: =RC[-1]-RC[-2] -> 0 | S18: 2 | T18: 2 | U18: =RC[-1]-RC[-2] -> 0 | W18: 2 | X18: 2 | Y18: =RC[-1]-RC[-2] -> 0 | AA18: 2 | AB18: 2 | AC18: =RC[-1]-RC[-2] -> 0 | AE18: 2 | AF18: 2 | AG18: =RC[-1]-RC[-2] -> 0 | AI18: 2 | AJ18: 2 | AK18: =RC[-1]-RC[-2] -> 0 | AM18: 2 | AN18: 2 | AO18: =RC[-1]-RC[-2] -> 0 | AQ18: 2 | AR18: 2 | AS18: =RC[-1]-RC[-2] -> 0 | AU18: 2 | AV18: 2 | AW18: =RC[-1]-RC[-2] -> 0 | AY18: 2 | AZ18: 2 | BA18: =RC[-1]-RC[-2] -> 0 | BC18: 2 | BD18: 2 | BE18: =RC[-1]-RC[-2] -> 0 | BG18: 2 | BH18: 2 | BI18: =RC[-1]-RC[-2] -> 0 | BK18: 2 | BL18: 2 | BM18: =RC[-1]-RC[-2] -> 0 | BO18: 2 | BP18: 2 | BQ18: =RC[-1]-RC[-2] -> 0 | BS18: 2 | BT18: 2 | BU18: =RC[-1]-RC[-2] -> 0 | BW18: 2 | BX18: 2 | BY18: =RC[-1]-RC[-2] -> 0 | CA18: 2 | CB18: 2 | CC18: =RC[-1]-RC[-2] -> 0 | CE18: 2 | CG18: =RC[-1]-RC[-2] -> -2 | CI18: 2 | CK18: =RC[-1]-RC[-2] -> -2 | CM18: =AVERAGE(RC[-4], RC[-8], RC[-12], RC[-16], RC[-20], RC[-24], RC[-28], RC[-32], RC[-36], RC[-40], RC[-44], RC[-48], RC[-52], RC[-56], RC[-60], RC[-64], RC[-68], RC[-72], RC[-76], RC[-80], RC[-84],RC[-88]) -> 2 | CN18: =AVERAGE(RC[-4], RC[-8], RC[-12], RC[-16], RC[-20], RC[-24], RC[-28], RC[-32], RC[-36], RC[-40], RC[-44], RC[-48], RC[-52], RC[-56], RC[-60], RC[-64], RC[-68], RC[-72], RC[-76], RC[-80], RC[-84],RC[-88]) -> 2 | CO18: =RC[-1]-RC[-2] -> 0
A19: * - причины отклонения
A21: Причины отклонения по вагонам:
A22: 1. | B22: Погодные условия
A23: 2. | B23: Отсутствие четкого планирования со стороны клиента
A24: 3. | B24: Запрет на отправление со стороны ОАО "РЖД"
A25: 4. | B25: Снятие запрета на отправление со стороны ОАО "РЖД"
A26: 5. | B26: Отсутствие заготовки перевозочных документов в АС ЭТРАН | M26: =15 -> 15
A27: 6. | B27: Появление заготовки перевозочных документов в АС ЭТРАН
A28: 7. | B28: Наличие заявки на обработку со стороны клиента на большее кол-во вагонов
A29: 8. | B29: Заключение договора на подачу/уборку вагонов с новым клиентом
A30: 9. | B30: Вагоны не готовы к уборке с грузового фронта по вине клиента
A32: Причины отклонения по локомотивам:
A33: 1. | B33: Переработано вагонов более заявленного кол-ва
A34: 2. | B34: Наличие аварийной заявки на обработку от клиента
A35: 3. | B35: Внутренняя работа (работа с путевой техникой, обработка депо и др.)
A36: 4. | B36: Испытание локомобиля
A37: 5. | B37: Отказ от заявки на обработку грузового фронта от клиента

Sheet: март
A1: Число | C1: 1 | G1: 2 | K1: 3 | O1: 4 | S1: 7 | W1: 8 | AA1: 9 | AE1: 10 | AI1: 11 | AM1: 14 | AQ1: 15 | AU1: 16 | AY1: 17 | BC1: 18 | BG1: 21 | BK1: 22 | BO1: 23 | BS1: 24 | BW1: 25 | CA1: 28 | CE1: 29 | CI1: 30 | CM1: Итого
A2: Клиенты | C2: план | D2: факт | E2: откл-е | F2: * | G2: план | H2: факт | I2: откл-е | J2: * | K2: план | L2: факт | M2: откл-е | N2: * | O2: план | P2: факт | Q2: откл-е | R2: * | S2: план | T2: факт | U2: откл-е | V2: * | W2: план | X2: факт | Y2: откл-е | Z2: * | AA2: план | AB2: факт | AC2: откл-е | AD2: * | AE2: план | AF2: факт | AG2: откл-е | AH2: * | AI2: план | AJ2: факт | AK2: откл-е | AL2: * | AM2: план | AN2: факт | AO2: откл-е | AP2: * | AQ2: план | AR2: факт | AS2: откл-е | AT2: * | AU2: план | AV2: факт | AW2: откл-е | AX2: * | AY2: план | AZ2: факт | BA2: откл-е | BB2: * | BC2: план | BD2: факт | BE2: откл-е | BF2: * | BG2: план | BH2: факт | BI2: откл-е | BJ2: * | BK2: план | BL2: факт | BM2: откл-е | BN2: * | BO2: план | BP2: факт | BQ2: откл-е | BR2: * | BS2: план | BT2: факт | BU2: откл-е | BV2: * | BW2: план | BX2: факт | BY2: откл-е | BZ2: * | CA2: план | CB2: факт | CC2: откл-е | CD2: * | CE2: план | CF2: факт | CG2: откл-е | CH2: * | CI2: план | CJ2: факт | CK2: откл-е | CL2: * | CM2: план | CN2: факт | CO2: откл-е
A3: БЕ ООО "НАК" | B3: ЛЗ | E3: =RC[-1]-RC[-2] -> 0 | I3: =RC[-1]-RC[-2] -> 0 | M3: =RC[-1]-RC[-2] -> 0 | Q3: =RC[-1]-RC[-2] -> 0 | U3: =RC[-1]-RC[-2] -> 0 | Y3: =RC[-1]-RC[-2] -> 0 | AC3: =RC[-1]-RC[-2] -> 0 | AG3: =RC[-1]-RC[-2] -> 0 | AK3: =RC[-1]-RC[-2] -> 0 | AO3: =RC[-1]-RC[-2] -> 0 | AS3: =RC[-1]-RC[-2] -> 0 | AW3: =RC[-1]-RC[-2] -> 0 | BA3: =RC[-1]-RC[-2] -> 0 | BE3: =RC[-1]-RC[-2] -> 0 | BI3: =RC[-1]-RC[-2] -> 0 | BM3: =RC[-1]-RC[-2] -> 0 | BQ3: =RC[-1]-RC[-2] -> 0 | BU3: =RC[-1]-RC[-2] -> 0 | BY3: =RC[-1]-RC[-2] -> 0 | CC3: =RC[-1]-RC[-2] -> 0 | CG3: =RC[-1]-RC[-2] -> 0 | CK3: =RC[-1]-RC[-2] -> 0 | CM3: =RC[-4]+RC[-8]+RC[-12]+RC[-16]+RC[-20]+RC[-24]+RC[-28]+RC[-32]+RC[-36]+RC[-40]+RC[-44]+RC[-48]+RC[-52]+RC[-56]+RC[-60]+RC[-64]+RC[-68]+RC[-72]+RC[-76]+RC[-80]+RC[-84]+RC[-88] -> 0 | CN3: =RC[-4]+RC[-8]+RC[-12]+RC[-16]+RC[-20]+RC[-24]+RC[-28]+RC[-32]+RC[-36]+RC[-40]+RC[-44]+RC[-48]+RC[-52]+RC[-56]+RC[-60]+RC[-64]+RC[-68]+RC[-72]+RC[-76]+RC[-80]+RC[-84]+RC[-88] -> 0 | CO3: =RC[-1]-RC[-2] -> 0
B4: ПРЗ | E4: =RC[-1]-RC[-2] -> 0 | I4: =RC[-1]-RC[-2] -> 0 | M4: =RC[-1]-RC[-2] -> 0 | Q4: =RC[-1]-RC[-2] -> 0 | U4: =RC[-1]-RC[-2] -> 0 | Y4: =RC[-1]-RC[-2] -> 0 | AC4: =RC[-1]-RC[-2] -> 0 | AG4: =RC[-1]-RC[-2] -> 0 | AK4: =RC[-1]-RC[-2] -> 0 | AO4: =RC[-1]-RC[-2] -> 0 | AS4: =RC[-1]-RC[-2] -> 0 | AW4: =RC[-1]-RC[-2] -> 0 | BA4: =RC[-1]-RC[-2] -> 0 | BE4: =RC[-1]-RC[-2] -> 0 | BI4: =RC[-1]-RC[-2] -> 0 | BM4: =RC[-1]-RC[-2] -> 0 | BQ4: =RC[-1]-RC[-2] -> 0 | BU4: =RC[-1]-RC[-2] -> 0 | BY4: =RC[-1]-RC[-2] -> 0 | CC4: =RC[-1]-RC[-2] -> 0 | CG4: =RC[-1]-RC[-2] -> 0 | CK4: =RC[-1]-RC[-2] -> 0 | CM4: =RC[-4]+RC[-8]+RC[-12]+RC[-16]+RC[-20]+RC[-24]+RC[-28]+RC[-32]+RC[-36]+RC[-40]+RC[-44]+RC[-48]+RC[-52]+RC[-56]+RC[-60]+RC[-64]+RC[-68]+RC[-72]+RC[-76]+RC[-80]+RC[-84]+RC[-88] -> 0 | CN4: =RC[-4]+RC[-8]+RC[-12]+RC[-16]+RC[-20]+RC[-24]+RC[-28]+RC[-32]+RC[-36]+RC[-40]+RC[-44]+RC[-48]+RC[-52]+RC[-56]+RC[-60]+RC[-64]+RC[-68]+RC[-72]+RC[-76]+RC[-80]+RC[-84]+RC[-88] -> 0 | CO4: =RC[-1]-RC[-2] -> 0
A5: ООО "НАК" | B5: ЗШП | E5: =RC[-1]-RC[-2] -> 0 | I5: =RC[-1]-RC[-2] -> 0 | M5: =RC[-1]-RC[-2] -> 0 | Q5: =RC[-1]-RC[-2] -> 0 | U5: =RC[-1]-RC[-2] -> 0 | Y5: =RC[-1]-RC[-2] -> 0 | AC5: =RC[-1]-RC[-2] -> 0 | AG5: =RC[-1]-RC[-2] -> 0 | AK5: =RC[-1]-RC[-2] -> 0 | AO5: =RC[-1]-RC[-2] -> 0 | AS5: =RC[-1]-RC[-2] -> 0 | AW5: =RC[-1]-RC[-2] -> 0 | BA5: =RC[-1]-RC[-2] -> 0 | BE5: =RC[-1]-RC[-2] -> 0 | BI5: =RC[-1]-RC[-2] -> 0 | BM5: =RC[-1]-RC[-2] -> 0 | BQ5: =RC[-1]-RC[-2] -> 0 | BU5: =RC[-1]-RC[-2] -> 0 | BY5: =RC[-1]-RC[-2] -> 0 | CC5: =RC[-1]-RC[-2] -> 0 | CG5: =RC[-1]-RC[-2] -> 0 | CK5: =RC[-1]-RC[-2] -> 0 | CM5: =RC[-4]+RC[-8]+RC[-12]+RC[-16]+RC[-20]+RC[-24]+RC[-28]+RC[-32]+RC[-36]+RC[-40]+RC[-44]+RC[-48]+RC[-52]+RC[-56]+RC[-60]+RC[-64]+RC[-68]+RC[-72]+RC[-76]+RC[-80]+RC[-84]+RC[-88] -> 0 | CN5: =RC[-4]+RC[-8]+RC[-12]+RC[-16]+RC[-20]+RC[-24]+RC[-28]+RC[-32]+RC[-36]+RC[-40]+RC[-44]+RC[-48]+RC[-52]+RC[-56]+RC[-60]+RC[-64]+RC[-68]+RC[-72]+RC[-76]+RC[-80]+RC[-84]+RC[-88] -> 0 | CO5: =RC[-1]-RC[-2] -> 0
B6: НАК | E6: =RC[-1]-RC[-2] -> 0 | I6: =RC[-1]-RC[-2] -> 0 | M6: =RC[-1]-RC[-2] -> 0 | Q6: =RC[-1]-RC[-2] -> 0 | U6: =RC[-1]-RC[-2] -> 0 | Y6: =RC[-1]-RC[-2] -> 0 | AC6: =RC[-1]-RC[-2] -> 0 | AG6: =RC[-1]-RC[-2] -> 0 | AK6: =RC[-1]-RC[-2] -> 0 | AO6: =RC[-1]-RC[-2] -> 0 | AS6: =RC[-1]-RC[-2] -> 0 | AW6: =RC[-1]-RC[-2] -> 0 | BA6: =RC[-1]-RC[-2] -> 0 | BE6: =RC[-1]-RC[-2] -> 0 | BI6: =RC[-1]-RC[-2] -> 0 | BM6: =RC[-1]-RC[-2] -> 0 | BQ6: =RC[-1]-RC[-2] -> 0 | BU6: =RC[-1]-RC[-2] -> 0 | BY6: =RC[-1]-RC[-2] -> 0 | CC6: =RC[-1]-RC[-2] -> 0 | CG6: =RC[-1]-RC[-2] -> 0 | CK6: =RC[-1]-RC[-2] -> 0 | CM6: =RC[-4]+RC[-8]+RC[-12]+RC[-16]+RC[-20]+RC[-24]+RC[-28]+RC[-32]+RC[-36]+RC[-40]+RC[-44]+RC[-48]+RC[-52]+RC[-56]+RC[-60]+RC[-64]+RC[-68]+RC[-72]+RC[-76]+RC[-80]+RC[-84]+RC[-88] -> 0 | CN6: =RC[-4]+RC[-8]+RC[-12]+RC[-16]+RC[-20]+RC[-24]+RC[-28]+RC[-32]+RC[-36]+RC[-40]+RC[-44]+RC[-48]+RC[-52]+RC[-56]+RC[-60]+RC[-64]+RC[-68]+RC[-72]+RC[-76]+RC[-80]+RC[-84]+RC[-88] -> 0 | CO6: =RC[-1]-RC[-2] -> 0
B7: НЛЗ | E7: =RC[-1]-RC[-2] -> 0 | I7: =RC[-1]-RC[-2] -> 0 | M7: =RC[-1]-RC[-2] -> 0 | Q7: =RC[-1]-RC[-2] -> 0 | U7: =RC[-1]-RC[-2] -> 0 | Y7: =RC[-1]-RC[-2] -> 0 | AC7: =RC[-1]-RC[-2] -> 0 | AG7: =RC[-1]-RC[-2] -> 0 | AK7: =RC[-1]-RC[-2] -> 0 | AO7: =RC[-1]-RC[-2] -> 0 | AS7: =RC[-1]-RC[-2] -> 0 | AW7: =RC[-1]-RC[-2] -> 0 | BA7: =RC[-1]-RC[-2] -> 0 | BE7: =RC[-1]-RC[-2] -> 0 | BI7: =RC[-1]-RC[-2] -> 0 | BM7: =RC[-1]-RC[-2] -> 0 | BQ7: =RC[-1]-RC[-2] -> 0 | BU7: =RC[-1]-RC[-2] -> 0 | BY7: =RC[-1]-RC[-2] -> 0 | CC7: =RC[-1]-RC[-2] -> 0 | CG7: =RC[-1]-RC[-2] -> 0 | CK7: =RC[-1]-RC[-2] -> 0 | CM7: =RC[-4]+RC[-8]+RC[-12]+RC[-16]+RC[-20]+RC[-24]+RC[-28]+RC[-32]+RC[-36]+RC[-40]+RC[-44]+RC[-48]+RC[-52]+RC[-56]+RC[-60]+RC[-64]+RC[-68]+RC[-72]+RC[-76]+RC[-80]+RC[-84]+RC[-88] -> 0 | CN7: =RC[-4]+RC[-8]+RC[-12]+RC[-16]+RC[-20]+RC[-24]+RC[-28]+RC[-32]+RC[-36]+RC[-40]+RC[-44]+RC[-48]+RC[-52]+RC[-56]+RC[-60]+RC[-64]+RC[-68]+RC[-72]+RC[-76]+RC[-80]+RC[-84]+RC[-88] -> 0 | CO7: =RC[-1]-RC[-2] -> 0
A8: ООО "НАЗ", АО "НГА" | B8: АЗ "НАЗ" | E8: =RC[-1]-RC[-2] -> 0 | I8: =RC[-1]-RC[-2] -> 0 | M8: =RC[-1]-RC[-2] -> 0 | Q8: =RC[-1]-RC[-2] -> 0 | U8: =RC[-1]-RC[-2] -> 0 | Y8: =RC[-1]-RC[-2] -> 0 | AC8: =RC[-1]-RC[-2] -> 0 | AG8: =RC[-1]-RC[-2] -> 0 | AK8: =RC[-1]-RC[-2] -> 0 | AO8: =RC[-1]-RC[-2] -> 0 | AS8: =RC[-1]-RC[-2] -> 0 | AW8: =RC[-1]-RC[-2] -> 0 | BA8: =RC[-1]-RC[-2] -> 0 | BE8: =RC[-1]-RC[-2] -> 0 | BI8: =RC[-1]-RC[-2] -> 0 | BM8: =RC[-1]-RC[-2] -> 0 | BQ8: =RC[-1]-RC[-2] -> 0 | BU8: =RC[-1]-RC[-2] -> 0 | BY8: =RC[-1]-RC[-2] -> 0 | CC8: =RC[-1]-RC[-2] -> 0 | CG8: =RC[-1]-RC[-2] -> 0 | CK8: =RC[-1]-RC[-2] -> 0 | CM8: =RC[-4]+RC[-8]+RC[-12]+RC[-16]+RC[-20]+RC[-24]+RC[-28]+RC[-32]+RC[-36]+RC[-40]+RC[-44]+RC[-48]+RC[-52]+RC[-56]+RC[-60]+RC[-64]+RC[-68]+RC[-72]+RC[-76]+RC[-80]+RC[-84]+RC[-88] -> 0 | CN8: =RC[-4]+RC[-8]+RC[-12]+RC[-16]+RC[-20]+RC[-24]+RC[-28]+RC[-32]+RC[-36]+RC[-40]+RC[-44]+RC[-48]+RC[-52]+RC[-56]+RC[-60]+RC[-64]+RC[-68]+RC[-72]+RC[-76]+RC[-80]+RC[-84]+RC[-88] -> 0 | CO8: =RC[-1]-RC[-2] -> 0
B9: АО "НГА" | E9: =RC[-1]-RC[-2] -> 0 | I9: =RC[-1]-RC[-2] -> 0 | M9: =RC[-1]-RC[-2] -> 0 | Q9: =RC[-1]-RC[-2] -> 0 | U9: =RC[-1]-RC[-2] -> 0 | Y9: =RC[-1]-RC[-2] -> 0 | AC9: =RC[-1]-RC[-2] -> 0 | AG9: =RC[-1]-RC[-2] -> 0 | AK9: =RC[-1]-RC[-2] -> 0 | AO9: =RC[-1]-RC[-2] -> 0 | AS9: =RC[-1]-RC[-2] -> 0 | AW9: =RC[-1]-RC[-2] -> 0 | BA9: =RC[-1]-RC[-2] -> 0 | BE9: =RC[-1]-RC[-2] -> 0 | BI9: =RC[-1]-RC[-2] -> 0 | BM9: =RC[-1]-RC[-2] -> 0 | BQ9: =RC[-1]-RC[-2] -> 0 | BU9: =RC[-1]-RC[-2] -> 0 | BY9: =RC[-1]-RC[-2] -> 0 | CC9: =RC[-1]-RC[-2] -> 0 | CG9: =RC[-1]-RC[-2] -> 0 | CK9: =RC[-1]-RC[-2] -> 0 | CM9: =RC[-4]+RC[-8]+RC[-12]+RC[-16]+RC[-20]+RC[-24]+RC[-28]+RC[-32]+RC[-36]+RC[-40]+RC[-44]+RC[-48]+RC[-52]+RC[-56]+RC[-60]+RC[-64]+RC[-68]+RC[-72]+RC[-76]+RC[-80]+RC[-84]+RC[-88] -> 0 | CN9: =RC[-4]+RC[-8]+RC[-12]+RC[-16]+RC[-20]+RC[-24]+RC[-28]+RC[-32]+RC[-36]+RC[-40]+RC[-44]+RC[-48]+RC[-52]+RC[-56]+RC[-60]+RC[-64]+RC[-68]+RC[-72]+RC[-76]+RC[-80]+RC[-84]+RC[-88] -> 0 | CO9: =RC[-1]-RC[-2] -> 0
A10: Сторонние внутренние | B10: КА-Группа ГАЗ( Вьетнам) | E10: =RC[-1]-RC[-2] -> 0 | I10: =RC[-1]-RC[-2] -> 0 | M10: =RC[-1]-RC[-2] -> 0 | Q10: =RC[-1]-RC[-2] -> 0 | U10: =RC[-1]-RC[-2] -> 0 | Y10: =RC[-1]-RC[-2] -> 0 | AC10: =RC[-1]-RC[-2] -> 0 | AG10: =RC[-1]-RC[-2] -> 0 | AK10: =RC[-1]-RC[-2] -> 0 | AO10: =RC[-1]-RC[-2] -> 0 | AS10: =RC[-1]-RC[-2] -> 0 | AW10: =RC[-1]-RC[-2] -> 0 | BA10: =RC[-1]-RC[-2] -> 0 | BE10: =RC[-1]-RC[-2] -> 0 | BI10: =RC[-1]-RC[-2] -> 0 | BM10: =RC[-1]-RC[-2] -> 0 | BQ10: =RC[-1]-RC[-2] -> 0 | BU10: =RC[-1]-RC[-2] -> 0 | BY10: =RC[-1]-RC[-2] -> 0 | CC10: =RC[-1]-RC[-2] -> 0 | CG10: =RC[-1]-RC[-2] -> 0 | CK10: =RC[-1]-RC[-2] -> 0 | CM10: =RC[-4]+RC[-8]+RC[-12]+RC[-16]+RC[-20]+RC[-24]+RC[-28]+RC[-32]+RC[-36]+RC[-40]+RC[-44]+RC[-48]+RC[-52]+RC[-56]+RC[-60]+RC[-64]+RC[-68]+RC[-72]+RC[-76]+RC[-80]+RC[-84]+RC[-88] -> 0 | CN10: =RC[-4]+RC[-8]+RC[-12]+RC[-16]+RC[-20]+RC[-24]+RC[-28]+RC[-32]+RC[-36]+RC[-40]+RC[-44]+RC[-48]+RC[-52]+RC[-56]+RC[-60]+RC[-64]+RC[-68]+RC[-72]+RC[-76]+RC[-80]+RC[-84]+RC[-88] -> 0 | CO10: =RC[-1]-RC[-2] -> 0
B11: Платформа А | E11: =RC[-1]-RC[-2] -> 0 | I11: =RC[-1]-RC[-2] -> 0 | M11: =RC[-1]-RC[-2] -> 0 | Q11: =RC[-1]-RC[-2] -> 0 | U11: =RC[-1]-RC[-2] -> 0 | Y11: =RC[-1]-RC[-2] -> 0 | AC11: =RC[-1]-RC[-2] -> 0 | AG11: =RC[-1]-RC[-2] -> 0 | AK11: =RC[-1]-RC[-2] -> 0 | AO11: =RC[-1]-RC[-2] -> 0 | AS11: =RC[-1]-RC[-2] -> 0 | AW11: =RC[-1]-RC[-2] -> 0 | BA11: =RC[-1]-RC[-2] -> 0 | BE11: =RC[-1]-RC[-2] -> 0 | BI11: =RC[-1]-RC[-2] -> 0 | BM11: =RC[-1]-RC[-2] -> 0 | BQ11: =RC[-1]-RC[-2] -> 0 | BU11: =RC[-1]-RC[-2] -> 0 | BY11: =RC[-1]-RC[-2] -> 0 | CC11: =RC[-1]-RC[-2] -> 0 | CG11: =RC[-1]-RC[-2] -> 0 | CK11: =RC[-1]-RC[-2] -> 0 | CM11: =RC[-4]+RC[-8]+RC[-12]+RC[-16]+RC[-20]+RC[-24]+RC[-28]+RC[-32]+RC[-36]+RC[-40]+RC[-44]+RC[-48]+RC[-52]+RC[-56]+RC[-60]+RC[-64]+RC[-68]+RC[-72]+RC[-76]+RC[-80]+RC[-84]+RC[-88] -> 0 | CN11: =RC[-4]+RC[-8]+RC[-12]+RC[-16]+RC[-20]+RC[-24]+RC[-28]+RC[-32]+RC[-36]+RC[-40]+RC[-44]+RC[-48]+RC[-52]+RC[-56]+RC[-60]+RC[-64]+RC[-68]+RC[-72]+RC[-76]+RC[-80]+RC[-84]+RC[-88] -> 0 | CO11: =RC[-1]-RC[-2] -> 0
A12: Сторонние внешние | B12: АО "ГОТХ" | E12: =RC[-1]-RC[-2] -> 0 | I12: =RC[-1]-RC[-2] -> 0 | M12: =RC[-1]-RC[-2] -> 0 | Q12: =RC[-1]-RC[-2] -> 0 | U12: =RC[-1]-RC[-2] -> 0 | Y12: =RC[-1]-RC[-2] -> 0 | AC12: =RC[-1]-RC[-2] -> 0 | AG12: =RC[-1]-RC[-2] -> 0 | AK12: =RC[-1]-RC[-2] -> 0 | AO12: =RC[-1]-RC[-2] -> 0 | AS12: =RC[-1]-RC[-2] -> 0 | AW12: =RC[-1]-RC[-2] -> 0 | BA12: =RC[-1]-RC[-2] -> 0 | BE12: =RC[-1]-RC[-2] -> 0 | BI12: =RC[-1]-RC[-2] -> 0 | BM12: =RC[-1]-RC[-2] -> 0 | BQ12: =RC[-1]-RC[-2] -> 0 | BU12: =RC[-1]-RC[-2] -> 0 | BY12: =RC[-1]-RC[-2] -> 0 | CC12: =RC[-1]-RC[-2] -> 0 | CG12: =RC[-1]-RC[-2] -> 0 | CK12: =RC[-1]-RC[-2] -> 0 | CM12: =RC[-4]+RC[-8]+RC[-12]+RC[-16]+RC[-20]+RC[-24]+RC[-28]+RC[-32]+RC[-36]+RC[-40]+RC[-44]+RC[-48]+RC[-52]+RC[-56]+RC[-60]+RC[-64]+RC[-68]+RC[-72]+RC[-76]+RC[-80]+RC[-84]+RC[-88] -> 0 | CN12: =RC[-4]+RC[-8]+RC[-12]+RC[-16]+RC[-20]+RC[-24]+RC[-28]+RC[-32]+RC[-36]+RC[-40]+RC[-44]+RC[-48]+RC[-52]+RC[-56]+RC[-60]+RC[-64]+RC[-68]+RC[-72]+RC[-76]+RC[-80]+RC[-84]+RC[-88] -> 0 | CO12: =RC[-1]-RC[-2] -> 0
B13: ООО "Нерудные материалы-НН" | E13: =RC[-1]-RC[-2] -> 0 | I13: =RC[-1]-RC[-2] -> 0 | M13: =RC[-1]-RC[-2] -> 0 | Q13: =RC[-1]-RC[-2] -> 0 | U13: =RC[-1]-RC[-2] -> 0 | Y13: =RC[-1]-RC[-2] -> 0 | AC13: =RC[-1]-RC[-2] -> 0 | AG13: =RC[-1]-RC[-2] -> 0 | AK13: =RC[-1]-RC[-2] -> 0 | AO13: =RC[-1]-RC[-2] -> 0 | AS13: =RC[-1]-RC[-2] -> 0 | AW13: =RC[-1]-RC[-2] -> 0 | BA13: =RC[-1]-RC[-2] -> 0 | BE13: =RC[-1]-RC[-2] -> 0 | BI13: =RC[-1]-RC[-2] -> 0 | BM13: =RC[-1]-RC[-2] -> 0 | BQ13: =RC[-1]-RC[-2] -> 0 | BU13: =RC[-1]-RC[-2] -> 0 | BY13: =RC[-1]-RC[-2] -> 0 | CC13: =RC[-1]-RC[-2] -> 0 | CG13: =RC[-1]-RC[-2] -> 0 | CK13: =RC[-1]-RC[-2] -> 0 | CM13: =RC[-4]+RC[-8]+RC[-12]+RC[-16]+RC[-20]+RC[-24]+RC[-28]+RC[-32]+RC[-36]+RC[-40]+RC[-44]+RC[-48]+RC[-52]+RC[-56]+RC[-60]+RC[-64]+RC[-68]+RC[-72]+RC[-76]+RC[-80]+RC[-84]+RC[-88] -> 0 | CN13: =RC[-4]+RC[-8]+RC[-12]+RC[-16]+RC[-20]+RC[-24]+RC[-28]+RC[-32]+RC[-36]+RC[-40]+RC[-44]+RC[-48]+RC[-52]+RC[-56]+RC[-60]+RC[-64]+RC[-68]+RC[-72]+RC[-76]+RC[-80]+RC[-84]+RC[-88] -> 0 | CO13: =RC[-1]-RC[-2] -> 0
B14: ПК НВМ (ООО "Профит") | E14: =RC[-1]-RC[-2] -> 0 | I14: =RC[-1]-RC[-2] -> 0 | M14: =RC[-1]-RC[-2] -> 0 | Q14: =RC[-1]-RC[-2] -> 0 | U14: =RC[-1]-RC[-2] -> 0 | Y14: =RC[-1]-RC[-2] -> 0 | AC14: =RC[-1]-RC[-2] -> 0 | AG14: =RC[-1]-RC[-2] -> 0 | AK14: =RC[-1]-RC[-2] -> 0 | AO14: =RC[-1]-RC[-2] -> 0 | AS14: =RC[-1]-RC[-2] -> 0 | AW14: =RC[-1]-RC[-2] -> 0 | BA14: =RC[-1]-RC[-2] -> 0 | BE14: =RC[-1]-RC[-2] -> 0 | BI14: =RC[-1]-RC[-2] -> 0 | BM14: =RC[-1]-RC[-2] -> 0 | BQ14: =RC[-1]-RC[-2] -> 0 | BU14: =RC[-1]-RC[-2] -> 0 | BY14: =RC[-1]-RC[-2] -> 0 | CC14: =RC[-1]-RC[-2] -> 0 | CG14: =RC[-1]-RC[-2] -> 0 | CK14: =RC[-1]-RC[-2] -> 0 | CM14: =RC[-4]+RC[-8]+RC[-12]+RC[-16]+RC[-20]+RC[-24]+RC[-28]+RC[-32]+RC[-36]+RC[-40]+RC[-44]+RC[-48]+RC[-52]+RC[-56]+RC[-60]+RC[-64]+RC[-68]+RC[-72]+RC[-76]+RC[-80]+RC[-84]+RC[-88] -> 0 | CN14: =RC[-4]+RC[-8]+RC[-12]+RC[-16]+RC[-20]+RC[-24]+RC[-28]+RC[-32]+RC[-36]+RC[-40]+RC[-44]+RC[-48]+RC[-52]+RC[-56]+RC[-60]+RC[-64]+RC[-68]+RC[-72]+RC[-76]+RC[-80]+RC[-84]+RC[-88] -> 0 | CO14: =RC[-1]-RC[-2] -> 0
B15: ООО "ИнтерметГрупп" | E15: =RC[-1]-RC[-2] -> 0 | I15: =RC[-1]-RC[-2] -> 0 | M15: =RC[-1]-RC[-2] -> 0 | Q15: =RC[-1]-RC[-2] -> 0 | U15: =RC[-1]-RC[-2] -> 0 | Y15: =RC[-1]-RC[-2] -> 0 | AC15: =RC[-1]-RC[-2] -> 0 | AG15: =RC[-1]-RC[-2] -> 0 | AK15: =RC[-1]-RC[-2] -> 0 | AO15: =RC[-1]-RC[-2] -> 0 | AS15: =RC[-1]-RC[-2] -> 0 | AW15: =RC[-1]-RC[-2] -> 0 | BA15: =RC[-1]-RC[-2] -> 0 | BE15: =RC[-1]-RC[-2] -> 0 | BI15: =RC[-1]-RC[-2] -> 0 | BM15: =RC[-1]-RC[-2] -> 0 | BQ15: =RC[-1]-RC[-2] -> 0 | BU15: =RC[-1]-RC[-2] -> 0 | BY15: =RC[-1]-RC[-2] -> 0 | CC15: =RC[-1]-RC[-2] -> 0 | CG15: =RC[-1]-RC[-2] -> 0 | CK15: =RC[-1]-RC[-2] -> 0 | CM15: =RC[-4]+RC[-8]+RC[-12]+RC[-16]+RC[-20]+RC[-24]+RC[-28]+RC[-32]+RC[-36]+RC[-40]+RC[-44]+RC[-48]+RC[-52]+RC[-56]+RC[-60]+RC[-64]+RC[-68]+RC[-72]+RC[-76]+RC[-80]+RC[-84]+RC[-88] -> 0 | CN15: =RC[-4]+RC[-8]+RC[-12]+RC[-16]+RC[-20]+RC[-24]+RC[-28]+RC[-32]+RC[-36]+RC[-40]+RC[-44]+RC[-48]+RC[-52]+RC[-56]+RC[-60]+RC[-64]+RC[-68]+RC[-72]+RC[-76]+RC[-80]+RC[-84]+RC[-88] -> 0 | CO15: =RC[-1]-RC[-2] -> 0
B16: Прочие | E16: =RC[-1]-RC[-2] -> 0 | I16: =RC[-1]-RC[-2] -> 0 | M16: =RC[-1]-RC[-2] -> 0 | Q16: =RC[-1]-RC[-2] -> 0 | U16: =RC[-1]-RC[-2] -> 0 | Y16: =RC[-1]-RC[-2] -> 0 | AC16: =RC[-1]-RC[-2] -> 0 | AG16: =RC[-1]-RC[-2] -> 0 | AK16: =RC[-1]-RC[-2] -> 0 | AO16: =RC[-1]-RC[-2] -> 0 | AS16: =RC[-1]-RC[-2] -> 0 | AW16: =RC[-1]-RC[-2] -> 0 | BA16: =RC[-1]-RC[-2] -> 0 | BE16: =RC[-1]-RC[-2] -> 0 | BI16: =RC[-1]-RC[-2] -> 0 | BM16: =RC[-1]-RC[-2] -> 0 | BQ16: =RC[-1]-RC[-2] -> 0 | BU16: =RC[-1]-RC[-2] -> 0 | BY16: =RC[-1]-RC[-2] -> 0 | CC16: =RC[-1]-RC[-2] -> 0 | CG16: =RC[-1]-RC[-2] -> 0 | CK16: =RC[-1]-RC[-2] -> 0 | CM16: =RC[-4]+RC[-8]+RC[-12]+RC[-16]+RC[-20]+RC[-24]+RC[-28]+RC[-32]+RC[-36]+RC[-40]+RC[-44]+RC[-48]+RC[-52]+RC[-56]+RC[-60]+RC[-64]+RC[-68]+RC[-72]+RC[-76]+RC[-80]+RC[-84]+RC[-88] -> 0 | CN16: =RC[-4]+RC[-8]+RC[-12]+RC[-16]+RC[-20]+RC[-24]+RC[-28]+RC[-32]+RC[-36]+RC[-40]+RC[-44]+RC[-48]+RC[-52]+RC[-56]+RC[-60]+RC[-64]+RC[-68]+RC[-72]+RC[-76]+RC[-80]+RC[-84]+RC[-88] -> 0 | CO16: =RC[-1]-RC[-2] -> 0
A17: ИТОГО за день: | C17: =SUM(R[-14]C:R[-1]C) -> 0 | D17: =SUM(R[-14]C:R[-1]C) -> 0 | E17: =RC[-1]-RC[-2] -> 0 | G17: =SUM(R[-14]C:R[-1]C) -> 0 | H17: =SUM(R[-14]C:R[-1]C) -> 0 | I17: =RC[-1]-RC[-2] -> 0 | K17: =SUM(R[-14]C:R[-1]C) -> 0 | L17: =SUM(R[-14]C:R[-1]C) -> 0 | M17: =RC[-1]-RC[-2] -> 0 | O17: =SUM(R[-14]C:R[-1]C) -> 0 | P17: =SUM(R[-14]C:R[-1]C) -> 0 | Q17: =RC[-1]-RC[-2] -> 0 | S17: =SUM(R[-14]C:R[-1]C) -> 0 | T17: =SUM(R[-14]C:R[-1]C) -> 0 | U17: =RC[-1]-RC[-2] -> 0 | W17: =SUM(R[-14]C:R[-1]C) -> 0 | X17: =SUM(R[-14]C:R[-1]C) -> 0 | Y17: =RC[-1]-RC[-2] -> 0 | AA17: =SUM(R[-14]C:R[-1]C) -> 0 | AB17: =SUM(R[-14]C:R[-1]C) -> 0 | AC17: =RC[-1]-RC[-2] -> 0 | AE17: =SUM(R[-14]C:R[-1]C) -> 0 | AF17: =SUM(R[-14]C:R[-1]C) -> 0 | AG17: =RC[-1]-RC[-2] -> 0 | AI17: =SUM(R[-14]C:R[-1]C) -> 0 | AJ17: =SUM(R[-14]C:R[-1]C) -> 0 | AK17: =RC[-1]-RC[-2] -> 0 | AM17: =SUM(R[-14]C:R[-1]C) -> 0 | AN17: =SUM(R[-14]C:R[-1]C) -> 0 | AO17: =RC[-1]-RC[-2] -> 0 | AQ17: =SUM(R[-14]C:R[-1]C) -> 0 | AR17: =SUM(R[-14]C:R[-1]C) -> 0 | AS17: =RC[-1]-RC[-2] -> 0 | AU17: =SUM(R[-14]C:R[-1]C) -> 0 | AV17: =SUM(R[-14]C:R[-1]C) -> 0 | AW17: =RC[-1]-RC[-2] -> 0 | AY17: =SUM(R[-14]C:R[-1]C) -> 0 | AZ17: =SUM(R[-14]C:R[-1]C) -> 0 | BA17: =RC[-1]-RC[-2] -> 0 | BC17: =SUM(R[-14]C:R[-1]C) -> 0 | BD17: =SUM(R[-14]C:R[-1]C) -> 0 | BE17: =RC[-1]-RC[-2] -> 0 | BG17: =SUM(R[-14]C:R[-1]C) -> 0 | BH17: =SUM(R[-14]C:R[-1]C) -> 0 | BI17: =RC[-1]-RC[-2] -> 0 | BK17: =SUM(R[-14]C:R[-1]C) -> 0 | BL17: =SUM(R[-14]C:R[-1]C) -> 0 | BM17: =RC[-1]-RC[-2] -> 0 | BO17: =SUM(R[-14]C:R[-1]C) -> 0 | BP17: =SUM(R[-14]C:R[-1]C) -> 0 | BQ17: =RC[-1]-RC[-2] -> 0 | BS17: =SUM(R[-14]C:R[-1]C) -> 0 | BT17: =SUM(R[-14]C:R[-1]C) -> 0 | BU17: =RC[-1]-RC[-2] -> 0 | BW17: =SUM(R[-14]C:R[-1]C) -> 0 | BX17: =SUM(R[-14]C:R[-1]C) -> 0 | BY17: =RC[-1]-RC[-2] -> 0 | CA17: =SUM(R[-14]C:R[-1]C) -> 0 | CB17: =SUM(R[-14]C:R[-1]C) -> 0 | CC17: =RC[-1]-RC[-2] -> 0 | CE17: =SUM(R[-14]C:R[-1]C) -> 0 | CF17: =SUM(R[-14]C:R[-1]C) -> 0 | CG17: =RC[-1]-RC[-2] -> 0 | CI17: =SUM(R[-14]C:R[-1]C) -> 0 | CJ17: =SUM(R[-14]C:R[-1]C) -> 0 | CK17: =RC[-1]-RC[-2] -> 0 | CM17: =RC[-4]+RC[-8]+RC[-12]+RC[-16]+RC[-20]+RC[-24]+RC[-28]+RC[-32]+RC[-36]+RC[-40]+RC[-44]+RC[-48]+RC[-52]+RC[-56]+RC[-60]+RC[-64]+RC[-68]+RC[-72]+RC[-76]+RC[-80]+RC[-84]+RC[-88] -> 0 | CN17: =RC[-4]+RC[-8]+RC[-12]+RC[-16]+RC[-20]+RC[-24]+RC[-28]+RC[-32]+RC[-36]+RC[-40]+RC[-44]+RC[-48]+RC[-52]+RC[-56]+RC[-60]+RC[-64]+RC[-68]+RC[-72]+RC[-76]+RC[-80]+RC[-84]+RC[-88] -> 0 | CO17: =RC[-1]-RC[-2] -> 0
A18: Эксплуатируемый парк локомотивов: | C18: 2 | E18: =RC[-1]-RC[-2] -> -2 | G18: 2 | I18: =RC[-1]-RC[-2] -> -2 | K18: 2 | M18: =RC[-1]-RC[-2] -> -2 | O18: 2 | Q18: =RC[-1]-RC[-2] -> -2 | S18: 2 | U18: =RC[-1]-RC[-2] -> -2 | W18: 2 | Y18: =RC[-1]-RC[-2] -> -2 | AA18: 2 | AC18: =RC[-1]-RC[-2] -> -2 | AE18: 2 | AG18: =RC[-1]-RC[-2] -> -2 | AI18: 2 | AK18: =RC[-1]-RC[-2] -> -2 | AM18: 2 | AO18: =RC[-1]-RC[-2] -> -2 | AQ18: 2 | AS18: =RC[-1]-RC[-2] -> -2 | AU18: 2 | AW18: =RC[-1]-RC[-2] -> -2 | AY18: 2 | BA18: =RC[-1]-RC[-2] -> -2 | BC18: 2 | BE18: =RC[-1]-RC[-2] -> -2 | BG18: 2 | BI18: =RC[-1]-RC[-2] -> -2 | BK18: 2 | BM18: =RC[-1]-RC[-2] -> -2 | BO18: 2 | BQ18: =RC[-1]-RC[-2] -> -2 | BS18: 2 | BU18: =RC[-1]-RC[-2] -> -2 | BW18: 2 | BY18: =RC[-1]-RC[-2] -> -2 | CA18: 2 | CC18: =RC[-1]-RC[-2] -> -2 | CE18: 2 | CG18: =RC[-1]-RC[-2] -> -2 | CI18: 2 | CK18: =RC[-1]-RC[-2] -> -2 | CM18: =AVERAGE(RC[-4], RC[-8], RC[-12], RC[-16], RC[-20], RC[-24], RC[-28], RC[-32], RC[-36], RC[-40], RC[-44], RC[-48], RC[-52], RC[-56], RC[-60], RC[-64], RC[-68], RC[-72], RC[-76], RC[-80], RC[-84],RC[-88]) -> 2 | CN18: =AVERAGE(RC[-4], RC[-8], RC[-12], RC[-16], RC[-20], RC[-24], RC[-28], RC[-32], RC[-36], RC[-40], RC[-44], RC[-48], RC[-52], RC[-56], RC[-60], RC[-64], RC[-68], RC[-72], RC[-76], RC[-80], RC[-84],RC[-88]) -> #DIV/0! | CO18: =RC[-1]-RC[-2] -> #DIV/0!
A19: * - причины отклонения
A21: Причины отклонения по вагонам:
A22: 1. | B22: Погодные условия
A23: 2. | B23: Отсутствие четкого планирования со стороны клиента
A24: 3. | B24: Запрет на отправление со стороны ОАО "РЖД"
A25: 4. | B25: Снятие запрета на отправление со стороны ОАО "РЖД"
A26: 5. | B26: Отсутствие заготовки перевозочных документов в АС ЭТРАН
A27: 6. | B27: Появление заготовки перевозочных документов в АС ЭТРАН
A28: 7. | B28: Наличие заявки на обработку со стороны клиента на большее кол-во вагонов
A29: 8. | B29: Заключение договора на подачу/уборку вагонов с новым клиентом
A30: 9. | B30: Вагоны не готовы к уборке с грузового фронта по вине клиента
A32: Причины отклонения по локомотивам:
A33: 1. | B33: Переработано вагонов более заявленного кол-ва
A34: 2. | B34: Наличие аварийной заявки на обработку от клиента
A35: 3. | B35: Внутренняя работа (работа с путевой техникой, обработка депо и др.)
A36: 4. | B36: Испытание локомобиля
A37: 5. | B37: Отказ от заявки на обработку грузового фронта от клиента

Sheet: апрель
A1: Число | C1: 1 | G1: 2 | K1: 3 | O1: 4 | S1: 7 | W1: 8 | AA1: 9 | AE1: 10 | AI1: 11 | AM1: 14 | AQ1: 15 | AU1: 16 | AY1: 17 | BC1: 18 | BG1: 21 | BK1: 22 | BO1: 23 | BS1: 24 | BW1: 25 | CA1: 28 | CE1: 29 | CI1: 30 | CM1: Итого
A2: Клиенты | C2: план | D2: факт | E2: откл-е | F2: * | G2: план | H2: факт | I2: откл-е | J2: * | K2: план | L2: факт | M2: откл-е | N2: * | O2: план | P2: факт | Q2: откл-е | R2: * | S2: план | T2: факт | U2: откл-е | V2: * | W2: план | X2: факт | Y2: откл-е | Z2: * | AA2: план | AB2: факт | AC2: откл-е | AD2: * | AE2: план | AF2: факт | AG2: откл-е | AH2: * | AI2: план | AJ2: факт | AK2: откл-е | AL2: * | AM2: план | AN2: факт | AO2: откл-е | AP2: * | AQ2: план | AR2: факт | AS2: откл-е | AT2: * | AU2: план | AV2: факт | AW2: откл-е | AX2: * | AY2: план | AZ2: факт | BA2: откл-е | BB2: * | BC2: план | BD2: факт | BE2: откл-е | BF2: * | BG2: план | BH2: факт | BI2: откл-е | BJ2: * | BK2: план | BL2: факт | BM2: откл-е | BN2: * | BO2: план | BP2: факт | BQ2: откл-е | BR2: * | BS2: план | BT2: факт | BU2: откл-е | BV2: * | BW2: план | BX2: факт | BY2: откл-е | BZ2: * | CA2: план | CB2: факт | CC2: откл-е | CD2: * | CE2: план | CF2: факт | CG2: откл-е | CH2: * | CI2: план | CJ2: факт | CK2: откл-е | CL2: * | CM2: план | CN2: факт | CO2: откл-е
A3: БЕ ООО "НАК" | B3: ЛЗ | E3: =RC[-1]-RC[-2] -> 0 | G3: 2 | I3: =RC[-1]-RC[-2] -> -2 | J3: 9 | M3: =RC[-1]-RC[-2] -> 0 | O3: 1 | Q3: =RC[-1]-RC[-2] -> -1 | R3: 9 | U3: =RC[-1]-RC[-2] -> 0 | X3: 1 | Y3: =RC[-1]-RC[-2] -> 1 | Z3: 7 | AA3: 2 | AC3: =RC[-1]-RC[-2] -> -2 | AD3: 9 | AF3: 1 | AG3: =RC[-1]-RC[-2] -> 1 | AH3: 9 | AI3: 1 | AK3: =RC[-1]-RC[-2] -> -1 | AL3: 9 | AO3: =RC[-1]-RC[-2] -> 0 | AS3: =RC[-1]-RC[-2] -> 0 | AU3: 2 | AV3: 2 | AW3: =RC[-1]-RC[-2] -> 0 | BA3: =RC[-1]-RC[-2] -> 0 | BC3: 2 | BE3: =RC[-1]-RC[-2] -> -2 | BF3: 9 | BI3: =RC[-1]-RC[-2] -> 0 | BM3: =RC[-1]-RC[-2] -> 0 | BO3: 2 | BP3: 0 | BQ3: =RC[-1]-RC[-2] -> -2 | BR3: 2 | BT3: 1 | BU3: =RC[-1]-RC[-2] -> 1 | BW3: 1 | BY3: =RC[-1]-RC[-2] -> -1 | CC3: =RC[-1]-RC[-2] -> 0 | CG3: =RC[-1]-RC[-2] -> 0 | CI3: 2 | CJ3: 2 | CK3: =RC[-1]-RC[-2] -> 0 | CM3: =RC[-4]+RC[-8]+RC[-12]+RC[-16]+RC[-20]+RC[-24]+RC[-28]+RC[-32]+RC[-36]+RC[-40]+RC[-44]+RC[-48]+RC[-52]+RC[-56]+RC[-60]+RC[-64]+RC[-68]+RC[-72]+RC[-76]+RC[-80]+RC[-84]+RC[-88] -> 15 | CN3: =RC[-4]+RC[-8]+RC[-12]+RC[-16]+RC[-20]+RC[-24]+RC[-28]+RC[-32]+RC[-36]+RC[-40]+RC[-44]+RC[-48]+RC[-52]+RC[-56]+RC[-60]+RC[-64]+RC[-68]+RC[-72]+RC[-76]+RC[-80]+RC[-84]+RC[-88] -> 7 | CO3: =RC[-1]-RC[-2] -> -8
B4: ПРЗ | C4: 2 | D4: 2 | E4: =RC[-1]-RC[-2] -> 0 | I4: =RC[-1]-RC[-2] -> 0 | K4: 1 | L4: 2 | M4: =RC[-1]-RC[-2] -> 1 | N4: 7 | Q4: =RC[-1]-RC[-2] -> 0 | U4: =RC[-1]-RC[-2] -> 0 | W4: 2 | X4: 2 | Y4: =RC[-1]-RC[-2] -> 0 | AC4: =RC[-1]-RC[-2] -> 0 | AE4: 1 | AG4: =RC[-1]-RC[-2] -> -1 | AH4: 9 | AJ4: 2 | AK4: =RC[-1]-RC[-2] -> 2 | AL4: 7 | AO4: =RC[-1]-RC[-2] -> 0 | AQ4: 2 | AS4: =RC[-1]-RC[-2] -> -2 | AT4: 9 | AV4: 1 | AW4: =RC[-1]-RC[-2] -> 1 | AX4: 7 | AY4: 2 | BA4: =RC[-1]-RC[-2] -> -2 | BB4: 9 | BE4: =RC[-1]-RC[-2] -> 0 | BH4: 2 | BI4: =RC[-1]-RC[-2] -> 2 | BJ4: 2 | BK4: 2 | BL4: 1 | BM4: =RC[-1]-RC[-2] -> -1 | BQ4: =RC[-1]-RC[-2] -> 0 | BS4: 1 | BU4: =RC[-1]-RC[-2] -> -1 | BX4: 2 | BY4: =RC[-1]-RC[-2] -> 2 | CC4: =RC[-1]-RC[-2] -> 0 | CE4: 2 | CG4: =RC[-1]-RC[-2] -> -2 | CK4: =RC[-1]-RC[-2] -> 0 | CM4: =RC[-4]+RC[-8]+RC[-12]+RC[-16]+RC[-20]+RC[-24]+RC[-28]+RC[-32]+RC[-36]+RC[-40]+RC[-44]+RC[-48]+RC[-52]+RC[-56]+RC[-60]+RC[-64]+RC[-68]+RC[-72]+RC[-76]+RC[-80]+RC[-84]+RC[-88] -> 15 | CN4: =RC[-4]+RC[-8]+RC[-12]+RC[-16]+RC[-20]+RC[-24]+RC[-28]+RC[-32]+RC[-36]+RC[-40]+RC[-44]+RC[-48]+RC[-52]+RC[-56]+RC[-60]+RC[-64]+RC[-68]+RC[-72]+RC[-76]+RC[-80]+RC[-84]+RC[-88] -> 14 | CO4: =RC[-1]-RC[-2] -> -1
A5: ООО "НАК" | B5: ЗШП | E5: =RC[-1]-RC[-2] -> 0 | I5: =RC[-1]-RC[-2] -> 0 | M5: =RC[-1]-RC[-2] -> 0 | Q5: =RC[-1]-RC[-2] -> 0 | U5: =RC[-1]-RC[-2] -> 0 | Y5: =RC[-1]-RC[-2] -> 0 | AC5: =RC[-1]-RC[-2] -> 0 | AG5: =RC[-1]-RC[-2] -> 0 | AK5: =RC[-1]-RC[-2] -> 0 | AO5: =RC[-1]-RC[-2] -> 0 | AS5: =RC[-1]-RC[-2] -> 0 | AW5: =RC[-1]-RC[-2] -> 0 | BA5: =RC[-1]-RC[-2] -> 0 | BE5: =RC[-1]-RC[-2] -> 0 | BI5: =RC[-1]-RC[-2] -> 0 | BM5: =RC[-1]-RC[-2] -> 0 | BQ5: =RC[-1]-RC[-2] -> 0 | BU5: =RC[-1]-RC[-2] -> 0 | BY5: =RC[-1]-RC[-2] -> 0 | CC5: =RC[-1]-RC[-2] -> 0 | CG5: =RC[-1]-RC[-2] -> 0 | CK5: =RC[-1]-RC[-2] -> 0 | CM5: =RC[-4]+RC[-8]+RC[-12]+RC[-16]+RC[-20]+RC[-24]+RC[-28]+RC[-32]+RC[-36]+RC[-40]+RC[-44]+RC[-48]+RC[-52]+RC[-56]+RC[-60]+RC[-64]+RC[-68]+RC[-72]+RC[-76]+RC[-80]+RC[-84]+RC[-88] -> 0 | CN5: =RC[-4]+RC[-8]+RC[-12]+RC[-16]+RC[-20]+RC[-24]+RC[-28]+RC[-32]+RC[-36]+RC[-40]+RC[-44]+RC[-48]+RC[-52]+RC[-56]+RC[-60]+RC[-64]+RC[-68]+RC[-72]+RC[-76]+RC[-80]+RC[-84]+RC[-88] -> 0 | CO5: =RC[-1]-RC[-2] -> 0
B6: НАК | C6: 9 | D6: 10 | E6: =RC[-1]-RC[-2] -> 1 | F6: 2 | G6: 9 | H6: 4 | I6: =RC[-1]-RC[-2] -> -5 | J6: 9 | K6: 9 | L6: 11 | M6: =RC[-1]-RC[-2] -> 2 | N6: 2 | O6: 9 | P6: 6 | Q6: =RC[-1]-RC[-2] -> -3 | R6: 2 | S6: 9 | T6: 6 | U6: =RC[-1]-RC[-2] -> -3 | V6: 9 | W6: 9 | X6: 10 | Y6: =RC[-1]-RC[-2] -> 1 | Z6: 2 | AA6: 9 | AB6: 8 | AC6: =RC[-1]-RC[-2] -> -1 | AD6: 9 | AE6: 9 | AF6: 8 | AG6: =RC[-1]-RC[-2] -> -1 | AH6: 9 | AI6: 10 | AJ6: 6 | AK6: =RC[-1]-RC[-2] -> -4 | AL6: 9 | AM6: 10 | AN6: 8 | AO6: =RC[-1]-RC[-2] -> -2 | AP6: 9 | AQ6: 10 | AR6: 9 | AS6: =RC[-1]-RC[-2] -> -1 | AT6: 5 | AU6: 9 | AV6: 3 | AW6: =RC[-1]-RC[-2] -> -6 | AX6: 5 | AY6: 10 | AZ6: 6 | BA6: =RC[-1]-RC[-2] -> -4 | BB6: 9 | BC6: 10 | BD6: 5 | BE6: =RC[-1]-RC[-2] -> -5 | BF6: 5 | BG6: 10 | BH6: 12 | BI6: =RC[-1]-RC[-2] -> 2 | BJ6: 2 | BK6: 12 | BL6: 4 | BM6: =RC[-1]-RC[-2] -> -8 | BO6: 11 | BP6: 5 | BQ6: =RC[-1]-RC[-2] -> -6 | BR6: 9 | BS6: 11 | BT6: 2 | BU6: =RC[-1]-RC[-2] -> -9 | BW6: 10 | BX6: 8 | BY6: =RC[-1]-RC[-2] -> -2 | CA6: 10 | CB6: 4 | CC6: =RC[-1]-RC[-2] -> -6 | CE6: 10 | CF6: 8 | CG6: =RC[-1]-RC[-2] -> -2 | CI6: 10 | CJ6: 6 | CK6: =RC[-1]-RC[-2] -> -4 | CL6: 9 | CM6: =RC[-4]+RC[-8]+RC[-12]+RC[-16]+RC[-20]+RC[-24]+RC[-28]+RC[-32]+RC[-36]+RC[-40]+RC[-44]+RC[-48]+RC[-52]+RC[-56]+RC[-60]+RC[-64]+RC[-68]+RC[-72]+RC[-76]+RC[-80]+RC[-84]+RC[-88] -> 215 | CN6: =RC[-4]+RC[-8]+RC[-12]+RC[-16]+RC[-20]+RC[-24]+RC[-28]+RC[-32]+RC[-36]+RC[-40]+RC[-44]+RC[-48]+RC[-52]+RC[-56]+RC[-60]+RC[-64]+RC[-68]+RC[-72]+RC[-76]+RC[-80]+RC[-84]+RC[-88] -> 149 | CO6: =RC[-1]-RC[-2] -> -66
B7: НЛЗ | E7: =RC[-1]-RC[-2] -> 0 | I7: =RC[-1]-RC[-2] -> 0 | M7: =RC[-1]-RC[-2] -> 0 | Q7: =RC[-1]-RC[-2] -> 0 | U7: =RC[-1]-RC[-2] -> 0 | Y7: =RC[-1]-RC[-2] -> 0 | AC7: =RC[-1]-RC[-2] -> 0 | AG7: =RC[-1]-RC[-2] -> 0 | AK7: =RC[-1]-RC[-2] -> 0 | AO7: =RC[-1]-RC[-2] -> 0 | AS7: =RC[-1]-RC[-2] -> 0 | AW7: =RC[-1]-RC[-2] -> 0 | BA7: =RC[-1]-RC[-2] -> 0 | BE7: =RC[-1]-RC[-2] -> 0 | BI7: =RC[-1]-RC[-2] -> 0 | BM7: =RC[-1]-RC[-2] -> 0 | BQ7: =RC[-1]-RC[-2] -> 0 | BU7: =RC[-1]-RC[-2] -> 0 | BY7: =RC[-1]-RC[-2] -> 0 | CC7: =RC[-1]-RC[-2] -> 0 | CG7: =RC[-1]-RC[-2] -> 0 | CK7: =RC[-1]-RC[-2] -> 0 | CM7: =RC[-4]+RC[-8]+RC[-12]+RC[-16]+RC[-20]+RC[-24]+RC[-28]+RC[-32]+RC[-36]+RC[-40]+RC[-44]+RC[-48]+RC[-52]+RC[-56]+RC[-60]+RC[-64]+RC[-68]+RC[-72]+RC[-76]+RC[-80]+RC[-84]+RC[-88] -> 0 | CN7: =RC[-4]+RC[-8]+RC[-12]+RC[-16]+RC[-20]+RC[-24]+RC[-28]+RC[-32]+RC[-36]+RC[-40]+RC[-44]+RC[-48]+RC[-52]+RC[-56]+RC[-60]+RC[-64]+RC[-68]+RC[-72]+RC[-76]+RC[-80]+RC[-84]+RC[-88] -> 0 | CO7: =RC[-1]-RC[-2] -> 0
A8: ООО "НАЗ", АО "НГА" | B8: АЗ "НАЗ" | E8: =RC[-1]-RC[-2] -> 0 | I8: =RC[-1]-RC[-2] -> 0 | M8: =RC[-1]-RC[-2] -> 0 | Q8: =RC[-1]-RC[-2] -> 0 | U8: =RC[-1]-RC[-2] -> 0 | Y8: =RC[-1]-RC[-2] -> 0 | AC8: =RC[-1]-RC[-2] -> 0 | AG8: =RC[-1]-RC[-2] -> 0 | AK8: =RC[-1]-RC[-2] -> 0 | AO8: =RC[-1]-RC[-2] -> 0 | AS8: =RC[-1]-RC[-2] -> 0 | AW8: =RC[-1]-RC[-2] -> 0 | BA8: =RC[-1]-RC[-2] -> 0 | BE8: =RC[-1]-RC[-2] -> 0 | BI8: =RC[-1]-RC[-2] -> 0 | BM8: =RC[-1]-RC[-2] -> 0 | BQ8: =RC[-1]-RC[-2] -> 0 | BU8: =RC[-1]-RC[-2] -> 0 | BY8: =RC[-1]-RC[-2] -> 0 | CC8: =RC[-1]-RC[-2] -> 0 | CG8: =RC[-1]-RC[-2] -> 0 | CK8: =RC[-1]-RC[-2] -> 0 | CM8: =RC[-4]+RC[-8]+RC[-12]+RC[-16]+RC[-20]+RC[-24]+RC[-28]+RC[-32]+RC[-36]+RC[-40]+RC[-44]+RC[-48]+RC[-52]+RC[-56]+RC[-60]+RC[-64]+RC[-68]+RC[-72]+RC[-76]+RC[-80]+RC[-84]+RC[-88] -> 0 | CN8: =RC[-4]+RC[-8]+RC[-12]+RC[-16]+RC[-20]+RC[-24]+RC[-28]+RC[-32]+RC[-36]+RC[-40]+RC[-44]+RC[-48]+RC[-52]+RC[-56]+RC[-60]+RC[-64]+RC[-68]+RC[-72]+RC[-76]+RC[-80]+RC[-84]+RC[-88] -> 0 | CO8: =RC[-1]-RC[-2] -> 0
B9: АО "НГА" | E9: =RC[-1]-RC[-2] -> 0 | I9: =RC[-1]-RC[-2] -> 0 | M9: =RC[-1]-RC[-2] -> 0 | Q9: =RC[-1]-RC[-2] -> 0 | S9: 1 | T9: 0 | U9: =RC[-1]-RC[-2] -> -1 | V9: 2 | Y9: =RC[-1]-RC[-2] -> 0 | AC9: =RC[-1]-RC[-2] -> 0 | AE9: 1 | AF9: 0 | AG9: =RC[-1]-RC[-2] -> -1 | AH9: 2 | AK9: =RC[-1]-RC[-2] -> 0 | AM9: 1 | AO9: =RC[-1]-RC[-2] -> -1 | AP9: 2 | AS9: =RC[-1]-RC[-2] -> 0 | AW9: =RC[-1]-RC[-2] -> 0 | BA9: =RC[-1]-RC[-2] -> 0 | BE9: =RC[-1]-RC[-2] -> 0 | BG9: 1 | BH9: 0 | BI9: =RC[-1]-RC[-2] -> -1 | BJ9: 2 | BM9: =RC[-1]-RC[-2] -> 0 | BQ9: =RC[-1]-RC[-2] -> 0 | BU9: =RC[-1]-RC[-2] -> 0 | BY9: =RC[-1]-RC[-2] -> 0 | CA9: 1 | CC9: =RC[-1]-RC[-2] -> -1 | CG9: =RC[-1]-RC[-2] -> 0 | CK9: =RC[-1]-RC[-2] -> 0 | CM9: =RC[-4]+RC[-8]+RC[-12]+RC[-16]+RC[-20]+RC[-24]+RC[-28]+RC[-32]+RC[-36]+RC[-40]+RC[-44]+RC[-48]+RC[-52]+RC[-56]+RC[-60]+RC[-64]+RC[-68]+RC[-72]+RC[-76]+RC[-80]+RC[-84]+RC[-88] -> 5 | CN9: =RC[-4]+RC[-8]+RC[-12]+RC[-16]+RC[-20]+RC[-24]+RC[-28]+RC[-32]+RC[-36]+RC[-40]+RC[-44]+RC[-48]+RC[-52]+RC[-56]+RC[-60]+RC[-64]+RC[-68]+RC[-72]+RC[-76]+RC[-80]+RC[-84]+RC[-88] -> 0 | CO9: =RC[-1]-RC[-2] -> -5
A10: Сторонние внутренние | B10: КА-Группа ГАЗ( Вьетнам) | E10: =RC[-1]-RC[-2] -> 0 | I10: =RC[-1]-RC[-2] -> 0 | M10: =RC[-1]-RC[-2] -> 0 | Q10: =RC[-1]-RC[-2] -> 0 | S10: 5 | T10: 0 | U10: =RC[-1]-RC[-2] -> -5 | V10: 2 | W10: 6 | X10: 5 | Y10: =RC[-1]-RC[-2] -> -1 | Z10: 2 | AA10: 5 | AB10: 5 | AC10: =RC[-1]-RC[-2] -> 0 | AD10: 2 | AE10: 6 | AF10: 5 | AG10: =RC[-1]-RC[-2] -> -1 | AH10: 2 | AI10: 5 | AK10: =RC[-1]-RC[-2] -> -5 | AL10: 9 | AM10: 6 | AN10: 4 | AO10: =RC[-1]-RC[-2] -> -2 | AP10: 9 | AQ10: 5 | AR10: 8 | AS10: =RC[-1]-RC[-2] -> 3 | AT10: 7 | AW10: =RC[-1]-RC[-2] -> 0 | BA10: =RC[-1]-RC[-2] -> 0 | BE10: =RC[-1]-RC[-2] -> 0 | BI10: =RC[-1]-RC[-2] -> 0 | BM10: =RC[-1]-RC[-2] -> 0 | BP10: 11 | BQ10: =RC[-1]-RC[-2] -> 11 | BU10: =RC[-1]-RC[-2] -> 0 | BY10: =RC[-1]-RC[-2] -> 0 | CC10: =RC[-1]-RC[-2] -> 0 | CG10: =RC[-1]-RC[-2] -> 0 | CK10: =RC[-1]-RC[-2] -> 0 | CM10: =RC[-4]+RC[-8]+RC[-12]+RC[-16]+RC[-20]+RC[-24]+RC[-28]+RC[-32]+RC[-36]+RC[-40]+RC[-44]+RC[-48]+RC[-52]+RC[-56]+RC[-60]+RC[-64]+RC[-68]+RC[-72]+RC[-76]+RC[-80]+RC[-84]+RC[-88] -> 38 | CN10: =RC[-4]+RC[-8]+RC[-12]+RC[-16]+RC[-20]+RC[-24]+RC[-28]+RC[-32]+RC[-36]+RC[-40]+RC[-44]+RC[-48]+RC[-52]+RC[-56]+RC[-60]+RC[-64]+RC[-68]+RC[-72]+RC[-76]+RC[-80]+RC[-84]+RC[-88] -> 38 | CO10: =RC[-1]-RC[-2] -> 0
B11: Платформа А | E11: =RC[-1]-RC[-2] -> 0 | I11: =RC[-1]-RC[-2] -> 0 | M11: =RC[-1]-RC[-2] -> 0 | Q11: =RC[-1]-RC[-2] -> 0 | U11: =RC[-1]-RC[-2] -> 0 | Y11: =RC[-1]-RC[-2] -> 0 | AC11: =RC[-1]-RC[-2] -> 0 | AG11: =RC[-1]-RC[-2] -> 0 | AK11: =RC[-1]-RC[-2] -> 0 | AO11: =RC[-1]-RC[-2] -> 0 | AS11: =RC[-1]-RC[-2] -> 0 | AW11: =RC[-1]-RC[-2] -> 0 | BA11: =RC[-1]-RC[-2] -> 0 | BE11: =RC[-1]-RC[-2] -> 0 | BI11: =RC[-1]-RC[-2] -> 0 | BM11: =RC[-1]-RC[-2] -> 0 | BQ11: =RC[-1]-RC[-2] -> 0 | BU11: =RC[-1]-RC[-2] -> 0 | BY11: =RC[-1]-RC[-2] -> 0 | CC11: =RC[-1]-RC[-2] -> 0 | CG11: =RC[-1]-RC[-2] -> 0 | CK11: =RC[-1]-RC[-2] -> 0 | CM11: =RC[-4]+RC[-8]+RC[-12]+RC[-16]+RC[-20]+RC[-24]+RC[-28]+RC[-32]+RC[-36]+RC[-40]+RC[-44]+RC[-48]+RC[-52]+RC[-56]+RC[-60]+RC[-64]+RC[-68]+RC[-72]+RC[-76]+RC[-80]+RC[-84]+RC[-88] -> 0 | CN11: =RC[-4]+RC[-8]+RC[-12]+RC[-16]+RC[-20]+RC[-24]+RC[-28]+RC[-32]+RC[-36]+RC[-40]+RC[-44]+RC[-48]+RC[-52]+RC[-56]+RC[-60]+RC[-64]+RC[-68]+RC[-72]+RC[-76]+RC[-80]+RC[-84]+RC[-88] -> 0 | CO11: =RC[-1]-RC[-2] -> 0
A12: Сторонние внешние | B12: АО "ГОТХ" | C12: 9 | D12: 27 | E12: =RC[-1]-RC[-2] -> 18 | F12: 4 | G12: 9 | H12: 13 | I12: =RC[-1]-RC[-2] -> 4 | J12: 4 | K12: 9 | L12: 14 | M12: =RC[-1]-RC[-2] -> 5 | N12: 4 | O12: 9 | P12: 7 | Q12: =RC[-1]-RC[-2] -> -2 | R12: 3 | S12: 9 | T12: 3 | U12: =RC[-1]-RC[-2] -> -6 | V12: 3 | W12: 10 | X12: 14 | Y12: =RC[-1]-RC[-2] -> 4 | Z12: 4 | AA12: 9 | AB12: 2 | AC12: =RC[-1]-RC[-2] -> -7 | AD12: 3 | AE12: 9 | AF12: 0 | AG12: =RC[-1]-RC[-2] -> -9 | AH12: 3 | AI12: 9 | AJ12: 0 | AK12: =RC[-1]-RC[-2] -> -9 | AL12: 3 | AM12: 9 | AO12: =RC[-1]-RC[-2] -> -9 | AP12: 5 | AQ12: 9 | AR12: 2 | AS12: =RC[-1]-RC[-2] -> -7 | AT12: 5 | AU12: 9 | AW12: =RC[-1]-RC[-2] -> -9 | AX12: 5 | AY12: 9 | AZ12: 1 | BA12: =RC[-1]-RC[-2] -> -8 | BB12: 5 | BC12: 9 | BE12: =RC[-1]-RC[-2] -> -9 | BF12: 5 | BG12: 9 | BH12: 19 | BI12: =RC[-1]-RC[-2] -> 10 | BJ12: 4 | BK12: 9 | BM12: =RC[-1]-RC[-2] -> -9 | BO12: 10 | BP12: 18 | BQ12: =RC[-1]-RC[-2] -> 8 | BR12: 2 | BS12: 9 | BT12: 2 | BU12: =RC[-1]-RC[-2] -> -7 | BW12: 9 | BX12: 3 | BY12: =RC[-1]-RC[-2] -> -6 | CA12: 9 | CB12: 30 | CC12: =RC[-1]-RC[-2] -> 21 | CE12: 9 | CF12: 18 | CG12: =RC[-1]-RC[-2] -> 9 | CI12: 9 | CJ12: 21 | CK12: =RC[-1]-RC[-2] -> 12 | CL12: 6 | CM12: =RC[-4]+RC[-8]+RC[-12]+RC[-16]+RC[-20]+RC[-24]+RC[-28]+RC[-32]+RC[-36]+RC[-40]+RC[-44]+RC[-48]+RC[-52]+RC[-56]+RC[-60]+RC[-64]+RC[-68]+RC[-72]+RC[-76]+RC[-80]+RC[-84]+RC[-88] -> 200 | CN12: =RC[-4]+RC[-8]+RC[-12]+RC[-16]+RC[-20]+RC[-24]+RC[-28]+RC[-32]+RC[-36]+RC[-40]+RC[-44]+RC[-48]+RC[-52]+RC[-56]+RC[-60]+RC[-64]+RC[-68]+RC[-72]+RC[-76]+RC[-80]+RC[-84]+RC[-88] -> 194 | CO12: =RC[-1]-RC[-2] -> -6
B13: ООО "Нерудные материалы-НН" | E13: =RC[-1]-RC[-2] -> 0 | I13: =RC[-1]-RC[-2] -> 0 | M13: =RC[-1]-RC[-2] -> 0 | Q13: =RC[-1]-RC[-2] -> 0 | U13: =RC[-1]-RC[-2] -> 0 | Y13: =RC[-1]-RC[-2] -> 0 | AB13: 6 | AC13: =RC[-1]-RC[-2] -> 6 | AG13: =RC[-1]-RC[-2] -> 0 | AJ13: 6 | AK13: =RC[-1]-RC[-2] -> 6 | AL13: 2 | AO13: =RC[-1]-RC[-2] -> 0 | AS13: =RC[-1]-RC[-2] -> 0 | AW13: =RC[-1]-RC[-2] -> 0 | BA13: =RC[-1]-RC[-2] -> 0 | BE13: =RC[-1]-RC[-2] -> 0 | BI13: =RC[-1]-RC[-2] -> 0 | BM13: =RC[-1]-RC[-2] -> 0 | BQ13: =RC[-1]-RC[-2] -> 0 | BU13: =RC[-1]-RC[-2] -> 0 | BY13: =RC[-1]-RC[-2] -> 0 | CC13: =RC[-1]-RC[-2] -> 0 | CG13: =RC[-1]-RC[-2] -> 0 | CK13: =RC[-1]-RC[-2] -> 0 | CM13: =RC[-4]+RC[-8]+RC[-12]+RC[-16]+RC[-20]+RC[-24]+RC[-28]+RC[-32]+RC[-36]+RC[-40]+RC[-44]+RC[-48]+RC[-52]+RC[-56]+RC[-60]+RC[-64]+RC[-68]+RC[-72]+RC[-76]+RC[-80]+RC[-84]+RC[-88] -> 0 | CN13: =RC[-4]+RC[-8]+RC[-12]+RC[-16]+RC[-20]+RC[-24]+RC[-28]+RC[-32]+RC[-36]+RC[-40]+RC[-44]+RC[-48]+RC[-52]+RC[-56]+RC[-60]+RC[-64]+RC[-68]+RC[-72]+RC[-76]+RC[-80]+RC[-84]+RC[-88] -> 12 | CO13: =RC[-1]-RC[-2] -> 12
B14: ПК НВМ (ООО "Профит") | E14: =RC[-1]-RC[-2] -> 0 | I14: =RC[-1]-RC[-2] -> 0 | M14: =RC[-1]-RC[-2] -> 0 | Q14: =RC[-1]-RC[-2] -> 0 | U14: =RC[-1]-RC[-2] -> 0 | Y14: =RC[-1]-RC[-2] -> 0 | AC14: =RC[-1]-RC[-2] -> 0 | AG14: =RC[-1]-RC[-2] -> 0 | AK14: =RC[-1]-RC[-2] -> 0 | AN14: 2 | AO14: =RC[-1]-RC[-2] -> 2 | AP14: 8 | AR14: 1 | AS14: =RC[-1]-RC[-2] -> 1 | AT14: 8 | AV14: 3 | AW14: =RC[-1]-RC[-2] -> 3 | AX14: 8 | AZ14: 6 | BA14: =RC[-1]-RC[-2] -> 6 | BB14: 8 | BE14: =RC[-1]-RC[-2] -> 0 | BI14: =RC[-1]-RC[-2] -> 0 | BL14: 2 | BM14: =RC[-1]-RC[-2] -> 2 | BQ14: 0 | BT14: 3 | BU14: =RC[-1]-RC[-2] -> 3 | BY14: =RC[-1]-RC[-2] -> 0 | CC14: =RC[-1]-RC[-2] -> 0 | CG14: =RC[-1]-RC[-2] -> 0 | CK14: =RC[-1]-RC[-2] -> 0 | CM14: =RC[-4]+RC[-8]+RC[-12]+RC[-16]+RC[-20]+RC[-24]+RC[-28]+RC[-32]+RC[-36]+RC[-40]+RC[-44]+RC[-48]+RC[-52]+RC[-56]+RC[-60]+RC[-64]+RC[-68]+RC[-72]+RC[-76]+RC[-80]+RC[-84]+RC[-88] -> 0 | CN14: =RC[-4]+RC[-8]+RC[-12]+RC[-16]+RC[-20]+RC[-24]+RC[-28]+RC[-32]+RC[-36]+RC[-40]+RC[-44]+RC[-48]+RC[-52]+RC[-56]+RC[-60]+RC[-64]+RC[-68]+RC[-72]+RC[-76]+RC[-80]+RC[-84]+RC[-88] -> 17 | CO14: =RC[-1]-RC[-2] -> 17
B15: ООО "ИнтерметГрупп" | C15: 1 | D15: 0 | E15: =RC[-1]-RC[-2] -> -1 | F15: 5 | G15: 1 | H15: 0 | I15: =RC[-1]-RC[-2] -> -1 | J15: 5 | K15: 1 | L15: 0 | M15: =RC[-1]-RC[-2] -> -1 | N15: 5 | Q15: =RC[-1]-RC[-2] -> 0 | S15: 1 | T15: 0 | U15: =RC[-1]-RC[-2] -> -1 | V15: 5 | W15: 1 | X15: 4 | Y15: =RC[-1]-RC[-2] -> 3 | Z15: 2 | AC15: =RC[-1]-RC[-2] -> 0 | AE15: 1 | AF15: 0 | AG15: =RC[-1]-RC[-2] -> -1 | AH15: 5 | AK15: =RC[-1]-RC[-2] -> 0 | AM15: 1 | AN15: 3 | AO15: =RC[-1]-RC[-2] -> 2 | AP15: 6 | AS15: =RC[-1]-RC[-2] -> 0 | AU15: 1 | AV15: 5 | AW15: =RC[-1]-RC[-2] -> 4 | AX15: 6 | AY15: 1 | BA15: =RC[-1]-RC[-2] -> -1 | BB15: 5 | BE15: =RC[-1]-RC[-2] -> 0 | BG15: 1 | BI15: =RC[-1]-RC[-2] -> -1 | BK15: 1 | BL15: 2 | BM15: =RC[-1]-RC[-2] -> 1 | BQ15: =RC[-1]-RC[-2] -> 0 | BS15: 1 | BU15: =RC[-1]-RC[-2] -> -1 | BY15: =RC[-1]-RC[-2] -> 0 | CA15: 1 | CC15: =RC[-1]-RC[-2] -> -1 | CE15: 1 | CG15: =RC[-1]-RC[-2] -> -1 | CI15: 1 | CJ15: 0 | CK15: =RC[-1]-RC[-2] -> -1 | CL15: 5 | CM15: =RC[-4]+RC[-8]+RC[-12]+RC[-16]+RC[-20]+RC[-24]+RC[-28]+RC[-32]+RC[-36]+RC[-40]+RC[-44]+RC[-48]+RC[-52]+RC[-56]+RC[-60]+RC[-64]+RC[-68]+RC[-72]+RC[-76]+RC[-80]+RC[-84]+RC[-88] -> 15 | CN15: =RC[-4]+RC[-8]+RC[-12]+RC[-16]+RC[-20]+RC[-24]+RC[-28]+RC[-32]+RC[-36]+RC[-40]+RC[-44]+RC[-48]+RC[-52]+RC[-56]+RC[-60]+RC[-64]+RC[-68]+RC[-72]+RC[-76]+RC[-80]+RC[-84]+RC[-88] -> 14 | CO15: =RC[-1]-RC[-2] -> -1
B16: Прочие | C16: 1 | D16: 2 | E16: =RC[-1]-RC[-2] -> 1 | F16: 2 | G16: 1 | H16: 0 | I16: =RC[-1]-RC[-2] -> -1 | J16: 5 | K16: 1 | L16: 1 | M16: =RC[-1]-RC[-2] -> 0 | O16: 1 | P16: 0 | Q16: =RC[-1]-RC[-2] -> -1 | R16: 5 | U16: =RC[-1]-RC[-2] -> 0 | Y16: =RC[-1]-RC[-2] -> 0 | AA16: 1 | AB16: 0 | AC16: =RC[-1]-RC[-2] -> -1 | AD16: 5 | AE16: 1 | AF16: 0 | AG16: =RC[-1]-RC[-2] -> -1 | AH16: 5 | AK16: =RC[-1]-RC[-2] -> 0 | AM16: 1 | AO16: =RC[-1]-RC[-2] -> -1 | AP16: 9 | AS16: =RC[-1]-RC[-2] -> 0 | AW16: =RC[-1]-RC[-2] -> 0 | AY16: 1 | BA16: =RC[-1]-RC[-2] -> -1 | BB16: 5 | BC16: 1 | BE16: =RC[-1]-RC[-2] -> -1 | BF16: 5 | BH16: 1 | BI16: =RC[-1]-RC[-2] -> 1 | BJ16: 2 | BK16: 1 | BL16: 1 | BM16: =RC[-1]-RC[-2] -> 0 | BP16: 1 | BQ16: =RC[-1]-RC[-2] -> 1 | BU16: =RC[-1]-RC[-2] -> 0 | BW16: 1 | BY16: =RC[-1]-RC[-2] -> -1 | CC16: =RC[-1]-RC[-2] -> 0 | CG16: =RC[-1]-RC[-2] -> 0 | CI16: 1 | CK16: =RC[-1]-RC[-2] -> -1 | CM16: =RC[-4]+RC[-8]+RC[-12]+RC[-16]+RC[-20]+RC[-24]+RC[-28]+RC[-32]+RC[-36]+RC[-40]+RC[-44]+RC[-48]+RC[-52]+RC[-56]+RC[-60]+RC[-64]+RC[-68]+RC[-72]+RC[-76]+RC[-80]+RC[-84]+RC[-88] -> 12 | CN16: =RC[-4]+RC[-8]+RC[-12]+RC[-16]+RC[-20]+RC[-24]+RC[-28]+RC[-32]+RC[-36]+RC[-40]+RC[-44]+RC[-48]+RC[-52]+RC[-56]+RC[-60]+RC[-64]+RC[-68]+RC[-72]+RC[-76]+RC[-80]+RC[-84]+RC[-88] -> 6 | CO16: =RC[-1]-RC[-2] -> -6
A17: ИТОГО за день: | C17: =SUM(R[-14]C:R[-1]C) -> 22 | D17: =SUM(R[-14]C:R[-1]C) -> 41 | E17: =RC[-1]-RC[-2] -> 19 | F17: 2,4,5 | G17: =SUM(R[-14]C:R[-1]C) -> 22 | H17: =SUM(R[-14]C:R[-1]C) -> 17 | I17: =RC[-1]-RC[-2] -> -5 | J17: 4,5,9 | K17: =SUM(R[-14]C:R[-1]C) -> 21 | L17: =SUM(R[-14]C:R[-1]C) -> 28 | M17: =RC[-1]-RC[-2] -> 7 | N17: 2,4,5,7 | O17: =SUM(R[-14]C:R[-1]C) -> 20 | P17: =SUM(R[-14]C:R[-1]C) -> 13 | Q17: =RC[-1]-RC[-2] -> -7 | R17: 2,3,5,9 | S17: =SUM(R[-14]C:R[-1]C) -> 25 | T17: =SUM(R[-14]C:R[-1]C) -> 9 | U17: =RC[-1]-RC[-2] -> -16 | W17: =SUM(R[-14]C:R[-1]C) -> 28 | X17: =SUM(R[-14]C:R[-1]C) -> 36 | Y17: =RC[-1]-RC[-2] -> 8 | Z17: 2,4,7 | AA17: =SUM(R[-14]C:R[-1]C) -> 26 | AB17: =SUM(R[-14]C:R[-1]C) -> 21 | AC17: =RC[-1]-RC[-2] -> -5 | AD17: 2,3,5,9 | AE17: =SUM(R[-14]C:R[-1]C) -> 28 | AF17: =SUM(R[-14]C:R[-1]C) -> 14 | AG17: =RC[-1]-RC[-2] -> -14 | AH17: 2,3,5,9 | AI17: =SUM(R[-14]C:R[-1]C) -> 25 | AJ17: =SUM(R[-14]C:R[-1]C) -> 14 | AK17: =RC[-1]-RC[-2] -> -11 | AL17: 2,3,7,9 | AM17: =SUM(R[-14]C:R[-1]C) -> 28 | AN17: =SUM(R[-14]C:R[-1]C) -> 17 | AO17: =RC[-1]-RC[-2] -> -11 | AP17: 2,5,6,8,9 | AQ17: =SUM(R[-14]C:R[-1]C) -> 26 | AR17: =SUM(R[-14]C:R[-1]C) -> 20 | AS17: =RC[-1]-RC[-2] -> -6 | AT17: 5,7,8,9 | AU17: =SUM(R[-14]C:R[-1]C) -> 21 | AV17: =SUM(R[-14]C:R[-1]C) -> 14 | AW17: =RC[-1]-RC[-2] -> -7 | AX17: 5,6,7,8 | AY17: =SUM(R[-14]C:R[-1]C) -> 23 | AZ17: =SUM(R[-14]C:R[-1]C) -> 13 | BA17: =RC[-1]-RC[-2] -> -10 | BB17: 5,8,9 | BC17: =SUM(R[-14]C:R[-1]C) -> 22 | BD17: =SUM(R[-14]C:R[-1]C) -> 5 | BE17: =RC[-1]-RC[-2] -> -17 | BF17: 5.9 | BG17: =SUM(R[-14]C:R[-1]C) -> 21 | BH17: =SUM(R[-14]C:R[-1]C) -> 34 | BI17: =RC[-1]-RC[-2] -> 13 | BK17: =SUM(R[-14]C:R[-1]C) -> 25 | BL17: =SUM(R[-14]C:R[-1]C) -> 10 | BM17: =RC[-1]-RC[-2] -> -15 | BO17: =SUM(R[-14]C:R[-1]C) -> 23 | BP17: =SUM(R[-14]C:R[-1]C) -> 35 | BQ17: =RC[-1]-RC[-2] -> 12 | BS17: =SUM(R[-14]C:R[-1]C) -> 22 | BT17: =SUM(R[-14]C:R[-1]C) -> 8 | BU17: =RC[-1]-RC[-2] -> -14 | BW17: =SUM(R[-14]C:R[-1]C) -> 21 | BX17: =SUM(R[-14]C:R[-1]C) -> 13 | BY17: =RC[-1]-RC[-2] -> -8 | CA17: =SUM(R[-14]C:R[-1]C) -> 21 | CB17: =SUM(R[-14]C:R[-1]C) -> 34 | CC17: =RC[-1]-RC[-2] -> 13 | CE17: =SUM(R[-14]C:R[-1]C) -> 22 | CF17: =SUM(R[-14]C:R[-1]C) -> 26 | CG17: =RC[-1]-RC[-2] -> 4 | CI17: =SUM(R[-14]C:R[-1]C) -> 23 | CJ17: =SUM(R[-14]C:R[-1]C) -> 29 | CK17: =RC[-1]-RC[-2] -> 6 | CM17: =RC[-4]+RC[-8]+RC[-12]+RC[-16]+RC[-20]+RC[-24]+RC[-28]+RC[-32]+RC[-36]+RC[-40]+RC[-44]+RC[-48]+RC[-52]+RC[-56]+RC[-60]+RC[-64]+RC[-68]+RC[-72]+RC[-76]+RC[-80]+RC[-84]+RC[-88] -> 515 | CN17: =RC[-4]+RC[-8]+RC[-12]+RC[-16]+RC[-20]+RC[-24]+RC[-28]+RC[-32]+RC[-36]+RC[-40]+RC[-44]+RC[-48]+RC[-52]+RC[-56]+RC[-60]+RC[-64]+RC[-68]+RC[-72]+RC[-76]+RC[-80]+RC[-84]+RC[-88] -> 451 | CO17: =RC[-1]-RC[-2] -> -64
A18: Эксплуатируемый парк локомотивов: | C18: 2 | D18: 3 | E18: =RC[-1]-RC[-2] -> 1 | F18: 1 | G18: 2 | H18: 2.7 | I18: =RC[-1]-RC[-2] -> 0.70000000000000018 | J18: 4 | K18: 2 | L18: 2 | M18: =RC[-1]-RC[-2] -> 0 | O18: 2 | P18: 2 | Q18: =RC[-1]-RC[-2] -> 0 | S18: 2 | T18: 2 | U18: =RC[-1]-RC[-2] -> 0 | W18: 2 | X18: 2 | Y18: =RC[-1]-RC[-2] -> 0 | AA18: 2 | AB18: 2 | AC18: =RC[-1]-RC[-2] -> 0 | AE18: 2 | AF18: 2 | AG18: =RC[-1]-RC[-2] -> 0 | AI18: 2 | AJ18: 2 | AK18: =RC[-1]-RC[-2] -> 0 | AM18: 2 | AN18: 1 | AO18: =RC[-1]-RC[-2] -> -1 | AP18: 5 | AQ18: 2 | AR18: 2 | AS18: =RC[-1]-RC[-2] -> 0 | AU18: 2 | AV18: 2 | AW18: =RC[-1]-RC[-2] -> 0 | AY18: 2 | AZ18: 2 | BA18: =RC[-1]-RC[-2] -> 0 | BC18: 2 | BD18: 2 | BE18: =RC[-1]-RC[-2] -> 0 | BG18: 2 | BH18: 2 | BI18: =RC[-1]-RC[-2] -> 0 | BK18: 2 | BL18: 1.75 | BM18: =RC[-1]-RC[-2] -> -0.25 | BO18: 2 | BP18: 1.8 | BQ18: =RC[-1]-RC[-2] -> -0.19999999999999996 | BR18: 4 | BS18: 2 | BT18: 2 | BU18: =RC[-1]-RC[-2] -> 0 | BW18: 2 | BX18: 2 | BY18: =RC[-1]-RC[-2] -> 0 | CA18: 2 | CB18: 2 | CC18: =RC[-1]-RC[-2] -> 0 | CE18: 2 | CF18: 2 | CG18: =RC[-1]-RC[-2] -> 0 | CI18: 2 | CJ18: 2 | CK18: =RC[-1]-RC[-2] -> 0 | CM18: =AVERAGE(RC[-4], RC[-8], RC[-12], RC[-16], RC[-20], RC[-24], RC[-28], RC[-32], RC[-36], RC[-40], RC[-44], RC[-48], RC[-52], RC[-56], RC[-60], RC[-64], RC[-68], RC[-72], RC[-76], RC[-80], RC[-84],RC[-88]) -> 2 | CN18: =AVERAGE(RC[-4], RC[-8], RC[-12], RC[-16], RC[-20], RC[-24], RC[-28], RC[-32], RC[-36], RC[-40], RC[-44], RC[-48], RC[-52], RC[-56], RC[-60], RC[-64], RC[-68], RC[-72], RC[-76], RC[-80], RC[-84],RC[-88]) -> 2.0113636363636362 | CO18: =RC[-1]-RC[-2] -> 1.1363636363636243E-2
A19: * - причины отклонения
A21: Причины отклонения по вагонам:
A22: 1. | B22: Погодные условия
A23: 2. | B23: Отсутствие четкого планирования со стороны клиента
A24: 3. | B24: Запрет на отправление со стороны ОАО "РЖД"
A25: 4. | B25: Снятие запрета на отправление со стороны ОАО "РЖД"
A26: 5. | B26: Отсутствие заготовки перевозочных документов в АС ЭТРАН
A27: 6. | B27: Появление заготовки перевозочных документов в АС ЭТРАН
A28: 7. | B28: Наличие заявки на обработку со стороны клиента на большее кол-во вагонов
A29: 8. | B29: Заключение договора на подачу/уборку вагонов с новым клиентом
A30: 9. | B30: Вагоны не готовы к уборке с грузового фронта по вине клиента
A32: Причины отклонения по локомотивам:
A33: 1. | B33: Переработано вагонов более заявленного кол-ва
A34: 2. | B34: Наличие аварийной заявки на обработку от клиента
A35: 3. | B35: Внутренняя работа (работа с путевой техникой, обработка депо и др.)
A36: 4. | B36: Испытание локомобиля
A37: 5. | B37: Отказ от заявки на обработку грузового фронта от клиента
A39: хранить год

Sheet: май
A1: Число | C1: 5 | G1: 6 | K1: 7 | O1: 12 | S1: 13 | W1: 14 | AA1: 15 | AE1: 16 | AI1: 19 | AM1: 20 | AQ1: 21 | AU1: 22 | AY1: 23 | BC1: 26 | BG1: 27 | BK1: 28 | BO1: 29 | BS1: 30 | BW1: Итого
A2: Клиенты | C2: план | D2: факт | E2: откл-е | F2: * | G2: план | H2: факт | I2: откл-е | J2: * | K2: план | L2: факт | M2: откл-е | N2: * | O2: план | P2: факт | Q2: откл-е | R2: * | S2: план | T2: факт | U2: откл-е | V2: * | W2: план | X2: факт | Y2: откл-е | Z2: * | AA2: план | AB2: факт | AC2: откл-е | AD2: * | AE2: план | AF2: факт | AG2: откл-е | AH2: * | AI2: план | AJ2: факт | AK2: откл-е | AL2: * | AM2: план | AN2: факт | AO2: откл-е | AP2: * | AQ2: план | AR2: факт | AS2: откл-е | AT2: * | AU2: план | AV2: факт | AW2: откл-е | AX2: * | AY2: план | AZ2: факт | BA2: откл-е | BB2: * | BC2: план | BD2: факт | BE2: откл-е | BF2: * | BG2: план | BH2: факт | BI2: откл-е | BJ2: * | BK2: план | BL2: факт | BM2: откл-е | BN2: * | BO2: план | BP2: факт | BQ2: откл-е | BR2: * | BS2: план | BT2: факт | BU2: откл-е | BV2: * | BW2: план | BX2: факт | BY2: откл-е
A3: БЕ ООО "НАК" | B3: ЛЗ | E3: =RC[-1]-RC[-2] -> 0 | I3: =RC[-1]-RC[-2] -> 0 | M3: =RC[-1]-RC[-2] -> 0 | Q3: =RC[-1]-RC[-2] -> 0 | U3: =RC[-1]-RC[-2] -> 0 | W3: 2 | X3: 2 | Y3: =RC[-1]-RC[-2] -> 0 | AB3: 3 | AC3: =RC[-1]-RC[-2] -> 3 | AE3: 1 | AF3: 1 | AG3: =RC[-1]-RC[-2] -> 0 | AK3: =RC[-1]-RC[-2] -> 0 | AM3: 2 | AN3: 1 | AO3: =RC[-1]-RC[-2] -> -1 | AS3: =RC[-1]-RC[-2] -> 0 | AU3: 1 | AW3: =RC[-1]-RC[-2] -> -1 | BA3: =RC[-1]-RC[-2] -> 0 | BE3: =RC[-1]-RC[-2] -> 0 | BG3: 2 | BI3: =RC[-1]-RC[-2] -> -2 | BM3: =RC[-1]-RC[-2] -> 0 | BO3: 1 | BQ3: =RC[-1]-RC[-2] -> -1 | BU3: =RC[-1]-RC[-2] -> 0 | BW3: =RC[-4]+RC[-8]+RC[-12]+RC[-16]+RC[-20]+RC[-24]+RC[-28]+RC[-32]+RC[-36]+RC[-40]+RC[-44]+RC[-48]+RC[-52]+RC[-56]+RC[-60]+RC[-64]+RC[-68]+RC[-72] -> 9 | BX3: =RC[-4]+RC[-8]+RC[-12]+RC[-16]+RC[-20]+RC[-24]+RC[-28]+RC[-32]+RC[-36]+RC[-40]+RC[-44]+RC[-48]+RC[-52]+RC[-56]+RC[-60]+RC[-64]+RC[-68]+RC[-72] -> 7 | BY3: =RC[-1]-RC[-2] -> -2
B4: ПРЗ | E4: =RC[-1]-RC[-2] -> 0 | I4: =RC[-1]-RC[-2] -> 0 | M4: =RC[-1]-RC[-2] -> 0 | Q4: =RC[-1]-RC[-2] -> 0 | S4: 2 | U4: =RC[-1]-RC[-2] -> -2 | Y4: =RC[-1]-RC[-2] -> 0 | AA4: 1 | AC4: =RC[-1]-RC[-2] -> -1 | AF4: 2 | AG4: =RC[-1]-RC[-2] -> 2 | AI4: 2 | AK4: =RC[-1]-RC[-2] -> -2 | AN4: 1 | AO4: =RC[-1]-RC[-2] -> 1 | AQ4: 1 | AS4: =RC[-1]-RC[-2] -> -1 | AW4: =RC[-1]-RC[-2] -> 0 | BA4: =RC[-1]-RC[-2] -> 0 | BC4: 2 | BE4: =RC[-1]-RC[-2] -> -2 | BI4: =RC[-1]-RC[-2] -> 0 | BK4: 1 | BM4: =RC[-1]-RC[-2] -> -1 | BQ4: =RC[-1]-RC[-2] -> 0 | BU4: =RC[-1]-RC[-2] -> 0 | BW4: =RC[-4]+RC[-8]+RC[-12]+RC[-16]+RC[-20]+RC[-24]+RC[-28]+RC[-32]+RC[-36]+RC[-40]+RC[-44]+RC[-48]+RC[-52]+RC[-56]+RC[-60]+RC[-64]+RC[-68]+RC[-72] -> 9 | BX4: =RC[-4]+RC[-8]+RC[-12]+RC[-16]+RC[-20]+RC[-24]+RC[-28]+RC[-32]+RC[-36]+RC[-40]+RC[-44]+RC[-48]+RC[-52]+RC[-56]+RC[-60]+RC[-64]+RC[-68]+RC[-72] -> 3 | BY4: =RC[-1]-RC[-2] -> -6
A5: ООО "НАК" | B5: ЗШП | E5: =RC[-1]-RC[-2] -> 0 | I5: =RC[-1]-RC[-2] -> 0 | M5: =RC[-1]-RC[-2] -> 0 | Q5: =RC[-1]-RC[-2] -> 0 | U5: =RC[-1]-RC[-2] -> 0 | Y5: =RC[-1]-RC[-2] -> 0 | AC5: =RC[-1]-RC[-2] -> 0 | AG5: =RC[-1]-RC[-2] -> 0 | AK5: =RC[-1]-RC[-2] -> 0 | AO5: =RC[-1]-RC[-2] -> 0 | AS5: =RC[-1]-RC[-2] -> 0 | AW5: =RC[-1]-RC[-2] -> 0 | BA5: =RC[-1]-RC[-2] -> 0 | BE5: =RC[-1]-RC[-2] -> 0 | BI5: =RC[-1]-RC[-2] -> 0 | BM5: =RC[-1]-RC[-2] -> 0 | BQ5: =RC[-1]-RC[-2] -> 0 | BU5: =RC[-1]-RC[-2] -> 0 | BW5: =RC[-4]+RC[-8]+RC[-12]+RC[-16]+RC[-20]+RC[-24]+RC[-28]+RC[-32]+RC[-36]+RC[-40]+RC[-44]+RC[-48]+RC[-52]+RC[-56]+RC[-60]+RC[-64]+RC[-68]+RC[-72] -> 0 | BX5: =RC[-4]+RC[-8]+RC[-12]+RC[-16]+RC[-20]+RC[-24]+RC[-28]+RC[-32]+RC[-36]+RC[-40]+RC[-44]+RC[-48]+RC[-52]+RC[-56]+RC[-60]+RC[-64]+RC[-68]+RC[-72] -> 0 | BY5: =RC[-1]-RC[-2] -> 0
B6: НАК | C6: 11 | D6: 9 | E6: =RC[-1]-RC[-2] -> -2 | G6: 10 | H6: 11 | I6: =RC[-1]-RC[-2] -> 1 | K6: 10 | L6: 9 | M6: =RC[-1]-RC[-2] -> -1 | O6: 11 | P6: 2 | Q6: =RC[-1]-RC[-2] -> -9 | S6: 10 | T6: 12 | U6: =RC[-1]-RC[-2] -> 2 | W6: 10 | X6: 4 | Y6: =RC[-1]-RC[-2] -> -6 | AA6: 10 | AB6: 1 | AC6: =RC[-1]-RC[-2] -> -9 | AE6: 10 | AF6: 7 | AG6: =RC[-1]-RC[-2] -> -3 | AI6: 11 | AJ6: 4 | AK6: =RC[-1]-RC[-2] -> -7 | AM6: 10 | AN6: 9 | AO6: =RC[-1]-RC[-2] -> -1 | AQ6: 10 | AS6: =RC[-1]-RC[-2] -> -10 | AU6: 10 | AW6: =RC[-1]-RC[-2] -> -10 | AY6: 10 | BA6: =RC[-1]-RC[-2] -> -10 | BC6: 11 | BE6: =RC[-1]-RC[-2] -> -11 | BG6: 10 | BI6: =RC[-1]-RC[-2] -> -10 | BK6: 10 | BM6: =RC[-1]-RC[-2] -> -10 | BO6: 10 | BQ6: =RC[-1]-RC[-2] -> -10 | BS6: 11 | BU6: =RC[-1]-RC[-2] -> -11 | BW6: =RC[-4]+RC[-8]+RC[-12]+RC[-16]+RC[-20]+RC[-24]+RC[-28]+RC[-32]+RC[-36]+RC[-40]+RC[-44]+RC[-48]+RC[-52]+RC[-56]+RC[-60]+RC[-64]+RC[-68]+RC[-72] -> 185 | BX6: =RC[-4]+RC[-8]+RC[-12]+RC[-16]+RC[-20]+RC[-24]+RC[-28]+RC[-32]+RC[-36]+RC[-40]+RC[-44]+RC[-48]+RC[-52]+RC[-56]+RC[-60]+RC[-64]+RC[-68]+RC[-72] -> 68 | BY6: =RC[-1]-RC[-2] -> -117
B7: НЛЗ | E7: =RC[-1]-RC[-2] -> 0 | I7: =RC[-1]-RC[-2] -> 0 | M7: =RC[-1]-RC[-2] -> 0 | Q7: =RC[-1]-RC[-2] -> 0 | U7: =RC[-1]-RC[-2] -> 0 | Y7: =RC[-1]-RC[-2] -> 0 | AC7: =RC[-1]-RC[-2] -> 0 | AG7: =RC[-1]-RC[-2] -> 0 | AK7: =RC[-1]-RC[-2] -> 0 | AO7: =RC[-1]-RC[-2] -> 0 | AS7: =RC[-1]-RC[-2] -> 0 | AW7: =RC[-1]-RC[-2] -> 0 | BA7: =RC[-1]-RC[-2] -> 0 | BE7: =RC[-1]-RC[-2] -> 0 | BI7: =RC[-1]-RC[-2] -> 0 | BM7: =RC[-1]-RC[-2] -> 0 | BQ7: =RC[-1]-RC[-2] -> 0 | BU7: =RC[-1]-RC[-2] -> 0 | BW7: =RC[-4]+RC[-8]+RC[-12]+RC[-16]+RC[-20]+RC[-24]+RC[-28]+RC[-32]+RC[-36]+RC[-40]+RC[-44]+RC[-48]+RC[-52]+RC[-56]+RC[-60]+RC[-64]+RC[-68]+RC[-72] -> 0 | BX7: =RC[-4]+RC[-8]+RC[-12]+RC[-16]+RC[-20]+RC[-24]+RC[-28]+RC[-32]+RC[-36]+RC[-40]+RC[-44]+RC[-48]+RC[-52]+RC[-56]+RC[-60]+RC[-64]+RC[-68]+RC[-72] -> 0 | BY7: =RC[-1]-RC[-2] -> 0
A8: ООО "НАЗ", АО "НГА" | B8: АЗ "НАЗ" | E8: =RC[-1]-RC[-2] -> 0 | I8: =RC[-1]-RC[-2] -> 0 | M8: =RC[-1]-RC[-2] -> 0 | Q8: =RC[-1]-RC[-2] -> 0 | U8: =RC[-1]-RC[-2] -> 0 | Y8: =RC[-1]-RC[-2] -> 0 | AC8: =RC[-1]-RC[-2] -> 0 | AG8: =RC[-1]-RC[-2] -> 0 | AJ8: 4 | AK8: =RC[-1]-RC[-2] -> 4 | AO8: =RC[-1]-RC[-2] -> 0 | AS8: =RC[-1]-RC[-2] -> 0 | AW8: =RC[-1]-RC[-2] -> 0 | BA8: =RC[-1]-RC[-2] -> 0 | BE8: =RC[-1]-RC[-2] -> 0 | BI8: =RC[-1]-RC[-2] -> 0 | BM8: =RC[-1]-RC[-2] -> 0 | BQ8: =RC[-1]-RC[-2] -> 0 | BU8: =RC[-1]-RC[-2] -> 0 | BW8: =RC[-4]+RC[-8]+RC[-12]+RC[-16]+RC[-20]+RC[-24]+RC[-28]+RC[-32]+RC[-36]+RC[-40]+RC[-44]+RC[-48]+RC[-52]+RC[-56]+RC[-60]+RC[-64]+RC[-68]+RC[-72] -> 0 | BX8: =RC[-4]+RC[-8]+RC[-12]+RC[-16]+RC[-20]+RC[-24]+RC[-28]+RC[-32]+RC[-36]+RC[-40]+RC[-44]+RC[-48]+RC[-52]+RC[-56]+RC[-60]+RC[-64]+RC[-68]+RC[-72] -> 4 | BY8: =RC[-1]-RC[-2] -> 4
B9: АО "НГА" | E9: =RC[-1]-RC[-2] -> 0 | I9: =RC[-1]-RC[-2] -> 0 | M9: =RC[-1]-RC[-2] -> 0 | P9: 33 | Q9: =RC[-1]-RC[-2] -> 33 | U9: =RC[-1]-RC[-2] -> 0 | Y9: =RC[-1]-RC[-2] -> 0 | AC9: =RC[-1]-RC[-2] -> 0 | AG9: =RC[-1]-RC[-2] -> 0 | AJ9: 6 | AK9: =RC[-1]-RC[-2] -> 6 | AO9: =RC[-1]-RC[-2] -> 0 | AS9: =RC[-1]-RC[-2] -> 0 | AW9: =RC[-1]-RC[-2] -> 0 | BA9: =RC[-1]-RC[-2] -> 0 | BE9: =RC[-1]-RC[-2] -> 0 | BI9: =RC[-1]-RC[-2] -> 0 | BM9: =RC[-1]-RC[-2] -> 0 | BQ9: =RC[-1]-RC[-2] -> 0 | BU9: =RC[-1]-RC[-2] -> 0 | BW9: =RC[-4]+RC[-8]+RC[-12]+RC[-16]+RC[-20]+RC[-24]+RC[-28]+RC[-32]+RC[-36]+RC[-40]+RC[-44]+RC[-48]+RC[-52]+RC[-56]+RC[-60]+RC[-64]+RC[-68]+RC[-72] -> 0 | BX9: =RC[-4]+RC[-8]+RC[-12]+RC[-16]+RC[-20]+RC[-24]+RC[-28]+RC[-32]+RC[-36]+RC[-40]+RC[-44]+RC[-48]+RC[-52]+RC[-56]+RC[-60]+RC[-64]+RC[-68]+RC[-72] -> 39 | BY9: =RC[-1]-RC[-2] -> 39
A10: Сторонние внутренние | B10: КА-Группа ГАЗ( Вьетнам) | E10: =RC[-1]-RC[-2] -> 0 | I10: =RC[-1]-RC[-2] -> 0 | M10: =RC[-1]-RC[-2] -> 0 | Q10: =RC[-1]-RC[-2] -> 0 | U10: =RC[-1]-RC[-2] -> 0 | Y10: =RC[-1]-RC[-2] -> 0 | AC10: =RC[-1]-RC[-2] -> 0 | AG10: =RC[-1]-RC[-2] -> 0 | AK10: =RC[-1]-RC[-2] -> 0 | AO10: =RC[-1]-RC[-2] -> 0 | AS10: =RC[-1]-RC[-2] -> 0 | AW10: =RC[-1]-RC[-2] -> 0 | BA10: =RC[-1]-RC[-2] -> 0 | BE10: =RC[-1]-RC[-2] -> 0 | BI10: =RC[-1]-RC[-2] -> 0 | BM10: =RC[-1]-RC[-2] -> 0 | BQ10: =RC[-1]-RC[-2] -> 0 | BU10: =RC[-1]-RC[-2] -> 0 | BW10: =RC[-4]+RC[-8]+RC[-12]+RC[-16]+RC[-20]+RC[-24]+RC[-28]+RC[-32]+RC[-36]+RC[-40]+RC[-44]+RC[-48]+RC[-52]+RC[-56]+RC[-60]+RC[-64]+RC[-68]+RC[-72] -> 0 | BX10: =RC[-4]+RC[-8]+RC[-12]+RC[-16]+RC[-20]+RC[-24]+RC[-28]+RC[-32]+RC[-36]+RC[-40]+RC[-44]+RC[-48]+RC[-52]+RC[-56]+RC[-60]+RC[-64]+RC[-68]+RC[-72] -> 0 | BY10: =RC[-1]-RC[-2] -> 0
B11: Платформа А | E11: =RC[-1]-RC[-2] -> 0 | I11: =RC[-1]-RC[-2] -> 0 | M11: =RC[-1]-RC[-2] -> 0 | Q11: =RC[-1]-RC[-2] -> 0 | U11: =RC[-1]-RC[-2] -> 0 | Y11: =RC[-1]-RC[-2] -> 0 | AC11: =RC[-1]-RC[-2] -> 0 | AG11: =RC[-1]-RC[-2] -> 0 | AK11: =RC[-1]-RC[-2] -> 0 | AO11: =RC[-1]-RC[-2] -> 0 | AS11: =RC[-1]-RC[-2] -> 0 | AW11: =RC[-1]-RC[-2] -> 0 | BA11: =RC[-1]-RC[-2] -> 0 | BE11: =RC[-1]-RC[-2] -> 0 | BI11: =RC[-1]-RC[-2] -> 0 | BM11: =RC[-1]-RC[-2] -> 0 | BQ11: =RC[-1]-RC[-2] -> 0 | BU11: =RC[-1]-RC[-2] -> 0 | BW11: =RC[-4]+RC[-8]+RC[-12]+RC[-16]+RC[-20]+RC[-24]+RC[-28]+RC[-32]+RC[-36]+RC[-40]+RC[-44]+RC[-48]+RC[-52]+RC[-56]+RC[-60]+RC[-64]+RC[-68]+RC[-72] -> 0 | BX11: =RC[-4]+RC[-8]+RC[-12]+RC[-16]+RC[-20]+RC[-24]+RC[-28]+RC[-32]+RC[-36]+RC[-40]+RC[-44]+RC[-48]+RC[-52]+RC[-56]+RC[-60]+RC[-64]+RC[-68]+RC[-72] -> 0 | BY11: =RC[-1]-RC[-2] -> 0
A12: Сторонние внешние | B12: АО "ГОТХ" | C12: 9 | D12: 68 | E12: =RC[-1]-RC[-2] -> 59 | G12: 8 | H12: 43 | I12: =RC[-1]-RC[-2] -> 35 | K12: 8 | L12: 34 | M12: =RC[-1]-RC[-2] -> 26 | O12: 10 | P12: 33 | Q12: =RC[-1]-RC[-2] -> 23 | S12: 8 | U12: =RC[-1]-RC[-2] -> -8 | W12: 8 | X12: 25 | Y12: =RC[-1]-RC[-2] -> 17 | AA12: 8 | AB12: 53 | AC12: =RC[-1]-RC[-2] -> 45 | AE12: 8 | AF12: 26 | AG12: =RC[-1]-RC[-2] -> 18 | AI12: 9 | AJ12: 8 | AK12: =RC[-1]-RC[-2] -> -1 | AM12: 8 | AN12: 6 | AO12: =RC[-1]-RC[-2] -> -2 | AQ12: 8 | AS12: =RC[-1]-RC[-2] -> -8 | AU12: 8 | AW12: =RC[-1]-RC[-2] -> -8 | AY12: 8 | BA12: =RC[-1]-RC[-2] -> -8 | BC12: 10 | BE12: =RC[-1]-RC[-2] -> -10 | BG12: 8 | BI12: =RC[-1]-RC[-2] -> -8 | BK12: 8 | BM12: =RC[-1]-RC[-2] -> -8 | BO12: 8 | BQ12: =RC[-1]-RC[-2] -> -8 | BS12: 8 | BU12: =RC[-1]-RC[-2] -> -8 | BW12: =RC[-4]+RC[-8]+RC[-12]+RC[-16]+RC[-20]+RC[-24]+RC[-28]+RC[-32]+RC[-36]+RC[-40]+RC[-44]+RC[-48]+RC[-52]+RC[-56]+RC[-60]+RC[-64]+RC[-68]+RC[-72] -> 150 | BX12: =RC[-4]+RC[-8]+RC[-12]+RC[-16]+RC[-20]+RC[-24]+RC[-28]+RC[-32]+RC[-36]+RC[-40]+RC[-44]+RC[-48]+RC[-52]+RC[-56]+RC[-60]+RC[-64]+RC[-68]+RC[-72] -> 296 | BY12: =RC[-1]-RC[-2] -> 146
B13: ООО "Нерудные материалы-НН" | E13: =RC[-1]-RC[-2] -> 0 | I13: =RC[-1]-RC[-2] -> 0 | M13: =RC[-1]-RC[-2] -> 0 | P13: 6 | Q13: =RC[-1]-RC[-2] -> 6 | U13: =RC[-1]-RC[-2] -> 0 | X13: 9 | Y13: =RC[-1]-RC[-2] -> 9 | AB13: 5 | AC13: =RC[-1]-RC[-2] -> 5 | AF13: 7 | AG13: =RC[-1]-RC[-2] -> 7 | AJ13: 9 | AK13: =RC[-1]-RC[-2] -> 9 | AN13: 9 | AO13: =RC[-1]-RC[-2] -> 9 | AS13: =RC[-1]-RC[-2] -> 0 | AW13: =RC[-1]-RC[-2] -> 0 | BA13: =RC[-1]-RC[-2] -> 0 | BE13: =RC[-1]-RC[-2] -> 0 | BI13: =RC[-1]-RC[-2] -> 0 | BM13: =RC[-1]-RC[-2] -> 0 | BQ13: =RC[-1]-RC[-2] -> 0 | BU13: =RC[-1]-RC[-2] -> 0 | BW13: =RC[-4]+RC[-8]+RC[-12]+RC[-16]+RC[-20]+RC[-24]+RC[-28]+RC[-32]+RC[-36]+RC[-40]+RC[-44]+RC[-48]+RC[-52]+RC[-56]+RC[-60]+RC[-64]+RC[-68]+RC[-72] -> 0 | BX13: =RC[-4]+RC[-8]+RC[-12]+RC[-16]+RC[-20]+RC[-24]+RC[-28]+RC[-32]+RC[-36]+RC[-40]+RC[-44]+RC[-48]+RC[-52]+RC[-56]+RC[-60]+RC[-64]+RC[-68]+RC[-72] -> 45 | BY13: =RC[-1]-RC[-2] -> 45
B14: ПК НВМ (ООО "Профит") | D14: 7 | E14: =RC[-1]-RC[-2] -> 7 | I14: =RC[-1]-RC[-2] -> 0 | M14: =RC[-1]-RC[-2] -> 0 | O14: 5 | P14: 4 | Q14: =RC[-1]-RC[-2] -> -1 | T14: 3 | U14: =RC[-1]-RC[-2] -> 3 | W14: 3 | X14: 1 | Y14: =RC[-1]-RC[-2] -> -2 | AB14: 3 | AC14: =RC[-1]-RC[-2] -> 3 | AE14: 2 | AF14: 2 | AG14: =RC[-1]-RC[-2] -> 0 | AI14: 5 | AJ14: 5 | AK14: =RC[-1]-RC[-2] -> 0 | AO14: =RC[-1]-RC[-2] -> 0 | AQ14: 3 | AS14: =RC[-1]-RC[-2] -> -3 | AW14: =RC[-1]-RC[-2] -> 0 | AY14: 2 | BA14: =RC[-1]-RC[-2] -> -2 | BC14: 3 | BE14: =RC[-1]-RC[-2] -> -3 | BI14: =RC[-1]-RC[-2] -> 0 | BK14: 2 | BM14: =RC[-1]-RC[-2] -> -2 | BQ14: 0 | BU14: =RC[-1]-RC[-2] -> 0 | BW14: =RC[-4]+RC[-8]+RC[-12]+RC[-16]+RC[-20]+RC[-24]+RC[-28]+RC[-32]+RC[-36]+RC[-40]+RC[-44]+RC[-48]+RC[-52]+RC[-56]+RC[-60]+RC[-64]+RC[-68]+RC[-72] -> 25 | BX14: =RC[-4]+RC[-8]+RC[-12]+RC[-16]+RC[-20]+RC[-24]+RC[-28]+RC[-32]+RC[-36]+RC[-40]+RC[-44]+RC[-48]+RC[-52]+RC[-56]+RC[-60]+RC[-64]+RC[-68]+RC[-72] -> 25 | BY14: =RC[-1]-RC[-2] -> 0
B15: ООО "ИнтерметГрупп" | E15: =RC[-1]-RC[-2] -> 0 | I15: =RC[-1]-RC[-2] -> 0 | M15: =RC[-1]-RC[-2] -> 0 | O15: 1 | P15: 3 | Q15: =RC[-1]-RC[-2] -> 2 | S15: 1 | U15: =RC[-1]-RC[-2] -> -1 | W15: 1 | Y15: =RC[-1]-RC[-2] -> -1 | AA15: 1 | AC15: =RC[-1]-RC[-2] -> -1 | AE15: 1 | AF15: 2 | AG15: =RC[-1]-RC[-2] -> 1 | AI15: 1 | AK15: =RC[-1]-RC[-2] -> -1 | AM15: 1 | AO15: =RC[-1]-RC[-2] -> -1 | AQ15: 1 | AS15: =RC[-1]-RC[-2] -> -1 | AU15: 1 | AW15: =RC[-1]-RC[-2] -> -1 | AY15: 1 | BA15: =RC[-1]-RC[-2] -> -1 | BC15: 1 | BE15: =RC[-1]-RC[-2] -> -1 | BG15: 1 | BI15: =RC[-1]-RC[-2] -> -1 | BK15: 1 | BM15: =RC[-1]-RC[-2] -> -1 | BO15: 1 | BQ15: =RC[-1]-RC[-2] -> -1 | BS15: 1 | BU15: =RC[-1]-RC[-2] -> -1 | BW15: =RC[-4]+RC[-8]+RC[-12]+RC[-16]+RC[-20]+RC[-24]+RC[-28]+RC[-32]+RC[-36]+RC[-40]+RC[-44]+RC[-48]+RC[-52]+RC[-56]+RC[-60]+RC[-64]+RC[-68]+RC[-72] -> 15 | BX15: =RC[-4]+RC[-8]+RC[-12]+RC[-16]+RC[-20]+RC[-24]+RC[-28]+RC[-32]+RC[-36]+RC[-40]+RC[-44]+RC[-48]+RC[-52]+RC[-56]+RC[-60]+RC[-64]+RC[-68]+RC[-72] -> 5 | BY15: =RC[-1]-RC[-2] -> -10
B16: Прочие | D16: 1 | E16: =RC[-1]-RC[-2] -> 1 | I16: =RC[-1]-RC[-2] -> 0 | M16: =RC[-1]-RC[-2] -> 0 | P16: 2 | Q16: =RC[-1]-RC[-2] -> 2 | S16: 1 | U16: =RC[-1]-RC[-2] -> -1 | W16: 1 | Y16: =RC[-1]-RC[-2] -> -1 | AA16: 1 | AB16: 1 | AC16: =RC[-1]-RC[-2] -> 0 | AE16: 1 | AF16: 6 | AG16: =RC[-1]-RC[-2] -> 5 | AI16: 1 | AK16: =RC[-1]-RC[-2] -> -1 | AM16: 1 | AO16: =RC[-1]-RC[-2] -> -1 | AS16: =RC[-1]-RC[-2] -> 0 | AU16: 1 | AW16: =RC[-1]-RC[-2] -> -1 | AY16: 1 | BA16: =RC[-1]-RC[-2] -> -1 | BC16: 1 | BE16: =RC[-1]-RC[-2] -> -1 | BG16: 1 | BI16: =RC[-1]-RC[-2] -> -1 | BK16: 1 | BM16: =RC[-1]-RC[-2] -> -1 | BO16: 1 | BQ16: =RC[-1]-RC[-2] -> -1 | BU16: =RC[-1]-RC[-2] -> 0 | BW16: =RC[-4]+RC[-8]+RC[-12]+RC[-16]+RC[-20]+RC[-24]+RC[-28]+RC[-32]+RC[-36]+RC[-40]+RC[-44]+RC[-48]+RC[-52]+RC[-56]+RC[-60]+RC[-64]+RC[-68]+RC[-72] -> 12 | BX16: =RC[-4]+RC[-8]+RC[-12]+RC[-16]+RC[-20]+RC[-24]+RC[-28]+RC[-32]+RC[-36]+RC[-40]+RC[-44]+RC[-48]+RC[-52]+RC[-56]+RC[-60]+RC[-64]+RC[-68]+RC[-72] -> 10 | BY16: =RC[-1]-RC[-2] -> -2
A17: ИТОГО за день: | C17: =SUM(R[-14]C:R[-1]C) -> 20 | D17: =SUM(R[-14]C:R[-1]C) -> 85 | E17: =RC[-1]-RC[-2] -> 65 | G17: =SUM(R[-14]C:R[-1]C) -> 18 | H17: =SUM(R[-14]C:R[-1]C) -> 54 | I17: =RC[-1]-RC[-2] -> 36 | K17: =SUM(R[-14]C:R[-1]C) -> 18 | L17: =SUM(R[-14]C:R[-1]C) -> 43 | M17: =RC[-1]-RC[-2] -> 25 | O17: =SUM(R[-14]C:R[-1]C) -> 27 | P17: =SUM(R[-14]C:R[-1]C) -> 83 | Q17: =RC[-1]-RC[-2] -> 56 | S17: =SUM(R[-14]C:R[-1]C) -> 22 | T17: =SUM(R[-14]C:R[-1]C) -> 15 | U17: =RC[-1]-RC[-2] -> -7 | W17: =SUM(R[-14]C:R[-1]C) -> 25 | X17: =SUM(R[-14]C:R[-1]C) -> 41 | Y17: =RC[-1]-RC[-2] -> 16 | AA17: =SUM(R[-14]C:R[-1]C) -> 21 | AB17: =SUM(R[-14]C:R[-1]C) -> 66 | AC17: =RC[-1]-RC[-2] -> 45 | AE17: =SUM(R[-14]C:R[-1]C) -> 23 | AF17: =SUM(R[-14]C:R[-1]C) -> 53 | AG17: =RC[-1]-RC[-2] -> 30 | AI17: =SUM(R[-14]C:R[-1]C) -> 29 | AJ17: =SUM(R[-14]C:R[-1]C) -> 36 | AK17: =RC[-1]-RC[-2] -> 7 | AM17: =SUM(R[-14]C:R[-1]C) -> 22 | AN17: =SUM(R[-14]C:R[-1]C) -> 26 | AO17: =RC[-1]-RC[-2] -> 4 | AQ17: =SUM(R[-14]C:R[-1]C) -> 23 | AR17: =SUM(R[-14]C:R[-1]C) -> 0 | AS17: =RC[-1]-RC[-2] -> -23 | AU17: =SUM(R[-14]C:R[-1]C) -> 21 | AV17: =SUM(R[-14]C:R[-1]C) -> 0 | AW17: =RC[-1]-RC[-2] -> -21 | AY17: =SUM(R[-14]C:R[-1]C) -> 22 | AZ17: =SUM(R[-14]C:R[-1]C) -> 0 | BA17: =RC[-1]-RC[-2] -> -22 | BC17: =SUM(R[-14]C:R[-1]C) -> 28 | BD17: =SUM(R[-14]C:R[-1]C) -> 0 | BE17: =RC[-1]-RC[-2] -> -28 | BG17: =SUM(R[-14]C:R[-1]C) -> 22 | BH17: =SUM(R[-14]C:R[-1]C) -> 0 | BI17: =RC[-1]-RC[-2] -> -22 | BK17: =SUM(R[-14]C:R[-1]C) -> 23 | BL17: =SUM(R[-14]C:R[-1]C) -> 0 | BM17: =RC[-1]-RC[-2] -> -23 | BO17: =SUM(R[-14]C:R[-1]C) -> 21 | BP17: =SUM(R[-14]C:R[-1]C) -> 0 | BQ17: =RC[-1]-RC[-2] -> -21 | BS17: =SUM(R[-14]C:R[-1]C) -> 20 | BT17: =SUM(R[-14]C:R[-1]C) -> 0 | BU17: =RC[-1]-RC[-2] -> -20 | BW17: =RC[-4]+RC[-8]+RC[-12]+RC[-16]+RC[-20]+RC[-24]+RC[-28]+RC[-32]+RC[-36]+RC[-40]+RC[-44]+RC[-48]+RC[-52]+RC[-56]+RC[-60]+RC[-64]+RC[-68]+RC[-72] -> 405 | BX17: =RC[-4]+RC[-8]+RC[-12]+RC[-16]+RC[-20]+RC[-24]+RC[-28]+RC[-32]+RC[-36]+RC[-40]+RC[-44]+RC[-48]+RC[-52]+RC[-56]+RC[-60]+RC[-64]+RC[-68]+RC[-72] -> 502 | BY17: =RC[-1]-RC[-2] -> 97
A18: Эксплуатируемый парк локомотивов: | C18: 2 | D18: 2 | E18: =RC[-1]-RC[-2] -> 0 | G18: 2 | H18: 2 | I18: =RC[-1]-RC[-2] -> 0 | K18: 2 | M18: =RC[-1]-RC[-2] -> -2 | N18: 2 | O18: 2 | P18: 3.75 | Q18: =RC[-1]-RC[-2] -> 1.75 | S18: 2 | T18: 3.75 | U18: =RC[-1]-RC[-2] -> 1.75 | W18: 2 | X18: 2 | Y18: =RC[-1]-RC[-2] -> 0 | AA18: 2 | AB18: 2 | AC18: =RC[-1]-RC[-2] -> 0 | AE18: 2 | AF18: 2 | AG18: =RC[-1]-RC[-2] -> 0 | AI18: 2 | AJ18: 2 | AK18: =RC[-1]-RC[-2] -> 0 | AM18: 2 | AN18: 2 | AO18: =RC[-1]-RC[-2] -> 0 | AQ18: 2 | AS18: =RC[-1]-RC[-2] -> -2 | AU18: 2 | AW18: =RC[-1]-RC[-2] -> -2 | AY18: 2 | BA18: =RC[-1]-RC[-2] -> -2 | BC18: 2 | BE18: =RC[-1]-RC[-2] -> -2 | BG18: 2 | BI18: =RC[-1]-RC[-2] -> -2 | BK18: 2 | BM18: =RC[-1]-RC[-2] -> -2 | BO18: 2 | BQ18: =RC[-1]-RC[-2] -> -2 | BS18: 2 | BT18: 0 | BU18: =RC[-1]-RC[-2] -> -2 | BW18: =AVERAGE(RC[-4], RC[-8], RC[-12], RC[-16], RC[-20], RC[-24], RC[-28], RC[-32], RC[-36], RC[-40], RC[-44], RC[-48], RC[-52], RC[-56], RC[-60], RC[-64], RC[-68],RC[-72]) -> 2 | BX18: =AVERAGE(RC[-4], RC[-8], RC[-12], RC[-16], RC[-20], RC[-24], RC[-28], RC[-32], RC[-36], RC[-40], RC[-44], RC[-48], RC[-52], RC[-56], RC[-60], RC[-64], RC[-68],RC[-72]) -> 2.15 | BY18: =RC[-1]-RC[-2] -> 0.14999999999999991
A19: * - причины отклонения
A22: 1. | B22: Погодные условия
A23: 2. | B23: Отсутствие четкого планирования со стороны клиента
A24: 3. | B24: Запрет на отправление со стороны ОАО "РЖД"
A25: 4. | B25: Снятие запрета на отправление со стороны ОАО "РЖД"
A26: 5. | B26: Отсутствие заготовки перевозочных документов в АС ЭТРАН
A27: 6. | B27: Появление заготовки перевозочных документов в АС ЭТРАН
A28: 7. | B28: Наличие заявки на обработку со стороны клиента на большее кол-во вагонов
A29: 8. | B29: Заключение договора на подачу/уборку вагонов с новым клиентом
A30: 9. | B30: Вагоны не готовы к уборке с грузового фронта по вине клиента
A33: 1. | B33: Переработано вагонов более заявленного кол-ва
A34: 2. | B34: Наличие аварийной заявки на обработку от клиента
A35: 3. | B35: Внутренняя работа (работа с путевой техникой, обработка депо и др.)
A36: 4. | B36: Испытание локомобиля
A37: 5. | B37: Отказ от заявки на обработку грузового фронта от клиента
A39: хранить год

Sheet: июнь
A1: Число | C1: 2 | G1: 3 | K1: 4 | O1: 5 | S1: 6 | W1: 9 | AA1: 10 | AE1: 11 | AI1: 16 | AM1: 17 | AQ1: 18 | AU1: 19 | AY1: 20 | BC1: 23 | BG1: 24 | BK1: 25 | BO1: 26 | BS1: 27 | BW1: 30 | CA1: Итого
A2: Клиенты | C2: план | D2: факт | E2: откл-е | F2: * | G2: план | H2: факт | I2: откл-е | J2: * | K2: план | L2: факт | M2: откл-е | N2: * | O2: план | P2: факт | Q2: откл-е | R2: * | S2: план | T2: факт | U2: откл-е | V2: * | W2: план | X2: факт | Y2: откл-е | Z2: * | AA2: план | AB2: факт | AC2: откл-е | AD2: * | AE2: план | AF2: факт | AG2: откл-е | AH2: * | AI2: план | AJ2: факт | AK2: откл-е | AL2: * | AM2: план | AN2: факт | AO2: откл-е | AP2: * | AQ2: план | AR2: факт | AS2: откл-е | AT2: * | AU2: план | AV2: факт | AW2: откл-е | AX2: * | AY2: план | AZ2: факт | BA2: откл-е | BB2: * | BC2: план | BD2: факт | BE2: откл-е | BF2: * | BG2: план | BH2: факт | BI2: откл-е | BJ2: * | BK2: план | BL2: факт | BM2: откл-е | BN2: * | BO2: план | BP2: факт | BQ2: откл-е | BR2: * | BS2: план | BT2: факт | BU2: откл-е | BV2: * | BW2: план | BX2: факт | BY2: откл-е | BZ2: * | CA2: план | CB2: факт | CC2: откл-е
A3: БЕ ООО "НАК" | B3: ЛЗ | E3: =RC[-1]-RC[-2] -> 0 | I3: =RC[-1]-RC[-2] -> 0 | M3: =RC[-1]-RC[-2] -> 0 | Q3: =RC[-1]-RC[-2] -> 0 | U3: =RC[-1]-RC[-2] -> 0 | Y3: =RC[-1]-RC[-2] -> 0 | AC3: =RC[-1]-RC[-2] -> 0 | AG3: =RC[-1]-RC[-2] -> 0 | AK3: =RC[-1]-RC[-2] -> 0 | AO3: =RC[-1]-RC[-2] -> 0 | AS3: =RC[-1]-RC[-2] -> 0 | AW3: =RC[-1]-RC[-2] -> 0 | BA3: =RC[-1]-RC[-2] -> 0 | BE3: =RC[-1]-RC[-2] -> 0 | BI3: =RC[-1]-RC[-2] -> 0 | BM3: =RC[-1]-RC[-2] -> 0 | BQ3: =RC[-1]-RC[-2] -> 0 | BU3: =RC[-1]-RC[-2] -> 0 | BY3: =RC[-1]-RC[-2] -> 0 | CA3: =RC[-4]+RC[-8]+RC[-12]+RC[-16]+RC[-20]+RC[-24]+RC[-28]+RC[-32]+RC[-36]+RC[-40]+RC[-44]+RC[-48]+RC[-52]+RC[-56]+RC[-60]+RC[-64]+RC[-68]+RC[-72]+RC[-76] -> 0 | CB3: =RC[-4]+RC[-8]+RC[-12]+RC[-16]+RC[-20]+RC[-24]+RC[-28]+RC[-32]+RC[-36]+RC[-40]+RC[-44]+#REF!+#REF!+RC[-48]+RC[-52]+RC[-56]+RC[-60]+RC[-64]+RC[-68]+RC[-72]+RC[-76]+#REF! -> #REF! | CC3: =RC[-1]-RC[-2] -> #REF!
B4: ПРЗ | E4: =RC[-1]-RC[-2] -> 0 | I4: =RC[-1]-RC[-2] -> 0 | M4: =RC[-1]-RC[-2] -> 0 | Q4: =RC[-1]-RC[-2] -> 0 | U4: =RC[-1]-RC[-2] -> 0 | Y4: =RC[-1]-RC[-2] -> 0 | AC4: =RC[-1]-RC[-2] -> 0 | AG4: =RC[-1]-RC[-2] -> 0 | AK4: =RC[-1]-RC[-2] -> 0 | AO4: =RC[-1]-RC[-2] -> 0 | AS4: =RC[-1]-RC[-2] -> 0 | AW4: =RC[-1]-RC[-2] -> 0 | BA4: =RC[-1]-RC[-2] -> 0 | BE4: =RC[-1]-RC[-2] -> 0 | BI4: =RC[-1]-RC[-2] -> 0 | BM4: =RC[-1]-RC[-2] -> 0 | BQ4: =RC[-1]-RC[-2] -> 0 | BU4: =RC[-1]-RC[-2] -> 0 | BY4: =RC[-1]-RC[-2] -> 0 | CA4: =RC[-4]+RC[-8]+RC[-12]+RC[-16]+RC[-20]+RC[-24]+RC[-28]+RC[-32]+RC[-36]+RC[-40]+RC[-44]+RC[-48]+RC[-52]+RC[-56]+RC[-60]+RC[-64]+RC[-68]+RC[-72]+RC[-76] -> 0 | CB4: =RC[-4]+RC[-8]+RC[-12]+RC[-16]+RC[-20]+RC[-24]+RC[-28]+RC[-32]+RC[-36]+RC[-40]+RC[-44]+#REF!+#REF!+RC[-48]+RC[-52]+RC[-56]+RC[-60]+RC[-64]+RC[-68]+RC[-72]+RC[-76]+#REF! -> #REF! | CC4: =RC[-1]-RC[-2] -> #REF!
A5: ООО "НАК" | B5: ЗШП | E5: =RC[-1]-RC[-2] -> 0 | I5: =RC[-1]-RC[-2] -> 0 | M5: =RC[-1]-RC[-2] -> 0 | Q5: =RC[-1]-RC[-2] -> 0 | U5: =RC[-1]-RC[-2] -> 0 | Y5: =RC[-1]-RC[-2] -> 0 | AC5: =RC[-1]-RC[-2] -> 0 | AG5: =RC[-1]-RC[-2] -> 0 | AK5: =RC[-1]-RC[-2] -> 0 | AO5: =RC[-1]-RC[-2] -> 0 | AS5: =RC[-1]-RC[-2] -> 0 | AW5: =RC[-1]-RC[-2] -> 0 | BA5: =RC[-1]-RC[-2] -> 0 | BE5: =RC[-1]-RC[-2] -> 0 | BI5: =RC[-1]-RC[-2] -> 0 | BM5: =RC[-1]-RC[-2] -> 0 | BQ5: =RC[-1]-RC[-2] -> 0 | BU5: =RC[-1]-RC[-2] -> 0 | BY5: =RC[-1]-RC[-2] -> 0 | CA5: =RC[-4]+RC[-8]+RC[-12]+RC[-16]+RC[-20]+RC[-24]+RC[-28]+RC[-32]+RC[-36]+RC[-40]+RC[-44]+RC[-48]+RC[-52]+RC[-56]+RC[-60]+RC[-64]+RC[-68]+RC[-72]+RC[-76] -> 0 | CB5: =RC[-4]+RC[-8]+RC[-12]+RC[-16]+RC[-20]+RC[-24]+RC[-28]+RC[-32]+RC[-36]+RC[-40]+RC[-44]+#REF!+#REF!+RC[-48]+RC[-52]+RC[-56]+RC[-60]+RC[-64]+RC[-68]+RC[-72]+RC[-76]+#REF! -> #REF! | CC5: =RC[-1]-RC[-2] -> #REF!
B6: НАК | C6: 12 | E6: =RC[-1]-RC[-2] -> -12 | G6: 11 | I6: =RC[-1]-RC[-2] -> -11 | K6: 12 | M6: =RC[-1]-RC[-2] -> -12 | O6: 12 | Q6: =RC[-1]-RC[-2] -> -12 | S6: 12 | U6: =RC[-1]-RC[-2] -> -12 | W6: 12 | Y6: =RC[-1]-RC[-2] -> -12 | AA6: 10 | AC6: =RC[-1]-RC[-2] -> -10 | AE6: 11 | AG6: =RC[-1]-RC[-2] -> -11 | AI6: 10 | AK6: =RC[-1]-RC[-2] -> -10 | AM6: 10 | AO6: =RC[-1]-RC[-2] -> -10 | AQ6: 10 | AS6: =RC[-1]-RC[-2] -> -10 | AU6: 11 | AW6: =RC[-1]-RC[-2] -> -11 | AY6: 10 | BA6: =RC[-1]-RC[-2] -> -10 | BC6: 10 | BE6: =RC[-1]-RC[-2] -> -10 | BG6: 12 | BI6: =RC[-1]-RC[-2] -> -12 | BK6: 12 | BM6: =RC[-1]-RC[-2] -> -12 | BO6: 10 | BQ6: =RC[-1]-RC[-2] -> -10 | BS6: 10 | BU6: =RC[-1]-RC[-2] -> -10 | BW6: 10 | BY6: =RC[-1]-RC[-2] -> -10 | CA6: =SUM(RC[-4]+RC[-8]+RC[-12]+RC[-16]+RC[-20]+RC[-24]+RC[-28]+RC[-32]+RC[-36]+RC[-44]+RC[-48]+RC[-52]+RC[-56]+RC[-60]+RC[-64]+RC[-68]+RC[-72]+RC[-76]) -> 197 | CB6: =RC[-4]+RC[-8]+RC[-12]+RC[-16]+RC[-20]+RC[-24]+RC[-28]+RC[-32]+RC[-36]+RC[-40]+RC[-44]+#REF!+#REF!+RC[-48]+RC[-52]+RC[-56]+RC[-60]+RC[-64]+RC[-68]+RC[-72]+RC[-76]+#REF! -> #REF! | CC6: =RC[-1]-RC[-2] -> #REF!
B7: НЛЗ | E7: =RC[-1]-RC[-2] -> 0 | I7: =RC[-1]-RC[-2] -> 0 | M7: =RC[-1]-RC[-2] -> 0 | Q7: =RC[-1]-RC[-2] -> 0 | U7: =RC[-1]-RC[-2] -> 0 | Y7: =RC[-1]-RC[-2] -> 0 | AC7: =RC[-1]-RC[-2] -> 0 | AG7: =RC[-1]-RC[-2] -> 0 | AK7: =RC[-1]-RC[-2] -> 0 | AO7: =RC[-1]-RC[-2] -> 0 | AS7: =RC[-1]-RC[-2] -> 0 | AW7: =RC[-1]-RC[-2] -> 0 | BA7: =RC[-1]-RC[-2] -> 0 | BE7: =RC[-1]-RC[-2] -> 0 | BI7: =RC[-1]-RC[-2] -> 0 | BM7: =RC[-1]-RC[-2] -> 0 | BQ7: =RC[-1]-RC[-2] -> 0 | BU7: =RC[-1]-RC[-2] -> 0 | BY7: =RC[-1]-RC[-2] -> 0 | CA7: =RC[-4]+RC[-8]+RC[-12]+RC[-16]+RC[-20]+RC[-24]+RC[-28]+RC[-32]+RC[-36]+RC[-40]+RC[-44]+RC[-48]+RC[-52]+RC[-56]+RC[-60]+RC[-64]+RC[-68]+RC[-72]+RC[-76] -> 0 | CB7: =RC[-4]+RC[-8]+RC[-12]+RC[-16]+RC[-20]+RC[-24]+RC[-28]+RC[-32]+RC[-36]+RC[-40]+RC[-44]+#REF!+#REF!+RC[-48]+RC[-52]+RC[-56]+RC[-60]+RC[-64]+RC[-68]+RC[-72]+RC[-76]+#REF! -> #REF! | CC7: =RC[-1]-RC[-2] -> #REF!
A8: ООО "НАЗ", АО "НГА" | B8: АЗ "НАЗ" | E8: =RC[-1]-RC[-2] -> 0 | I8: =RC[-1]-RC[-2] -> 0 | M8: =RC[-1]-RC[-2] -> 0 | Q8: =RC[-1]-RC[-2] -> 0 | U8: =RC[-1]-RC[-2] -> 0 | Y8: =RC[-1]-RC[-2] -> 0 | AC8: =RC[-1]-RC[-2] -> 0 | AG8: =RC[-1]-RC[-2] -> 0 | AK8: =RC[-1]-RC[-2] -> 0 | AO8: =RC[-1]-RC[-2] -> 0 | AS8: =RC[-1]-RC[-2] -> 0 | AW8: =RC[-1]-RC[-2] -> 0 | BA8: =RC[-1]-RC[-2] -> 0 | BE8: =RC[-1]-RC[-2] -> 0 | BI8: =RC[-1]-RC[-2] -> 0 | BM8: =RC[-1]-RC[-2] -> 0 | BQ8: =RC[-1]-RC[-2] -> 0 | BU8: =RC[-1]-RC[-2] -> 0 | BY8: =RC[-1]-RC[-2] -> 0 | CA8: =RC[-4]+RC[-8]+RC[-12]+RC[-16]+RC[-20]+RC[-24]+RC[-28]+RC[-32]+RC[-36]+RC[-40]+RC[-44]+RC[-48]+RC[-52]+RC[-56]+RC[-60]+RC[-64]+RC[-68]+RC[-72]+RC[-76] -> 0 | CB8: =RC[-4]+RC[-8]+RC[-12]+RC[-16]+RC[-20]+RC[-24]+RC[-28]+RC[-32]+RC[-36]+RC[-40]+RC[-44]+#REF!+#REF!+RC[-48]+RC[-52]+RC[-56]+RC[-60]+RC[-64]+RC[-68]+RC[-72]+RC[-76]+#REF! -> #REF! | CC8: =RC[-1]-RC[-2] -> #REF!
B9: АО "НГА" | E9: =RC[-1]-RC[-2] -> 0 | I9: =RC[-1]-RC[-2] -> 0 | M9: =RC[-1]-RC[-2] -> 0 | Q9: =RC[-1]-RC[-2] -> 0 | U9: =RC[-1]-RC[-2] -> 0 | Y9: =RC[-1]-RC[-2] -> 0 | AC9: =RC[-1]-RC[-2] -> 0 | AG9: =RC[-1]-RC[-2] -> 0 | AK9: =RC[-1]-RC[-2] -> 0 | AO9: =RC[-1]-RC[-2] -> 0 | AS9: =RC[-1]-RC[-2] -> 0 | AW9: =RC[-1]-RC[-2] -> 0 | BA9: =RC[-1]-RC[-2] -> 0 | BE9: =RC[-1]-RC[-2] -> 0 | BI9: =RC[-1]-RC[-2] -> 0 | BM9: =RC[-1]-RC[-2] -> 0 | BQ9: =RC[-1]-RC[-2] -> 0 | BU9: =RC[-1]-RC[-2] -> 0 | BY9: =RC[-1]-RC[-2] -> 0 | CA9: =RC[-4]+RC[-8]+RC[-12]+RC[-16]+RC[-20]+RC[-24]+RC[-28]+RC[-32]+RC[-36]+RC[-40]+RC[-44]+RC[-48]+RC[-52]+RC[-56]+RC[-60]+RC[-64]+RC[-68]+RC[-72]+RC[-76] -> 0 | CB9: =RC[-4]+RC[-8]+RC[-12]+RC[-16]+RC[-20]+RC[-24]+RC[-28]+RC[-32]+RC[-36]+RC[-40]+RC[-44]+#REF!+#REF!+RC[-48]+RC[-52]+RC[-56]+RC[-60]+RC[-64]+RC[-68]+RC[-72]+RC[-76]+#REF! -> #REF! | CC9: =RC[-1]-RC[-2] -> #REF!
A10: Сторонние внутренние | B10: КА-Группа ГАЗ( Вьетнам) | E10: =RC[-1]-RC[-2] -> 0 | I10: =RC[-1]-RC[-2] -> 0 | M10: =RC[-1]-RC[-2] -> 0 | Q10: =RC[-1]-RC[-2] -> 0 | U10: =RC[-1]-RC[-2] -> 0 | Y10: =RC[-1]-RC[-2] -> 0 | AC10: =RC[-1]-RC[-2] -> 0 | AG10: =RC[-1]-RC[-2] -> 0 | AK10: =RC[-1]-RC[-2] -> 0 | AO10: =RC[-1]-RC[-2] -> 0 | AS10: =RC[-1]-RC[-2] -> 0 | AW10: =RC[-1]-RC[-2] -> 0 | BA10: =RC[-1]-RC[-2] -> 0 | BE10: =RC[-1]-RC[-2] -> 0 | BI10: =RC[-1]-RC[-2] -> 0 | BM10: =RC[-1]-RC[-2] -> 0 | BQ10: =RC[-1]-RC[-2] -> 0 | BU10: =RC[-1]-RC[-2] -> 0 | BY10: =RC[-1]-RC[-2] -> 0 | CA10: =RC[-4]+RC[-8]+RC[-12]+RC[-16]+RC[-20]+RC[-24]+RC[-28]+RC[-32]+RC[-36]+RC[-40]+RC[-44]+RC[-48]+RC[-52]+RC[-56]+RC[-60]+RC[-64]+RC[-68]+RC[-72]+RC[-76] -> 0 | CB10: =RC[-4]+RC[-8]+RC[-12]+RC[-16]+RC[-20]+RC[-24]+RC[-28]+RC[-32]+RC[-36]+RC[-40]+RC[-44]+#REF!+#REF!+RC[-48]+RC[-52]+RC[-56]+RC[-60]+RC[-64]+RC[-68]+RC[-72]+RC[-76]+#REF! -> #REF! | CC10: =RC[-1]-RC[-2] -> #REF!
B11: Платформа А | E11: =RC[-1]-RC[-2] -> 0 | I11: =RC[-1]-RC[-2] -> 0 | M11: =RC[-1]-RC[-2] -> 0 | Q11: =RC[-1]-RC[-2] -> 0 | U11: =RC[-1]-RC[-2] -> 0 | Y11: =RC[-1]-RC[-2] -> 0 | AC11: =RC[-1]-RC[-2] -> 0 | AG11: =RC[-1]-RC[-2] -> 0 | AK11: =RC[-1]-RC[-2] -> 0 | AO11: =RC[-1]-RC[-2] -> 0 | AS11: =RC[-1]-RC[-2] -> 0 | AW11: =RC[-1]-RC[-2] -> 0 | BA11: =RC[-1]-RC[-2] -> 0 | BE11: =RC[-1]-RC[-2] -> 0 | BI11: =RC[-1]-RC[-2] -> 0 | BM11: =RC[-1]-RC[-2] -> 0 | BQ11: =RC[-1]-RC[-2] -> 0 | BU11: =RC[-1]-RC[-2] -> 0 | BY11: =RC[-1]-RC[-2] -> 0 | CA11: =RC[-4]+RC[-8]+RC[-12]+RC[-16]+RC[-20]+RC[-24]+RC[-28]+RC[-32]+RC[-36]+RC[-40]+RC[-44]+RC[-48]+RC[-52]+RC[-56]+RC[-60]+RC[-64]+RC[-68]+RC[-72]+RC[-76] -> 0 | CB11: =RC[-4]+RC[-8]+RC[-12]+RC[-16]+RC[-20]+RC[-24]+RC[-28]+RC[-32]+RC[-36]+RC[-40]+RC[-44]+#REF!+#REF!+RC[-48]+RC[-52]+RC[-56]+RC[-60]+RC[-64]+RC[-68]+RC[-72]+RC[-76]+#REF! -> #REF! | CC11: =RC[-1]-RC[-2] -> #REF!
A12: Сторонние внешние | B12: АО "ГОТХ" | C12: 8 | E12: =RC[-1]-RC[-2] -> -8 | G12: 8 | I12: =RC[-1]-RC[-2] -> -8 | K12: 8 | M12: =RC[-1]-RC[-2] -> -8 | O12: 8 | Q12: =RC[-1]-RC[-2] -> -8 | S12: 8 | U12: =RC[-1]-RC[-2] -> -8 | W12: 8 | Y12: =RC[-1]-RC[-2] -> -8 | AA12: 8 | AC12: =RC[-1]-RC[-2] -> -8 | AE12: 8 | AG12: =RC[-1]-RC[-2] -> -8 | AI12: 8 | AK12: =RC[-1]-RC[-2] -> -8 | AM12: 8 | AO12: =RC[-1]-RC[-2] -> -8 | AQ12: 8 | AS12: =RC[-1]-RC[-2] -> -8 | AU12: 8 | AW12: =RC[-1]-RC[-2] -> -8 | AY12: 8 | BA12: =RC[-1]-RC[-2] -> -8 | BC12: 8 | BE12: =RC[-1]-RC[-2] -> -8 | BG12: 8 | BI12: =RC[-1]-RC[-2] -> -8 | BK12: 6 | BM12: =RC[-1]-RC[-2] -> -6 | BO12: 8 | BQ12: =RC[-1]-RC[-2] -> -8 | BS12: 8 | BU12: =RC[-1]-RC[-2] -> -8 | BW12: 8 | BY12: =RC[-1]-RC[-2] -> -8 | CA12: =RC[-4]+RC[-8]+RC[-12]+RC[-16]+RC[-20]+RC[-24]+RC[-28]+RC[-32]+RC[-36]+RC[-40]+RC[-44]+RC[-48]+RC[-52]+RC[-56]+RC[-60]+RC[-64]+RC[-68]+RC[-72]+RC[-76] -> 150 | CB12: =RC[-4]+RC[-8]+RC[-12]+RC[-16]+RC[-20]+RC[-24]+RC[-28]+RC[-32]+RC[-36]+RC[-40]+RC[-44]+#REF!+#REF!+RC[-48]+RC[-52]+RC[-56]+RC[-60]+RC[-64]+RC[-68]+RC[-72]+RC[-76]+#REF! -> #REF! | CC12: =RC[-1]-RC[-2] -> #REF!
B13: ООО "Нерудные материалы-НН" | C13: 8 | E13: =RC[-1]-RC[-2] -> -8 | G13: 0 | I13: =RC[-1]-RC[-2] -> 0 | K13: 16 | M13: =RC[-1]-RC[-2] -> -16 | O13: 0 | Q13: =RC[-1]-RC[-2] -> 0 | S13: 0 | U13: =RC[-1]-RC[-2] -> 0 | W13: 0 | Y13: =RC[-1]-RC[-2] -> 0 | AA13: 8 | AC13: =RC[-1]-RC[-2] -> -8 | AE13: 0 | AG13: =RC[-1]-RC[-2] -> 0 | AI13: 0 | AK13: =RC[-1]-RC[-2] -> 0 | AM13: 8 | AO13: =RC[-1]-RC[-2] -> -8 | AQ13: 0 | AS13: =RC[-1]-RC[-2] -> 0 | AU13: 0 | AW13: =RC[-1]-RC[-2] -> 0 | AY13: 0 | BA13: =RC[-1]-RC[-2] -> 0 | BC13: 0 | BE13: =RC[-1]-RC[-2] -> 0 | BG13: 16 | BI13: =RC[-1]-RC[-2] -> -16 | BK13: 0 | BM13: =RC[-1]-RC[-2] -> 0 | BO13: 0 | BQ13: =RC[-1]-RC[-2] -> 0 | BS13: 8 | BU13: =RC[-1]-RC[-2] -> -8 | BW13: 0 | BY13: =RC[-1]-RC[-2] -> 0 | CA13: =RC[-4]+RC[-8]+RC[-12]+RC[-16]+RC[-20]+RC[-24]+RC[-28]+RC[-32]+RC[-36]+RC[-40]+RC[-44]+RC[-48]+RC[-52]+RC[-56]+RC[-60]+RC[-64]+RC[-68]+RC[-72]+RC[-76] -> 64 | CB13: =RC[-4]+RC[-8]+RC[-12]+RC[-16]+RC[-20]+RC[-24]+RC[-28]+RC[-32]+RC[-36]+RC[-40]+RC[-44]+#REF!+#REF!+RC[-48]+RC[-52]+RC[-56]+RC[-60]+RC[-64]+RC[-68]+RC[-72]+RC[-76]+#REF! -> #REF! | CC13: =RC[-1]-RC[-2] -> #REF!
B14: ПК НВМ (ООО "Профит") | C14: 3 | E14: =RC[-1]-RC[-2] -> -3 | G14: 3 | I14: =RC[-1]-RC[-2] -> -3 | K14: 4 | M14: =RC[-1]-RC[-2] -> -4 | O14: 4 | Q14: =RC[-1]-RC[-2] -> -4 | S14: 4 | U14: =RC[-1]-RC[-2] -> -4 | W14: 4 | Y14: =RC[-1]-RC[-2] -> -4 | AA14: 4 | AC14: =RC[-1]-RC[-2] -> -4 | AE14: 4 | AG14: =RC[-1]-RC[-2] -> -4 | AI14: 4 | AK14: =RC[-1]-RC[-2] -> -4 | AM14: 4 | AO14: =RC[-1]-RC[-2] -> -4 | AQ14: 4 | AS14: =RC[-1]-RC[-2] -> -4 | AU14: 4 | AW14: =RC[-1]-RC[-2] -> -4 | AZ14: 4 | BA14: =RC[-1]-RC[-2] -> 4 | BC14: 4 | BE14: =RC[-1]-RC[-2] -> -4 | BG14: 4 | BI14: =RC[-1]-RC[-2] -> -4 | BK14: 4 | BM14: =RC[-1]-RC[-2] -> -4 | BO14: 4 | BQ14: =RC[-1]-RC[-2] -> -4 | BS14: 4 | BU14: =RC[-1]-RC[-2] -> -4 | BW14: 4 | BY14: =RC[-1]-RC[-2] -> -4 | CA14: =RC[-4]+RC[-8]+RC[-12]+RC[-16]+RC[-20]+RC[-24]+RC[-28]+RC[-32]+RC[-36]+RC[-40]+RC[-44]+RC[-48]+RC[-52]+RC[-56]+RC[-60]+RC[-64]+RC[-68]+RC[-72]+RC[-76] -> 70 | CB14: =RC[-4]+RC[-8]+RC[-12]+RC[-16]+RC[-20]+RC[-24]+RC[-28]+RC[-32]+RC[-36]+RC[-40]+RC[-44]+#REF!+#REF!+RC[-48]+RC[-52]+RC[-56]+RC[-60]+RC[-64]+RC[-68]+RC[-72]+RC[-76]+#REF! -> #REF! | CC14: =RC[-1]-RC[-2] -> #REF!
B15: ООО "ИнтерметГрупп" | C15: 0 | E15: =RC[-1]-RC[-2] -> 0 | G15: 0 | I15: =RC[-1]-RC[-2] -> 0 | K15: 0 | M15: =RC[-1]-RC[-2] -> 0 | O15: 0 | Q15: =RC[-1]-RC[-2] -> 0 | S15: 0 | U15: =RC[-1]-RC[-2] -> 0 | W15: 0 | Y15: =RC[-1]-RC[-2] -> 0 | AA15: 0 | AC15: =RC[-1]-RC[-2] -> 0 | AE15: 0 | AG15: =RC[-1]-RC[-2] -> 0 | AI15: 1 | AK15: =RC[-1]-RC[-2] -> -1 | AM15: 0 | AO15: =RC[-1]-RC[-2] -> 0 | AQ15: 0 | AS15: =RC[-1]-RC[-2] -> 0 | AU15: 0 | AW15: =RC[-1]-RC[-2] -> 0 | AY15: 0 | BA15: =RC[-1]-RC[-2] -> 0 | BC15: 0 | BE15: =RC[-1]-RC[-2] -> 0 | BG15: 0 | BI15: =RC[-1]-RC[-2] -> 0 | BK15: 0 | BM15: =RC[-1]-RC[-2] -> 0 | BO15: 0 | BQ15: =RC[-1]-RC[-2] -> 0 | BS15: 0 | BU15: =RC[-1]-RC[-2] -> 0 | BW15: 0 | BY15: =RC[-1]-RC[-2] -> 0 | CA15: =RC[-4]+RC[-8]+RC[-12]+RC[-16]+RC[-20]+RC[-24]+RC[-28]+RC[-32]+RC[-36]+RC[-40]+RC[-44]+RC[-48]+RC[-52]+RC[-56]+RC[-60]+RC[-64]+RC[-68]+RC[-72]+RC[-76] -> 1 | CB15: =RC[-4]+RC[-8]+RC[-12]+RC[-16]+RC[-20]+RC[-24]+RC[-28]+RC[-32]+RC[-36]+RC[-40]+RC[-44]+#REF!+#REF!+RC[-48]+RC[-52]+RC[-56]+RC[-60]+RC[-64]+RC[-68]+RC[-72]+RC[-76]+#REF! -> #REF! | CC15: =RC[-1]-RC[-2] -> #REF!
B16: Прочие | E16: =RC[-1]-RC[-2] -> 0 | I16: =RC[-1]-RC[-2] -> 0 | M16: =RC[-1]-RC[-2] -> 0 | Q16: =RC[-1]-RC[-2] -> 0 | U16: =RC[-1]-RC[-2] -> 0 | Y16: =RC[-1]-RC[-2] -> 0 | AC16: =RC[-1]-RC[-2] -> 0 | AG16: =RC[-1]-RC[-2] -> 0 | AK16: =RC[-1]-RC[-2] -> 0 | AO16: =RC[-1]-RC[-2] -> 0 | AS16: =RC[-1]-RC[-2] -> 0 | AW16: =RC[-1]-RC[-2] -> 0 | BA16: =RC[-1]-RC[-2] -> 0 | BE16: =RC[-1]-RC[-2] -> 0 | BI16: =RC[-1]-RC[-2] -> 0 | BM16: =RC[-1]-RC[-2] -> 0 | BQ16: =RC[-1]-RC[-2] -> 0 | BU16: =RC[-1]-RC[-2] -> 0 | BY16: =RC[-1]-RC[-2] -> 0 | CA16: =RC[-4]+RC[-8]+RC[-12]+RC[-16]+RC[-20]+RC[-24]+RC[-28]+RC[-32]+RC[-36]+RC[-40]+RC[-44]+RC[-48]+RC[-52]+RC[-56]+RC[-60]+RC[-64]+RC[-68]+RC[-72]+RC[-76] -> 0 | CB16: =RC[-4]+RC[-8]+RC[-12]+RC[-16]+RC[-20]+RC[-24]+RC[-28]+RC[-32]+RC[-36]+RC[-40]+RC[-44]+#REF!+#REF!+RC[-48]+RC[-52]+RC[-56]+RC[-60]+RC[-64]+RC[-68]+RC[-72]+RC[-76]+#REF! -> #REF! | CC16: =RC[-1]-RC[-2] -> #REF!
A17: ИТОГО за день: | C17: =SUM(R[-14]C:R[-1]C) -> 31 | D17: =SUM(R[-14]C:R[-1]C) -> 0 | E17: =RC[-1]-RC[-2] -> -31 | G17: =SUM(R[-14]C:R[-1]C) -> 22 | H17: =SUM(R[-14]C:R[-1]C) -> 0 | I17: =RC[-1]-RC[-2] -> -22 | K17: =SUM(R[-14]C:R[-1]C) -> 40 | L17: =SUM(R[-14]C:R[-1]C) -> 0 | M17: =RC[-1]-RC[-2] -> -40 | O17: =SUM(R[-14]C:R[-1]C) -> 24 | P17: =SUM(R[-14]C:R[-1]C) -> 0 | Q17: =RC[-1]-RC[-2] -> -24 | S17: =SUM(R[-14]C:R[-1]C) -> 24 | T17: =SUM(R[-14]C:R[-1]C) -> 0 | U17: =RC[-1]-RC[-2] -> -24 | W17: =SUM(R[-14]C:R[-1]C) -> 24 | X17: =SUM(R[-14]C:R[-1]C) -> 0 | Y17: =RC[-1]-RC[-2] -> -24 | AA17: =SUM(R[-14]C:R[-1]C) -> 30 | AB17: =SUM(R[-14]C:R[-1]C) -> 0 | AC17: =RC[-1]-RC[-2] -> -30 | AE17: =SUM(R[-14]C:R[-1]C) -> 23 | AF17: =SUM(R[-14]C:R[-1]C) -> 0 | AG17: =RC[-1]-RC[-2] -> -23 | AI17: =SUM(R[-14]C:R[-1]C) -> 23 | AJ17: =SUM(R[-14]C:R[-1]C) -> 0 | AK17: =RC[-1]-RC[-2] -> -23 | AM17: =SUM(R[-14]C:R[-1]C) -> 30 | AN17: =SUM(R[-14]C:R[-1]C) -> 0 | AO17: =RC[-1]-RC[-2] -> -30 | AQ17: =SUM(R[-14]C:R[-1]C) -> 22 | AR17: =SUM(R[-14]C:R[-1]C) -> 0 | AS17: =RC[-1]-RC[-2] -> -22 | AU17: =SUM(R[-14]C:R[-1]C) -> 23 | AV17: =SUM(R[-14]C:R[-1]C) -> 0 | AW17: =RC[-1]-RC[-2] -> -23 | AY17: =SUM(R[-14]C:R[-1]C) -> 18 | AZ17: =SUM(R[-14]C:R[-1]C) -> 4 | BA17: =RC[-1]-RC[-2] -> -14 | BC17: =SUM(R[-14]C:R[-1]C) -> 22 | BD17: =SUM(R[-14]C:R[-1]C) -> 0 | BE17: =RC[-1]-RC[-2] -> -22 | BG17: =SUM(R[-14]C:R[-1]C) -> 40 | BH17: =SUM(R[-14]C:R[-1]C) -> 0 | BI17: =RC[-1]-RC[-2] -> -40 | BK17: =SUM(R[-14]C:R[-1]C) -> 22 | BL17: =SUM(R[-14]C:R[-1]C) -> 0 | BM17: =RC[-1]-RC[-2] -> -22 | BO17: =SUM(R[-14]C:R[-1]C) -> 22 | BP17: =SUM(R[-14]C:R[-1]C) -> 0 | BQ17: =RC[-1]-RC[-2] -> -22 | BS17: =SUM(R[-14]C:R[-1]C) -> 30 | BT17: =SUM(R[-14]C:R[-1]C) -> 0 | BU17: =RC[-1]-RC[-2] -> -30 | BW17: =SUM(R[-14]C:R[-1]C) -> 22 | BX17: =SUM(R[-14]C:R[-1]C) -> 0 | BY17: =RC[-1]-RC[-2] -> -22 | CA17: =RC[-4]+RC[-8]+RC[-12]+RC[-16]+RC[-20]+RC[-24]+RC[-28]+RC[-32]+RC[-36]+RC[-40]+RC[-44]+RC[-48]+RC[-52]+RC[-56]+RC[-60]+RC[-64]+RC[-68]+RC[-72]+RC[-76] -> 492 | CB17: =RC[-4]+RC[-8]+RC[-12]+RC[-16]+RC[-20]+RC[-24]+RC[-28]+RC[-32]+RC[-36]+RC[-40]+RC[-44]+#REF!+#REF!+RC[-48]+RC[-52]+RC[-56]+RC[-60]+RC[-64]+RC[-68]+RC[-72]+RC[-76]+#REF! -> #REF! | CC17: =RC[-1]-RC[-2] -> #REF!
A18: Эксплуатируемый парк локомотивов: | C18: 2 | E18: =RC[-1]-RC[-2] -> -2 | G18: 2 | I18: =RC[-1]-RC[-2] -> -2 | K18: 2 | M18: =RC[-1]-RC[-2] -> -2 | O18: 2 | Q18: =RC[-1]-RC[-2] -> -2 | S18: 2 | U18: =RC[-1]-RC[-2] -> -2 | W18: 2 | Y18: =RC[-1]-RC[-2] -> -2 | AA18: 2 | AC18: =RC[-1]-RC[-2] -> -2 | AE18: 2 | AG18: =RC[-1]-RC[-2] -> -2 | AI18: 2 | AK18: =RC[-1]-RC[-2] -> -2 | AM18: 2 | AO18: =RC[-1]-RC[-2] -> -2 | AQ18: 2 | AS18: =RC[-1]-RC[-2] -> -2 | AU18: 2 | AW18: =RC[-1]-RC[-2] -> -2 | AY18: 2 | BA18: =RC[-1]-RC[-2] -> -2 | BC18: 2 | BE18: =RC[-1]-RC[-2] -> -2 | BG18: 2 | BI18: =RC[-1]-RC[-2] -> -2 | BK18: 2 | BM18: =RC[-1]-RC[-2] -> -2 | BO18: 2 | BQ18: =RC[-1]-RC[-2] -> -2 | BS18: 2 | BU18: =RC[-1]-RC[-2] -> -2 | BW18: 2 | BY18: =RC[-1]-RC[-2] -> -2 | CA18: =AVERAGE(RC[-4], RC[-8], RC[-12], RC[-16], RC[-20], RC[-24], RC[-28], RC[-32], RC[-36], RC[-40], RC[-44] RC[-48], RC[-52], RC[-56], RC[-60], RC[-64], RC[-68], RC[-72], RC[-76]) -> #NULL! | CB18: =AVERAGE(RC[-4], RC[-8], RC[-12], RC[-16], RC[-20], RC[-24], RC[-28], RC[-32], RC[-36], RC[-40], RC[-44],#REF!,#REF!, RC[-48], RC[-52], RC[-56], RC[-60], RC[-64], RC[-68], RC[-72], RC[-76],#REF!) -> #REF! | CC18: =RC[-1]-RC[-2] -> #REF!
A19: * - причины отклонения
A22: 1. | B22: Погодные условия
A23: 2. | B23: Отсутствие четкого планирования со стороны клиента
A24: 3. | B24: Запрет на отправление со стороны ОАО "РЖД"
A25: 4. | B25: Снятие запрета на отправление со стороны ОАО "РЖД"
A26: 5. | B26: Отсутствие заготовки перевозочных документов в АС ЭТРАН
A27: 6. | B27: Появление заготовки перевозочных документов в АС ЭТРАН
A28: 7. | B28: Наличие заявки на обработку со стороны клиента на большее кол-во вагонов
A29: 8. | B29: Заключение договора на подачу/уборку вагонов с новым клиентом
A30: 9. | B30: Вагоны не готовы к уборке с грузового фронта по вине клиента
A33: 1. | B33: Переработано вагонов более заявленного кол-ва
A34: 2. | B34: Наличие аварийной заявки на обработку от клиента
A35: 3. | B35: Внутренняя работа (работа с путевой техникой, обработка депо и др.)
A36: 4. | B36: Испытание локомобиля
A37: 5. | B37: Отказ от заявки на обработку грузового фронта от клиента
A39: хранить год

Sheet: июль
A1: Число | B1: 1 | E1: 2 | H1: 3 | K1: 4 | N1: 5 | Q1: 6 | T1: 7 | W1: 8 | Z1: 9 | AC1: 10 | AF1: 11 | AI1: 12 | AL1: 13 | AO1: 14 | AR1: 15 | AU1: 16 | AX1: 17 | BA1: 18 | BD1: 19 | BG1: 20 | BJ1: 21 | BM1: 22 | BP1: 23 | BS1: 24 | BV1: 25 | BY1: 26 | CB1: 27 | CE1: 28 | CH1: 29 | CK1: 30
B2: план | C2: факт | D2: отклонение | E2: план | F2: факт | G2: отклонение | H2: план | I2: факт | J2: отклонение | K2: план | L2: факт | M2: отклонение | N2: план | O2: факт | P2: отклонение | Q2: план | R2: факт | S2: отклонение | T2: план | U2: факт | V2: отклонение | W2: план | X2: факт | Y2: отклонение | Z2: план | AA2: факт | AB2: отклонение | AC2: план | AD2: факт | AE2: отклонение | AF2: план | AG2: факт | AH2: отклонение | AI2: план | AJ2: факт | AK2: отклонение | AL2: план | AM2: факт | AN2: отклонение | AO2: план | AP2: факт | AQ2: отклонение | AR2: план | AS2: факт | AT2: отклонение | AU2: план | AV2: факт | AW2: отклонение | AX2: план | AY2: факт | AZ2: отклонение | BA2: план | BB2: факт | BC2: отклонение | BD2: план | BE2: факт | BF2: отклонение | BG2: план | BH2: факт | BI2: отклонение | BJ2: план | BK2: факт | BL2: отклонение | BM2: план | BN2: факт | BO2: отклонение | BP2: план | BQ2: факт | BR2: отклонение | BS2: план | BT2: факт | BU2: отклонение | BV2: план | BW2: факт | BX2: отклонение | BY2: план | BZ2: факт | CA2: отклонение | CB2: план | CC2: факт | CD2: отклонение | CE2: план | CF2: факт | CG2: отклонение | CH2: план | CI2: факт | CJ2: отклонение | CK2: план | CL2: факт | CM2: отклонение
A3: БЕ ООО "НАК" (местные) | B3: 2 | E3: 2 | H3: 2 | K3: 2 | N3: 2 | Q3: 2 | T3: 2 | W3: 2 | Z3: 2 | AC3: 2 | AF3: 2 | AI3: 2 | AL3: 2 | AO3: 2 | AR3: 2 | AU3: 2 | AX3: 2 | BA3: 2 | BD3: 2 | BG3: 2 | BJ3: 2 | BM3: 2 | BP3: 2 | BS3: 2 | BV3: 2 | BY3: 2 | CB3: 2 | CE3: 2 | CH3: 2 | CK3: 2
A4: ООО "НАК" ( НЛЗ, НАК, ЗПШ) | B4: 9 | E4: 9 | H4: 9 | K4: 9 | N4: 9 | Q4: 9 | T4: 9 | W4: 9 | Z4: 9 | AC4: 9 | AF4: 9 | AI4: 9 | AL4: 9 | AO4: 9 | AR4: 9 | AU4: 9 | AX4: 9 | BA4: 9 | BD4: 9 | BG4: 9 | BJ4: 9 | BM4: 9 | BP4: 9 | BS4: 9 | BV4: 9 | BY4: 9 | CB4: 9 | CE4: 9 | CH4: 9 | CK4: 9
A5: СВХ выгр (АЗ "НАЗ", НГА) | B5: 0 | E5: 0 | H5: 0 | K5: 0 | N5: 0 | Q5: 0 | T5: 0 | W5: 0 | Z5: 0 | AC5: 0 | AF5: 0 | AI5: 0 | AL5: 0 | AO5: 0 | AR5: 0 | AU5: 0 | AX5: 0 | BA5: 0 | BD5: 0 | BG5: 0 | BJ5: 0 | BM5: 0 | BP5: 0 | BS5: 0 | BV5: 0 | BY5: 0 | CB5: 0 | CE5: 0 | CH5: 0 | CK5: 0
A6: Погрузка (АО "Платформа А", ООО "Коммерческие автомобили-Группа ГАЗ" (Вьетнам)) | B6: 0 | E6: 0 | H6: 0 | K6: 0 | N6: 0 | Q6: 0 | T6: 0 | W6: 0 | Z6: 0 | AC6: 0 | AF6: 0 | AI6: 0 | AL6: 0 | AO6: 0 | AR6: 0 | AU6: 0 | AX6: 0 | BA6: 0 | BD6: 0 | BG6: 0 | BJ6: 0 | BM6: 0 | BP6: 0 | BS6: 0 | BV6: 0 | BY6: 0 | CB6: 0 | CE6: 0 | CH6: 0 | CK6: 0
A7: АО "ГОТХ" | B7: 9 | E7: 9 | H7: 9 | K7: 9 | N7: 9 | Q7: 9 | T7: 9 | W7: 9 | Z7: 9 | AC7: 9 | AF7: 9 | AI7: 9 | AL7: 9 | AO7: 9 | AR7: 9 | AU7: 9 | AX7: 9 | BA7: 9 | BD7: 9 | BG7: 9 | BJ7: 9 | BM7: 9 | BP7: 9 | BS7: 9 | BV7: 9 | BY7: 9 | CB7: 9 | CE7: 9 | CH7: 9 | CK7: 9
A8: ООО "Нерудные материалы-НН"
A9: ПК НВМ (ООО "Профит")
A10: ООО "ИнтерметГрупп" | B10: 1 | E10: 1 | H10: 1 | K10: 1 | N10: 1 | Q10: 1 | T10: 1 | W10: 1 | Z10: 1 | AC10: 1 | AF10: 1 | AI10: 1 | AL10: 1 | AO10: 1 | AR10: 1 | AU10: 1 | AX10: 1 | BA10: 1 | BD10: 1 | BG10: 1 | BJ10: 1 | BM10: 1 | BP10: 1 | BS10: 1 | BV10: 1 | BY10: 1 | CB10: 1 | CE10: 1 | CH10: 1 | CK10: 1
A11: Сторонние (все остальные) | B11: 1 | E11: 1 | H11: 1 | K11: 1 | N11: 1 | Q11: 1 | T11: 1 | W11: 1 | Z11: 1 | AC11: 1 | AF11: 1 | AI11: 1 | AL11: 1 | AO11: 1 | AR11: 1 | AU11: 1 | AX11: 1 | BA11: 1 | BD11: 1 | BG11: 1 | BJ11: 1 | BM11: 1 | BP11: 1 | BS11: 1 | BV11: 1 | BY11: 1 | CB11: 1 | CE11: 1 | CH11: 1 | CK11: 1
A12: План в вагонах ИТОГО: | B12: =SUM(R[-9]C:R[-1]C) -> 22 | E12: =SUM(R[-9]C:R[-1]C) -> 22 | H12: =SUM(R[-9]C:R[-1]C) -> 22 | K12: =SUM(R[-9]C:R[-1]C) -> 22 | N12: =SUM(R[-9]C:R[-1]C) -> 22 | Q12: =SUM(R[-9]C:R[-1]C) -> 22 | T12: =SUM(R[-9]C:R[-1]C) -> 22 | W12: =SUM(R[-9]C:R[-1]C) -> 22 | Z12: =SUM(R[-9]C:R[-1]C) -> 22 | AC12: =SUM(R[-9]C:R[-1]C) -> 22 | AF12: =SUM(R[-9]C:R[-1]C) -> 22 | AI12: =SUM(R[-9]C:R[-1]C) -> 22 | AL12: =SUM(R[-9]C:R[-1]C) -> 22 | AO12: =SUM(R[-9]C:R[-1]C) -> 22 | AR12: =SUM(R[-9]C:R[-1]C) -> 22 | AU12: =SUM(R[-9]C:R[-1]C) -> 22 | AX12: =SUM(R[-9]C:R[-1]C) -> 22 | BA12: =SUM(R[-9]C:R[-1]C) -> 22 | BD12: =SUM(R[-9]C:R[-1]C) -> 22 | BG12: =SUM(R[-9]C:R[-1]C) -> 22 | BJ12: =SUM(R[-9]C:R[-1]C) -> 22 | BM12: =SUM(R[-9]C:R[-1]C) -> 22 | BP12: =SUM(R[-9]C:R[-1]C) -> 22 | BS12: =SUM(R[-9]C:R[-1]C) -> 22 | BV12: =SUM(R[-9]C:R[-1]C) -> 22 | BY12: =SUM(R[-9]C:R[-1]C) -> 22 | CB12: =SUM(R[-9]C:R[-1]C) -> 22 | CE12: =SUM(R[-9]C:R[-1]C) -> 22 | CH12: =SUM(R[-9]C:R[-1]C) -> 22 | CK12: =SUM(R[-9]C:R[-1]C) -> 22
A13: Отклонения в вагонах | B13: =#REF!-R[-1]C -> #REF! | E13: =#REF!-R[-1]C -> #REF! | H13: =#REF!-R[-1]C -> #REF! | K13: =#REF!-R[-1]C -> #REF! | N13: =#REF!-R[-1]C -> #REF! | Q13: =#REF!-R[-1]C -> #REF! | T13: =#REF!-R[-1]C -> #REF! | W13: =#REF!-R[-1]C -> #REF! | Z13: =#REF!-R[-1]C -> #REF! | AC13: =#REF!-R[-1]C -> #REF! | AF13: =#REF!-R[-1]C -> #REF! | AI13: =#REF!-R[-1]C -> #REF! | AL13: =#REF!-R[-1]C -> #REF! | AO13: =#REF!-R[-1]C -> #REF! | AR13: =#REF!-R[-1]C -> #REF! | AU13: =#REF!-R[-1]C -> #REF! | AX13: =#REF!-R[-1]C -> #REF! | BA13: =#REF!-R[-1]C -> #REF! | BD13: =#REF!-R[-1]C -> #REF! | BG13: =#REF!-R[-1]C -> #REF! | BJ13: =#REF!-R[-1]C -> #REF! | BM13: =#REF!-R[-1]C -> #REF! | BP13: =#REF!-R[-1]C -> #REF! | BS13: =#REF!-R[-1]C -> #REF! | BV13: =#REF!-R[-1]C -> #REF! | BY13: =#REF!-R[-1]C -> #REF! | CB13: =#REF!-R[-1]C -> #REF! | CE13: =#REF!-R[-1]C -> #REF! | CH13: =#REF!-R[-1]C -> #REF! | CK13: =#REF!-R[-1]C -> #REF!
A14: План локомотивы | B14: 2 | E14: 2 | H14: 2 | K14: 2 | N14: 2 | Q14: 2 | T14: 2 | W14: 2 | Z14: 2 | AC14: 2 | AF14: 2 | AI14: 2 | AL14: 2 | AO14: 2 | AR14: 2 | AU14: 2 | AX14: 2 | BA14: 2 | BD14: 2 | BG14: 2 | BJ14: 2 | BM14: 2 | BP14: 2 | BS14: 2 | BV14: 2 | BY14: 2 | CB14: 2 | CE14: 2 | CH14: 2 | CK14: 2
A15: Факт локомотивы | B15: 3 | E15: 3 | H15: 3 | K15: 3 | N15: 3 | Q15: 3 | T15: 3 | W15: 3 | Z15: 3 | AC15: 3 | AF15: 3 | AI15: 3 | AL15: 3 | AO15: 3 | AR15: 3 | AU15: 3 | AX15: 3 | BA15: 3 | BD15: 3 | BG15: 3 | BJ15: 3 | BM15: 3 | BP15: 3 | BS15: 3 | BV15: 3 | BY15: 3 | CB15: 3 | CE15: 3 | CH15: 3 | CK15: 3
A16: Причины отклонения по вагонам
A17: Причины отклонения по локомотивам

Sheet: август
A1: Число | C1: 1 | G1: 2 | K1: 3 | O1: 4 | S1: 7 | W1: 8 | AA1: 9 | AE1: 10 | AI1: 11 | AM1: 14 | AQ1: 15 | AU1: 16 | AY1: 17 | BC1: 18 | BG1: 21 | BK1: 22 | BO1: 23 | BS1: 24 | BW1: 25 | CA1: 28 | CE1: 29 | CI1: 30 | CM1: Итого
A2: Клиенты | C2: план | D2: факт | E2: откл-е | F2: * | G2: план | H2: факт | I2: откл-е | J2: * | K2: план | L2: факт | M2: откл-е | N2: * | O2: план | P2: факт | Q2: откл-е | R2: * | S2: план | T2: факт | U2: откл-е | V2: * | W2: план | X2: факт | Y2: откл-е | Z2: * | AA2: план | AB2: факт | AC2: откл-е | AD2: * | AE2: план | AF2: факт | AG2: откл-е | AH2: * | AI2: план | AJ2: факт | AK2: откл-е | AL2: * | AM2: план | AN2: факт | AO2: откл-е | AP2: * | AQ2: план | AR2: факт | AS2: откл-е | AT2: * | AU2: план | AV2: факт | AW2: откл-е | AX2: * | AY2: план | AZ2: факт | BA2: откл-е | BB2: * | BC2: план | BD2: факт | BE2: откл-е | BF2: * | BG2: план | BH2: факт | BI2: откл-е | BJ2: * | BK2: план | BL2: факт | BM2: откл-е | BN2: * | BO2: план | BP2: факт | BQ2: откл-е | BR2: * | BS2: план | BT2: факт | BU2: откл-е | BV2: * | BW2: план | BX2: факт | BY2: откл-е | BZ2: * | CA2: план | CB2: факт | CC2: откл-е | CD2: * | CE2: план | CF2: факт | CG2: откл-е | CH2: * | CI2: план | CJ2: факт | CK2: откл-е | CL2: * | CM2: план | CN2: факт | CO2: откл-е
A3: БЕ ООО "НАК" | B3: ЛЗ | E3: =RC[-1]-RC[-2] -> 0 | I3: =RC[-1]-RC[-2] -> 0 | M3: =RC[-1]-RC[-2] -> 0 | Q3: =RC[-1]-RC[-2] -> 0 | U3: =RC[-1]-RC[-2] -> 0 | Y3: =RC[-1]-RC[-2] -> 0 | AC3: =RC[-1]-RC[-2] -> 0 | AG3: =RC[-1]-RC[-2] -> 0 | AK3: =RC[-1]-RC[-2] -> 0 | AO3: =RC[-1]-RC[-2] -> 0 | AS3: =RC[-1]-RC[-2] -> 0 | AW3: =RC[-1]-RC[-2] -> 0 | BA3: =RC[-1]-RC[-2] -> 0 | BE3: =RC[-1]-RC[-2] -> 0 | BI3: =RC[-1]-RC[-2] -> 0 | BM3: =RC[-1]-RC[-2] -> 0 | BQ3: =RC[-1]-RC[-2] -> 0 | BU3: =RC[-1]-RC[-2] -> 0 | BY3: =RC[-1]-RC[-2] -> 0 | CC3: =RC[-1]-RC[-2] -> 0 | CG3: =RC[-1]-RC[-2] -> 0 | CK3: =RC[-1]-RC[-2] -> 0 | CM3: =RC[-4]+RC[-8]+RC[-12]+RC[-16]+RC[-20]+RC[-24]+RC[-28]+RC[-32]+RC[-36]+RC[-40]+RC[-44]+RC[-48]+RC[-52]+RC[-56]+RC[-60]+RC[-64]+RC[-68]+RC[-72]+RC[-76]+RC[-80]+RC[-84]+RC[-88] -> 0 | CN3: =RC[-4]+RC[-8]+RC[-12]+RC[-16]+RC[-20]+RC[-24]+RC[-28]+RC[-32]+RC[-36]+RC[-40]+RC[-44]+RC[-48]+RC[-52]+RC[-56]+RC[-60]+RC[-64]+RC[-68]+RC[-72]+RC[-76]+RC[-80]+RC[-84]+RC[-88] -> 0 | CO3: =RC[-1]-RC[-2] -> 0
B4: ПРЗ | E4: =RC[-1]-RC[-2] -> 0 | I4: =RC[-1]-RC[-2] -> 0 | M4: =RC[-1]-RC[-2] -> 0 | Q4: =RC[-1]-RC[-2] -> 0 | U4: =RC[-1]-RC[-2] -> 0 | Y4: =RC[-1]-RC[-2] -> 0 | AC4: =RC[-1]-RC[-2] -> 0 | AG4: =RC[-1]-RC[-2] -> 0 | AK4: =RC[-1]-RC[-2] -> 0 | AO4: =RC[-1]-RC[-2] -> 0 | AS4: =RC[-1]-RC[-2] -> 0 | AW4: =RC[-1]-RC[-2] -> 0 | BA4: =RC[-1]-RC[-2] -> 0 | BE4: =RC[-1]-RC[-2] -> 0 | BI4: =RC[-1]-RC[-2] -> 0 | BM4: =RC[-1]-RC[-2] -> 0 | BQ4: =RC[-1]-RC[-2] -> 0 | BU4: =RC[-1]-RC[-2] -> 0 | BY4: =RC[-1]-RC[-2] -> 0 | CC4: =RC[-1]-RC[-2] -> 0 | CG4: =RC[-1]-RC[-2] -> 0 | CK4: =RC[-1]-RC[-2] -> 0 | CM4: =RC[-4]+RC[-8]+RC[-12]+RC[-16]+RC[-20]+RC[-24]+RC[-28]+RC[-32]+RC[-36]+RC[-40]+RC[-44]+RC[-48]+RC[-52]+RC[-56]+RC[-60]+RC[-64]+RC[-68]+RC[-72]+RC[-76]+RC[-80]+RC[-84]+RC[-88] -> 0 | CN4: =RC[-4]+RC[-8]+RC[-12]+RC[-16]+RC[-20]+RC[-24]+RC[-28]+RC[-32]+RC[-36]+RC[-40]+RC[-44]+RC[-48]+RC[-52]+RC[-56]+RC[-60]+RC[-64]+RC[-68]+RC[-72]+RC[-76]+RC[-80]+RC[-84]+RC[-88] -> 0 | CO4: =RC[-1]-RC[-2] -> 0
A5: ООО "НАК" | B5: ЗШП | E5: =RC[-1]-RC[-2] -> 0 | I5: =RC[-1]-RC[-2] -> 0 | M5: =RC[-1]-RC[-2] -> 0 | Q5: =RC[-1]-RC[-2] -> 0 | U5: =RC[-1]-RC[-2] -> 0 | Y5: =RC[-1]-RC[-2] -> 0 | AC5: =RC[-1]-RC[-2] -> 0 | AG5: =RC[-1]-RC[-2] -> 0 | AK5: =RC[-1]-RC[-2] -> 0 | AO5: =RC[-1]-RC[-2] -> 0 | AS5: =RC[-1]-RC[-2] -> 0 | AW5: =RC[-1]-RC[-2] -> 0 | BA5: =RC[-1]-RC[-2] -> 0 | BE5: =RC[-1]-RC[-2] -> 0 | BI5: =RC[-1]-RC[-2] -> 0 | BM5: =RC[-1]-RC[-2] -> 0 | BQ5: =RC[-1]-RC[-2] -> 0 | BU5: =RC[-1]-RC[-2] -> 0 | BY5: =RC[-1]-RC[-2] -> 0 | CC5: =RC[-1]-RC[-2] -> 0 | CG5: =RC[-1]-RC[-2] -> 0 | CK5: =RC[-1]-RC[-2] -> 0 | CM5: =RC[-4]+RC[-8]+RC[-12]+RC[-16]+RC[-20]+RC[-24]+RC[-28]+RC[-32]+RC[-36]+RC[-40]+RC[-44]+RC[-48]+RC[-52]+RC[-56]+RC[-60]+RC[-64]+RC[-68]+RC[-72]+RC[-76]+RC[-80]+RC[-84]+RC[-88] -> 0 | CN5: =RC[-4]+RC[-8]+RC[-12]+RC[-16]+RC[-20]+RC[-24]+RC[-28]+RC[-32]+RC[-36]+RC[-40]+RC[-44]+RC[-48]+RC[-52]+RC[-56]+RC[-60]+RC[-64]+RC[-68]+RC[-72]+RC[-76]+RC[-80]+RC[-84]+RC[-88] -> 0 | CO5: =RC[-1]-RC[-2] -> 0
B6: НАК | E6: =RC[-1]-RC[-2] -> 0 | I6: =RC[-1]-RC[-2] -> 0 | M6: =RC[-1]-RC[-2] -> 0 | Q6: =RC[-1]-RC[-2] -> 0 | U6: =RC[-1]-RC[-2] -> 0 | Y6: =RC[-1]-RC[-2] -> 0 | AC6: =RC[-1]-RC[-2] -> 0 | AG6: =RC[-1]-RC[-2] -> 0 | AK6: =RC[-1]-RC[-2] -> 0 | AO6: =RC[-1]-RC[-2] -> 0 | AS6: =RC[-1]-RC[-2] -> 0 | AW6: =RC[-1]-RC[-2] -> 0 | BA6: =RC[-1]-RC[-2] -> 0 | BE6: =RC[-1]-RC[-2] -> 0 | BI6: =RC[-1]-RC[-2] -> 0 | BM6: =RC[-1]-RC[-2] -> 0 | BQ6: =RC[-1]-RC[-2] -> 0 | BU6: =RC[-1]-RC[-2] -> 0 | BY6: =RC[-1]-RC[-2] -> 0 | CC6: =RC[-1]-RC[-2] -> 0 | CG6: =RC[-1]-RC[-2] -> 0 | CK6: =RC[-1]-RC[-2] -> 0 | CM6: =RC[-4]+RC[-8]+RC[-12]+RC[-16]+RC[-20]+RC[-24]+RC[-28]+RC[-32]+RC[-36]+RC[-40]+RC[-44]+RC[-48]+RC[-52]+RC[-56]+RC[-60]+RC[-64]+RC[-68]+RC[-72]+RC[-76]+RC[-80]+RC[-84]+RC[-88] -> 0 | CN6: =RC[-4]+RC[-8]+RC[-12]+RC[-16]+RC[-20]+RC[-24]+RC[-28]+RC[-32]+RC[-36]+RC[-40]+RC[-44]+RC[-48]+RC[-52]+RC[-56]+RC[-60]+RC[-64]+RC[-68]+RC[-72]+RC[-76]+RC[-80]+RC[-84]+RC[-88] -> 0 | CO6: =RC[-1]-RC[-2] -> 0
B7: НЛЗ | E7: =RC[-1]-RC[-2] -> 0 | I7: =RC[-1]-RC[-2] -> 0 | M7: =RC[-1]-RC[-2] -> 0 | Q7: =RC[-1]-RC[-2] -> 0 | U7: =RC[-1]-RC[-2] -> 0 | Y7: =RC[-1]-RC[-2] -> 0 | AC7: =RC[-1]-RC[-2] -> 0 | AG7: =RC[-1]-RC[-2] -> 0 | AK7: =RC[-1]-RC[-2] -> 0 | AO7: =RC[-1]-RC[-2] -> 0 | AS7: =RC[-1]-RC[-2] -> 0 | AW7: =RC[-1]-RC[-2] -> 0 | BA7: =RC[-1]-RC[-2] -> 0 | BE7: =RC[-1]-RC[-2] -> 0 | BI7: =RC[-1]-RC[-2] -> 0 | BM7: =RC[-1]-RC[-2] -> 0 | BQ7: =RC[-1]-RC[-2] -> 0 | BU7: =RC[-1]-RC[-2] -> 0 | BY7: =RC[-1]-RC[-2] -> 0 | CC7: =RC[-1]-RC[-2] -> 0 | CG7: =RC[-1]-RC[-2] -> 0 | CK7: =RC[-1]-RC[-2] -> 0 | CM7: =RC[-4]+RC[-8]+RC[-12]+RC[-16]+RC[-20]+RC[-24]+RC[-28]+RC[-32]+RC[-36]+RC[-40]+RC[-44]+RC[-48]+RC[-52]+RC[-56]+RC[-60]+RC[-64]+RC[-68]+RC[-72]+RC[-76]+RC[-80]+RC[-84]+RC[-88] -> 0 | CN7: =RC[-4]+RC[-8]+RC[-12]+RC[-16]+RC[-20]+RC[-24]+RC[-28]+RC[-32]+RC[-36]+RC[-40]+RC[-44]+RC[-48]+RC[-52]+RC[-56]+RC[-60]+RC[-64]+RC[-68]+RC[-72]+RC[-76]+RC[-80]+RC[-84]+RC[-88] -> 0 | CO7: =RC[-1]-RC[-2] -> 0
A8: ООО "НАЗ", АО "НГА" | B8: АЗ "НАЗ" | E8: =RC[-1]-RC[-2] -> 0 | I8: =RC[-1]-RC[-2] -> 0 | M8: =RC[-1]-RC[-2] -> 0 | Q8: =RC[-1]-RC[-2] -> 0 | U8: =RC[-1]-RC[-2] -> 0 | Y8: =RC[-1]-RC[-2] -> 0 | AC8: =RC[-1]-RC[-2] -> 0 | AG8: =RC[-1]-RC[-2] -> 0 | AK8: =RC[-1]-RC[-2] -> 0 | AO8: =RC[-1]-RC[-2] -> 0 | AS8: =RC[-1]-RC[-2] -> 0 | AW8: =RC[-1]-RC[-2] -> 0 | BA8: =RC[-1]-RC[-2] -> 0 | BE8: =RC[-1]-RC[-2] -> 0 | BI8: =RC[-1]-RC[-2] -> 0 | BM8: =RC[-1]-RC[-2] -> 0 | BQ8: =RC[-1]-RC[-2] -> 0 | BU8: =RC[-1]-RC[-2] -> 0 | BY8: =RC[-1]-RC[-2] -> 0 | CC8: =RC[-1]-RC[-2] -> 0 | CG8: =RC[-1]-RC[-2] -> 0 | CK8: =RC[-1]-RC[-2] -> 0 | CM8: =RC[-4]+RC[-8]+RC[-12]+RC[-16]+RC[-20]+RC[-24]+RC[-28]+RC[-32]+RC[-36]+RC[-40]+RC[-44]+RC[-48]+RC[-52]+RC[-56]+RC[-60]+RC[-64]+RC[-68]+RC[-72]+RC[-76]+RC[-80]+RC[-84]+RC[-88] -> 0 | CN8: =RC[-4]+RC[-8]+RC[-12]+RC[-16]+RC[-20]+RC[-24]+RC[-28]+RC[-32]+RC[-36]+RC[-40]+RC[-44]+RC[-48]+RC[-52]+RC[-56]+RC[-60]+RC[-64]+RC[-68]+RC[-72]+RC[-76]+RC[-80]+RC[-84]+RC[-88] -> 0 | CO8: =RC[-1]-RC[-2] -> 0
B9: АО "НГА" | E9: =RC[-1]-RC[-2] -> 0 | I9: =RC[-1]-RC[-2] -> 0 | M9: =RC[-1]-RC[-2] -> 0 | Q9: =RC[-1]-RC[-2] -> 0 | U9: =RC[-1]-RC[-2] -> 0 | Y9: =RC[-1]-RC[-2] -> 0 | AC9: =RC[-1]-RC[-2] -> 0 | AG9: =RC[-1]-RC[-2] -> 0 | AK9: =RC[-1]-RC[-2] -> 0 | AO9: =RC[-1]-RC[-2] -> 0 | AS9: =RC[-1]-RC[-2] -> 0 | AW9: =RC[-1]-RC[-2] -> 0 | BA9: =RC[-1]-RC[-2] -> 0 | BE9: =RC[-1]-RC[-2] -> 0 | BI9: =RC[-1]-RC[-2] -> 0 | BM9: =RC[-1]-RC[-2] -> 0 | BQ9: =RC[-1]-RC[-2] -> 0 | BU9: =RC[-1]-RC[-2] -> 0 | BY9: =RC[-1]-RC[-2] -> 0 | CC9: =RC[-1]-RC[-2] -> 0 | CG9: =RC[-1]-RC[-2] -> 0 | CK9: =RC[-1]-RC[-2] -> 0 | CM9: =RC[-4]+RC[-8]+RC[-12]+RC[-16]+RC[-20]+RC[-24]+RC[-28]+RC[-32]+RC[-36]+RC[-40]+RC[-44]+RC[-48]+RC[-52]+RC[-56]+RC[-60]+RC[-64]+RC[-68]+RC[-72]+RC[-76]+RC[-80]+RC[-84]+RC[-88] -> 0 | CN9: =RC[-4]+RC[-8]+RC[-12]+RC[-16]+RC[-20]+RC[-24]+RC[-28]+RC[-32]+RC[-36]+RC[-40]+RC[-44]+RC[-48]+RC[-52]+RC[-56]+RC[-60]+RC[-64]+RC[-68]+RC[-72]+RC[-76]+RC[-80]+RC[-84]+RC[-88] -> 0 | CO9: =RC[-1]-RC[-2] -> 0
A10: Сторонние внутренние | B10: КА-Группа ГАЗ( Вьетнам) | E10: =RC[-1]-RC[-2] -> 0 | I10: =RC[-1]-RC[-2] -> 0 | M10: =RC[-1]-RC[-2] -> 0 | Q10: =RC[-1]-RC[-2] -> 0 | U10: =RC[-1]-RC[-2] -> 0 | Y10: =RC[-1]-RC[-2] -> 0 | AC10: =RC[-1]-RC[-2] -> 0 | AG10: =RC[-1]-RC[-2] -> 0 | AK10: =RC[-1]-RC[-2] -> 0 | AO10: =RC[-1]-RC[-2] -> 0 | AS10: =RC[-1]-RC[-2] -> 0 | AW10: =RC[-1]-RC[-2] -> 0 | BA10: =RC[-1]-RC[-2] -> 0 | BE10: =RC[-1]-RC[-2] -> 0 | BI10: =RC[-1]-RC[-2] -> 0 | BM10: =RC[-1]-RC[-2] -> 0 | BQ10: =RC[-1]-RC[-2] -> 0 | BU10: =RC[-1]-RC[-2] -> 0 | BY10: =RC[-1]-RC[-2] -> 0 | CC10: =RC[-1]-RC[-2] -> 0 | CG10: =RC[-1]-RC[-2] -> 0 | CK10: =RC[-1]-RC[-2] -> 0 | CM10: =RC[-4]+RC[-8]+RC[-12]+RC[-16]+RC[-20]+RC[-24]+RC[-28]+RC[-32]+RC[-36]+RC[-40]+RC[-44]+RC[-48]+RC[-52]+RC[-56]+RC[-60]+RC[-64]+RC[-68]+RC[-72]+RC[-76]+RC[-80]+RC[-84]+RC[-88] -> 0 | CN10: =RC[-4]+RC[-8]+RC[-12]+RC[-16]+RC[-20]+RC[-24]+RC[-28]+RC[-32]+RC[-36]+RC[-40]+RC[-44]+RC[-48]+RC[-52]+RC[-56]+RC[-60]+RC[-64]+RC[-68]+RC[-72]+RC[-76]+RC[-80]+RC[-84]+RC[-88] -> 0 | CO10: =RC[-1]-RC[-2] -> 0
B11: Платформа А | E11: =RC[-1]-RC[-2] -> 0 | I11: =RC[-1]-RC[-2] -> 0 | M11: =RC[-1]-RC[-2] -> 0 | Q11: =RC[-1]-RC[-2] -> 0 | U11: =RC[-1]-RC[-2] -> 0 | Y11: =RC[-1]-RC[-2] -> 0 | AC11: =RC[-1]-RC[-2] -> 0 | AG11: =RC[-1]-RC[-2] -> 0 | AK11: =RC[-1]-RC[-2] -> 0 | AO11: =RC[-1]-RC[-2] -> 0 | AS11: =RC[-1]-RC[-2] -> 0 | AW11: =RC[-1]-RC[-2] -> 0 | BA11: =RC[-1]-RC[-2] -> 0 | BE11: =RC[-1]-RC[-2] -> 0 | BI11: =RC[-1]-RC[-2] -> 0 | BM11: =RC[-1]-RC[-2] -> 0 | BQ11: =RC[-1]-RC[-2] -> 0 | BU11: =RC[-1]-RC[-2] -> 0 | BY11: =RC[-1]-RC[-2] -> 0 | CC11: =RC[-1]-RC[-2] -> 0 | CG11: =RC[-1]-RC[-2] -> 0 | CK11: =RC[-1]-RC[-2] -> 0 | CM11: =RC[-4]+RC[-8]+RC[-12]+RC[-16]+RC[-20]+RC[-24]+RC[-28]+RC[-32]+RC[-36]+RC[-40]+RC[-44]+RC[-48]+RC[-52]+RC[-56]+RC[-60]+RC[-64]+RC[-68]+RC[-72]+RC[-76]+RC[-80]+RC[-84]+RC[-88] -> 0 | CN11: =RC[-4]+RC[-8]+RC[-12]+RC[-16]+RC[-20]+RC[-24]+RC[-28]+RC[-32]+RC[-36]+RC[-40]+RC[-44]+RC[-48]+RC[-52]+RC[-56]+RC[-60]+RC[-64]+RC[-68]+RC[-72]+RC[-76]+RC[-80]+RC[-84]+RC[-88] -> 0 | CO11: =RC[-1]-RC[-2] -> 0
A12: Сторонние внешние | B12: АО "ГОТХ" | E12: =RC[-1]-RC[-2] -> 0 | I12: =RC[-1]-RC[-2] -> 0 | M12: =RC[-1]-RC[-2] -> 0 | Q12: =RC[-1]-RC[-2] -> 0 | U12: =RC[-1]-RC[-2] -> 0 | Y12: =RC[-1]-RC[-2] -> 0 | AC12: =RC[-1]-RC[-2] -> 0 | AG12: =RC[-1]-RC[-2] -> 0 | AK12: =RC[-1]-RC[-2] -> 0 | AO12: =RC[-1]-RC[-2] -> 0 | AS12: =RC[-1]-RC[-2] -> 0 | AW12: =RC[-1]-RC[-2] -> 0 | BA12: =RC[-1]-RC[-2] -> 0 | BE12: =RC[-1]-RC[-2] -> 0 | BI12: =RC[-1]-RC[-2] -> 0 | BM12: =RC[-1]-RC[-2] -> 0 | BQ12: =RC[-1]-RC[-2] -> 0 | BU12: =RC[-1]-RC[-2] -> 0 | BY12: =RC[-1]-RC[-2] -> 0 | CC12: =RC[-1]-RC[-2] -> 0 | CG12: =RC[-1]-RC[-2] -> 0 | CK12: =RC[-1]-RC[-2] -> 0 | CM12: =RC[-4]+RC[-8]+RC[-12]+RC[-16]+RC[-20]+RC[-24]+RC[-28]+RC[-32]+RC[-36]+RC[-40]+RC[-44]+RC[-48]+RC[-52]+RC[-56]+RC[-60]+RC[-64]+RC[-68]+RC[-72]+RC[-76]+RC[-80]+RC[-84]+RC[-88] -> 0 | CN12: =RC[-4]+RC[-8]+RC[-12]+RC[-16]+RC[-20]+RC[-24]+RC[-28]+RC[-32]+RC[-36]+RC[-40]+RC[-44]+RC[-48]+RC[-52]+RC[-56]+RC[-60]+RC[-64]+RC[-68]+RC[-72]+RC[-76]+RC[-80]+RC[-84]+RC[-88] -> 0 | CO12: =RC[-1]-RC[-2] -> 0
B13: ООО "Нерудные материалы-НН" | E13: =RC[-1]-RC[-2] -> 0 | I13: =RC[-1]-RC[-2] -> 0 | M13: =RC[-1]-RC[-2] -> 0 | Q13: =RC[-1]-RC[-2] -> 0 | U13: =RC[-1]-RC[-2] -> 0 | Y13: =RC[-1]-RC[-2] -> 0 | AC13: =RC[-1]-RC[-2] -> 0 | AG13: =RC[-1]-RC[-2] -> 0 | AK13: =RC[-1]-RC[-2] -> 0 | AO13: =RC[-1]-RC[-2] -> 0 | AS13: =RC[-1]-RC[-2] -> 0 | AW13: =RC[-1]-RC[-2] -> 0 | BA13: =RC[-1]-RC[-2] -> 0 | BE13: =RC[-1]-RC[-2] -> 0 | BI13: =RC[-1]-RC[-2] -> 0 | BM13: =RC[-1]-RC[-2] -> 0 | BQ13: =RC[-1]-RC[-2] -> 0 | BU13: =RC[-1]-RC[-2] -> 0 | BY13: =RC[-1]-RC[-2] -> 0 | CC13: =RC[-1]-RC[-2] -> 0 | CG13: =RC[-1]-RC[-2] -> 0 | CK13: =RC[-1]-RC[-2] -> 0 | CM13: =RC[-4]+RC[-8]+RC[-12]+RC[-16]+RC[-20]+RC[-24]+RC[-28]+RC[-32]+RC[-36]+RC[-40]+RC[-44]+RC[-48]+RC[-52]+RC[-56]+RC[-60]+RC[-64]+RC[-68]+RC[-72]+RC[-76]+RC[-80]+RC[-84]+RC[-88] -> 0 | CN13: =RC[-4]+RC[-8]+RC[-12]+RC[-16]+RC[-20]+RC[-24]+RC[-28]+RC[-32]+RC[-36]+RC[-40]+RC[-44]+RC[-48]+RC[-52]+RC[-56]+RC[-60]+RC[-64]+RC[-68]+RC[-72]+RC[-76]+RC[-80]+RC[-84]+RC[-88] -> 0 | CO13: =RC[-1]-RC[-2] -> 0
B14: ПК НВМ (ООО "Профит") | E14: =RC[-1]-RC[-2] -> 0 | I14: =RC[-1]-RC[-2] -> 0 | M14: =RC[-1]-RC[-2] -> 0 | Q14: =RC[-1]-RC[-2] -> 0 | U14: =RC[-1]-RC[-2] -> 0 | Y14: =RC[-1]-RC[-2] -> 0 | AC14: =RC[-1]-RC[-2] -> 0 | AG14: =RC[-1]-RC[-2] -> 0 | AK14: =RC[-1]-RC[-2] -> 0 | AO14: =RC[-1]-RC[-2] -> 0 | AS14: =RC[-1]-RC[-2] -> 0 | AW14: =RC[-1]-RC[-2] -> 0 | BA14: =RC[-1]-RC[-2] -> 0 | BE14: =RC[-1]-RC[-2] -> 0 | BI14: =RC[-1]-RC[-2] -> 0 | BM14: =RC[-1]-RC[-2] -> 0 | BQ14: =RC[-1]-RC[-2] -> 0 | BU14: =RC[-1]-RC[-2] -> 0 | BY14: =RC[-1]-RC[-2] -> 0 | CC14: =RC[-1]-RC[-2] -> 0 | CG14: =RC[-1]-RC[-2] -> 0 | CK14: =RC[-1]-RC[-2] -> 0 | CM14: =RC[-4]+RC[-8]+RC[-12]+RC[-16]+RC[-20]+RC[-24]+RC[-28]+RC[-32]+RC[-36]+RC[-40]+RC[-44]+RC[-48]+RC[-52]+RC[-56]+RC[-60]+RC[-64]+RC[-68]+RC[-72]+RC[-76]+RC[-80]+RC[-84]+RC[-88] -> 0 | CN14: =RC[-4]+RC[-8]+RC[-12]+RC[-16]+RC[-20]+RC[-24]+RC[-28]+RC[-32]+RC[-36]+RC[-40]+RC[-44]+RC[-48]+RC[-52]+RC[-56]+RC[-60]+RC[-64]+RC[-68]+RC[-72]+RC[-76]+RC[-80]+RC[-84]+RC[-88] -> 0 | CO14: =RC[-1]-RC[-2] -> 0
B15: ООО "ИнтерметГрупп" | E15: =RC[-1]-RC[-2] -> 0 | I15: =RC[-1]-RC[-2] -> 0 | M15: =RC[-1]-RC[-2] -> 0 | Q15: =RC[-1]-RC[-2] -> 0 | U15: =RC[-1]-RC[-2] -> 0 | Y15: =RC[-1]-RC[-2] -> 0 | AC15: =RC[-1]-RC[-2] -> 0 | AG15: =RC[-1]-RC[-2] -> 0 | AK15: =RC[-1]-RC[-2] -> 0 | AO15: =RC[-1]-RC[-2] -> 0 | AS15: =RC[-1]-RC[-2] -> 0 | AW15: =RC[-1]-RC[-2] -> 0 | BA15: =RC[-1]-RC[-2] -> 0 | BE15: =RC[-1]-RC[-2] -> 0 | BI15: =RC[-1]-RC[-2] -> 0 | BM15: =RC[-1]-RC[-2] -> 0 | BQ15: =RC[-1]-RC[-2] -> 0 | BU15: =RC[-1]-RC[-2] -> 0 | BY15: =RC[-1]-RC[-2] -> 0 | CC15: =RC[-1]-RC[-2] -> 0 | CG15: =RC[-1]-RC[-2] -> 0 | CK15: =RC[-1]-RC[-2] -> 0 | CM15: =RC[-4]+RC[-8]+RC[-12]+RC[-16]+RC[-20]+RC[-24]+RC[-28]+RC[-32]+RC[-36]+RC[-40]+RC[-44]+RC[-48]+RC[-52]+RC[-56]+RC[-60]+RC[-64]+RC[-68]+RC[-72]+RC[-76]+RC[-80]+RC[-84]+RC[-88] -> 0 | CN15: =RC[-4]+RC[-8]+RC[-12]+RC[-16]+RC[-20]+RC[-24]+RC[-28]+RC[-32]+RC[-36]+RC[-40]+RC[-44]+RC[-48]+RC[-52]+RC[-56]+RC[-60]+RC[-64]+RC[-68]+RC[-72]+RC[-76]+RC[-80]+RC[-84]+RC[-88] -> 0 | CO15: =RC[-1]-RC[-2] -> 0
B16: Прочие | E16: =RC[-1]-RC[-2] -> 0 | I16: =RC[-1]-RC[-2] -> 0 | M16: =RC[-1]-RC[-2] -> 0 | Q16: =RC[-1]-RC[-2] -> 0 | U16: =RC[-1]-RC[-2] -> 0 | Y16: =RC[-1]-RC[-2] -> 0 | AC16: =RC[-1]-RC[-2] -> 0 | AG16: =RC[-1]-RC[-2] -> 0 | AK16: =RC[-1]-RC[-2] -> 0 | AO16: =RC[-1]-RC[-2] -> 0 | AS16: =RC[-1]-RC[-2] -> 0 | AW16: =RC[-1]-RC[-2] -> 0 | BA16: =RC[-1]-RC[-2] -> 0 | BE16: =RC[-1]-RC[-2] -> 0 | BI16: =RC[-1]-RC[-2] -> 0 | BM16: =RC[-1]-RC[-2] -> 0 | BQ16: =RC[-1]-RC[-2] -> 0 | BU16: =RC[-1]-RC[-2] -> 0 | BY16: =RC[-1]-RC[-2] -> 0 | CC16: =RC[-1]-RC[-2] -> 0 | CG16: =RC[-1]-RC[-2] -> 0 | CK16: =RC[-1]-RC[-2] -> 0 | CM16: =RC[-4]+RC[-8]+RC[-12]+RC[-16]+RC[-20]+RC[-24]+RC[-28]+RC[-32]+RC[-36]+RC[-40]+RC[-44]+RC[-48]+RC[-52]+RC[-56]+RC[-60]+RC[-64]+RC[-68]+RC[-72]+RC[-76]+RC[-80]+RC[-84]+RC[-88] -> 0 | CN16: =RC[-4]+RC[-8]+RC[-12]+RC[-16]+RC[-20]+RC[-24]+RC[-28]+RC[-32]+RC[-36]+RC[-40]+RC[-44]+RC[-48]+RC[-52]+RC[-56]+RC[-60]+RC[-64]+RC[-68]+RC[-72]+RC[-76]+RC[-80]+RC[-84]+RC[-88] -> 0 | CO16: =RC[-1]-RC[-2] -> 0
A17: ИТОГО за день: | C17: =SUM(R[-14]C:R[-1]C) -> 0 | D17: =SUM(R[-14]C:R[-1]C) -> 0 | E17: =RC[-1]-RC[-2] -> 0 | G17: =SUM(R[-14]C:R[-1]C) -> 0 | H17: =SUM(R[-14]C:R[-1]C) -> 0 | I17: =RC[-1]-RC[-2] -> 0 | K17: =SUM(R[-14]C:R[-1]C) -> 0 | L17: =SUM(R[-14]C:R[-1]C) -> 0 | M17: =RC[-1]-RC[-2] -> 0 | O17: =SUM(R[-14]C:R[-1]C) -> 0 | P17: =SUM(R[-14]C:R[-1]C) -> 0 | Q17: =RC[-1]-RC[-2] -> 0 | S17: =SUM(R[-14]C:R[-1]C) -> 0 | T17: =SUM(R[-14]C:R[-1]C) -> 0 | U17: =RC[-1]-RC[-2] -> 0 | W17: =SUM(R[-14]C:R[-1]C) -> 0 | X17: =SUM(R[-14]C:R[-1]C) -> 0 | Y17: =RC[-1]-RC[-2] -> 0 | AA17: =SUM(R[-14]C:R[-1]C) -> 0 | AB17: =SUM(R[-14]C:R[-1]C) -> 0 | AC17: =RC[-1]-RC[-2] -> 0 | AE17: =SUM(R[-14]C:R[-1]C) -> 0 | AF17: =SUM(R[-14]C:R[-1]C) -> 0 | AG17: =RC[-1]-RC[-2] -> 0 | AI17: =SUM(R[-14]C:R[-1]C) -> 0 | AJ17: =SUM(R[-14]C:R[-1]C) -> 0 | AK17: =RC[-1]-RC[-2] -> 0 | AM17: =SUM(R[-14]C:R[-1]C) -> 0 | AN17: =SUM(R[-14]C:R[-1]C) -> 0 | AO17: =RC[-1]-RC[-2] -> 0 | AQ17: =SUM(R[-14]C:R[-1]C) -> 0 | AR17: =SUM(R[-14]C:R[-1]C) -> 0 | AS17: =RC[-1]-RC[-2] -> 0 | AU17: =SUM(R[-14]C:R[-1]C) -> 0 | AV17: =SUM(R[-14]C:R[-1]C) -> 0 | AW17: =RC[-1]-RC[-2] -> 0 | AY17: =SUM(R[-14]C:R[-1]C) -> 0 | AZ17: =SUM(R[-14]C:R[-1]C) -> 0 | BA17: =RC[-1]-RC[-2] -> 0 | BC17: =SUM(R[-14]C:R[-1]C) -> 0 | BD17: =SUM(R[-14]C:R[-1]C) -> 0 | BE17: =RC[-1]-RC[-2] -> 0 | BG17: =SUM(R[-14]C:R[-1]C) -> 0 | BH17: =SUM(R[-14]C:R[-1]C) -> 0 | BI17: =RC[-1]-RC[-2] -> 0 | BK17: =SUM(R[-14]C:R[-1]C) -> 0 | BL17: =SUM(R[-14]C:R[-1]C) -> 0 | BM17: =RC[-1]-RC[-2] -> 0 | BO17: =SUM(R[-14]C:R[-1]C) -> 0 | BP17: =SUM(R[-14]C:R[-1]C) -> 0 | BQ17: =RC[-1]-RC[-2] -> 0 | BS17: =SUM(R[-14]C:R[-1]C) -> 0 | BT17: =SUM(R[-14]C:R[-1]C) -> 0 | BU17: =RC[-1]-RC[-2] -> 0 | BW17: =SUM(R[-14]C:R[-1]C) -> 0 | BX17: =SUM(R[-14]C:R[-1]C) -> 0 | BY17: =RC[-1]-RC[-2] -> 0 | CA17: =SUM(R[-14]C:R[-1]C) -> 0 | CB17: =SUM(R[-14]C:R[-1]C) -> 0 | CC17: =RC[-1]-RC[-2] -> 0 | CE17: =SUM(R[-14]C:R[-1]C) -> 0 | CF17: =SUM(R[-14]C:R[-1]C) -> 0 | CG17: =RC[-1]-RC[-2] -> 0 | CI17: =SUM(R[-14]C:R[-1]C) -> 0 | CJ17: =SUM(R[-14]C:R[-1]C) -> 0 | CK17: =RC[-1]-RC[-2] -> 0 | CM17: =RC[-4]+RC[-8]+RC[-12]+RC[-16]+RC[-20]+RC[-24]+RC[-28]+RC[-32]+RC[-36]+RC[-40]+RC[-44]+RC[-48]+RC[-52]+RC[-56]+RC[-60]+RC[-64]+RC[-68]+RC[-72]+RC[-76]+RC[-80]+RC[-84]+RC[-88] -> 0 | CN17: =RC[-4]+RC[-8]+RC[-12]+RC[-16]+RC[-20]+RC[-24]+RC[-28]+RC[-32]+RC[-36]+RC[-40]+RC[-44]+RC[-48]+RC[-52]+RC[-56]+RC[-60]+RC[-64]+RC[-68]+RC[-72]+RC[-76]+RC[-80]+RC[-84]+RC[-88] -> 0 | CO17: =RC[-1]-RC[-2] -> 0
A18: Эксплуатируемый парк локомотивов: | C18: 2 | E18: =RC[-1]-RC[-2] -> -2 | G18: 2 | I18: =RC[-1]-RC[-2] -> -2 | K18: 2 | M18: =RC[-1]-RC[-2] -> -2 | O18: 2 | Q18: =RC[-1]-RC[-2] -> -2 | S18: 2 | U18: =RC[-1]-RC[-2] -> -2 | W18: 2 | Y18: =RC[-1]-RC[-2] -> -2 | AA18: 2 | AC18: =RC[-1]-RC[-2] -> -2 | AE18: 2 | AG18: =RC[-1]-RC[-2] -> -2 | AI18: 2 | AK18: =RC[-1]-RC[-2] -> -2 | AM18: 2 | AO18: =RC[-1]-RC[-2] -> -2 | AQ18: 2 | AS18: =RC[-1]-RC[-2] -> -2 | AU18: 2 | AW18: =RC[-1]-RC[-2] -> -2 | AY18: 2 | BA18: =RC[-1]-RC[-2] -> -2 | BC18: 2 | BE18: =RC[-1]-RC[-2] -> -2 | BG18: 2 | BI18: =RC[-1]-RC[-2] -> -2 | BK18: 2 | BM18: =RC[-1]-RC[-2] -> -2 | BO18: 2 | BQ18: =RC[-1]-RC[-2] -> -2 | BS18: 2 | BU18: =RC[-1]-RC[-2] -> -2 | BW18: 2 | BY18: =RC[-1]-RC[-2] -> -2 | CA18: 2 | CC18: =RC[-1]-RC[-2] -> -2 | CE18: 2 | CG18: =RC[-1]-RC[-2] -> -2 | CI18: 2 | CK18: =RC[-1]-RC[-2] -> -2 | CM18: =AVERAGE(RC[-4], RC[-8], RC[-12], RC[-16], RC[-20], RC[-24], RC[-28], RC[-32], RC[-36], RC[-40], RC[-44], RC[-48], RC[-52], RC[-56], RC[-60], RC[-64], RC[-68], RC[-72], RC[-76], RC[-80], RC[-84],RC[-88]) -> 2 | CN18: =AVERAGE(RC[-4], RC[-8], RC[-12], RC[-16], RC[-20], RC[-24], RC[-28], RC[-32], RC[-36], RC[-40], RC[-44], RC[-48], RC[-52], RC[-56], RC[-60], RC[-64], RC[-68], RC[-72], RC[-76], RC[-80], RC[-84],RC[-88]) -> #DIV/0! | CO18: =RC[-1]-RC[-2] -> #DIV/0!
A19: * - причины отклонения
A21: Причины отклонения по вагонам:
A22: 1. | B22: Погодные условия
A23: 2. | B23: Отсутствие четкого планирования со стороны клиента
A24: 3. | B24: Запрет на отправление со стороны ОАО "РЖД"
A25: 4. | B25: Снятие запрета на отправление со стороны ОАО "РЖД"
A26: 5. | B26: Отсутствие заготовки перевозочных документов в АС ЭТРАН
A27: 6. | B27: Появление заготовки перевозочных документов в АС ЭТРАН
A28: 7. | B28: Наличие заявки на обработку со стороны клиента на большее кол-во вагонов
A29: 8. | B29: Заключение договора на подачу/уборку вагонов с новым клиентом
A30: 9. | B30: Вагоны не готовы к уборке с грузового фронта по вине клиента
A32: Причины отклонения по локомотивам:
A33: 1. | B33: Переработано вагонов более заявленного кол-ва
A34: 2. | B34: Наличие аварийной заявки на обработку от клиента
A35: 3. | B35: Внутренняя работа (работа с путевой техникой, обработка депо и др.)
A36: 4. | B36: Испытание локомобиля
A37: 5. | B37: Отказ от заявки на обработку грузового фронта от клиента

Sheet: сентябрь
A1: Число | C1: 1 | G1: 2 | K1: 3 | O1: 4 | S1: 7 | W1: 8 | AA1: 9 | AE1: 10 | AI1: 11 | AM1: 14 | AQ1: 15 | AU1: 16 | AY1: 17 | BC1: 18 | BG1: 21 | BK1: 22 | BO1: 23 | BS1: 24 | BW1: 25 | CA1: 28 | CE1: 29 | CI1: 30 | CM1: Итого
A2: Клиенты | C2: план | D2: факт | E2: откл-е | F2: * | G2: план | H2: факт | I2: откл-е | J2: * | K2: план | L2: факт | M2: откл-е | N2: * | O2: план | P2: факт | Q2: откл-е | R2: * | S2: план | T2: факт | U2: откл-е | V2: * | W2: план | X2: факт | Y2: откл-е | Z2: * | AA2: план | AB2: факт | AC2: откл-е | AD2: * | AE2: план | AF2: факт | AG2: откл-е | AH2: * | AI2: план | AJ2: факт | AK2: откл-е | AL2: * | AM2: план | AN2: факт | AO2: откл-е | AP2: * | AQ2: план | AR2: факт | AS2: откл-е | AT2: * | AU2: план | AV2: факт | AW2: откл-е | AX2: * | AY2: план | AZ2: факт | BA2: откл-е | BB2: * | BC2: план | BD2: факт | BE2: откл-е | BF2: * | BG2: план | BH2: факт | BI2: откл-е | BJ2: * | BK2: план | BL2: факт | BM2: откл-е | BN2: * | BO2: план | BP2: факт | BQ2: откл-е | BR2: * | BS2: план | BT2: факт | BU2: откл-е | BV2: * | BW2: план | BX2: факт | BY2: откл-е | BZ2: * | CA2: план | CB2: факт | CC2: откл-е | CD2: * | CE2: план | CF2: факт | CG2: откл-е | CH2: * | CI2: план | CJ2: факт | CK2: откл-е | CL2: * | CM2: план | CN2: факт | CO2: откл-е
A3: БЕ ООО "НАК" | B3: ЛЗ | E3: =RC[-1]-RC[-2] -> 0 | I3: =RC[-1]-RC[-2] -> 0 | M3: =RC[-1]-RC[-2] -> 0 | Q3: =RC[-1]-RC[-2] -> 0 | U3: =RC[-1]-RC[-2] -> 0 | Y3: =RC[-1]-RC[-2] -> 0 | AC3: =RC[-1]-RC[-2] -> 0 | AG3: =RC[-1]-RC[-2] -> 0 | AK3: =RC[-1]-RC[-2] -> 0 | AO3: =RC[-1]-RC[-2] -> 0 | AS3: =RC[-1]-RC[-2] -> 0 | AW3: =RC[-1]-RC[-2] -> 0 | BA3: =RC[-1]-RC[-2] -> 0 | BE3: =RC[-1]-RC[-2] -> 0 | BI3: =RC[-1]-RC[-2] -> 0 | BM3: =RC[-1]-RC[-2] -> 0 | BQ3: =RC[-1]-RC[-2] -> 0 | BU3: =RC[-1]-RC[-2] -> 0 | BY3: =RC[-1]-RC[-2] -> 0 | CC3: =RC[-1]-RC[-2] -> 0 | CG3: =RC[-1]-RC[-2] -> 0 | CK3: =RC[-1]-RC[-2] -> 0 | CM3: =RC[-4]+RC[-8]+RC[-12]+RC[-16]+RC[-20]+RC[-24]+RC[-28]+RC[-32]+RC[-36]+RC[-40]+RC[-44]+RC[-48]+RC[-52]+RC[-56]+RC[-60]+RC[-64]+RC[-68]+RC[-72]+RC[-76]+RC[-80]+RC[-84]+RC[-88] -> 0 | CN3: =RC[-4]+RC[-8]+RC[-12]+RC[-16]+RC[-20]+RC[-24]+RC[-28]+RC[-32]+RC[-36]+RC[-40]+RC[-44]+RC[-48]+RC[-52]+RC[-56]+RC[-60]+RC[-64]+RC[-68]+RC[-72]+RC[-76]+RC[-80]+RC[-84]+RC[-88] -> 0 | CO3: =RC[-1]-RC[-2] -> 0
B4: ПРЗ | E4: =RC[-1]-RC[-2] -> 0 | I4: =RC[-1]-RC[-2] -> 0 | M4: =RC[-1]-RC[-2] -> 0 | Q4: =RC[-1]-RC[-2] -> 0 | U4: =RC[-1]-RC[-2] -> 0 | Y4: =RC[-1]-RC[-2] -> 0 | AC4: =RC[-1]-RC[-2] -> 0 | AG4: =RC[-1]-RC[-2] -> 0 | AK4: =RC[-1]-RC[-2] -> 0 | AO4: =RC[-1]-RC[-2] -> 0 | AS4: =RC[-1]-RC[-2] -> 0 | AW4: =RC[-1]-RC[-2] -> 0 | BA4: =RC[-1]-RC[-2] -> 0 | BE4: =RC[-1]-RC[-2] -> 0 | BI4: =RC[-1]-RC[-2] -> 0 | BM4: =RC[-1]-RC[-2] -> 0 | BQ4: =RC[-1]-RC[-2] -> 0 | BU4: =RC[-1]-RC[-2] -> 0 | BY4: =RC[-1]-RC[-2] -> 0 | CC4: =RC[-1]-RC[-2] -> 0 | CG4: =RC[-1]-RC[-2] -> 0 | CK4: =RC[-1]-RC[-2] -> 0 | CM4: =RC[-4]+RC[-8]+RC[-12]+RC[-16]+RC[-20]+RC[-24]+RC[-28]+RC[-32]+RC[-36]+RC[-40]+RC[-44]+RC[-48]+RC[-52]+RC[-56]+RC[-60]+RC[-64]+RC[-68]+RC[-72]+RC[-76]+RC[-80]+RC[-84]+RC[-88] -> 0 | CN4: =RC[-4]+RC[-8]+RC[-12]+RC[-16]+RC[-20]+RC[-24]+RC[-28]+RC[-32]+RC[-36]+RC[-40]+RC[-44]+RC[-48]+RC[-52]+RC[-56]+RC[-60]+RC[-64]+RC[-68]+RC[-72]+RC[-76]+RC[-80]+RC[-84]+RC[-88] -> 0 | CO4: =RC[-1]-RC[-2] -> 0
A5: ООО "НАК" | B5: ЗШП | E5: =RC[-1]-RC[-2] -> 0 | I5: =RC[-1]-RC[-2] -> 0 | M5: =RC[-1]-RC[-2] -> 0 | Q5: =RC[-1]-RC[-2] -> 0 | U5: =RC[-1]-RC[-2] -> 0 | Y5: =RC[-1]-RC[-2] -> 0 | AC5: =RC[-1]-RC[-2] -> 0 | AG5: =RC[-1]-RC[-2] -> 0 | AK5: =RC[-1]-RC[-2] -> 0 | AO5: =RC[-1]-RC[-2] -> 0 | AS5: =RC[-1]-RC[-2] -> 0 | AW5: =RC[-1]-RC[-2] -> 0 | BA5: =RC[-1]-RC[-2] -> 0 | BE5: =RC[-1]-RC[-2] -> 0 | BI5: =RC[-1]-RC[-2] -> 0 | BM5: =RC[-1]-RC[-2] -> 0 | BQ5: =RC[-1]-RC[-2] -> 0 | BU5: =RC[-1]-RC[-2] -> 0 | BY5: =RC[-1]-RC[-2] -> 0 | CC5: =RC[-1]-RC[-2] -> 0 | CG5: =RC[-1]-RC[-2] -> 0 | CK5: =RC[-1]-RC[-2] -> 0 | CM5: =RC[-4]+RC[-8]+RC[-12]+RC[-16]+RC[-20]+RC[-24]+RC[-28]+RC[-32]+RC[-36]+RC[-40]+RC[-44]+RC[-48]+RC[-52]+RC[-56]+RC[-60]+RC[-64]+RC[-68]+RC[-72]+RC[-76]+RC[-80]+RC[-84]+RC[-88] -> 0 | CN5: =RC[-4]+RC[-8]+RC[-12]+RC[-16]+RC[-20]+RC[-24]+RC[-28]+RC[-32]+RC[-36]+RC[-40]+RC[-44]+RC[-48]+RC[-52]+RC[-56]+RC[-60]+RC[-64]+RC[-68]+RC[-72]+RC[-76]+RC[-80]+RC[-84]+RC[-88] -> 0 | CO5: =RC[-1]-RC[-2] -> 0
B6: НАК | E6: =RC[-1]-RC[-2] -> 0 | I6: =RC[-1]-RC[-2] -> 0 | M6: =RC[-1]-RC[-2] -> 0 | Q6: =RC[-1]-RC[-2] -> 0 | U6: =RC[-1]-RC[-2] -> 0 | Y6: =RC[-1]-RC[-2] -> 0 | AC6: =RC[-1]-RC[-2] -> 0 | AG6: =RC[-1]-RC[-2] -> 0 | AK6: =RC[-1]-RC[-2] -> 0 | AO6: =RC[-1]-RC[-2] -> 0 | AS6: =RC[-1]-RC[-2] -> 0 | AW6: =RC[-1]-RC[-2] -> 0 | BA6: =RC[-1]-RC[-2] -> 0 | BE6: =RC[-1]-RC[-2] -> 0 | BI6: =RC[-1]-RC[-2] -> 0 | BM6: =RC[-1]-RC[-2] -> 0 | BQ6: =RC[-1]-RC[-2] -> 0 | BU6: =RC[-1]-RC[-2] -> 0 | BY6: =RC[-1]-RC[-2] -> 0 | CC6: =RC[-1]-RC[-2] -> 0 | CG6: =RC[-1]-RC[-2] -> 0 | CK6: =RC[-1]-RC[-2] -> 0 | CM6: =RC[-4]+RC[-8]+RC[-12]+RC[-16]+RC[-20]+RC[-24]+RC[-28]+RC[-32]+RC[-36]+RC[-40]+RC[-44]+RC[-48]+RC[-52]+RC[-56]+RC[-60]+RC[-64]+RC[-68]+RC[-72]+RC[-76]+RC[-80]+RC[-84]+RC[-88] -> 0 | CN6: =RC[-4]+RC[-8]+RC[-12]+RC[-16]+RC[-20]+RC[-24]+RC[-28]+RC[-32]+RC[-36]+RC[-40]+RC[-44]+RC[-48]+RC[-52]+RC[-56]+RC[-60]+RC[-64]+RC[-68]+RC[-72]+RC[-76]+RC[-80]+RC[-84]+RC[-88] -> 0 | CO6: =RC[-1]-RC[-2] -> 0
B7: НЛЗ | E7: =RC[-1]-RC[-2] -> 0 | I7: =RC[-1]-RC[-2] -> 0 | M7: =RC[-1]-RC[-2] -> 0 | Q7: =RC[-1]-RC[-2] -> 0 | U7: =RC[-1]-RC[-2] -> 0 | Y7: =RC[-1]-RC[-2] -> 0 | AC7: =RC[-1]-RC[-2] -> 0 | AG7: =RC[-1]-RC[-2] -> 0 | AK7: =RC[-1]-RC[-2] -> 0 | AO7: =RC[-1]-RC[-2] -> 0 | AS7: =RC[-1]-RC[-2] -> 0 | AW7: =RC[-1]-RC[-2] -> 0 | BA7: =RC[-1]-RC[-2] -> 0 | BE7: =RC[-1]-RC[-2] -> 0 | BI7: =RC[-1]-RC[-2] -> 0 | BM7: =RC[-1]-RC[-2] -> 0 | BQ7: =RC[-1]-RC[-2] -> 0 | BU7: =RC[-1]-RC[-2] -> 0 | BY7: =RC[-1]-RC[-2] -> 0 | CC7: =RC[-1]-RC[-2] -> 0 | CG7: =RC[-1]-RC[-2] -> 0 | CK7: =RC[-1]-RC[-2] -> 0 | CM7: =RC[-4]+RC[-8]+RC[-12]+RC[-16]+RC[-20]+RC[-24]+RC[-28]+RC[-32]+RC[-36]+RC[-40]+RC[-44]+RC[-48]+RC[-52]+RC[-56]+RC[-60]+RC[-64]+RC[-68]+RC[-72]+RC[-76]+RC[-80]+RC[-84]+RC[-88] -> 0 | CN7: =RC[-4]+RC[-8]+RC[-12]+RC[-16]+RC[-20]+RC[-24]+RC[-28]+RC[-32]+RC[-36]+RC[-40]+RC[-44]+RC[-48]+RC[-52]+RC[-56]+RC[-60]+RC[-64]+RC[-68]+RC[-72]+RC[-76]+RC[-80]+RC[-84]+RC[-88] -> 0 | CO7: =RC[-1]-RC[-2] -> 0
A8: ООО "НАЗ", АО "НГА" | B8: АЗ "НАЗ" | E8: =RC[-1]-RC[-2] -> 0 | I8: =RC[-1]-RC[-2] -> 0 | M8: =RC[-1]-RC[-2] -> 0 | Q8: =RC[-1]-RC[-2] -> 0 | U8: =RC[-1]-RC[-2] -> 0 | Y8: =RC[-1]-RC[-2] -> 0 | AC8: =RC[-1]-RC[-2] -> 0 | AG8: =RC[-1]-RC[-2] -> 0 | AK8: =RC[-1]-RC[-2] -> 0 | AO8: =RC[-1]-RC[-2] -> 0 | AS8: =RC[-1]-RC[-2] -> 0 | AW8: =RC[-1]-RC[-2] -> 0 | BA8: =RC[-1]-RC[-2] -> 0 | BE8: =RC[-1]-RC[-2] -> 0 | BI8: =RC[-1]-RC[-2] -> 0 | BM8: =RC[-1]-RC[-2] -> 0 | BQ8: =RC[-1]-RC[-2] -> 0 | BU8: =RC[-1]-RC[-2] -> 0 | BY8: =RC[-1]-RC[-2] -> 0 | CC8: =RC[-1]-RC[-2] -> 0 | CG8: =RC[-1]-RC[-2] -> 0 | CK8: =RC[-1]-RC[-2] -> 0 | CM8: =RC[-4]+RC[-8]+RC[-12]+RC[-16]+RC[-20]+RC[-24]+RC[-28]+RC[-32]+RC[-36]+RC[-40]+RC[-44]+RC[-48]+RC[-52]+RC[-56]+RC[-60]+RC[-64]+RC[-68]+RC[-72]+RC[-76]+RC[-80]+RC[-84]+RC[-88] -> 0 | CN8: =RC[-4]+RC[-8]+RC[-12]+RC[-16]+RC[-20]+RC[-24]+RC[-28]+RC[-32]+RC[-36]+RC[-40]+RC[-44]+RC[-48]+RC[-52]+RC[-56]+RC[-60]+RC[-64]+RC[-68]+RC[-72]+RC[-76]+RC[-80]+RC[-84]+RC[-88] -> 0 | CO8: =RC[-1]-RC[-2] -> 0
B9: АО "НГА" | E9: =RC[-1]-RC[-2] -> 0 | I9: =RC[-1]-RC[-2] -> 0 | M9: =RC[-1]-RC[-2] -> 0 | Q9: =RC[-1]-RC[-2] -> 0 | U9: =RC[-1]-RC[-2] -> 0 | Y9: =RC[-1]-RC[-2] -> 0 | AC9: =RC[-1]-RC[-2] -> 0 | AG9: =RC[-1]-RC[-2] -> 0 | AK9: =RC[-1]-RC[-2] -> 0 | AO9: =RC[-1]-RC[-2] -> 0 | AS9: =RC[-1]-RC[-2] -> 0 | AW9: =RC[-1]-RC[-2] -> 0 | BA9: =RC[-1]-RC[-2] -> 0 | BE9: =RC[-1]-RC[-2] -> 0 | BI9: =RC[-1]-RC[-2] -> 0 | BM9: =RC[-1]-RC[-2] -> 0 | BQ9: =RC[-1]-RC[-2] -> 0 | BU9: =RC[-1]-RC[-2] -> 0 | BY9: =RC[-1]-RC[-2] -> 0 | CC9: =RC[-1]-RC[-2] -> 0 | CG9: =RC[-1]-RC[-2] -> 0 | CK9: =RC[-1]-RC[-2] -> 0 | CM9: =RC[-4]+RC[-8]+RC[-12]+RC[-16]+RC[-20]+RC[-24]+RC[-28]+RC[-32]+RC[-36]+RC[-40]+RC[-44]+RC[-48]+RC[-52]+RC[-56]+RC[-60]+RC[-64]+RC[-68]+RC[-72]+RC[-76]+RC[-80]+RC[-84]+RC[-88] -> 0 | CN9: =RC[-4]+RC[-8]+RC[-12]+RC[-16]+RC[-20]+RC[-24]+RC[-28]+RC[-32]+RC[-36]+RC[-40]+RC[-44]+RC[-48]+RC[-52]+RC[-56]+RC[-60]+RC[-64]+RC[-68]+RC[-72]+RC[-76]+RC[-80]+RC[-84]+RC[-88] -> 0 | CO9: =RC[-1]-RC[-2] -> 0
A10: Сторонние внутренние | B10: КА-Группа ГАЗ( Вьетнам) | E10: =RC[-1]-RC[-2] -> 0 | I10: =RC[-1]-RC[-2] -> 0 | M10: =RC[-1]-RC[-2] -> 0 | Q10: =RC[-1]-RC[-2] -> 0 | U10: =RC[-1]-RC[-2] -> 0 | Y10: =RC[-1]-RC[-2] -> 0 | AC10: =RC[-1]-RC[-2] -> 0 | AG10: =RC[-1]-RC[-2] -> 0 | AK10: =RC[-1]-RC[-2] -> 0 | AO10: =RC[-1]-RC[-2] -> 0 | AS10: =RC[-1]-RC[-2] -> 0 | AW10: =RC[-1]-RC[-2] -> 0 | BA10: =RC[-1]-RC[-2] -> 0 | BE10: =RC[-1]-RC[-2] -> 0 | BI10: =RC[-1]-RC[-2] -> 0 | BM10: =RC[-1]-RC[-2] -> 0 | BQ10: =RC[-1]-RC[-2] -> 0 | BU10: =RC[-1]-RC[-2] -> 0 | BY10: =RC[-1]-RC[-2] -> 0 | CC10: =RC[-1]-RC[-2] -> 0 | CG10: =RC[-1]-RC[-2] -> 0 | CK10: =RC[-1]-RC[-2] -> 0 | CM10: =RC[-4]+RC[-8]+RC[-12]+RC[-16]+RC[-20]+RC[-24]+RC[-28]+RC[-32]+RC[-36]+RC[-40]+RC[-44]+RC[-48]+RC[-52]+RC[-56]+RC[-60]+RC[-64]+RC[-68]+RC[-72]+RC[-76]+RC[-80]+RC[-84]+RC[-88] -> 0 | CN10: =RC[-4]+RC[-8]+RC[-12]+RC[-16]+RC[-20]+RC[-24]+RC[-28]+RC[-32]+RC[-36]+RC[-40]+RC[-44]+RC[-48]+RC[-52]+RC[-56]+RC[-60]+RC[-64]+RC[-68]+RC[-72]+RC[-76]+RC[-80]+RC[-84]+RC[-88] -> 0 | CO10: =RC[-1]-RC[-2] -> 0
B11: Платформа А | E11: =RC[-1]-RC[-2] -> 0 | I11: =RC[-1]-RC[-2] -> 0 | M11: =RC[-1]-RC[-2] -> 0 | Q11: =RC[-1]-RC[-2] -> 0 | U11: =RC[-1]-RC[-2] -> 0 | Y11: =RC[-1]-RC[-2] -> 0 | AC11: =RC[-1]-RC[-2] -> 0 | AG11: =RC[-1]-RC[-2] -> 0 | AK11: =RC[-1]-RC[-2] -> 0 | AO11: =RC[-1]-RC[-2] -> 0 | AS11: =RC[-1]-RC[-2] -> 0 | AW11: =RC[-1]-RC[-2] -> 0 | BA11: =RC[-1]-RC[-2] -> 0 | BE11: =RC[-1]-RC[-2] -> 0 | BI11: =RC[-1]-RC[-2] -> 0 | BM11: =RC[-1]-RC[-2] -> 0 | BQ11: =RC[-1]-RC[-2] -> 0 | BU11: =RC[-1]-RC[-2] -> 0 | BY11: =RC[-1]-RC[-2] -> 0 | CC11: =RC[-1]-RC[-2] -> 0 | CG11: =RC[-1]-RC[-2] -> 0 | CK11: =RC[-1]-RC[-2] -> 0 | CM11: =RC[-4]+RC[-8]+RC[-12]+RC[-16]+RC[-20]+RC[-24]+RC[-28]+RC[-32]+RC[-36]+RC[-40]+RC[-44]+RC[-48]+RC[-52]+RC[-56]+RC[-60]+RC[-64]+RC[-68]+RC[-72]+RC[-76]+RC[-80]+RC[-84]+RC[-88] -> 0 | CN11: =RC[-4]+RC[-8]+RC[-12]+RC[-16]+RC[-20]+RC[-24]+RC[-28]+RC[-32]+RC[-36]+RC[-40]+RC[-44]+RC[-48]+RC[-52]+RC[-56]+RC[-60]+RC[-64]+RC[-68]+RC[-72]+RC[-76]+RC[-80]+RC[-84]+RC[-88] -> 0 | CO11: =RC[-1]-RC[-2] -> 0
A12: Сторонние внешние | B12: АО "ГОТХ" | E12: =RC[-1]-RC[-2] -> 0 | I12: =RC[-1]-RC[-2] -> 0 | M12: =RC[-1]-RC[-2] -> 0 | Q12: =RC[-1]-RC[-2] -> 0 | U12: =RC[-1]-RC[-2] -> 0 | Y12: =RC[-1]-RC[-2] -> 0 | AC12: =RC[-1]-RC[-2] -> 0 | AG12: =RC[-1]-RC[-2] -> 0 | AK12: =RC[-1]-RC[-2] -> 0 | AO12: =RC[-1]-RC[-2] -> 0 | AS12: =RC[-1]-RC[-2] -> 0 | AW12: =RC[-1]-RC[-2] -> 0 | BA12: =RC[-1]-RC[-2] -> 0 | BE12: =RC[-1]-RC[-2] -> 0 | BI12: =RC[-1]-RC[-2] -> 0 | BM12: =RC[-1]-RC[-2] -> 0 | BQ12: =RC[-1]-RC[-2] -> 0 | BU12: =RC[-1]-RC[-2] -> 0 | BY12: =RC[-1]-RC[-2] -> 0 | CC12: =RC[-1]-RC[-2] -> 0 | CG12: =RC[-1]-RC[-2] -> 0 | CK12: =RC[-1]-RC[-2] -> 0 | CM12: =RC[-4]+RC[-8]+RC[-12]+RC[-16]+RC[-20]+RC[-24]+RC[-28]+RC[-32]+RC[-36]+RC[-40]+RC[-44]+RC[-48]+RC[-52]+RC[-56]+RC[-60]+RC[-64]+RC[-68]+RC[-72]+RC[-76]+RC[-80]+RC[-84]+RC[-88] -> 0 | CN12: =RC[-4]+RC[-8]+RC[-12]+RC[-16]+RC[-20]+RC[-24]+RC[-28]+RC[-32]+RC[-36]+RC[-40]+RC[-44]+RC[-48]+RC[-52]+RC[-56]+RC[-60]+RC[-64]+RC[-68]+RC[-72]+RC[-76]+RC[-80]+RC[-84]+RC[-88] -> 0 | CO12: =RC[-1]-RC[-2] -> 0
B13: ООО "Нерудные материалы-НН" | E13: =RC[-1]-RC[-2] -> 0 | I13: =RC[-1]-RC[-2] -> 0 | M13: =RC[-1]-RC[-2] -> 0 | Q13: =RC[-1]-RC[-2] -> 0 | U13: =RC[-1]-RC[-2] -> 0 | Y13: =RC[-1]-RC[-2] -> 0 | AC13: =RC[-1]-RC[-2] -> 0 | AG13: =RC[-1]-RC[-2] -> 0 | AK13: =RC[-1]-RC[-2] -> 0 | AO13: =RC[-1]-RC[-2] -> 0 | AS13: =RC[-1]-RC[-2] -> 0 | AW13: =RC[-1]-RC[-2] -> 0 | BA13: =RC[-1]-RC[-2] -> 0 | BE13: =RC[-1]-RC[-2] -> 0 | BI13: =RC[-1]-RC[-2] -> 0 | BM13: =RC[-1]-RC[-2] -> 0 | BQ13: =RC[-1]-RC[-2] -> 0 | BU13: =RC[-1]-RC[-2] -> 0 | BY13: =RC[-1]-RC[-2] -> 0 | CC13: =RC[-1]-RC[-2] -> 0 | CG13: =RC[-1]-RC[-2] -> 0 | CK13: =RC[-1]-RC[-2] -> 0 | CM13: =RC[-4]+RC[-8]+RC[-12]+RC[-16]+RC[-20]+RC[-24]+RC[-28]+RC[-32]+RC[-36]+RC[-40]+RC[-44]+RC[-48]+RC[-52]+RC[-56]+RC[-60]+RC[-64]+RC[-68]+RC[-72]+RC[-76]+RC[-80]+RC[-84]+RC[-88] -> 0 | CN13: =RC[-4]+RC[-8]+RC[-12]+RC[-16]+RC[-20]+RC[-24]+RC[-28]+RC[-32]+RC[-36]+RC[-40]+RC[-44]+RC[-48]+RC[-52]+RC[-56]+RC[-60]+RC[-64]+RC[-68]+RC[-72]+RC[-76]+RC[-80]+RC[-84]+RC[-88] -> 0 | CO13: =RC[-1]-RC[-2] -> 0
B14: ПК НВМ (ООО "Профит") | E14: =RC[-1]-RC[-2] -> 0 | I14: =RC[-1]-RC[-2] -> 0 | M14: =RC[-1]-RC[-2] -> 0 | Q14: =RC[-1]-RC[-2] -> 0 | U14: =RC[-1]-RC[-2] -> 0 | Y14: =RC[-1]-RC[-2] -> 0 | AC14: =RC[-1]-RC[-2] -> 0 | AG14: =RC[-1]-RC[-2] -> 0 | AK14: =RC[-1]-RC[-2] -> 0 | AO14: =RC[-1]-RC[-2] -> 0 | AS14: =RC[-1]-RC[-2] -> 0 | AW14: =RC[-1]-RC[-2] -> 0 | BA14: =RC[-1]-RC[-2] -> 0 | BE14: =RC[-1]-RC[-2] -> 0 | BI14: =RC[-1]-RC[-2] -> 0 | BM14: =RC[-1]-RC[-2] -> 0 | BQ14: =RC[-1]-RC[-2] -> 0 | BU14: =RC[-1]-RC[-2] -> 0 | BY14: =RC[-1]-RC[-2] -> 0 | CC14: =RC[-1]-RC[-2] -> 0 | CG14: =RC[-1]-RC[-2] -> 0 | CK14: =RC[-1]-RC[-2] -> 0 | CM14: =RC[-4]+RC[-8]+RC[-12]+RC[-16]+RC[-20]+RC[-24]+RC[-28]+RC[-32]+RC[-36]+RC[-40]+RC[-44]+RC[-48]+RC[-52]+RC[-56]+RC[-60]+RC[-64]+RC[-68]+RC[-72]+RC[-76]+RC[-80]+RC[-84]+RC[-88] -> 0 | CN14: =RC[-4]+RC[-8]+RC[-12]+RC[-16]+RC[-20]+RC[-24]+RC[-28]+RC[-32]+RC[-36]+RC[-40]+RC[-44]+RC[-48]+RC[-52]+RC[-56]+RC[-60]+RC[-64]+RC[-68]+RC[-72]+RC[-76]+RC[-80]+RC[-84]+RC[-88] -> 0 | CO14: =RC[-1]-RC[-2] -> 0
B15: ООО "ИнтерметГрупп" | E15: =RC[-1]-RC[-2] -> 0 | I15: =RC[-1]-RC[-2] -> 0 | M15: =RC[-1]-RC[-2] -> 0 | Q15: =RC[-1]-RC[-2] -> 0 | U15: =RC[-1]-RC[-2] -> 0 | Y15: =RC[-1]-RC[-2] -> 0 | AC15: =RC[-1]-RC[-2] -> 0 | AG15: =RC[-1]-RC[-2] -> 0 | AK15: =RC[-1]-RC[-2] -> 0 | AO15: =RC[-1]-RC[-2] -> 0 | AS15: =RC[-1]-RC[-2] -> 0 | AW15: =RC[-1]-RC[-2] -> 0 | BA15: =RC[-1]-RC[-2] -> 0 | BE15: =RC[-1]-RC[-2] -> 0 | BI15: =RC[-1]-RC[-2] -> 0 | BM15: =RC[-1]-RC[-2] -> 0 | BQ15: =RC[-1]-RC[-2] -> 0 | BU15: =RC[-1]-RC[-2] -> 0 | BY15: =RC[-1]-RC[-2] -> 0 | CC15: =RC[-1]-RC[-2] -> 0 | CG15: =RC[-1]-RC[-2] -> 0 | CK15: =RC[-1]-RC[-2] -> 0 | CM15: =RC[-4]+RC[-8]+RC[-12]+RC[-16]+RC[-20]+RC[-24]+RC[-28]+RC[-32]+RC[-36]+RC[-40]+RC[-44]+RC[-48]+RC[-52]+RC[-56]+RC[-60]+RC[-64]+RC[-68]+RC[-72]+RC[-76]+RC[-80]+RC[-84]+RC[-88] -> 0 | CN15: =RC[-4]+RC[-8]+RC[-12]+RC[-16]+RC[-20]+RC[-24]+RC[-28]+RC[-32]+RC[-36]+RC[-40]+RC[-44]+RC[-48]+RC[-52]+RC[-56]+RC[-60]+RC[-64]+RC[-68]+RC[-72]+RC[-76]+RC[-80]+RC[-84]+RC[-88] -> 0 | CO15: =RC[-1]-RC[-2] -> 0
B16: Прочие | E16: =RC[-1]-RC[-2] -> 0 | I16: =RC[-1]-RC[-2] -> 0 | M16: =RC[-1]-RC[-2] -> 0 | Q16: =RC[-1]-RC[-2] -> 0 | U16: =RC[-1]-RC[-2] -> 0 | Y16: =RC[-1]-RC[-2] -> 0 | AC16: =RC[-1]-RC[-2] -> 0 | AG16: =RC[-1]-RC[-2] -> 0 | AK16: =RC[-1]-RC[-2] -> 0 | AO16: =RC[-1]-RC[-2] -> 0 | AS16: =RC[-1]-RC[-2] -> 0 | AW16: =RC[-1]-RC[-2] -> 0 | BA16: =RC[-1]-RC[-2] -> 0 | BE16: =RC[-1]-RC[-2] -> 0 | BI16: =RC[-1]-RC[-2] -> 0 | BM16: =RC[-1]-RC[-2] -> 0 | BQ16: =RC[-1]-RC[-2] -> 0 | BU16: =RC[-1]-RC[-2] -> 0 | BY16: =RC[-1]-RC[-2] -> 0 | CC16: =RC[-1]-RC[-2] -> 0 | CG16: =RC[-1]-RC[-2] -> 0 | CK16: =RC[-1]-RC[-2] -> 0 | CM16: =RC[-4]+RC[-8]+RC[-12]+RC[-16]+RC[-20]+RC[-24]+RC[-28]+RC[-32]+RC[-36]+RC[-40]+RC[-44]+RC[-48]+RC[-52]+RC[-56]+RC[-60]+RC[-64]+RC[-68]+RC[-72]+RC[-76]+RC[-80]+RC[-84]+RC[-88] -> 0 | CN16: =RC[-4]+RC[-8]+RC[-12]+RC[-16]+RC[-20]+RC[-24]+RC[-28]+RC[-32]+RC[-36]+RC[-40]+RC[-44]+RC[-48]+RC[-52]+RC[-56]+RC[-60]+RC[-64]+RC[-68]+RC[-72]+RC[-76]+RC[-80]+RC[-84]+RC[-88] -> 0 | CO16: =RC[-1]-RC[-2] -> 0
A17: ИТОГО за день: | C17: =SUM(R[-14]C:R[-1]C) -> 0 | D17: =SUM(R[-14]C:R[-1]C) -> 0 | E17: =RC[-1]-RC[-2] -> 0 | G17: =SUM(R[-14]C:R[-1]C) -> 0 | H17: =SUM(R[-14]C:R[-1]C) -> 0 | I17: =RC[-1]-RC[-2] -> 0 | K17: =SUM(R[-14]C:R[-1]C) -> 0 | L17: =SUM(R[-14]C:R[-1]C) -> 0 | M17: =RC[-1]-RC[-2] -> 0 | O17: =SUM(R[-14]C:R[-1]C) -> 0 | P17: =SUM(R[-14]C:R[-1]C) -> 0 | Q17: =RC[-1]-RC[-2] -> 0 | S17: =SUM(R[-14]C:R[-1]C) -> 0 | T17: =SUM(R[-14]C:R[-1]C) -> 0 | U17: =RC[-1]-RC[-2] -> 0 | W17: =SUM(R[-14]C:R[-1]C) -> 0 | X17: =SUM(R[-14]C:R[-1]C) -> 0 | Y17: =RC[-1]-RC[-2] -> 0 | AA17: =SUM(R[-14]C:R[-1]C) -> 0 | AB17: =SUM(R[-14]C:R[-1]C) -> 0 | AC17: =RC[-1]-RC[-2] -> 0 | AE17: =SUM(R[-14]C:R[-1]C) -> 0 | AF17: =SUM(R[-14]C:R[-1]C) -> 0 | AG17: =RC[-1]-RC[-2] -> 0 | AI17: =SUM(R[-14]C:R[-1]C) -> 0 | AJ17: =SUM(R[-14]C:R[-1]C) -> 0 | AK17: =RC[-1]-RC[-2] -> 0 | AM17: =SUM(R[-14]C:R[-1]C) -> 0 | AN17: =SUM(R[-14]C:R[-1]C) -> 0 | AO17: =RC[-1]-RC[-2] -> 0 | AQ17: =SUM(R[-14]C:R[-1]C) -> 0 | AR17: =SUM(R[-14]C:R[-1]C) -> 0 | AS17: =RC[-1]-RC[-2] -> 0 | AU17: =SUM(R[-14]C:R[-1]C) -> 0 | AV17: =SUM(R[-14]C:R[-1]C) -> 0 | AW17: =RC[-1]-RC[-2] -> 0 | AY17: =SUM(R[-14]C:R[-1]C) -> 0 | AZ17: =SUM(R[-14]C:R[-1]C) -> 0 | BA17: =RC[-1]-RC[-2] -> 0 | BC17: =SUM(R[-14]C:R[-1]C) -> 0 | BD17: =SUM(R[-14]C:R[-1]C) -> 0 | BE17: =RC[-1]-RC[-2] -> 0 | BG17: =SUM(R[-14]C:R[-1]C) -> 0 | BH17: =SUM(R[-14]C:R[-1]C) -> 0 | BI17: =RC[-1]-RC[-2] -> 0 | BK17: =SUM(R[-14]C:R[-1]C) -> 0 | BL17: =SUM(R[-14]C:R[-1]C) -> 0 | BM17: =RC[-1]-RC[-2] -> 0 | BO17: =SUM(R[-14]C:R[-1]C) -> 0 | BP17: =SUM(R[-14]C:R[-1]C) -> 0 | BQ17: =RC[-1]-RC[-2] -> 0 | BS17: =SUM(R[-14]C:R[-1]C) -> 0 | BT17: =SUM(R[-14]C:R[-1]C) -> 0 | BU17: =RC[-1]-RC[-2] -> 0 | BW17: =SUM(R[-14]C:R[-1]C) -> 0 | BX17: =SUM(R[-14]C:R[-1]C) -> 0 | BY17: =RC[-1]-RC[-2] -> 0 | CA17: =SUM(R[-14]C:R[-1]C) -> 0 | CB17: =SUM(R[-14]C:R[-1]C) -> 0 | CC17: =RC[-1]-RC[-2] -> 0 | CE17: =SUM(R[-14]C:R[-1]C) -> 0 | CF17: =SUM(R[-14]C:R[-1]C) -> 0 | CG17: =RC[-1]-RC[-2] -> 0 | CI17: =SUM(R[-14]C:R[-1]C) -> 0 | CJ17: =SUM(R[-14]C:R[-1]C) -> 0 | CK17: =RC[-1]-RC[-2] -> 0 | CM17: =RC[-4]+RC[-8]+RC[-12]+RC[-16]+RC[-20]+RC[-24]+RC[-28]+RC[-32]+RC[-36]+RC[-40]+RC[-44]+RC[-48]+RC[-52]+RC[-56]+RC[-60]+RC[-64]+RC[-68]+RC[-72]+RC[-76]+RC[-80]+RC[-84]+RC[-88] -> 0 | CN17: =RC[-4]+RC[-8]+RC[-12]+RC[-16]+RC[-20]+RC[-24]+RC[-28]+RC[-32]+RC[-36]+RC[-40]+RC[-44]+RC[-48]+RC[-52]+RC[-56]+RC[-60]+RC[-64]+RC[-68]+RC[-72]+RC[-76]+RC[-80]+RC[-84]+RC[-88] -> 0 | CO17: =RC[-1]-RC[-2] -> 0
A18: Эксплуатируемый парк локомотивов: | C18: 2 | E18: =RC[-1]-RC[-2] -> -2 | G18: 2 | I18: =RC[-1]-RC[-2] -> -2 | K18: 2 | M18: =RC[-1]-RC[-2] -> -2 | O18: 2 | Q18: =RC[-1]-RC[-2] -> -2 | S18: 2 | U18: =RC[-1]-RC[-2] -> -2 | W18: 2 | Y18: =RC[-1]-RC[-2] -> -2 | AA18: 2 | AC18: =RC[-1]-RC[-2] -> -2 | AE18: 2 | AG18: =RC[-1]-RC[-2] -> -2 | AI18: 2 | AK18: =RC[-1]-RC[-2] -> -2 | AM18: 2 | AO18: =RC[-1]-RC[-2] -> -2 | AQ18: 2 | AS18: =RC[-1]-RC[-2] -> -2 | AU18: 2 | AW18: =RC[-1]-RC[-2] -> -2 | AY18: 2 | BA18: =RC[-1]-RC[-2] -> -2 | BC18: 2 | BE18: =RC[-1]-RC[-2] -> -2 | BG18: 2 | BI18: =RC[-1]-RC[-2] -> -2 | BK18: 2 | BM18: =RC[-1]-RC[-2] -> -2 | BO18: 2 | BQ18: =RC[-1]-RC[-2] -> -2 | BS18: 2 | BU18: =RC[-1]-RC[-2] -> -2 | BW18: 2 | BY18: =RC[-1]-RC[-2] -> -2 | CA18: 2 | CC18: =RC[-1]-RC[-2] -> -2 | CE18: 2 | CG18: =RC[-1]-RC[-2] -> -2 | CI18: 2 | CK18: =RC[-1]-RC[-2] -> -2 | CM18: =AVERAGE(RC[-4], RC[-8], RC[-12], RC[-16], RC[-20], RC[-24], RC[-28], RC[-32], RC[-36], RC[-40], RC[-44], RC[-48], RC[-52], RC[-56], RC[-60], RC[-64], RC[-68], RC[-72], RC[-76], RC[-80], RC[-84],RC[-88]) -> 2 | CN18: =AVERAGE(RC[-4], RC[-8], RC[-12], RC[-16], RC[-20], RC[-24], RC[-28], RC[-32], RC[-36], RC[-40], RC[-44], RC[-48], RC[-52], RC[-56], RC[-60], RC[-64], RC[-68], RC[-72], RC[-76], RC[-80], RC[-84],RC[-88]) -> #DIV/0! | CO18: =RC[-1]-RC[-2] -> #DIV/0!
A19: * - причины отклонения
A21: Причины отклонения по вагонам:
A22: 1. | B22: Погодные условия
A23: 2. | B23: Отсутствие четкого планирования со стороны клиента
A24: 3. | B24: Запрет на отправление со стороны ОАО "РЖД"
A25: 4. | B25: Снятие запрета на отправление со стороны ОАО "РЖД"
A26: 5. | B26: Отсутствие заготовки перевозочных документов в АС ЭТРАН
A27: 6. | B27: Появление заготовки перевозочных документов в АС ЭТРАН
A28: 7. | B28: Наличие заявки на обработку со стороны клиента на большее кол-во вагонов
A29: 8. | B29: Заключение договора на подачу/уборку вагонов с новым клиентом
A30: 9. | B30: Вагоны не готовы к уборке с грузового фронта по вине клиента
A32: Причины отклонения по локомотивам:
A33: 1. | B33: Переработано вагонов более заявленного кол-ва
A34: 2. | B34: Наличие аварийной заявки на обработку от клиента
A35: 3. | B35: Внутренняя работа (работа с путевой техникой, обработка депо и др.)
A36: 4. | B36: Испытание локомобиля
A37: 5. | B37: Отказ от заявки на обработку грузового фронта от клиента

Sheet: октябрь
A1: Число | C1: 1 | G1: 2 | K1: 3 | O1: 4 | S1: 7 | W1: 8 | AA1: 9 | AE1: 10 | AI1: 11 | AM1: 14 | AQ1: 15 | AU1: 16 | AY1: 17 | BC1: 18 | BG1: 21 | BK1: 22 | BO1: 23 | BS1: 24 | BW1: 25 | CA1: 28 | CE1: 29 | CI1: 30 | CM1: Итого
A2: Клиенты | C2: план | D2: факт | E2: откл-е | F2: * | G2: план | H2: факт | I2: откл-е | J2: * | K2: план | L2: факт | M2: откл-е | N2: * | O2: план | P2: факт | Q2: откл-е | R2: * | S2: план | T2: факт | U2: откл-е | V2: * | W2: план | X2: факт | Y2: откл-е | Z2: * | AA2: план | AB2: факт | AC2: откл-е | AD2: * | AE2: план | AF2: факт | AG2: откл-е | AH2: * | AI2: план | AJ2: факт | AK2: откл-е | AL2: * | AM2: план | AN2: факт | AO2: откл-е | AP2: * | AQ2: план | AR2: факт | AS2: откл-е | AT2: * | AU2: план | AV2: факт | AW2: откл-е | AX2: * | AY2: план | AZ2: факт | BA2: откл-е | BB2: * | BC2: план | BD2: факт | BE2: откл-е | BF2: * | BG2: план | BH2: факт | BI2: откл-е | BJ2: * | BK2: план | BL2: факт | BM2: откл-е | BN2: * | BO2: план | BP2: факт | BQ2: откл-е | BR2: * | BS2: план | BT2: факт | BU2: откл-е | BV2: * | BW2: план | BX2: факт | BY2: откл-е | BZ2: * | CA2: план | CB2: факт | CC2: откл-е | CD2: * | CE2: план | CF2: факт | CG2: откл-е | CH2: * | CI2: план | CJ2: факт | CK2: откл-е | CL2: * | CM2: план | CN2: факт | CO2: откл-е
A3: БЕ ООО "НАК" | B3: ЛЗ | E3: =RC[-1]-RC[-2] -> 0 | I3: =RC[-1]-RC[-2] -> 0 | M3: =RC[-1]-RC[-2] -> 0 | Q3: =RC[-1]-RC[-2] -> 0 | U3: =RC[-1]-RC[-2] -> 0 | Y3: =RC[-1]-RC[-2] -> 0 | AC3: =RC[-1]-RC[-2] -> 0 | AG3: =RC[-1]-RC[-2] -> 0 | AK3: =RC[-1]-RC[-2] -> 0 | AO3: =RC[-1]-RC[-2] -> 0 | AS3: =RC[-1]-RC[-2] -> 0 | AW3: =RC[-1]-RC[-2] -> 0 | BA3: =RC[-1]-RC[-2] -> 0 | BE3: =RC[-1]-RC[-2] -> 0 | BI3: =RC[-1]-RC[-2] -> 0 | BM3: =RC[-1]-RC[-2] -> 0 | BQ3: =RC[-1]-RC[-2] -> 0 | BU3: =RC[-1]-RC[-2] -> 0 | BY3: =RC[-1]-RC[-2] -> 0 | CC3: =RC[-1]-RC[-2] -> 0 | CG3: =RC[-1]-RC[-2] -> 0 | CK3: =RC[-1]-RC[-2] -> 0 | CM3: =RC[-4]+RC[-8]+RC[-12]+RC[-16]+RC[-20]+RC[-24]+RC[-28]+RC[-32]+RC[-36]+RC[-40]+RC[-44]+RC[-48]+RC[-52]+RC[-56]+RC[-60]+RC[-64]+RC[-68]+RC[-72]+RC[-76]+RC[-80]+RC[-84]+RC[-88] -> 0 | CN3: =RC[-4]+RC[-8]+RC[-12]+RC[-16]+RC[-20]+RC[-24]+RC[-28]+RC[-32]+RC[-36]+RC[-40]+RC[-44]+RC[-48]+RC[-52]+RC[-56]+RC[-60]+RC[-64]+RC[-68]+RC[-72]+RC[-76]+RC[-80]+RC[-84]+RC[-88] -> 0 | CO3: =RC[-1]-RC[-2] -> 0
B4: ПРЗ | E4: =RC[-1]-RC[-2] -> 0 | I4: =RC[-1]-RC[-2] -> 0 | M4: =RC[-1]-RC[-2] -> 0 | Q4: =RC[-1]-RC[-2] -> 0 | U4: =RC[-1]-RC[-2] -> 0 | Y4: =RC[-1]-RC[-2] -> 0 | AC4: =RC[-1]-RC[-2] -> 0 | AG4: =RC[-1]-RC[-2] -> 0 | AK4: =RC[-1]-RC[-2] -> 0 | AO4: =RC[-1]-RC[-2] -> 0 | AS4: =RC[-1]-RC[-2] -> 0 | AW4: =RC[-1]-RC[-2] -> 0 | BA4: =RC[-1]-RC[-2] -> 0 | BE4: =RC[-1]-RC[-2] -> 0 | BI4: =RC[-1]-RC[-2] -> 0 | BM4: =RC[-1]-RC[-2] -> 0 | BQ4: =RC[-1]-RC[-2] -> 0 | BU4: =RC[-1]-RC[-2] -> 0 | BY4: =RC[-1]-RC[-2] -> 0 | CC4: =RC[-1]-RC[-2] -> 0 | CG4: =RC[-1]-RC[-2] -> 0 | CK4: =RC[-1]-RC[-2] -> 0 | CM4: =RC[-4]+RC[-8]+RC[-12]+RC[-16]+RC[-20]+RC[-24]+RC[-28]+RC[-32]+RC[-36]+RC[-40]+RC[-44]+RC[-48]+RC[-52]+RC[-56]+RC[-60]+RC[-64]+RC[-68]+RC[-72]+RC[-76]+RC[-80]+RC[-84]+RC[-88] -> 0 | CN4: =RC[-4]+RC[-8]+RC[-12]+RC[-16]+RC[-20]+RC[-24]+RC[-28]+RC[-32]+RC[-36]+RC[-40]+RC[-44]+RC[-48]+RC[-52]+RC[-56]+RC[-60]+RC[-64]+RC[-68]+RC[-72]+RC[-76]+RC[-80]+RC[-84]+RC[-88] -> 0 | CO4: =RC[-1]-RC[-2] -> 0
A5: ООО "НАК" | B5: ЗШП | E5: =RC[-1]-RC[-2] -> 0 | I5: =RC[-1]-RC[-2] -> 0 | M5: =RC[-1]-RC[-2] -> 0 | Q5: =RC[-1]-RC[-2] -> 0 | U5: =RC[-1]-RC[-2] -> 0 | Y5: =RC[-1]-RC[-2] -> 0 | AC5: =RC[-1]-RC[-2] -> 0 | AG5: =RC[-1]-RC[-2] -> 0 | AK5: =RC[-1]-RC[-2] -> 0 | AO5: =RC[-1]-RC[-2] -> 0 | AS5: =RC[-1]-RC[-2] -> 0 | AW5: =RC[-1]-RC[-2] -> 0 | BA5: =RC[-1]-RC[-2] -> 0 | BE5: =RC[-1]-RC[-2] -> 0 | BI5: =RC[-1]-RC[-2] -> 0 | BM5: =RC[-1]-RC[-2] -> 0 | BQ5: =RC[-1]-RC[-2] -> 0 | BU5: =RC[-1]-RC[-2] -> 0 | BY5: =RC[-1]-RC[-2] -> 0 | CC5: =RC[-1]-RC[-2] -> 0 | CG5: =RC[-1]-RC[-2] -> 0 | CK5: =RC[-1]-RC[-2] -> 0 | CM5: =RC[-4]+RC[-8]+RC[-12]+RC[-16]+RC[-20]+RC[-24]+RC[-28]+RC[-32]+RC[-36]+RC[-40]+RC[-44]+RC[-48]+RC[-52]+RC[-56]+RC[-60]+RC[-64]+RC[-68]+RC[-72]+RC[-76]+RC[-80]+RC[-84]+RC[-88] -> 0 | CN5: =RC[-4]+RC[-8]+RC[-12]+RC[-16]+RC[-20]+RC[-24]+RC[-28]+RC[-32]+RC[-36]+RC[-40]+RC[-44]+RC[-48]+RC[-52]+RC[-56]+RC[-60]+RC[-64]+RC[-68]+RC[-72]+RC[-76]+RC[-80]+RC[-84]+RC[-88] -> 0 | CO5: =RC[-1]-RC[-2] -> 0
B6: НАК | E6: =RC[-1]-RC[-2] -> 0 | I6: =RC[-1]-RC[-2] -> 0 | M6: =RC[-1]-RC[-2] -> 0 | Q6: =RC[-1]-RC[-2] -> 0 | U6: =RC[-1]-RC[-2] -> 0 | Y6: =RC[-1]-RC[-2] -> 0 | AC6: =RC[-1]-RC[-2] -> 0 | AG6: =RC[-1]-RC[-2] -> 0 | AK6: =RC[-1]-RC[-2] -> 0 | AO6: =RC[-1]-RC[-2] -> 0 | AS6: =RC[-1]-RC[-2] -> 0 | AW6: =RC[-1]-RC[-2] -> 0 | BA6: =RC[-1]-RC[-2] -> 0 | BE6: =RC[-1]-RC[-2] -> 0 | BI6: =RC[-1]-RC[-2] -> 0 | BM6: =RC[-1]-RC[-2] -> 0 | BQ6: =RC[-1]-RC[-2] -> 0 | BU6: =RC[-1]-RC[-2] -> 0 | BY6: =RC[-1]-RC[-2] -> 0 | CC6: =RC[-1]-RC[-2] -> 0 | CG6: =RC[-1]-RC[-2] -> 0 | CK6: =RC[-1]-RC[-2] -> 0 | CM6: =RC[-4]+RC[-8]+RC[-12]+RC[-16]+RC[-20]+RC[-24]+RC[-28]+RC[-32]+RC[-36]+RC[-40]+RC[-44]+RC[-48]+RC[-52]+RC[-56]+RC[-60]+RC[-64]+RC[-68]+RC[-72]+RC[-76]+RC[-80]+RC[-84]+RC[-88] -> 0 | CN6: =RC[-4]+RC[-8]+RC[-12]+RC[-16]+RC[-20]+RC[-24]+RC[-28]+RC[-32]+RC[-36]+RC[-40]+RC[-44]+RC[-48]+RC[-52]+RC[-56]+RC[-60]+RC[-64]+RC[-68]+RC[-72]+RC[-76]+RC[-80]+RC[-84]+RC[-88] -> 0 | CO6: =RC[-1]-RC[-2] -> 0
B7: НЛЗ | E7: =RC[-1]-RC[-2] -> 0 | I7: =RC[-1]-RC[-2] -> 0 | M7: =RC[-1]-RC[-2] -> 0 | Q7: =RC[-1]-RC[-2] -> 0 | U7: =RC[-1]-RC[-2] -> 0 | Y7: =RC[-1]-RC[-2] -> 0 | AC7: =RC[-1]-RC[-2] -> 0 | AG7: =RC[-1]-RC[-2] -> 0 | AK7: =RC[-1]-RC[-2] -> 0 | AO7: =RC[-1]-RC[-2] -> 0 | AS7: =RC[-1]-RC[-2] -> 0 | AW7: =RC[-1]-RC[-2] -> 0 | BA7: =RC[-1]-RC[-2] -> 0 | BE7: =RC[-1]-RC[-2] -> 0 | BI7: =RC[-1]-RC[-2] -> 0 | BM7: =RC[-1]-RC[-2] -> 0 | BQ7: =RC[-1]-RC[-2] -> 0 | BU7: =RC[-1]-RC[-2] -> 0 | BY7: =RC[-1]-RC[-2] -> 0 | CC7: =RC[-1]-RC[-2] -> 0 | CG7: =RC[-1]-RC[-2] -> 0 | CK7: =RC[-1]-RC[-2] -> 0 | CM7: =RC[-4]+RC[-8]+RC[-12]+RC[-16]+RC[-20]+RC[-24]+RC[-28]+RC[-32]+RC[-36]+RC[-40]+RC[-44]+RC[-48]+RC[-52]+RC[-56]+RC[-60]+RC[-64]+RC[-68]+RC[-72]+RC[-76]+RC[-80]+RC[-84]+RC[-88] -> 0 | CN7: =RC[-4]+RC[-8]+RC[-12]+RC[-16]+RC[-20]+RC[-24]+RC[-28]+RC[-32]+RC[-36]+RC[-40]+RC[-44]+RC[-48]+RC[-52]+RC[-56]+RC[-60]+RC[-64]+RC[-68]+RC[-72]+RC[-76]+RC[-80]+RC[-84]+RC[-88] -> 0 | CO7: =RC[-1]-RC[-2] -> 0
A8: ООО "НАЗ", АО "НГА" | B8: АЗ "НАЗ" | E8: =RC[-1]-RC[-2] -> 0 | I8: =RC[-1]-RC[-2] -> 0 | M8: =RC[-1]-RC[-2] -> 0 | Q8: =RC[-1]-RC[-2] -> 0 | U8: =RC[-1]-RC[-2] -> 0 | Y8: =RC[-1]-RC[-2] -> 0 | AC8: =RC[-1]-RC[-2] -> 0 | AG8: =RC[-1]-RC[-2] -> 0 | AK8: =RC[-1]-RC[-2] -> 0 | AO8: =RC[-1]-RC[-2] -> 0 | AS8: =RC[-1]-RC[-2] -> 0 | AW8: =RC[-1]-RC[-2] -> 0 | BA8: =RC[-1]-RC[-2] -> 0 | BE8: =RC[-1]-RC[-2] -> 0 | BI8: =RC[-1]-RC[-2] -> 0 | BM8: =RC[-1]-RC[-2] -> 0 | BQ8: =RC[-1]-RC[-2] -> 0 | BU8: =RC[-1]-RC[-2] -> 0 | BY8: =RC[-1]-RC[-2] -> 0 | CC8: =RC[-1]-RC[-2] -> 0 | CG8: =RC[-1]-RC[-2] -> 0 | CK8: =RC[-1]-RC[-2] -> 0 | CM8: =RC[-4]+RC[-8]+RC[-12]+RC[-16]+RC[-20]+RC[-24]+RC[-28]+RC[-32]+RC[-36]+RC[-40]+RC[-44]+RC[-48]+RC[-52]+RC[-56]+RC[-60]+RC[-64]+RC[-68]+RC[-72]+RC[-76]+RC[-80]+RC[-84]+RC[-88] -> 0 | CN8: =RC[-4]+RC[-8]+RC[-12]+RC[-16]+RC[-20]+RC[-24]+RC[-28]+RC[-32]+RC[-36]+RC[-40]+RC[-44]+RC[-48]+RC[-52]+RC[-56]+RC[-60]+RC[-64]+RC[-68]+RC[-72]+RC[-76]+RC[-80]+RC[-84]+RC[-88] -> 0 | CO8: =RC[-1]-RC[-2] -> 0
B9: АО "НГА" | E9: =RC[-1]-RC[-2] -> 0 | I9: =RC[-1]-RC[-2] -> 0 | M9: =RC[-1]-RC[-2] -> 0 | Q9: =RC[-1]-RC[-2] -> 0 | U9: =RC[-1]-RC[-2] -> 0 | Y9: =RC[-1]-RC[-2] -> 0 | AC9: =RC[-1]-RC[-2] -> 0 | AG9: =RC[-1]-RC[-2] -> 0 | AK9: =RC[-1]-RC[-2] -> 0 | AO9: =RC[-1]-RC[-2] -> 0 | AS9: =RC[-1]-RC[-2] -> 0 | AW9: =RC[-1]-RC[-2] -> 0 | BA9: =RC[-1]-RC[-2] -> 0 | BE9: =RC[-1]-RC[-2] -> 0 | BI9: =RC[-1]-RC[-2] -> 0 | BM9: =RC[-1]-RC[-2] -> 0 | BQ9: =RC[-1]-RC[-2] -> 0 | BU9: =RC[-1]-RC[-2] -> 0 | BY9: =RC[-1]-RC[-2] -> 0 | CC9: =RC[-1]-RC[-2] -> 0 | CG9: =RC[-1]-RC[-2] -> 0 | CK9: =RC[-1]-RC[-2] -> 0 | CM9: =RC[-4]+RC[-8]+RC[-12]+RC[-16]+RC[-20]+RC[-24]+RC[-28]+RC[-32]+RC[-36]+RC[-40]+RC[-44]+RC[-48]+RC[-52]+RC[-56]+RC[-60]+RC[-64]+RC[-68]+RC[-72]+RC[-76]+RC[-80]+RC[-84]+RC[-88] -> 0 | CN9: =RC[-4]+RC[-8]+RC[-12]+RC[-16]+RC[-20]+RC[-24]+RC[-28]+RC[-32]+RC[-36]+RC[-40]+RC[-44]+RC[-48]+RC[-52]+RC[-56]+RC[-60]+RC[-64]+RC[-68]+RC[-72]+RC[-76]+RC[-80]+RC[-84]+RC[-88] -> 0 | CO9: =RC[-1]-RC[-2] -> 0
A10: Сторонние внутренние | B10: КА-Группа ГАЗ( Вьетнам) | E10: =RC[-1]-RC[-2] -> 0 | I10: =RC[-1]-RC[-2] -> 0 | M10: =RC[-1]-RC[-2] -> 0 | Q10: =RC[-1]-RC[-2] -> 0 | U10: =RC[-1]-RC[-2] -> 0 | Y10: =RC[-1]-RC[-2] -> 0 | AC10: =RC[-1]-RC[-2] -> 0 | AG10: =RC[-1]-RC[-2] -> 0 | AK10: =RC[-1]-RC[-2] -> 0 | AO10: =RC[-1]-RC[-2] -> 0 | AS10: =RC[-1]-RC[-2] -> 0 | AW10: =RC[-1]-RC[-2] -> 0 | BA10: =RC[-1]-RC[-2] -> 0 | BE10: =RC[-1]-RC[-2] -> 0 | BI10: =RC[-1]-RC[-2] -> 0 | BM10: =RC[-1]-RC[-2] -> 0 | BQ10: =RC[-1]-RC[-2] -> 0 | BU10: =RC[-1]-RC[-2] -> 0 | BY10: =RC[-1]-RC[-2] -> 0 | CC10: =RC[-1]-RC[-2] -> 0 | CG10: =RC[-1]-RC[-2] -> 0 | CK10: =RC[-1]-RC[-2] -> 0 | CM10: =RC[-4]+RC[-8]+RC[-12]+RC[-16]+RC[-20]+RC[-24]+RC[-28]+RC[-32]+RC[-36]+RC[-40]+RC[-44]+RC[-48]+RC[-52]+RC[-56]+RC[-60]+RC[-64]+RC[-68]+RC[-72]+RC[-76]+RC[-80]+RC[-84]+RC[-88] -> 0 | CN10: =RC[-4]+RC[-8]+RC[-12]+RC[-16]+RC[-20]+RC[-24]+RC[-28]+RC[-32]+RC[-36]+RC[-40]+RC[-44]+RC[-48]+RC[-52]+RC[-56]+RC[-60]+RC[-64]+RC[-68]+RC[-72]+RC[-76]+RC[-80]+RC[-84]+RC[-88] -> 0 | CO10: =RC[-1]-RC[-2] -> 0
B11: Платформа А | E11: =RC[-1]-RC[-2] -> 0 | I11: =RC[-1]-RC[-2] -> 0 | M11: =RC[-1]-RC[-2] -> 0 | Q11: =RC[-1]-RC[-2] -> 0 | U11: =RC[-1]-RC[-2] -> 0 | Y11: =RC[-1]-RC[-2] -> 0 | AC11: =RC[-1]-RC[-2] -> 0 | AG11: =RC[-1]-RC[-2] -> 0 | AK11: =RC[-1]-RC[-2] -> 0 | AO11: =RC[-1]-RC[-2] -> 0 | AS11: =RC[-1]-RC[-2] -> 0 | AW11: =RC[-1]-RC[-2] -> 0 | BA11: =RC[-1]-RC[-2] -> 0 | BE11: =RC[-1]-RC[-2] -> 0 | BI11: =RC[-1]-RC[-2] -> 0 | BM11: =RC[-1]-RC[-2] -> 0 | BQ11: =RC[-1]-RC[-2] -> 0 | BU11: =RC[-1]-RC[-2] -> 0 | BY11: =RC[-1]-RC[-2] -> 0 | CC11: =RC[-1]-RC[-2] -> 0 | CG11: =RC[-1]-RC[-2] -> 0 | CK11: =RC[-1]-RC[-2] -> 0 | CM11: =RC[-4]+RC[-8]+RC[-12]+RC[-16]+RC[-20]+RC[-24]+RC[-28]+RC[-32]+RC[-36]+RC[-40]+RC[-44]+RC[-48]+RC[-52]+RC[-56]+RC[-60]+RC[-64]+RC[-68]+RC[-72]+RC[-76]+RC[-80]+RC[-84]+RC[-88] -> 0 | CN11: =RC[-4]+RC[-8]+RC[-12]+RC[-16]+RC[-20]+RC[-24]+RC[-28]+RC[-32]+RC[-36]+RC[-40]+RC[-44]+RC[-48]+RC[-52]+RC[-56]+RC[-60]+RC[-64]+RC[-68]+RC[-72]+RC[-76]+RC[-80]+RC[-84]+RC[-88] -> 0 | CO11: =RC[-1]-RC[-2] -> 0
A12: Сторонние внешние | B12: АО "ГОТХ" | E12: =RC[-1]-RC[-2] -> 0 | I12: =RC[-1]-RC[-2] -> 0 | M12: =RC[-1]-RC[-2] -> 0 | Q12: =RC[-1]-RC[-2] -> 0 | U12: =RC[-1]-RC[-2] -> 0 | Y12: =RC[-1]-RC[-2] -> 0 | AC12: =RC[-1]-RC[-2] -> 0 | AG12: =RC[-1]-RC[-2] -> 0 | AK12: =RC[-1]-RC[-2] -> 0 | AO12: =RC[-1]-RC[-2] -> 0 | AS12: =RC[-1]-RC[-2] -> 0 | AW12: =RC[-1]-RC[-2] -> 0 | BA12: =RC[-1]-RC[-2] -> 0 | BE12: =RC[-1]-RC[-2] -> 0 | BI12: =RC[-1]-RC[-2] -> 0 | BM12: =RC[-1]-RC[-2] -> 0 | BQ12: =RC[-1]-RC[-2] -> 0 | BU12: =RC[-1]-RC[-2] -> 0 | BY12: =RC[-1]-RC[-2] -> 0 | CC12: =RC[-1]-RC[-2] -> 0 | CG12: =RC[-1]-RC[-2] -> 0 | CK12: =RC[-1]-RC[-2] -> 0 | CM12: =RC[-4]+RC[-8]+RC[-12]+RC[-16]+RC[-20]+RC[-24]+RC[-28]+RC[-32]+RC[-36]+RC[-40]+RC[-44]+RC[-48]+RC[-52]+RC[-56]+RC[-60]+RC[-64]+RC[-68]+RC[-72]+RC[-76]+RC[-80]+RC[-84]+RC[-88] -> 0 | CN12: =RC[-4]+RC[-8]+RC[-12]+RC[-16]+RC[-20]+RC[-24]+RC[-28]+RC[-32]+RC[-36]+RC[-40]+RC[-44]+RC[-48]+RC[-52]+RC[-56]+RC[-60]+RC[-64]+RC[-68]+RC[-72]+RC[-76]+RC[-80]+RC[-84]+RC[-88] -> 0 | CO12: =RC[-1]-RC[-2] -> 0
B13: ООО "Нерудные материалы-НН" | E13: =RC[-1]-RC[-2] -> 0 | I13: =RC[-1]-RC[-2] -> 0 | M13: =RC[-1]-RC[-2] -> 0 | Q13: =RC[-1]-RC[-2] -> 0 | U13: =RC[-1]-RC[-2] -> 0 | Y13: =RC[-1]-RC[-2] -> 0 | AC13: =RC[-1]-RC[-2] -> 0 | AG13: =RC[-1]-RC[-2] -> 0 | AK13: =RC[-1]-RC[-2] -> 0 | AO13: =RC[-1]-RC[-2] -> 0 | AS13: =RC[-1]-RC[-2] -> 0 | AW13: =RC[-1]-RC[-2] -> 0 | BA13: =RC[-1]-RC[-2] -> 0 | BE13: =RC[-1]-RC[-2] -> 0 | BI13: =RC[-1]-RC[-2] -> 0 | BM13: =RC[-1]-RC[-2] -> 0 | BQ13: =RC[-1]-RC[-2] -> 0 | BU13: =RC[-1]-RC[-2] -> 0 | BY13: =RC[-1]-RC[-2] -> 0 | CC13: =RC[-1]-RC[-2] -> 0 | CG13: =RC[-1]-RC[-2] -> 0 | CK13: =RC[-1]-RC[-2] -> 0 | CM13: =RC[-4]+RC[-8]+RC[-12]+RC[-16]+RC[-20]+RC[-24]+RC[-28]+RC[-32]+RC[-36]+RC[-40]+RC[-44]+RC[-48]+RC[-52]+RC[-56]+RC[-60]+RC[-64]+RC[-68]+RC[-72]+RC[-76]+RC[-80]+RC[-84]+RC[-88] -> 0 | CN13: =RC[-4]+RC[-8]+RC[-12]+RC[-16]+RC[-20]+RC[-24]+RC[-28]+RC[-32]+RC[-36]+RC[-40]+RC[-44]+RC[-48]+RC[-52]+RC[-56]+RC[-60]+RC[-64]+RC[-68]+RC[-72]+RC[-76]+RC[-80]+RC[-84]+RC[-88] -> 0 | CO13: =RC[-1]-RC[-2] -> 0
B14: ПК НВМ (ООО "Профит") | E14: =RC[-1]-RC[-2] -> 0 | I14: =RC[-1]-RC[-2] -> 0 | M14: =RC[-1]-RC[-2] -> 0 | Q14: =RC[-1]-RC[-2] -> 0 | U14: =RC[-1]-RC[-2] -> 0 | Y14: =RC[-1]-RC[-2] -> 0 | AC14: =RC[-1]-RC[-2] -> 0 | AG14: =RC[-1]-RC[-2] -> 0 | AK14: =RC[-1]-RC[-2] -> 0 | AO14: =RC[-1]-RC[-2] -> 0 | AS14: =RC[-1]-RC[-2] -> 0 | AW14: =RC[-1]-RC[-2] -> 0 | BA14: =RC[-1]-RC[-2] -> 0 | BE14: =RC[-1]-RC[-2] -> 0 | BI14: =RC[-1]-RC[-2] -> 0 | BM14: =RC[-1]-RC[-2] -> 0 | BQ14: =RC[-1]-RC[-2] -> 0 | BU14: =RC[-1]-RC[-2] -> 0 | BY14: =RC[-1]-RC[-2] -> 0 | CC14: =RC[-1]-RC[-2] -> 0 | CG14: =RC[-1]-RC[-2] -> 0 | CK14: =RC[-1]-RC[-2] -> 0 | CM14: =RC[-4]+RC[-8]+RC[-12]+RC[-16]+RC[-20]+RC[-24]+RC[-28]+RC[-32]+RC[-36]+RC[-40]+RC[-44]+RC[-48]+RC[-52]+RC[-56]+RC[-60]+RC[-64]+RC[-68]+RC[-72]+RC[-76]+RC[-80]+RC[-84]+RC[-88] -> 0 | CN14: =RC[-4]+RC[-8]+RC[-12]+RC[-16]+RC[-20]+RC[-24]+RC[-28]+RC[-32]+RC[-36]+RC[-40]+RC[-44]+RC[-48]+RC[-52]+RC[-56]+RC[-60]+RC[-64]+RC[-68]+RC[-72]+RC[-76]+RC[-80]+RC[-84]+RC[-88] -> 0 | CO14: =RC[-1]-RC[-2] -> 0
B15: ООО "ИнтерметГрупп" | E15: =RC[-1]-RC[-2] -> 0 | I15: =RC[-1]-RC[-2] -> 0 | M15: =RC[-1]-RC[-2] -> 0 | Q15: =RC[-1]-RC[-2] -> 0 | U15: =RC[-1]-RC[-2] -> 0 | Y15: =RC[-1]-RC[-2] -> 0 | AC15: =RC[-1]-RC[-2] -> 0 | AG15: =RC[-1]-RC[-2] -> 0 | AK15: =RC[-1]-RC[-2] -> 0 | AO15: =RC[-1]-RC[-2] -> 0 | AS15: =RC[-1]-RC[-2] -> 0 | AW15: =RC[-1]-RC[-2] -> 0 | BA15: =RC[-1]-RC[-2] -> 0 | BE15: =RC[-1]-RC[-2] -> 0 | BI15: =RC[-1]-RC[-2] -> 0 | BM15: =RC[-1]-RC[-2] -> 0 | BQ15: =RC[-1]-RC[-2] -> 0 | BU15: =RC[-1]-RC[-2] -> 0 | BY15: =RC[-1]-RC[-2] -> 0 | CC15: =RC[-1]-RC[-2] -> 0 | CG15: =RC[-1]-RC[-2] -> 0 | CK15: =RC[-1]-RC[-2] -> 0 | CM15: =RC[-4]+RC[-8]+RC[-12]+RC[-16]+RC[-20]+RC[-24]+RC[-28]+RC[-32]+RC[-36]+RC[-40]+RC[-44]+RC[-48]+RC[-52]+RC[-56]+RC[-60]+RC[-64]+RC[-68]+RC[-72]+RC[-76]+RC[-80]+RC[-84]+RC[-88] -> 0 | CN15: =RC[-4]+RC[-8]+RC[-12]+RC[-16]+RC[-20]+RC[-24]+RC[-28]+RC[-32]+RC[-36]+RC[-40]+RC[-44]+RC[-48]+RC[-52]+RC[-56]+RC[-60]+RC[-64]+RC[-68]+RC[-72]+RC[-76]+RC[-80]+RC[-84]+RC[-88] -> 0 | CO15: =RC[-1]-RC[-2] -> 0
B16: Прочие | E16: =RC[-1]-RC[-2] -> 0 | I16: =RC[-1]-RC[-2] -> 0 | M16: =RC[-1]-RC[-2] -> 0 | Q16: =RC[-1]-RC[-2] -> 0 | U16: =RC[-1]-RC[-2] -> 0 | Y16: =RC[-1]-RC[-2] -> 0 | AC16: =RC[-1]-RC[-2] -> 0 | AG16: =RC[-1]-RC[-2] -> 0 | AK16: =RC[-1]-RC[-2] -> 0 | AO16: =RC[-1]-RC[-2] -> 0 | AS16: =RC[-1]-RC[-2] -> 0 | AW16: =RC[-1]-RC[-2] -> 0 | BA16: =RC[-1]-RC[-2] -> 0 | BE16: =RC[-1]-RC[-2] -> 0 | BI16: =RC[-1]-RC[-2] -> 0 | BM16: =RC[-1]-RC[-2] -> 0 | BQ16: =RC[-1]-RC[-2] -> 0 | BU16: =RC[-1]-RC[-2] -> 0 | BY16: =RC[-1]-RC[-2] -> 0 | CC16: =RC[-1]-RC[-2] -> 0 | CG16: =RC[-1]-RC[-2] -> 0 | CK16: =RC[-1]-RC[-2] -> 0 | CM16: =RC[-4]+RC[-8]+RC[-12]+RC[-16]+RC[-20]+RC[-24]+RC[-28]+RC[-32]+RC[-36]+RC[-40]+RC[-44]+RC[-48]+RC[-52]+RC[-56]+RC[-60]+RC[-64]+RC[-68]+RC[-72]+RC[-76]+RC[-80]+RC[-84]+RC[-88] -> 0 | CN16: =RC[-4]+RC[-8]+RC[-12]+RC[-16]+RC[-20]+RC[-24]+RC[-28]+RC[-32]+RC[-36]+RC[-40]+RC[-44]+RC[-48]+RC[-52]+RC[-56]+RC[-60]+RC[-64]+RC[-68]+RC[-72]+RC[-76]+RC[-80]+RC[-84]+RC[-88] -> 0 | CO16: =RC[-1]-RC[-2] -> 0
A17: ИТОГО за день: | C17: =SUM(R[-14]C:R[-1]C) -> 0 | D17: =SUM(R[-14]C:R[-1]C) -> 0 | E17: =RC[-1]-RC[-2] -> 0 | G17: =SUM(R[-14]C:R[-1]C) -> 0 | H17: =SUM(R[-14]C:R[-1]C) -> 0 | I17: =RC[-1]-RC[-2] -> 0 | K17: =SUM(R[-14]C:R[-1]C) -> 0 | L17: =SUM(R[-14]C:R[-1]C) -> 0 | M17: =RC[-1]-RC[-2] -> 0 | O17: =SUM(R[-14]C:R[-1]C) -> 0 | P17: =SUM(R[-14]C:R[-1]C) -> 0 | Q17: =RC[-1]-RC[-2] -> 0 | S17: =SUM(R[-14]C:R[-1]C) -> 0 | T17: =SUM(R[-14]C:R[-1]C) -> 0 | U17: =RC[-1]-RC[-2] -> 0 | W17: =SUM(R[-14]C:R[-1]C) -> 0 | X17: =SUM(R[-14]C:R[-1]C) -> 0 | Y17: =RC[-1]-RC[-2] -> 0 | AA17: =SUM(R[-14]C:R[-1]C) -> 0 | AB17: =SUM(R[-14]C:R[-1]C) -> 0 | AC17: =RC[-1]-RC[-2] -> 0 | AE17: =SUM(R[-14]C:R[-1]C) -> 0 | AF17: =SUM(R[-14]C:R[-1]C) -> 0 | AG17: =RC[-1]-RC[-2] -> 0 | AI17: =SUM(R[-14]C:R[-1]C) -> 0 | AJ17: =SUM(R[-14]C:R[-1]C) -> 0 | AK17: =RC[-1]-RC[-2] -> 0 | AM17: =SUM(R[-14]C:R[-1]C) -> 0 | AN17: =SUM(R[-14]C:R[-1]C) -> 0 | AO17: =RC[-1]-RC[-2] -> 0 | AQ17: =SUM(R[-14]C:R[-1]C) -> 0 | AR17: =SUM(R[-14]C:R[-1]C) -> 0 | AS17: =RC[-1]-RC[-2] -> 0 | AU17: =SUM(R[-14]C:R[-1]C) -> 0 | AV17: =SUM(R[-14]C:R[-1]C) -> 0 | AW17: =RC[-1]-RC[-2] -> 0 | AY17: =SUM(R[-14]C:R[-1]C) -> 0 | AZ17: =SUM(R[-14]C:R[-1]C) -> 0 | BA17: =RC[-1]-RC[-2] -> 0 | BC17: =SUM(R[-14]C:R[-1]C) -> 0 | BD17: =SUM(R[-14]C:R[-1]C) -> 0 | BE17: =RC[-1]-RC[-2] -> 0 | BG17: =SUM(R[-14]C:R[-1]C) -> 0 | BH17: =SUM(R[-14]C:R[-1]C) -> 0 | BI17: =RC[-1]-RC[-2] -> 0 | BK17: =SUM(R[-14]C:R[-1]C) -> 0 | BL17: =SUM(R[-14]C:R[-1]C) -> 0 | BM17: =RC[-1]-RC[-2] -> 0 | BO17: =SUM(R[-14]C:R[-1]C) -> 0 | BP17: =SUM(R[-14]C:R[-1]C) -> 0 | BQ17: =RC[-1]-RC[-2] -> 0 | BS17: =SUM(R[-14]C:R[-1]C) -> 0 | BT17: =SUM(R[-14]C:R[-1]C) -> 0 | BU17: =RC[-1]-RC[-2] -> 0 | BW17: =SUM(R[-14]C:R[-1]C) -> 0 | BX17: =SUM(R[-14]C:R[-1]C) -> 0 | BY17: =RC[-1]-RC[-2] -> 0 | CA17: =SUM(R[-14]C:R[-1]C) -> 0 | CB17: =SUM(R[-14]C:R[-1]C) -> 0 | CC17: =RC[-1]-RC[-2] -> 0 | CE17: =SUM(R[-14]C:R[-1]C) -> 0 | CF17: =SUM(R[-14]C:R[-1]C) -> 0 | CG17: =RC[-1]-RC[-2] -> 0 | CI17: =SUM(R[-14]C:R[-1]C) -> 0 | CJ17: =SUM(R[-14]C:R[-1]C) -> 0 | CK17: =RC[-1]-RC[-2] -> 0 | CM17: =RC[-4]+RC[-8]+RC[-12]+RC[-16]+RC[-20]+RC[-24]+RC[-28]+RC[-32]+RC[-36]+RC[-40]+RC[-44]+RC[-48]+RC[-52]+RC[-56]+RC[-60]+RC[-64]+RC[-68]+RC[-72]+RC[-76]+RC[-80]+RC[-84]+RC[-88] -> 0 | CN17: =RC[-4]+RC[-8]+RC[-12]+RC[-16]+RC[-20]+RC[-24]+RC[-28]+RC[-32]+RC[-36]+RC[-40]+RC[-44]+RC[-48]+RC[-52]+RC[-56]+RC[-60]+RC[-64]+RC[-68]+RC[-72]+RC[-76]+RC[-80]+RC[-84]+RC[-88] -> 0 | CO17: =RC[-1]-RC[-2] -> 0
A18: Эксплуатируемый парк локомотивов: | C18: 2 | E18: =RC[-1]-RC[-2] -> -2 | G18: 2 | I18: =RC[-1]-RC[-2] -> -2 | K18: 2 | M18: =RC[-1]-RC[-2] -> -2 | O18: 2 | Q18: =RC[-1]-RC[-2] -> -2 | S18: 2 | U18: =RC[-1]-RC[-2] -> -2 | W18: 2 | Y18: =RC[-1]-RC[-2] -> -2 | AA18: 2 | AC18: =RC[-1]-RC[-2] -> -2 | AE18: 2 | AG18: =RC[-1]-RC[-2] -> -2 | AI18: 2 | AK18: =RC[-1]-RC[-2] -> -2 | AM18: 2 | AO18: =RC[-1]-RC[-2] -> -2 | AQ18: 2 | AS18: =RC[-1]-RC[-2] -> -2 | AU18: 2 | AW18: =RC[-1]-RC[-2] -> -2 | AY18: 2 | BA18: =RC[-1]-RC[-2] -> -2 | BC18: 2 | BE18: =RC[-1]-RC[-2] -> -2 | BG18: 2 | BI18: =RC[-1]-RC[-2] -> -2 | BK18: 2 | BM18: =RC[-1]-RC[-2] -> -2 | BO18: 2 | BQ18: =RC[-1]-RC[-2] -> -2 | BS18: 2 | BU18: =RC[-1]-RC[-2] -> -2 | BW18: 2 | BY18: =RC[-1]-RC[-2] -> -2 | CA18: 2 | CC18: =RC[-1]-RC[-2] -> -2 | CE18: 2 | CG18: =RC[-1]-RC[-2] -> -2 | CI18: 2 | CK18: =RC[-1]-RC[-2] -> -2 | CM18: =AVERAGE(RC[-4], RC[-8], RC[-12], RC[-16], RC[-20], RC[-24], RC[-28], RC[-32], RC[-36], RC[-40], RC[-44], RC[-48], RC[-52], RC[-56], RC[-60], RC[-64], RC[-68], RC[-72], RC[-76], RC[-80], RC[-84],RC[-88]) -> 2 | CN18: =AVERAGE(RC[-4], RC[-8], RC[-12], RC[-16], RC[-20], RC[-24], RC[-28], RC[-32], RC[-36], RC[-40], RC[-44], RC[-48], RC[-52], RC[-56], RC[-60], RC[-64], RC[-68], RC[-72], RC[-76], RC[-80], RC[-84],RC[-88]) -> #DIV/0! | CO18: =RC[-1]-RC[-2] -> #DIV/0!
A19: * - причины отклонения
A21: Причины отклонения по вагонам:
A22: 1. | B22: Погодные условия
A23: 2. | B23: Отсутствие четкого планирования со стороны клиента
A24: 3. | B24: Запрет на отправление со стороны ОАО "РЖД"
A25: 4. | B25: Снятие запрета на отправление со стороны ОАО "РЖД"
A26: 5. | B26: Отсутствие заготовки перевозочных документов в АС ЭТРАН
A27: 6. | B27: Появление заготовки перевозочных документов в АС ЭТРАН
A28: 7. | B28: Наличие заявки на обработку со стороны клиента на большее кол-во вагонов
A29: 8. | B29: Заключение договора на подачу/уборку вагонов с новым клиентом
A30: 9. | B30: Вагоны не готовы к уборке с грузового фронта по вине клиента
A32: Причины отклонения по локомотивам:
A33: 1. | B33: Переработано вагонов более заявленного кол-ва
A34: 2. | B34: Наличие аварийной заявки на обработку от клиента
A35: 3. | B35: Внутренняя работа (работа с путевой техникой, обработка депо и др.)
A36: 4. | B36: Испытание локомобиля
A37: 5. | B37: Отказ от заявки на обработку грузового фронта от клиента

Sheet: ноябрь
A1: Число | C1: 1 | G1: 2 | K1: 3 | O1: 4 | S1: 7 | W1: 8 | AA1: 9 | AE1: 10 | AI1: 11 | AM1: 14 | AQ1: 15 | AU1: 16 | AY1: 17 | BC1: 18 | BG1: 21 | BK1: 22 | BO1: 23 | BS1: 24 | BW1: 25 | CA1: 28 | CE1: 29 | CI1: 30 | CM1: Итого
A2: Клиенты | C2: план | D2: факт | E2: откл-е | F2: * | G2: план | H2: факт | I2: откл-е | J2: * | K2: план | L2: факт | M2: откл-е | N2: * | O2: план | P2: факт | Q2: откл-е | R2: * | S2: план | T2: факт | U2: откл-е | V2: * | W2: план | X2: факт | Y2: откл-е | Z2: * | AA2: план | AB2: факт | AC2: откл-е | AD2: * | AE2: план | AF2: факт | AG2: откл-е | AH2: * | AI2: план | AJ2: факт | AK2: откл-е | AL2: * | AM2: план | AN2: факт | AO2: откл-е | AP2: * | AQ2: план | AR2: факт | AS2: откл-е | AT2: * | AU2: план | AV2: факт | AW2: откл-е | AX2: * | AY2: план | AZ2: факт | BA2: откл-е | BB2: * | BC2: план | BD2: факт | BE2: откл-е | BF2: * | BG2: план | BH2: факт | BI2: откл-е | BJ2: * | BK2: план | BL2: факт | BM2: откл-е | BN2: * | BO2: план | BP2: факт | BQ2: откл-е | BR2: * | BS2: план | BT2: факт | BU2: откл-е | BV2: * | BW2: план | BX2: факт | BY2: откл-е | BZ2: * | CA2: план | CB2: факт | CC2: откл-е | CD2: * | CE2: план | CF2: факт | CG2: откл-е | CH2: * | CI2: план | CJ2: факт | CK2: откл-е | CL2: * | CM2: план | CN2: факт | CO2: откл-е
A3: БЕ ООО "НАК" | B3: ЛЗ | E3: =RC[-1]-RC[-2] -> 0 | I3: =RC[-1]-RC[-2] -> 0 | M3: =RC[-1]-RC[-2] -> 0 | Q3: =RC[-1]-RC[-2] -> 0 | U3: =RC[-1]-RC[-2] -> 0 | Y3: =RC[-1]-RC[-2] -> 0 | AC3: =RC[-1]-RC[-2] -> 0 | AG3: =RC[-1]-RC[-2] -> 0 | AK3: =RC[-1]-RC[-2] -> 0 | AO3: =RC[-1]-RC[-2] -> 0 | AS3: =RC[-1]-RC[-2] -> 0 | AW3: =RC[-1]-RC[-2] -> 0 | BA3: =RC[-1]-RC[-2] -> 0 | BE3: =RC[-1]-RC[-2] -> 0 | BI3: =RC[-1]-RC[-2] -> 0 | BM3: =RC[-1]-RC[-2] -> 0 | BQ3: =RC[-1]-RC[-2] -> 0 | BU3: =RC[-1]-RC[-2] -> 0 | BY3: =RC[-1]-RC[-2] -> 0 | CC3: =RC[-1]-RC[-2] -> 0 | CG3: =RC[-1]-RC[-2] -> 0 | CK3: =RC[-1]-RC[-2] -> 0 | CM3: =RC[-4]+RC[-8]+RC[-12]+RC[-16]+RC[-20]+RC[-24]+RC[-28]+RC[-32]+RC[-36]+RC[-40]+RC[-44]+RC[-48]+RC[-52]+RC[-56]+RC[-60]+RC[-64]+RC[-68]+RC[-72]+RC[-76]+RC[-80]+RC[-84]+RC[-88] -> 0 | CN3: =RC[-4]+RC[-8]+RC[-12]+RC[-16]+RC[-20]+RC[-24]+RC[-28]+RC[-32]+RC[-36]+RC[-40]+RC[-44]+RC[-48]+RC[-52]+RC[-56]+RC[-60]+RC[-64]+RC[-68]+RC[-72]+RC[-76]+RC[-80]+RC[-84]+RC[-88] -> 0 | CO3: =RC[-1]-RC[-2] -> 0
B4: ПРЗ | E4: =RC[-1]-RC[-2] -> 0 | I4: =RC[-1]-RC[-2] -> 0 | M4: =RC[-1]-RC[-2] -> 0 | Q4: =RC[-1]-RC[-2] -> 0 | U4: =RC[-1]-RC[-2] -> 0 | Y4: =RC[-1]-RC[-2] -> 0 | AC4: =RC[-1]-RC[-2] -> 0 | AG4: =RC[-1]-RC[-2] -> 0 | AK4: =RC[-1]-RC[-2] -> 0 | AO4: =RC[-1]-RC[-2] -> 0 | AS4: =RC[-1]-RC[-2] -> 0 | AW4: =RC[-1]-RC[-2] -> 0 | BA4: =RC[-1]-RC[-2] -> 0 | BE4: =RC[-1]-RC[-2] -> 0 | BI4: =RC[-1]-RC[-2] -> 0 | BM4: =RC[-1]-RC[-2] -> 0 | BQ4: =RC[-1]-RC[-2] -> 0 | BU4: =RC[-1]-RC[-2] -> 0 | BY4: =RC[-1]-RC[-2] -> 0 | CC4: =RC[-1]-RC[-2] -> 0 | CG4: =RC[-1]-RC[-2] -> 0 | CK4: =RC[-1]-RC[-2] -> 0 | CM4: =RC[-4]+RC[-8]+RC[-12]+RC[-16]+RC[-20]+RC[-24]+RC[-28]+RC[-32]+RC[-36]+RC[-40]+RC[-44]+RC[-48]+RC[-52]+RC[-56]+RC[-60]+RC[-64]+RC[-68]+RC[-72]+RC[-76]+RC[-80]+RC[-84]+RC[-88] -> 0 | CN4: =RC[-4]+RC[-8]+RC[-12]+RC[-16]+RC[-20]+RC[-24]+RC[-28]+RC[-32]+RC[-36]+RC[-40]+RC[-44]+RC[-48]+RC[-52]+RC[-56]+RC[-60]+RC[-64]+RC[-68]+RC[-72]+RC[-76]+RC[-80]+RC[-84]+RC[-88] -> 0 | CO4: =RC[-1]-RC[-2] -> 0
A5: ООО "НАК" | B5: ЗШП | E5: =RC[-1]-RC[-2] -> 0 | I5: =RC[-1]-RC[-2] -> 0 | M5: =RC[-1]-RC[-2] -> 0 | Q5: =RC[-1]-RC[-2] -> 0 | U5: =RC[-1]-RC[-2] -> 0 | Y5: =RC[-1]-RC[-2] -> 0 | AC5: =RC[-1]-RC[-2] -> 0 | AG5: =RC[-1]-RC[-2] -> 0 | AK5: =RC[-1]-RC[-2] -> 0 | AO5: =RC[-1]-RC[-2] -> 0 | AS5: =RC[-1]-RC[-2] -> 0 | AW5: =RC[-1]-RC[-2] -> 0 | BA5: =RC[-1]-RC[-2] -> 0 | BE5: =RC[-1]-RC[-2] -> 0 | BI5: =RC[-1]-RC[-2] -> 0 | BM5: =RC[-1]-RC[-2] -> 0 | BQ5: =RC[-1]-RC[-2] -> 0 | BU5: =RC[-1]-RC[-2] -> 0 | BY5: =RC[-1]-RC[-2] -> 0 | CC5: =RC[-1]-RC[-2] -> 0 | CG5: =RC[-1]-RC[-2] -> 0 | CK5: =RC[-1]-RC[-2] -> 0 | CM5: =RC[-4]+RC[-8]+RC[-12]+RC[-16]+RC[-20]+RC[-24]+RC[-28]+RC[-32]+RC[-36]+RC[-40]+RC[-44]+RC[-48]+RC[-52]+RC[-56]+RC[-60]+RC[-64]+RC[-68]+RC[-72]+RC[-76]+RC[-80]+RC[-84]+RC[-88] -> 0 | CN5: =RC[-4]+RC[-8]+RC[-12]+RC[-16]+RC[-20]+RC[-24]+RC[-28]+RC[-32]+RC[-36]+RC[-40]+RC[-44]+RC[-48]+RC[-52]+RC[-56]+RC[-60]+RC[-64]+RC[-68]+RC[-72]+RC[-76]+RC[-80]+RC[-84]+RC[-88] -> 0 | CO5: =RC[-1]-RC[-2] -> 0
B6: НАК | E6: =RC[-1]-RC[-2] -> 0 | I6: =RC[-1]-RC[-2] -> 0 | M6: =RC[-1]-RC[-2] -> 0 | Q6: =RC[-1]-RC[-2] -> 0 | U6: =RC[-1]-RC[-2] -> 0 | Y6: =RC[-1]-RC[-2] -> 0 | AC6: =RC[-1]-RC[-2] -> 0 | AG6: =RC[-1]-RC[-2] -> 0 | AK6: =RC[-1]-RC[-2] -> 0 | AO6: =RC[-1]-RC[-2] -> 0 | AS6: =RC[-1]-RC[-2] -> 0 | AW6: =RC[-1]-RC[-2] -> 0 | BA6: =RC[-1]-RC[-2] -> 0 | BE6: =RC[-1]-RC[-2] -> 0 | BI6: =RC[-1]-RC[-2] -> 0 | BM6: =RC[-1]-RC[-2] -> 0 | BQ6: =RC[-1]-RC[-2] -> 0 | BU6: =RC[-1]-RC[-2] -> 0 | BY6: =RC[-1]-RC[-2] -> 0 | CC6: =RC[-1]-RC[-2] -> 0 | CG6: =RC[-1]-RC[-2] -> 0 | CK6: =RC[-1]-RC[-2] -> 0 | CM6: =RC[-4]+RC[-8]+RC[-12]+RC[-16]+RC[-20]+RC[-24]+RC[-28]+RC[-32]+RC[-36]+RC[-40]+RC[-44]+RC[-48]+RC[-52]+RC[-56]+RC[-60]+RC[-64]+RC[-68]+RC[-72]+RC[-76]+RC[-80]+RC[-84]+RC[-88] -> 0 | CN6: =RC[-4]+RC[-8]+RC[-12]+RC[-16]+RC[-20]+RC[-24]+RC[-28]+RC[-32]+RC[-36]+RC[-40]+RC[-44]+RC[-48]+RC[-52]+RC[-56]+RC[-60]+RC[-64]+RC[-68]+RC[-72]+RC[-76]+RC[-80]+RC[-84]+RC[-88] -> 0 | CO6: =RC[-1]-RC[-2] -> 0
B7: НЛЗ | E7: =RC[-1]-RC[-2] -> 0 | I7: =RC[-1]-RC[-2] -> 0 | M7: =RC[-1]-RC[-2] -> 0 | Q7: =RC[-1]-RC[-2] -> 0 | U7: =RC[-1]-RC[-2] -> 0 | Y7: =RC[-1]-RC[-2] -> 0 | AC7: =RC[-1]-RC[-2] -> 0 | AG7: =RC[-1]-RC[-2] -> 0 | AK7: =RC[-1]-RC[-2] -> 0 | AO7: =RC[-1]-RC[-2] -> 0 | AS7: =RC[-1]-RC[-2] -> 0 | AW7: =RC[-1]-RC[-2] -> 0 | BA7: =RC[-1]-RC[-2] -> 0 | BE7: =RC[-1]-RC[-2] -> 0 | BI7: =RC[-1]-RC[-2] -> 0 | BM7: =RC[-1]-RC[-2] -> 0 | BQ7: =RC[-1]-RC[-2] -> 0 | BU7: =RC[-1]-RC[-2] -> 0 | BY7: =RC[-1]-RC[-2] -> 0 | CC7: =RC[-1]-RC[-2] -> 0 | CG7: =RC[-1]-RC[-2] -> 0 | CK7: =RC[-1]-RC[-2] -> 0 | CM7: =RC[-4]+RC[-8]+RC[-12]+RC[-16]+RC[-20]+RC[-24]+RC[-28]+RC[-32]+RC[-36]+RC[-40]+RC[-44]+RC[-48]+RC[-52]+RC[-56]+RC[-60]+RC[-64]+RC[-68]+RC[-72]+RC[-76]+RC[-80]+RC[-84]+RC[-88] -> 0 | CN7: =RC[-4]+RC[-8]+RC[-12]+RC[-16]+RC[-20]+RC[-24]+RC[-28]+RC[-32]+RC[-36]+RC[-40]+RC[-44]+RC[-48]+RC[-52]+RC[-56]+RC[-60]+RC[-64]+RC[-68]+RC[-72]+RC[-76]+RC[-80]+RC[-84]+RC[-88] -> 0 | CO7: =RC[-1]-RC[-2] -> 0
A8: ООО "НАЗ", АО "НГА" | B8: АЗ "НАЗ" | E8: =RC[-1]-RC[-2] -> 0 | I8: =RC[-1]-RC[-2] -> 0 | M8: =RC[-1]-RC[-2] -> 0 | Q8: =RC[-1]-RC[-2] -> 0 | U8: =RC[-1]-RC[-2] -> 0 | Y8: =RC[-1]-RC[-2] -> 0 | AC8: =RC[-1]-RC[-2] -> 0 | AG8: =RC[-1]-RC[-2] -> 0 | AK8: =RC[-1]-RC[-2] -> 0 | AO8: =RC[-1]-RC[-2] -> 0 | AS8: =RC[-1]-RC[-2] -> 0 | AW8: =RC[-1]-RC[-2] -> 0 | BA8: =RC[-1]-RC[-2] -> 0 | BE8: =RC[-1]-RC[-2] -> 0 | BI8: =RC[-1]-RC[-2] -> 0 | BM8: =RC[-1]-RC[-2] -> 0 | BQ8: =RC[-1]-RC[-2] -> 0 | BU8: =RC[-1]-RC[-2] -> 0 | BY8: =RC[-1]-RC[-2] -> 0 | CC8: =RC[-1]-RC[-2] -> 0 | CG8: =RC[-1]-RC[-2] -> 0 | CK8: =RC[-1]-RC[-2] -> 0 | CM8: =RC[-4]+RC[-8]+RC[-12]+RC[-16]+RC[-20]+RC[-24]+RC[-28]+RC[-32]+RC[-36]+RC[-40]+RC[-44]+RC[-48]+RC[-52]+RC[-56]+RC[-60]+RC[-64]+RC[-68]+RC[-72]+RC[-76]+RC[-80]+RC[-84]+RC[-88] -> 0 | CN8: =RC[-4]+RC[-8]+RC[-12]+RC[-16]+RC[-20]+RC[-24]+RC[-28]+RC[-32]+RC[-36]+RC[-40]+RC[-44]+RC[-48]+RC[-52]+RC[-56]+RC[-60]+RC[-64]+RC[-68]+RC[-72]+RC[-76]+RC[-80]+RC[-84]+RC[-88] -> 0 | CO8: =RC[-1]-RC[-2] -> 0
B9: АО "НГА" | E9: =RC[-1]-RC[-2] -> 0 | I9: =RC[-1]-RC[-2] -> 0 | M9: =RC[-1]-RC[-2] -> 0 | Q9: =RC[-1]-RC[-2] -> 0 | U9: =RC[-1]-RC[-2] -> 0 | Y9: =RC[-1]-RC[-2] -> 0 | AC9: =RC[-1]-RC[-2] -> 0 | AG9: =RC[-1]-RC[-2] -> 0 | AK9: =RC[-1]-RC[-2] -> 0 | AO9: =RC[-1]-RC[-2] -> 0 | AS9: =RC[-1]-RC[-2] -> 0 | AW9: =RC[-1]-RC[-2] -> 0 | BA9: =RC[-1]-RC[-2] -> 0 | BE9: =RC[-1]-RC[-2] -> 0 | BI9: =RC[-1]-RC[-2] -> 0 | BM9: =RC[-1]-RC[-2] -> 0 | BQ9: =RC[-1]-RC[-2] -> 0 | BU9: =RC[-1]-RC[-2] -> 0 | BY9: =RC[-1]-RC[-2] -> 0 | CC9: =RC[-1]-RC[-2] -> 0 | CG9: =RC[-1]-RC[-2] -> 0 | CK9: =RC[-1]-RC[-2] -> 0 | CM9: =RC[-4]+RC[-8]+RC[-12]+RC[-16]+RC[-20]+RC[-24]+RC[-28]+RC[-32]+RC[-36]+RC[-40]+RC[-44]+RC[-48]+RC[-52]+RC[-56]+RC[-60]+RC[-64]+RC[-68]+RC[-72]+RC[-76]+RC[-80]+RC[-84]+RC[-88] -> 0 | CN9: =RC[-4]+RC[-8]+RC[-12]+RC[-16]+RC[-20]+RC[-24]+RC[-28]+RC[-32]+RC[-36]+RC[-40]+RC[-44]+RC[-48]+RC[-52]+RC[-56]+RC[-60]+RC[-64]+RC[-68]+RC[-72]+RC[-76]+RC[-80]+RC[-84]+RC[-88] -> 0 | CO9: =RC[-1]-RC[-2] -> 0
A10: Сторонние внутренние | B10: КА-Группа ГАЗ( Вьетнам) | E10: =RC[-1]-RC[-2] -> 0 | I10: =RC[-1]-RC[-2] -> 0 | M10: =RC[-1]-RC[-2] -> 0 | Q10: =RC[-1]-RC[-2] -> 0 | U10: =RC[-1]-RC[-2] -> 0 | Y10: =RC[-1]-RC[-2] -> 0 | AC10: =RC[-1]-RC[-2] -> 0 | AG10: =RC[-1]-RC[-2] -> 0 | AK10: =RC[-1]-RC[-2] -> 0 | AO10: =RC[-1]-RC[-2] -> 0 | AS10: =RC[-1]-RC[-2] -> 0 | AW10: =RC[-1]-RC[-2] -> 0 | BA10: =RC[-1]-RC[-2] -> 0 | BE10: =RC[-1]-RC[-2] -> 0 | BI10: =RC[-1]-RC[-2] -> 0 | BM10: =RC[-1]-RC[-2] -> 0 | BQ10: =RC[-1]-RC[-2] -> 0 | BU10: =RC[-1]-RC[-2] -> 0 | BY10: =RC[-1]-RC[-2] -> 0 | CC10: =RC[-1]-RC[-2] -> 0 | CG10: =RC[-1]-RC[-2] -> 0 | CK10: =RC[-1]-RC[-2] -> 0 | CM10: =RC[-4]+RC[-8]+RC[-12]+RC[-16]+RC[-20]+RC[-24]+RC[-28]+RC[-32]+RC[-36]+RC[-40]+RC[-44]+RC[-48]+RC[-52]+RC[-56]+RC[-60]+RC[-64]+RC[-68]+RC[-72]+RC[-76]+RC[-80]+RC[-84]+RC[-88] -> 0 | CN10: =RC[-4]+RC[-8]+RC[-12]+RC[-16]+RC[-20]+RC[-24]+RC[-28]+RC[-32]+RC[-36]+RC[-40]+RC[-44]+RC[-48]+RC[-52]+RC[-56]+RC[-60]+RC[-64]+RC[-68]+RC[-72]+RC[-76]+RC[-80]+RC[-84]+RC[-88] -> 0 | CO10: =RC[-1]-RC[-2] -> 0
B11: Платформа А | E11: =RC[-1]-RC[-2] -> 0 | I11: =RC[-1]-RC[-2] -> 0 | M11: =RC[-1]-RC[-2] -> 0 | Q11: =RC[-1]-RC[-2] -> 0 | U11: =RC[-1]-RC[-2] -> 0 | Y11: =RC[-1]-RC[-2] -> 0 | AC11: =RC[-1]-RC[-2] -> 0 | AG11: =RC[-1]-RC[-2] -> 0 | AK11: =RC[-1]-RC[-2] -> 0 | AO11: =RC[-1]-RC[-2] -> 0 | AS11: =RC[-1]-RC[-2] -> 0 | AW11: =RC[-1]-RC[-2] -> 0 | BA11: =RC[-1]-RC[-2] -> 0 | BE11: =RC[-1]-RC[-2] -> 0 | BI11: =RC[-1]-RC[-2] -> 0 | BM11: =RC[-1]-RC[-2] -> 0 | BQ11: =RC[-1]-RC[-2] -> 0 | BU11: =RC[-1]-RC[-2] -> 0 | BY11: =RC[-1]-RC[-2] -> 0 | CC11: =RC[-1]-RC[-2] -> 0 | CG11: =RC[-1]-RC[-2] -> 0 | CK11: =RC[-1]-RC[-2] -> 0 | CM11: =RC[-4]+RC[-8]+RC[-12]+RC[-16]+RC[-20]+RC[-24]+RC[-28]+RC[-32]+RC[-36]+RC[-40]+RC[-44]+RC[-48]+RC[-52]+RC[-56]+RC[-60]+RC[-64]+RC[-68]+RC[-72]+RC[-76]+RC[-80]+RC[-84]+RC[-88] -> 0 | CN11: =RC[-4]+RC[-8]+RC[-12]+RC[-16]+RC[-20]+RC[-24]+RC[-28]+RC[-32]+RC[-36]+RC[-40]+RC[-44]+RC[-48]+RC[-52]+RC[-56]+RC[-60]+RC[-64]+RC[-68]+RC[-72]+RC[-76]+RC[-80]+RC[-84]+RC[-88] -> 0 | CO11: =RC[-1]-RC[-2] -> 0
A12: Сторонние внешние | B12: АО "ГОТХ" | E12: =RC[-1]-RC[-2] -> 0 | I12: =RC[-1]-RC[-2] -> 0 | M12: =RC[-1]-RC[-2] -> 0 | Q12: =RC[-1]-RC[-2] -> 0 | U12: =RC[-1]-RC[-2] -> 0 | Y12: =RC[-1]-RC[-2] -> 0 | AC12: =RC[-1]-RC[-2] -> 0 | AG12: =RC[-1]-RC[-2] -> 0 | AK12: =RC[-1]-RC[-2] -> 0 | AO12: =RC[-1]-RC[-2] -> 0 | AS12: =RC[-1]-RC[-2] -> 0 | AW12: =RC[-1]-RC[-2] -> 0 | BA12: =RC[-1]-RC[-2] -> 0 | BE12: =RC[-1]-RC[-2] -> 0 | BI12: =RC[-1]-RC[-2] -> 0 | BM12: =RC[-1]-RC[-2] -> 0 | BQ12: =RC[-1]-RC[-2] -> 0 | BU12: =RC[-1]-RC[-2] -> 0 | BY12: =RC[-1]-RC[-2] -> 0 | CC12: =RC[-1]-RC[-2] -> 0 | CG12: =RC[-1]-RC[-2] -> 0 | CK12: =RC[-1]-RC[-2] -> 0 | CM12: =RC[-4]+RC[-8]+RC[-12]+RC[-16]+RC[-20]+RC[-24]+RC[-28]+RC[-32]+RC[-36]+RC[-40]+RC[-44]+RC[-48]+RC[-52]+RC[-56]+RC[-60]+RC[-64]+RC[-68]+RC[-72]+RC[-76]+RC[-80]+RC[-84]+RC[-88] -> 0 | CN12: =RC[-4]+RC[-8]+RC[-12]+RC[-16]+RC[-20]+RC[-24]+RC[-28]+RC[-32]+RC[-36]+RC[-40]+RC[-44]+RC[-48]+RC[-52]+RC[-56]+RC[-60]+RC[-64]+RC[-68]+RC[-72]+RC[-76]+RC[-80]+RC[-84]+RC[-88] -> 0 | CO12: =RC[-1]-RC[-2] -> 0
B13: ООО "Нерудные материалы-НН" | E13: =RC[-1]-RC[-2] -> 0 | I13: =RC[-1]-RC[-2] -> 0 | M13: =RC[-1]-RC[-2] -> 0 | Q13: =RC[-1]-RC[-2] -> 0 | U13: =RC[-1]-RC[-2] -> 0 | Y13: =RC[-1]-RC[-2] -> 0 | AC13: =RC[-1]-RC[-2] -> 0 | AG13: =RC[-1]-RC[-2] -> 0 | AK13: =RC[-1]-RC[-2] -> 0 | AO13: =RC[-1]-RC[-2] -> 0 | AS13: =RC[-1]-RC[-2] -> 0 | AW13: =RC[-1]-RC[-2] -> 0 | BA13: =RC[-1]-RC[-2] -> 0 | BE13: =RC[-1]-RC[-2] -> 0 | BI13: =RC[-1]-RC[-2] -> 0 | BM13: =RC[-1]-RC[-2] -> 0 | BQ13: =RC[-1]-RC[-2] -> 0 | BU13: =RC[-1]-RC[-2] -> 0 | BY13: =RC[-1]-RC[-2] -> 0 | CC13: =RC[-1]-RC[-2] -> 0 | CG13: =RC[-1]-RC[-2] -> 0 | CK13: =RC[-1]-RC[-2] -> 0 | CM13: =RC[-4]+RC[-8]+RC[-12]+RC[-16]+RC[-20]+RC[-24]+RC[-28]+RC[-32]+RC[-36]+RC[-40]+RC[-44]+RC[-48]+RC[-52]+RC[-56]+RC[-60]+RC[-64]+RC[-68]+RC[-72]+RC[-76]+RC[-80]+RC[-84]+RC[-88] -> 0 | CN13: =RC[-4]+RC[-8]+RC[-12]+RC[-16]+RC[-20]+RC[-24]+RC[-28]+RC[-32]+RC[-36]+RC[-40]+RC[-44]+RC[-48]+RC[-52]+RC[-56]+RC[-60]+RC[-64]+RC[-68]+RC[-72]+RC[-76]+RC[-80]+RC[-84]+RC[-88] -> 0 | CO13: =RC[-1]-RC[-2] -> 0
B14: ПК НВМ (ООО "Профит") | E14: =RC[-1]-RC[-2] -> 0 | I14: =RC[-1]-RC[-2] -> 0 | M14: =RC[-1]-RC[-2] -> 0 | Q14: =RC[-1]-RC[-2] -> 0 | U14: =RC[-1]-RC[-2] -> 0 | Y14: =RC[-1]-RC[-2] -> 0 | AC14: =RC[-1]-RC[-2] -> 0 | AG14: =RC[-1]-RC[-2] -> 0 | AK14: =RC[-1]-RC[-2] -> 0 | AO14: =RC[-1]-RC[-2] -> 0 | AS14: =RC[-1]-RC[-2] -> 0 | AW14: =RC[-1]-RC[-2] -> 0 | BA14: =RC[-1]-RC[-2] -> 0 | BE14: =RC[-1]-RC[-2] -> 0 | BI14: =RC[-1]-RC[-2] -> 0 | BM14: =RC[-1]-RC[-2] -> 0 | BQ14: =RC[-1]-RC[-2] -> 0 | BU14: =RC[-1]-RC[-2] -> 0 | BY14: =RC[-1]-RC[-2] -> 0 | CC14: =RC[-1]-RC[-2] -> 0 | CG14: =RC[-1]-RC[-2] -> 0 | CK14: =RC[-1]-RC[-2] -> 0 | CM14: =RC[-4]+RC[-8]+RC[-12]+RC[-16]+RC[-20]+RC[-24]+RC[-28]+RC[-32]+RC[-36]+RC[-40]+RC[-44]+RC[-48]+RC[-52]+RC[-56]+RC[-60]+RC[-64]+RC[-68]+RC[-72]+RC[-76]+RC[-80]+RC[-84]+RC[-88] -> 0 | CN14: =RC[-4]+RC[-8]+RC[-12]+RC[-16]+RC[-20]+RC[-24]+RC[-28]+RC[-32]+RC[-36]+RC[-40]+RC[-44]+RC[-48]+RC[-52]+RC[-56]+RC[-60]+RC[-64]+RC[-68]+RC[-72]+RC[-76]+RC[-80]+RC[-84]+RC[-88] -> 0 | CO14: =RC[-1]-RC[-2] -> 0
B15: ООО "ИнтерметГрупп" | E15: =RC[-1]-RC[-2] -> 0 | I15: =RC[-1]-RC[-2] -> 0 | M15: =RC[-1]-RC[-2] -> 0 | Q15: =RC[-1]-RC[-2] -> 0 | U15: =RC[-1]-RC[-2] -> 0 | Y15: =RC[-1]-RC[-2] -> 0 | AC15: =RC[-1]-RC[-2] -> 0 | AG15: =RC[-1]-RC[-2] -> 0 | AK15: =RC[-1]-RC[-2] -> 0 | AO15: =RC[-1]-RC[-2] -> 0 | AS15: =RC[-1]-RC[-2] -> 0 | AW15: =RC[-1]-RC[-2] -> 0 | BA15: =RC[-1]-RC[-2] -> 0 | BE15: =RC[-1]-RC[-2] -> 0 | BI15: =RC[-1]-RC[-2] -> 0 | BM15: =RC[-1]-RC[-2] -> 0 | BQ15: =RC[-1]-RC[-2] -> 0 | BU15: =RC[-1]-RC[-2] -> 0 | BY15: =RC[-1]-RC[-2] -> 0 | CC15: =RC[-1]-RC[-2] -> 0 | CG15: =RC[-1]-RC[-2] -> 0 | CK15: =RC[-1]-RC[-2] -> 0 | CM15: =RC[-4]+RC[-8]+RC[-12]+RC[-16]+RC[-20]+RC[-24]+RC[-28]+RC[-32]+RC[-36]+RC[-40]+RC[-44]+RC[-48]+RC[-52]+RC[-56]+RC[-60]+RC[-64]+RC[-68]+RC[-72]+RC[-76]+RC[-80]+RC[-84]+RC[-88] -> 0 | CN15: =RC[-4]+RC[-8]+RC[-12]+RC[-16]+RC[-20]+RC[-24]+RC[-28]+RC[-32]+RC[-36]+RC[-40]+RC[-44]+RC[-48]+RC[-52]+RC[-56]+RC[-60]+RC[-64]+RC[-68]+RC[-72]+RC[-76]+RC[-80]+RC[-84]+RC[-88] -> 0 | CO15: =RC[-1]-RC[-2] -> 0
B16: Прочие | E16: =RC[-1]-RC[-2] -> 0 | I16: =RC[-1]-RC[-2] -> 0 | M16: =RC[-1]-RC[-2] -> 0 | Q16: =RC[-1]-RC[-2] -> 0 | U16: =RC[-1]-RC[-2] -> 0 | Y16: =RC[-1]-RC[-2] -> 0 | AC16: =RC[-1]-RC[-2] -> 0 | AG16: =RC[-1]-RC[-2] -> 0 | AK16: =RC[-1]-RC[-2] -> 0 | AO16: =RC[-1]-RC[-2] -> 0 | AS16: =RC[-1]-RC[-2] -> 0 | AW16: =RC[-1]-RC[-2] -> 0 | BA16: =RC[-1]-RC[-2] -> 0 | BE16: =RC[-1]-RC[-2] -> 0 | BI16: =RC[-1]-RC[-2] -> 0 | BM16: =RC[-1]-RC[-2] -> 0 | BQ16: =RC[-1]-RC[-2] -> 0 | BU16: =RC[-1]-RC[-2] -> 0 | BY16: =RC[-1]-RC[-2] -> 0 | CC16: =RC[-1]-RC[-2] -> 0 | CG16: =RC[-1]-RC[-2] -> 0 | CK16: =RC[-1]-RC[-2] -> 0 | CM16: =RC[-4]+RC[-8]+RC[-12]+RC[-16]+RC[-20]+RC[-24]+RC[-28]+RC[-32]+RC[-36]+RC[-40]+RC[-44]+RC[-48]+RC[-52]+RC[-56]+RC[-60]+RC[-64]+RC[-68]+RC[-72]+RC[-76]+RC[-80]+RC[-84]+RC[-88] -> 0 | CN16: =RC[-4]+RC[-8]+RC[-12]+RC[-16]+RC[-20]+RC[-24]+RC[-28]+RC[-32]+RC[-36]+RC[-40]+RC[-44]+RC[-48]+RC[-52]+RC[-56]+RC[-60]+RC[-64]+RC[-68]+RC[-72]+RC[-76]+RC[-80]+RC[-84]+RC[-88] -> 0 | CO16: =RC[-1]-RC[-2] -> 0
A17: ИТОГО за день: | C17: =SUM(R[-14]C:R[-1]C) -> 0 | D17: =SUM(R[-14]C:R[-1]C) -> 0 | E17: =RC[-1]-RC[-2] -> 0 | G17: =SUM(R[-14]C:R[-1]C) -> 0 | H17: =SUM(R[-14]C:R[-1]C) -> 0 | I17: =RC[-1]-RC[-2] -> 0 | K17: =SUM(R[-14]C:R[-1]C) -> 0 | L17: =SUM(R[-14]C:R[-1]C) -> 0 | M17: =RC[-1]-RC[-2] -> 0 | O17: =SUM(R[-14]C:R[-1]C) -> 0 | P17: =SUM(R[-14]C:R[-1]C) -> 0 | Q17: =RC[-1]-RC[-2] -> 0 | S17: =SUM(R[-14]C:R[-1]C) -> 0 | T17: =SUM(R[-14]C:R[-1]C) -> 0 | U17: =RC[-1]-RC[-2] -> 0 | W17: =SUM(R[-14]C:R[-1]C) -> 0 | X17: =SUM(R[-14]C:R[-1]C) -> 0 | Y17: =RC[-1]-RC[-2] -> 0 | AA17: =SUM(R[-14]C:R[-1]C) -> 0 | AB17: =SUM(R[-14]C:R[-1]C) -> 0 | AC17: =RC[-1]-RC[-2] -> 0 | AE17: =SUM(R[-14]C:R[-1]C) -> 0 | AF17: =SUM(R[-14]C:R[-1]C) -> 0 | AG17: =RC[-1]-RC[-2] -> 0 | AI17: =SUM(R[-14]C:R[-1]C) -> 0 | AJ17: =SUM(R[-14]C:R[-1]C) -> 0 | AK17: =RC[-1]-RC[-2] -> 0 | AM17: =SUM(R[-14]C:R[-1]C) -> 0 | AN17: =SUM(R[-14]C:R[-1]C) -> 0 | AO17: =RC[-1]-RC[-2] -> 0 | AQ17: =SUM(R[-14]C:R[-1]C) -> 0 | AR17: =SUM(R[-14]C:R[-1]C) -> 0 | AS17: =RC[-1]-RC[-2] -> 0 | AU17: =SUM(R[-14]C:R[-1]C) -> 0 | AV17: =SUM(R[-14]C:R[-1]C) -> 0 | AW17: =RC[-1]-RC[-2] -> 0 | AY17: =SUM(R[-14]C:R[-1]C) -> 0 | AZ17: =SUM(R[-14]C:R[-1]C) -> 0 | BA17: =RC[-1]-RC[-2] -> 0 | BC17: =SUM(R[-14]C:R[-1]C) -> 0 | BD17: =SUM(R[-14]C:R[-1]C) -> 0 | BE17: =RC[-1]-RC[-2] -> 0 | BG17: =SUM(R[-14]C:R[-1]C) -> 0 | BH17: =SUM(R[-14]C:R[-1]C) -> 0 | BI17: =RC[-1]-RC[-2] -> 0 | BK17: =SUM(R[-14]C:R[-1]C) -> 0 | BL17: =SUM(R[-14]C:R[-1]C) -> 0 | BM17: =RC[-1]-RC[-2] -> 0 | BO17: =SUM(R[-14]C:R[-1]C) -> 0 | BP17: =SUM(R[-14]C:R[-1]C) -> 0 | BQ17: =RC[-1]-RC[-2] -> 0 | BS17: =SUM(R[-14]C:R[-1]C) -> 0 | BT17: =SUM(R[-14]C:R[-1]C) -> 0 | BU17: =RC[-1]-RC[-2] -> 0 | BW17: =SUM(R[-14]C:R[-1]C) -> 0 | BX17: =SUM(R[-14]C:R[-1]C) -> 0 | BY17: =RC[-1]-RC[-2] -> 0 | CA17: =SUM(R[-14]C:R[-1]C) -> 0 | CB17: =SUM(R[-14]C:R[-1]C) -> 0 | CC17: =RC[-1]-RC[-2] -> 0 | CE17: =SUM(R[-14]C:R[-1]C) -> 0 | CF17: =SUM(R[-14]C:R[-1]C) -> 0 | CG17: =RC[-1]-RC[-2] -> 0 | CI17: =SUM(R[-14]C:R[-1]C) -> 0 | CJ17: =SUM(R[-14]C:R[-1]C) -> 0 | CK17: =RC[-1]-RC[-2] -> 0 | CM17: =RC[-4]+RC[-8]+RC[-12]+RC[-16]+RC[-20]+RC[-24]+RC[-28]+RC[-32]+RC[-36]+RC[-40]+RC[-44]+RC[-48]+RC[-52]+RC[-56]+RC[-60]+RC[-64]+RC[-68]+RC[-72]+RC[-76]+RC[-80]+RC[-84]+RC[-88] -> 0 | CN17: =RC[-4]+RC[-8]+RC[-12]+RC[-16]+RC[-20]+RC[-24]+RC[-28]+RC[-32]+RC[-36]+RC[-40]+RC[-44]+RC[-48]+RC[-52]+RC[-56]+RC[-60]+RC[-64]+RC[-68]+RC[-72]+RC[-76]+RC[-80]+RC[-84]+RC[-88] -> 0 | CO17: =RC[-1]-RC[-2] -> 0
A18: Эксплуатируемый парк локомотивов: | C18: 2 | E18: =RC[-1]-RC[-2] -> -2 | G18: 2 | I18: =RC[-1]-RC[-2] -> -2 | K18: 2 | M18: =RC[-1]-RC[-2] -> -2 | O18: 2 | Q18: =RC[-1]-RC[-2] -> -2 | S18: 2 | U18: =RC[-1]-RC[-2] -> -2 | W18: 2 | Y18: =RC[-1]-RC[-2] -> -2 | AA18: 2 | AC18: =RC[-1]-RC[-2] -> -2 | AE18: 2 | AG18: =RC[-1]-RC[-2] -> -2 | AI18: 2 | AK18: =RC[-1]-RC[-2] -> -2 | AM18: 2 | AO18: =RC[-1]-RC[-2] -> -2 | AQ18: 2 | AS18: =RC[-1]-RC[-2] -> -2 | AU18: 2 | AW18: =RC[-1]-RC[-2] -> -2 | AY18: 2 | BA18: =RC[-1]-RC[-2] -> -2 | BC18: 2 | BE18: =RC[-1]-RC[-2] -> -2 | BG18: 2 | BI18: =RC[-1]-RC[-2] -> -2 | BK18: 2 | BM18: =RC[-1]-RC[-2] -> -2 | BO18: 2 | BQ18: =RC[-1]-RC[-2] -> -2 | BS18: 2 | BU18: =RC[-1]-RC[-2] -> -2 | BW18: 2 | BY18: =RC[-1]-RC[-2] -> -2 | CA18: 2 | CC18: =RC[-1]-RC[-2] -> -2 | CE18: 2 | CG18: =RC[-1]-RC[-2] -> -2 | CI18: 2 | CK18: =RC[-1]-RC[-2] -> -2 | CM18: =AVERAGE(RC[-4], RC[-8], RC[-12], RC[-16], RC[-20], RC[-24], RC[-28], RC[-32], RC[-36], RC[-40], RC[-44], RC[-48], RC[-52], RC[-56], RC[-60], RC[-64], RC[-68], RC[-72], RC[-76], RC[-80], RC[-84],RC[-88]) -> 2 | CN18: =AVERAGE(RC[-4], RC[-8], RC[-12], RC[-16], RC[-20], RC[-24], RC[-28], RC[-32], RC[-36], RC[-40], RC[-44], RC[-48], RC[-52], RC[-56], RC[-60], RC[-64], RC[-68], RC[-72], RC[-76], RC[-80], RC[-84],RC[-88]) -> #DIV/0! | CO18: =RC[-1]-RC[-2] -> #DIV/0!
A19: * - причины отклонения
A21: Причины отклонения по вагонам:
A22: 1. | B22: Погодные условия
A23: 2. | B23: Отсутствие четкого планирования со стороны клиента
A24: 3. | B24: Запрет на отправление со стороны ОАО "РЖД"
A25: 4. | B25: Снятие запрета на отправление со стороны ОАО "РЖД"
A26: 5. | B26: Отсутствие заготовки перевозочных документов в АС ЭТРАН
A27: 6. | B27: Появление заготовки перевозочных документов в АС ЭТРАН
A28: 7. | B28: Наличие заявки на обработку со стороны клиента на большее кол-во вагонов
A29: 8. | B29: Заключение договора на подачу/уборку вагонов с новым клиентом
A30: 9. | B30: Вагоны не готовы к уборке с грузового фронта по вине клиента
A32: Причины отклонения по локомотивам:
A33: 1. | B33: Переработано вагонов более заявленного кол-ва
A34: 2. | B34: Наличие аварийной заявки на обработку от клиента
A35: 3. | B35: Внутренняя работа (работа с путевой техникой, обработка депо и др.)
A36: 4. | B36: Испытание локомобиля
A37: 5. | B37: Отказ от заявки на обработку грузового фронта от клиента

Sheet: декабрь
A1: Число | C1: 1 | G1: 2 | K1: 3 | O1: 4 | S1: 7 | W1: 8 | AA1: 9 | AE1: 10 | AI1: 11 | AM1: 14 | AQ1: 15 | AU1: 16 | AY1: 17 | BC1: 18 | BG1: 21 | BK1: 22 | BO1: 23 | BS1: 24 | BW1: 25 | CA1: 28 | CE1: 29 | CI1: 30 | CM1: Итого
A2: Клиенты | C2: план | D2: факт | E2: откл-е | F2: * | G2: план | H2: факт | I2: откл-е | J2: * | K2: план | L2: факт | M2: откл-е | N2: * | O2: план | P2: факт | Q2: откл-е | R2: * | S2: план | T2: факт | U2: откл-е | V2: * | W2: план | X2: факт | Y2: откл-е | Z2: * | AA2: план | AB2: факт | AC2: откл-е | AD2: * | AE2: план | AF2: факт | AG2: откл-е | AH2: * | AI2: план | AJ2: факт | AK2: откл-е | AL2: * | AM2: план | AN2: факт | AO2: откл-е | AP2: * | AQ2: план | AR2: факт | AS2: откл-е | AT2: * | AU2: план | AV2: факт | AW2: откл-е | AX2: * | AY2: план | AZ2: факт | BA2: откл-е | BB2: * | BC2: план | BD2: факт | BE2: откл-е | BF2: * | BG2: план | BH2: факт | BI2: откл-е | BJ2: * | BK2: план | BL2: факт | BM2: откл-е | BN2: * | BO2: план | BP2: факт | BQ2: откл-е | BR2: * | BS2: план | BT2: факт | BU2: откл-е | BV2: * | BW2: план | BX2: факт | BY2: откл-е | BZ2: * | CA2: план | CB2: факт | CC2: откл-е | CD2: * | CE2: план | CF2: факт | CG2: откл-е | CH2: * | CI2: план | CJ2: факт | CK2: откл-е | CL2: * | CM2: план | CN2: факт | CO2: откл-е
A3: БЕ ООО "НАК" | B3: ЛЗ | E3: =RC[-1]-RC[-2] -> 0 | I3: =RC[-1]-RC[-2] -> 0 | M3: =RC[-1]-RC[-2] -> 0 | Q3: =RC[-1]-RC[-2] -> 0 | U3: =RC[-1]-RC[-2] -> 0 | Y3: =RC[-1]-RC[-2] -> 0 | AC3: =RC[-1]-RC[-2] -> 0 | AG3: =RC[-1]-RC[-2] -> 0 | AK3: =RC[-1]-RC[-2] -> 0 | AO3: =RC[-1]-RC[-2] -> 0 | AS3: =RC[-1]-RC[-2] -> 0 | AW3: =RC[-1]-RC[-2] -> 0 | BA3: =RC[-1]-RC[-2] -> 0 | BE3: =RC[-1]-RC[-2] -> 0 | BI3: =RC[-1]-RC[-2] -> 0 | BM3: =RC[-1]-RC[-2] -> 0 | BQ3: =RC[-1]-RC[-2] -> 0 | BU3: =RC[-1]-RC[-2] -> 0 | BY3: =RC[-1]-RC[-2] -> 0 | CC3: =RC[-1]-RC[-2] -> 0 | CG3: =RC[-1]-RC[-2] -> 0 | CK3: =RC[-1]-RC[-2] -> 0 | CM3: =RC[-4]+RC[-8]+RC[-12]+RC[-16]+RC[-20]+RC[-24]+RC[-28]+RC[-32]+RC[-36]+RC[-40]+RC[-44]+RC[-48]+RC[-52]+RC[-56]+RC[-60]+RC[-64]+RC[-68]+RC[-72]+RC[-76]+RC[-80]+RC[-84]+RC[-88] -> 0 | CN3: =RC[-4]+RC[-8]+RC[-12]+RC[-16]+RC[-20]+RC[-24]+RC[-28]+RC[-32]+RC[-36]+RC[-40]+RC[-44]+RC[-48]+RC[-52]+RC[-56]+RC[-60]+RC[-64]+RC[-68]+RC[-72]+RC[-76]+RC[-80]+RC[-84]+RC[-88] -> 0 | CO3: =RC[-1]-RC[-2] -> 0
B4: ПРЗ | E4: =RC[-1]-RC[-2] -> 0 | I4: =RC[-1]-RC[-2] -> 0 | M4: =RC[-1]-RC[-2] -> 0 | Q4: =RC[-1]-RC[-2] -> 0 | U4: =RC[-1]-RC[-2] -> 0 | Y4: =RC[-1]-RC[-2] -> 0 | AC4: =RC[-1]-RC[-2] -> 0 | AG4: =RC[-1]-RC[-2] -> 0 | AK4: =RC[-1]-RC[-2] -> 0 | AO4: =RC[-1]-RC[-2] -> 0 | AS4: =RC[-1]-RC[-2] -> 0 | AW4: =RC[-1]-RC[-2] -> 0 | BA4: =RC[-1]-RC[-2] -> 0 | BE4: =RC[-1]-RC[-2] -> 0 | BI4: =RC[-1]-RC[-2] -> 0 | BM4: =RC[-1]-RC[-2] -> 0 | BQ4: =RC[-1]-RC[-2] -> 0 | BU4: =RC[-1]-RC[-2] -> 0 | BY4: =RC[-1]-RC[-2] -> 0 | CC4: =RC[-1]-RC[-2] -> 0 | CG4: =RC[-1]-RC[-2] -> 0 | CK4: =RC[-1]-RC[-2] -> 0 | CM4: =RC[-4]+RC[-8]+RC[-12]+RC[-16]+RC[-20]+RC[-24]+RC[-28]+RC[-32]+RC[-36]+RC[-40]+RC[-44]+RC[-48]+RC[-52]+RC[-56]+RC[-60]+RC[-64]+RC[-68]+RC[-72]+RC[-76]+RC[-80]+RC[-84]+RC[-88] -> 0 | CN4: =RC[-4]+RC[-8]+RC[-12]+RC[-16]+RC[-20]+RC[-24]+RC[-28]+RC[-32]+RC[-36]+RC[-40]+RC[-44]+RC[-48]+RC[-52]+RC[-56]+RC[-60]+RC[-64]+RC[-68]+RC[-72]+RC[-76]+RC[-80]+RC[-84]+RC[-88] -> 0 | CO4: =RC[-1]-RC[-2] -> 0
A5: ООО "НАК" | B5: ЗШП | E5: =RC[-1]-RC[-2] -> 0 | I5: =RC[-1]-RC[-2] -> 0 | M5: =RC[-1]-RC[-2] -> 0 | Q5: =RC[-1]-RC[-2] -> 0 | U5: =RC[-1]-RC[-2] -> 0 | Y5: =RC[-1]-RC[-2] -> 0 | AC5: =RC[-1]-RC[-2] -> 0 | AG5: =RC[-1]-RC[-2] -> 0 | AK5: =RC[-1]-RC[-2] -> 0 | AO5: =RC[-1]-RC[-2] -> 0 | AS5: =RC[-1]-RC[-2] -> 0 | AW5: =RC[-1]-RC[-2] -> 0 | BA5: =RC[-1]-RC[-2] -> 0 | BE5: =RC[-1]-RC[-2] -> 0 | BI5: =RC[-1]-RC[-2] -> 0 | BM5: =RC[-1]-RC[-2] -> 0 | BQ5: =RC[-1]-RC[-2] -> 0 | BU5: =RC[-1]-RC[-2] -> 0 | BY5: =RC[-1]-RC[-2] -> 0 | CC5: =RC[-1]-RC[-2] -> 0 | CG5: =RC[-1]-RC[-2] -> 0 | CK5: =RC[-1]-RC[-2] -> 0 | CM5: =RC[-4]+RC[-8]+RC[-12]+RC[-16]+RC[-20]+RC[-24]+RC[-28]+RC[-32]+RC[-36]+RC[-40]+RC[-44]+RC[-48]+RC[-52]+RC[-56]+RC[-60]+RC[-64]+RC[-68]+RC[-72]+RC[-76]+RC[-80]+RC[-84]+RC[-88] -> 0 | CN5: =RC[-4]+RC[-8]+RC[-12]+RC[-16]+RC[-20]+RC[-24]+RC[-28]+RC[-32]+RC[-36]+RC[-40]+RC[-44]+RC[-48]+RC[-52]+RC[-56]+RC[-60]+RC[-64]+RC[-68]+RC[-72]+RC[-76]+RC[-80]+RC[-84]+RC[-88] -> 0 | CO5: =RC[-1]-RC[-2] -> 0
B6: НАК | E6: =RC[-1]-RC[-2] -> 0 | I6: =RC[-1]-RC[-2] -> 0 | M6: =RC[-1]-RC[-2] -> 0 | Q6: =RC[-1]-RC[-2] -> 0 | U6: =RC[-1]-RC[-2] -> 0 | Y6: =RC[-1]-RC[-2] -> 0 | AC6: =RC[-1]-RC[-2] -> 0 | AG6: =RC[-1]-RC[-2] -> 0 | AK6: =RC[-1]-RC[-2] -> 0 | AO6: =RC[-1]-RC[-2] -> 0 | AS6: =RC[-1]-RC[-2] -> 0 | AW6: =RC[-1]-RC[-2] -> 0 | BA6: =RC[-1]-RC[-2] -> 0 | BE6: =RC[-1]-RC[-2] -> 0 | BI6: =RC[-1]-RC[-2] -> 0 | BM6: =RC[-1]-RC[-2] -> 0 | BQ6: =RC[-1]-RC[-2] -> 0 | BU6: =RC[-1]-RC[-2] -> 0 | BY6: =RC[-1]-RC[-2] -> 0 | CC6: =RC[-1]-RC[-2] -> 0 | CG6: =RC[-1]-RC[-2] -> 0 | CK6: =RC[-1]-RC[-2] -> 0 | CM6: =RC[-4]+RC[-8]+RC[-12]+RC[-16]+RC[-20]+RC[-24]+RC[-28]+RC[-32]+RC[-36]+RC[-40]+RC[-44]+RC[-48]+RC[-52]+RC[-56]+RC[-60]+RC[-64]+RC[-68]+RC[-72]+RC[-76]+RC[-80]+RC[-84]+RC[-88] -> 0 | CN6: =RC[-4]+RC[-8]+RC[-12]+RC[-16]+RC[-20]+RC[-24]+RC[-28]+RC[-32]+RC[-36]+RC[-40]+RC[-44]+RC[-48]+RC[-52]+RC[-56]+RC[-60]+RC[-64]+RC[-68]+RC[-72]+RC[-76]+RC[-80]+RC[-84]+RC[-88] -> 0 | CO6: =RC[-1]-RC[-2] -> 0
B7: НЛЗ | E7: =RC[-1]-RC[-2] -> 0 | I7: =RC[-1]-RC[-2] -> 0 | M7: =RC[-1]-RC[-2] -> 0 | Q7: =RC[-1]-RC[-2] -> 0 | U7: =RC[-1]-RC[-2] -> 0 | Y7: =RC[-1]-RC[-2] -> 0 | AC7: =RC[-1]-RC[-2] -> 0 | AG7: =RC[-1]-RC[-2] -> 0 | AK7: =RC[-1]-RC[-2] -> 0 | AO7: =RC[-1]-RC[-2] -> 0 | AS7: =RC[-1]-RC[-2] -> 0 | AW7: =RC[-1]-RC[-2] -> 0 | BA7: =RC[-1]-RC[-2] -> 0 | BE7: =RC[-1]-RC[-2] -> 0 | BI7: =RC[-1]-RC[-2] -> 0 | BM7: =RC[-1]-RC[-2] -> 0 | BQ7: =RC[-1]-RC[-2] -> 0 | BU7: =RC[-1]-RC[-2] -> 0 | BY7: =RC[-1]-RC[-2] -> 0 | CC7: =RC[-1]-RC[-2] -> 0 | CG7: =RC[-1]-RC[-2] -> 0 | CK7: =RC[-1]-RC[-2] -> 0 | CM7: =RC[-4]+RC[-8]+RC[-12]+RC[-16]+RC[-20]+RC[-24]+RC[-28]+RC[-32]+RC[-36]+RC[-40]+RC[-44]+RC[-48]+RC[-52]+RC[-56]+RC[-60]+RC[-64]+RC[-68]+RC[-72]+RC[-76]+RC[-80]+RC[-84]+RC[-88] -> 0 | CN7: =RC[-4]+RC[-8]+RC[-12]+RC[-16]+RC[-20]+RC[-24]+RC[-28]+RC[-32]+RC[-36]+RC[-40]+RC[-44]+RC[-48]+RC[-52]+RC[-56]+RC[-60]+RC[-64]+RC[-68]+RC[-72]+RC[-76]+RC[-80]+RC[-84]+RC[-88] -> 0 | CO7: =RC[-1]-RC[-2] -> 0
A8: ООО "НАЗ", АО "НГА" | B8: АЗ "НАЗ" | E8: =RC[-1]-RC[-2] -> 0 | I8: =RC[-1]-RC[-2] -> 0 | M8: =RC[-1]-RC[-2] -> 0 | Q8: =RC[-1]-RC[-2] -> 0 | U8: =RC[-1]-RC[-2] -> 0 | Y8: =RC[-1]-RC[-2] -> 0 | AC8: =RC[-1]-RC[-2] -> 0 | AG8: =RC[-1]-RC[-2] -> 0 | AK8: =RC[-1]-RC[-2] -> 0 | AO8: =RC[-1]-RC[-2] -> 0 | AS8: =RC[-1]-RC[-2] -> 0 | AW8: =RC[-1]-RC[-2] -> 0 | BA8: =RC[-1]-RC[-2] -> 0 | BE8: =RC[-1]-RC[-2] -> 0 | BI8: =RC[-1]-RC[-2] -> 0 | BM8: =RC[-1]-RC[-2] -> 0 | BQ8: =RC[-1]-RC[-2] -> 0 | BU8: =RC[-1]-RC[-2] -> 0 | BY8: =RC[-1]-RC[-2] -> 0 | CC8: =RC[-1]-RC[-2] -> 0 | CG8: =RC[-1]-RC[-2] -> 0 | CK8: =RC[-1]-RC[-2] -> 0 | CM8: =RC[-4]+RC[-8]+RC[-12]+RC[-16]+RC[-20]+RC[-24]+RC[-28]+RC[-32]+RC[-36]+RC[-40]+RC[-44]+RC[-48]+RC[-52]+RC[-56]+RC[-60]+RC[-64]+RC[-68]+RC[-72]+RC[-76]+RC[-80]+RC[-84]+RC[-88] -> 0 | CN8: =RC[-4]+RC[-8]+RC[-12]+RC[-16]+RC[-20]+RC[-24]+RC[-28]+RC[-32]+RC[-36]+RC[-40]+RC[-44]+RC[-48]+RC[-52]+RC[-56]+RC[-60]+RC[-64]+RC[-68]+RC[-72]+RC[-76]+RC[-80]+RC[-84]+RC[-88] -> 0 | CO8: =RC[-1]-RC[-2] -> 0
B9: АО "НГА" | E9: =RC[-1]-RC[-2] -> 0 | I9: =RC[-1]-RC[-2] -> 0 | M9: =RC[-1]-RC[-2] -> 0 | Q9: =RC[-1]-RC[-2] -> 0 | U9: =RC[-1]-RC[-2] -> 0 | Y9: =RC[-1]-RC[-2] -> 0 | AC9: =RC[-1]-RC[-2] -> 0 | AG9: =RC[-1]-RC[-2] -> 0 | AK9: =RC[-1]-RC[-2] -> 0 | AO9: =RC[-1]-RC[-2] -> 0 | AS9: =RC[-1]-RC[-2] -> 0 | AW9: =RC[-1]-RC[-2] -> 0 | BA9: =RC[-1]-RC[-2] -> 0 | BE9: =RC[-1]-RC[-2] -> 0 | BI9: =RC[-1]-RC[-2] -> 0 | BM9: =RC[-1]-RC[-2] -> 0 | BQ9: =RC[-1]-RC[-2] -> 0 | BU9: =RC[-1]-RC[-2] -> 0 | BY9: =RC[-1]-RC[-2] -> 0 | CC9: =RC[-1]-RC[-2] -> 0 | CG9: =RC[-1]-RC[-2] -> 0 | CK9: =RC[-1]-RC[-2] -> 0 | CM9: =RC[-4]+RC[-8]+RC[-12]+RC[-16]+RC[-20]+RC[-24]+RC[-28]+RC[-32]+RC[-36]+RC[-40]+RC[-44]+RC[-48]+RC[-52]+RC[-56]+RC[-60]+RC[-64]+RC[-68]+RC[-72]+RC[-76]+RC[-80]+RC[-84]+RC[-88] -> 0 | CN9: =RC[-4]+RC[-8]+RC[-12]+RC[-16]+RC[-20]+RC[-24]+RC[-28]+RC[-32]+RC[-36]+RC[-40]+RC[-44]+RC[-48]+RC[-52]+RC[-56]+RC[-60]+RC[-64]+RC[-68]+RC[-72]+RC[-76]+RC[-80]+RC[-84]+RC[-88] -> 0 | CO9: =RC[-1]-RC[-2] -> 0
A10: Сторонние внутренние | B10: КА-Группа ГАЗ( Вьетнам) | E10: =RC[-1]-RC[-2] -> 0 | I10: =RC[-1]-RC[-2] -> 0 | M10: =RC[-1]-RC[-2] -> 0 | Q10: =RC[-1]-RC[-2] -> 0 | U10: =RC[-1]-RC[-2] -> 0 | Y10: =RC[-1]-RC[-2] -> 0 | AC10: =RC[-1]-RC[-2] -> 0 | AG10: =RC[-1]-RC[-2] -> 0 | AK10: =RC[-1]-RC[-2] -> 0 | AO10: =RC[-1]-RC[-2] -> 0 | AS10: =RC[-1]-RC[-2] -> 0 | AW10: =RC[-1]-RC[-2] -> 0 | BA10: =RC[-1]-RC[-2] -> 0 | BE10: =RC[-1]-RC[-2] -> 0 | BI10: =RC[-1]-RC[-2] -> 0 | BM10: =RC[-1]-RC[-2] -> 0 | BQ10: =RC[-1]-RC[-2] -> 0 | BU10: =RC[-1]-RC[-2] -> 0 | BY10: =RC[-1]-RC[-2] -> 0 | CC10: =RC[-1]-RC[-2] -> 0 | CG10: =RC[-1]-RC[-2] -> 0 | CK10: =RC[-1]-RC[-2] -> 0 | CM10: =RC[-4]+RC[-8]+RC[-12]+RC[-16]+RC[-20]+RC[-24]+RC[-28]+RC[-32]+RC[-36]+RC[-40]+RC[-44]+RC[-48]+RC[-52]+RC[-56]+RC[-60]+RC[-64]+RC[-68]+RC[-72]+RC[-76]+RC[-80]+RC[-84]+RC[-88] -> 0 | CN10: =RC[-4]+RC[-8]+RC[-12]+RC[-16]+RC[-20]+RC[-24]+RC[-28]+RC[-32]+RC[-36]+RC[-40]+RC[-44]+RC[-48]+RC[-52]+RC[-56]+RC[-60]+RC[-64]+RC[-68]+RC[-72]+RC[-76]+RC[-80]+RC[-84]+RC[-88] -> 0 | CO10: =RC[-1]-RC[-2] -> 0
B11: Платформа А | E11: =RC[-1]-RC[-2] -> 0 | I11: =RC[-1]-RC[-2] -> 0 | M11: =RC[-1]-RC[-2] -> 0 | Q11: =RC[-1]-RC[-2] -> 0 | U11: =RC[-1]-RC[-2] -> 0 | Y11: =RC[-1]-RC[-2] -> 0 | AC11: =RC[-1]-RC[-2] -> 0 | AG11: =RC[-1]-RC[-2] -> 0 | AK11: =RC[-1]-RC[-2] -> 0 | AO11: =RC[-1]-RC[-2] -> 0 | AS11: =RC[-1]-RC[-2] -> 0 | AW11: =RC[-1]-RC[-2] -> 0 | BA11: =RC[-1]-RC[-2] -> 0 | BE11: =RC[-1]-RC[-2] -> 0 | BI11: =RC[-1]-RC[-2] -> 0 | BM11: =RC[-1]-RC[-2] -> 0 | BQ11: =RC[-1]-RC[-2] -> 0 | BU11: =RC[-1]-RC[-2] -> 0 | BY11: =RC[-1]-RC[-2] -> 0 | CC11: =RC[-1]-RC[-2] -> 0 | CG11: =RC[-1]-RC[-2] -> 0 | CK11: =RC[-1]-RC[-2] -> 0 | CM11: =RC[-4]+RC[-8]+RC[-12]+RC[-16]+RC[-20]+RC[-24]+RC[-28]+RC[-32]+RC[-36]+RC[-40]+RC[-44]+RC[-48]+RC[-52]+RC[-56]+RC[-60]+RC[-64]+RC[-68]+RC[-72]+RC[-76]+RC[-80]+RC[-84]+RC[-88] -> 0 | CN11: =RC[-4]+RC[-8]+RC[-12]+RC[-16]+RC[-20]+RC[-24]+RC[-28]+RC[-32]+RC[-36]+RC[-40]+RC[-44]+RC[-48]+RC[-52]+RC[-56]+RC[-60]+RC[-64]+RC[-68]+RC[-72]+RC[-76]+RC[-80]+RC[-84]+RC[-88] -> 0 | CO11: =RC[-1]-RC[-2] -> 0
A12: Сторонние внешние | B12: АО "ГОТХ" | E12: =RC[-1]-RC[-2] -> 0 | I12: =RC[-1]-RC[-2] -> 0 | M12: =RC[-1]-RC[-2] -> 0 | Q12: =RC[-1]-RC[-2] -> 0 | U12: =RC[-1]-RC[-2] -> 0 | Y12: =RC[-1]-RC[-2] -> 0 | AC12: =RC[-1]-RC[-2] -> 0 | AG12: =RC[-1]-RC[-2] -> 0 | AK12: =RC[-1]-RC[-2] -> 0 | AO12: =RC[-1]-RC[-2] -> 0 | AS12: =RC[-1]-RC[-2] -> 0 | AW12: =RC[-1]-RC[-2] -> 0 | BA12: =RC[-1]-RC[-2] -> 0 | BE12: =RC[-1]-RC[-2] -> 0 | BI12: =RC[-1]-RC[-2] -> 0 | BM12: =RC[-1]-RC[-2] -> 0 | BQ12: =RC[-1]-RC[-2] -> 0 | BU12: =RC[-1]-RC[-2] -> 0 | BY12: =RC[-1]-RC[-2] -> 0 | CC12: =RC[-1]-RC[-2] -> 0 | CG12: =RC[-1]-RC[-2] -> 0 | CK12: =RC[-1]-RC[-2] -> 0 | CM12: =RC[-4]+RC[-8]+RC[-12]+RC[-16]+RC[-20]+RC[-24]+RC[-28]+RC[-32]+RC[-36]+RC[-40]+RC[-44]+RC[-48]+RC[-52]+RC[-56]+RC[-60]+RC[-64]+RC[-68]+RC[-72]+RC[-76]+RC[-80]+RC[-84]+RC[-88] -> 0 | CN12: =RC[-4]+RC[-8]+RC[-12]+RC[-16]+RC[-20]+RC[-24]+RC[-28]+RC[-32]+RC[-36]+RC[-40]+RC[-44]+RC[-48]+RC[-52]+RC[-56]+RC[-60]+RC[-64]+RC[-68]+RC[-72]+RC[-76]+RC[-80]+RC[-84]+RC[-88] -> 0 | CO12: =RC[-1]-RC[-2] -> 0
B13: ООО "Нерудные материалы-НН" | E13: =RC[-1]-RC[-2] -> 0 | I13: =RC[-1]-RC[-2] -> 0 | M13: =RC[-1]-RC[-2] -> 0 | Q13: =RC[-1]-RC[-2] -> 0 | U13: =RC[-1]-RC[-2] -> 0 | Y13: =RC[-1]-RC[-2] -> 0 | AC13: =RC[-1]-RC[-2] -> 0 | AG13: =RC[-1]-RC[-2] -> 0 | AK13: =RC[-1]-RC[-2] -> 0 | AO13: =RC[-1]-RC[-2] -> 0 | AS13: =RC[-1]-RC[-2] -> 0 | AW13: =RC[-1]-RC[-2] -> 0 | BA13: =RC[-1]-RC[-2] -> 0 | BE13: =RC[-1]-RC[-2] -> 0 | BI13: =RC[-1]-RC[-2] -> 0 | BM13: =RC[-1]-RC[-2] -> 0 | BQ13: =RC[-1]-RC[-2] -> 0 | BU13: =RC[-1]-RC[-2] -> 0 | BY13: =RC[-1]-RC[-2] -> 0 | CC13: =RC[-1]-RC[-2] -> 0 | CG13: =RC[-1]-RC[-2] -> 0 | CK13: =RC[-1]-RC[-2] -> 0 | CM13: =RC[-4]+RC[-8]+RC[-12]+RC[-16]+RC[-20]+RC[-24]+RC[-28]+RC[-32]+RC[-36]+RC[-40]+RC[-44]+RC[-48]+RC[-52]+RC[-56]+RC[-60]+RC[-64]+RC[-68]+RC[-72]+RC[-76]+RC[-80]+RC[-84]+RC[-88] -> 0 | CN13: =RC[-4]+RC[-8]+RC[-12]+RC[-16]+RC[-20]+RC[-24]+RC[-28]+RC[-32]+RC[-36]+RC[-40]+RC[-44]+RC[-48]+RC[-52]+RC[-56]+RC[-60]+RC[-64]+RC[-68]+RC[-72]+RC[-76]+RC[-80]+RC[-84]+RC[-88] -> 0 | CO13: =RC[-1]-RC[-2] -> 0
B14: ПК НВМ (ООО "Профит") | E14: =RC[-1]-RC[-2] -> 0 | I14: =RC[-1]-RC[-2] -> 0 | M14: =RC[-1]-RC[-2] -> 0 | Q14: =RC[-1]-RC[-2] -> 0 | U14: =RC[-1]-RC[-2] -> 0 | Y14: =RC[-1]-RC[-2] -> 0 | AC14: =RC[-1]-RC[-2] -> 0 | AG14: =RC[-1]-RC[-2] -> 0 | AK14: =RC[-1]-RC[-2] -> 0 | AO14: =RC[-1]-RC[-2] -> 0 | AS14: =RC[-1]-RC[-2] -> 0 | AW14: =RC[-1]-RC[-2] -> 0 | BA14: =RC[-1]-RC[-2] -> 0 | BE14: =RC[-1]-RC[-2] -> 0 | BI14: =RC[-1]-RC[-2] -> 0 | BM14: =RC[-1]-RC[-2] -> 0 | BQ14: =RC[-1]-RC[-2] -> 0 | BU14: =RC[-1]-RC[-2] -> 0 | BY14: =RC[-1]-RC[-2] -> 0 | CC14: =RC[-1]-RC[-2] -> 0 | CG14: =RC[-1]-RC[-2] -> 0 | CK14: =RC[-1]-RC[-2] -> 0 | CM14: =RC[-4]+RC[-8]+RC[-12]+RC[-16]+RC[-20]+RC[-24]+RC[-28]+RC[-32]+RC[-36]+RC[-40]+RC[-44]+RC[-48]+RC[-52]+RC[-56]+RC[-60]+RC[-64]+RC[-68]+RC[-72]+RC[-76]+RC[-80]+RC[-84]+RC[-88] -> 0 | CN14: =RC[-4]+RC[-8]+RC[-12]+RC[-16]+RC[-20]+RC[-24]+RC[-28]+RC[-32]+RC[-36]+RC[-40]+RC[-44]+RC[-48]+RC[-52]+RC[-56]+RC[-60]+RC[-64]+RC[-68]+RC[-72]+RC[-76]+RC[-80]+RC[-84]+RC[-88] -> 0 | CO14: =RC[-1]-RC[-2] -> 0
B15: ООО "ИнтерметГрупп" | E15: =RC[-1]-RC[-2] -> 0 | I15: =RC[-1]-RC[-2] -> 0 | M15: =RC[-1]-RC[-2] -> 0 | Q15: =RC[-1]-RC[-2] -> 0 | U15: =RC[-1]-RC[-2] -> 0 | Y15: =RC[-1]-RC[-2] -> 0 | AC15: =RC[-1]-RC[-2] -> 0 | AG15: =RC[-1]-RC[-2] -> 0 | AK15: =RC[-1]-RC[-2] -> 0 | AO15: =RC[-1]-RC[-2] -> 0 | AS15: =RC[-1]-RC[-2] -> 0 | AW15: =RC[-1]-RC[-2] -> 0 | BA15: =RC[-1]-RC[-2] -> 0 | BE15: =RC[-1]-RC[-2] -> 0 | BI15: =RC[-1]-RC[-2] -> 0 | BM15: =RC[-1]-RC[-2] -> 0 | BQ15: =RC[-1]-RC[-2] -> 0 | BU15: =RC[-1]-RC[-2] -> 0 | BY15: =RC[-1]-RC[-2] -> 0 | CC15: =RC[-1]-RC[-2] -> 0 | CG15: =RC[-1]-RC[-2] -> 0 | CK15: =RC[-1]-RC[-2] -> 0 | CM15: =RC[-4]+RC[-8]+RC[-12]+RC[-16]+RC[-20]+RC[-24]+RC[-28]+RC[-32]+RC[-36]+RC[-40]+RC[-44]+RC[-48]+RC[-52]+RC[-56]+RC[-60]+RC[-64]+RC[-68]+RC[-72]+RC[-76]+RC[-80]+RC[-84]+RC[-88] -> 0 | CN15: =RC[-4]+RC[-8]+RC[-12]+RC[-16]+RC[-20]+RC[-24]+RC[-28]+RC[-32]+RC[-36]+RC[-40]+RC[-44]+RC[-48]+RC[-52]+RC[-56]+RC[-60]+RC[-64]+RC[-68]+RC[-72]+RC[-76]+RC[-80]+RC[-84]+RC[-88] -> 0 | CO15: =RC[-1]-RC[-2] -> 0
B16: Прочие | E16: =RC[-1]-RC[-2] -> 0 | I16: =RC[-1]-RC[-2] -> 0 | M16: =RC[-1]-RC[-2] -> 0 | Q16: =RC[-1]-RC[-2] -> 0 | U16: =RC[-1]-RC[-2] -> 0 | Y16: =RC[-1]-RC[-2] -> 0 | AC16: =RC[-1]-RC[-2] -> 0 | AG16: =RC[-1]-RC[-2] -> 0 | AK16: =RC[-1]-RC[-2] -> 0 | AO16: =RC[-1]-RC[-2] -> 0 | AS16: =RC[-1]-RC[-2] -> 0 | AW16: =RC[-1]-RC[-2] -> 0 | BA16: =RC[-1]-RC[-2] -> 0 | BE16: =RC[-1]-RC[-2] -> 0 | BI16: =RC[-1]-RC[-2] -> 0 | BM16: =RC[-1]-RC[-2] -> 0 | BQ16: =RC[-1]-RC[-2] -> 0 | BU16: =RC[-1]-RC[-2] -> 0 | BY16: =RC[-1]-RC[-2] -> 0 | CC16: =RC[-1]-RC[-2] -> 0 | CG16: =RC[-1]-RC[-2] -> 0 | CK16: =RC[-1]-RC[-2] -> 0 | CM16: =RC[-4]+RC[-8]+RC[-12]+RC[-16]+RC[-20]+RC[-24]+RC[-28]+RC[-32]+RC[-36]+RC[-40]+RC[-44]+RC[-48]+RC[-52]+RC[-56]+RC[-60]+RC[-64]+RC[-68]+RC[-72]+RC[-76]+RC[-80]+RC[-84]+RC[-88] -> 0 | CN16: =RC[-4]+RC[-8]+RC[-12]+RC[-16]+RC[-20]+RC[-24]+RC[-28]+RC[-32]+RC[-36]+RC[-40]+RC[-44]+RC[-48]+RC[-52]+RC[-56]+RC[-60]+RC[-64]+RC[-68]+RC[-72]+RC[-76]+RC[-80]+RC[-84]+RC[-88] -> 0 | CO16: =RC[-1]-RC[-2] -> 0
A17: ИТОГО за день: | C17: =SUM(R[-14]C:R[-1]C) -> 0 | D17: =SUM(R[-14]C:R[-1]C) -> 0 | E17: =RC[-1]-RC[-2] -> 0 | G17: =SUM(R[-14]C:R[-1]C) -> 0 | H17: =SUM(R[-14]C:R[-1]C) -> 0 | I17: =RC[-1]-RC[-2] -> 0 | K17: =SUM(R[-14]C:R[-1]C) -> 0 | L17: =SUM(R[-14]C:R[-1]C) -> 0 | M17: =RC[-1]-RC[-2] -> 0 | O17: =SUM(R[-14]C:R[-1]C) -> 0 | P17: =SUM(R[-14]C:R[-1]C) -> 0 | Q17: =RC[-1]-RC[-2] -> 0 | S17: =SUM(R[-14]C:R[-1]C) -> 0 | T17: =SUM(R[-14]C:R[-1]C) -> 0 | U17: =RC[-1]-RC[-2] -> 0 | W17: =SUM(R[-14]C:R[-1]C) -> 0 | X17: =SUM(R[-14]C:R[-1]C) -> 0 | Y17: =RC[-1]-RC[-2] -> 0 | AA17: =SUM(R[-14]C:R[-1]C) -> 0 | AB17: =SUM(R[-14]C:R[-1]C) -> 0 | AC17: =RC[-1]-RC[-2] -> 0 | AE17: =SUM(R[-14]C:R[-1]C) -> 0 | AF17: =SUM(R[-14]C:R[-1]C) -> 0 | AG17: =RC[-1]-RC[-2] -> 0 | AI17: =SUM(R[-14]C:R[-1]C) -> 0 | AJ17: =SUM(R[-14]C:R[-1]C) -> 0 | AK17: =RC[-1]-RC[-2] -> 0 | AM17: =SUM(R[-14]C:R[-1]C) -> 0 | AN17: =SUM(R[-14]C:R[-1]C) -> 0 | AO17: =RC[-1]-RC[-2] -> 0 | AQ17: =SUM(R[-14]C:R[-1]C) -> 0 | AR17: =SUM(R[-14]C:R[-1]C) -> 0 | AS17: =RC[-1]-RC[-2] -> 0 | AU17: =SUM(R[-14]C:R[-1]C) -> 0 | AV17: =SUM(R[-14]C:R[-1]C) -> 0 | AW17: =RC[-1]-RC[-2] -> 0 | AY17: =SUM(R[-14]C:R[-1]C) -> 0 | AZ17: =SUM(R[-14]C:R[-1]C) -> 0 | BA17: =RC[-1]-RC[-2] -> 0 | BC17: =SUM(R[-14]C:R[-1]C) -> 0 | BD17: =SUM(R[-14]C:R[-1]C) -> 0 | BE17: =RC[-1]-RC[-2] -> 0 | BG17: =SUM(R[-14]C:R[-1]C) -> 0 | BH17: =SUM(R[-14]C:R[-1]C) -> 0 | BI17: =RC[-1]-RC[-2] -> 0 | BK17: =SUM(R[-14]C:R[-1]C) -> 0 | BL17: =SUM(R[-14]C:R[-1]C) -> 0 | BM17: =RC[-1]-RC[-2] -> 0 | BO17: =SUM(R[-14]C:R[-1]C) -> 0 | BP17: =SUM(R[-14]C:R[-1]C) -> 0 | BQ17: =RC[-1]-RC[-2] -> 0 | BS17: =SUM(R[-14]C:R[-1]C) -> 0 | BT17: =SUM(R[-14]C:R[-1]C) -> 0 | BU17: =RC[-1]-RC[-2] -> 0 | BW17: =SUM(R[-14]C:R[-1]C) -> 0 | BX17: =SUM(R[-14]C:R[-1]C) -> 0 | BY17: =RC[-1]-RC[-2] -> 0 | CA17: =SUM(R[-14]C:R[-1]C) -> 0 | CB17: =SUM(R[-14]C:R[-1]C) -> 0 | CC17: =RC[-1]-RC[-2] -> 0 | CE17: =SUM(R[-14]C:R[-1]C) -> 0 | CF17: =SUM(R[-14]C:R[-1]C) -> 0 | CG17: =RC[-1]-RC[-2] -> 0 | CI17: =SUM(R[-14]C:R[-1]C) -> 0 | CJ17: =SUM(R[-14]C:R[-1]C) -> 0 | CK17: =RC[-1]-RC[-2] -> 0 | CM17: =RC[-4]+RC[-8]+RC[-12]+RC[-16]+RC[-20]+RC[-24]+RC[-28]+RC[-32]+RC[-36]+RC[-40]+RC[-44]+RC[-48]+RC[-52]+RC[-56]+RC[-60]+RC[-64]+RC[-68]+RC[-72]+RC[-76]+RC[-80]+RC[-84]+RC[-88] -> 0 | CN17: =RC[-4]+RC[-8]+RC[-12]+RC[-16]+RC[-20]+RC[-24]+RC[-28]+RC[-32]+RC[-36]+RC[-40]+RC[-44]+RC[-48]+RC[-52]+RC[-56]+RC[-60]+RC[-64]+RC[-68]+RC[-72]+RC[-76]+RC[-80]+RC[-84]+RC[-88] -> 0 | CO17: =RC[-1]-RC[-2] -> 0
A18: Эксплуатируемый парк локомотивов: | C18: 2 | E18: =RC[-1]-RC[-2] -> -2 | G18: 2 | I18: =RC[-1]-RC[-2] -> -2 | K18: 2 | M18: =RC[-1]-RC[-2] -> -2 | O18: 2 | Q18: =RC[-1]-RC[-2] -> -2 | S18: 2 | U18: =RC[-1]-RC[-2] -> -2 | W18: 2 | Y18: =RC[-1]-RC[-2] -> -2 | AA18: 2 | AC18: =RC[-1]-RC[-2] -> -2 | AE18: 2 | AG18: =RC[-1]-RC[-2] -> -2 | AI18: 2 | AK18: =RC[-1]-RC[-2] -> -2 | AM18: 2 | AO18: =RC[-1]-RC[-2] -> -2 | AQ18: 2 | AS18: =RC[-1]-RC[-2] -> -2 | AU18: 2 | AW18: =RC[-1]-RC[-2] -> -2 | AY18: 2 | BA18: =RC[-1]-RC[-2] -> -2 | BC18: 2 | BE18: =RC[-1]-RC[-2] -> -2 | BG18: 2 | BI18: =RC[-1]-RC[-2] -> -2 | BK18: 2 | BM18: =RC[-1]-RC[-2] -> -2 | BO18: 2 | BQ18: =RC[-1]-RC[-2] -> -2 | BS18: 2 | BU18: =RC[-1]-RC[-2] -> -2 | BW18: 2 | BY18: =RC[-1]-RC[-2] -> -2 | CA18: 2 | CC18: =RC[-1]-RC[-2] -> -2 | CE18: 2 | CG18: =RC[-1]-RC[-2] -> -2 | CI18: 2 | CK18: =RC[-1]-RC[-2] -> -2 | CM18: =AVERAGE(RC[-4], RC[-8], RC[-12], RC[-16], RC[-20], RC[-24], RC[-28], RC[-32], RC[-36], RC[-40], RC[-44], RC[-48], RC[-52], RC[-56], RC[-60], RC[-64], RC[-68], RC[-72], RC[-76], RC[-80], RC[-84],RC[-88]) -> 2 | CN18: =AVERAGE(RC[-4], RC[-8], RC[-12], RC[-16], RC[-20], RC[-24], RC[-28], RC[-32], RC[-36], RC[-40], RC[-44], RC[-48], RC[-52], RC[-56], RC[-60], RC[-64], RC[-68], RC[-72], RC[-76], RC[-80], RC[-84],RC[-88]) -> #DIV/0! | CO18: =RC[-1]-RC[-2] -> #DIV/0!
A19: * - причины отклонения
A21: Причины отклонения по вагонам:
A22: 1. | B22: Погодные условия
A23: 2. | B23: Отсутствие четкого планирования со стороны клиента
A24: 3. | B24: Запрет на отправление со стороны ОАО "РЖД"
A25: 4. | B25: Снятие запрета на отправление со стороны ОАО "РЖД"
A26: 5. | B26: Отсутствие заготовки перевозочных документов в АС ЭТРАН
A27: 6. | B27: Появление заготовки перевозочных документов в АС ЭТРАН
A28: 7. | B28: Наличие заявки на обработку со стороны клиента на большее кол-во вагонов
A29: 8. | B29: Заключение договора на подачу/уборку вагонов с новым клиентом
A30: 9. | B30: Вагоны не готовы к уборке с грузового фронта по вине клиента
A32: Причины отклонения по локомотивам:
A33: 1. | B33: Переработано вагонов более заявленного кол-ва
A34: 2. | B34: Наличие аварийной заявки на обработку от клиента
A35: 3. | B35: Внутренняя работа (работа с путевой техникой, обработка депо и др.)
A36: 4. | B36: Испытание локомобиля
A37: 5. | B37: Отказ от заявки на обработку грузового фронта от клиента